
\channelMsgEntry{%
    \msgRealSource{ĞĞµĞ‘ÑƒÑ‚Ğ»ĞµĞ³ ï¼ˆè¿«çœŸï¼‰}{2020-01-01 15:45:09}%
    \msgMainContent{æˆ‘æ‰çŸ¥é“åŸæ¥æ‘©æ‰˜ç½—æ‹‰çœŸæœ‰6800}%
    %
}


\channelMsgEntry{%
    \msgRealSource{åŒå€å¤šå¤šå†°ğŸ§¶ | ğ¦ğŸğœğŸ}{2020-01-01 15:45:09}%
    \msgMainContent{ä¸ç„¶ 68k æ˜¯è°çš„åç»§}%
    %
}


\channelMsgEntry{%
    \msgRealSource{Mingcong Bai}{2020-01-01 15:45:09}%
    \msgMainContent{å½“ç„¶æ˜¯ 67999}%
    %
}


\channelMsgEntry{%
    \msgRealSource{Mingcong Bai}{2020-01-01 15:57:00}%
    \msgMainContent{æ°å“¥åŒ–äº†ï¼ˆ}%
    %
}


\channelMsgEntry{%
    \msgRealSource{Mingcong Bai}{2020-01-01 15:57:00}%
    \msgMainContent{æ­¤å¤„æ’å…¥æ•°ç å®è´è¿›åŒ– BGM}%
    %
}


\channelMsgEntry{%
    \msgRealSource{Mingcong Bai}{2020-01-01 15:57:00}%
    \msgMainContent{\emph{å…‰æŸ±} \emph{æ—‹è½¬} \emph{ç¼©æ”¾}}%
    %
}


\channelMsgEntry{%
    \msgRealSource{Mingcong Bai}{2020-01-01 15:57:00}%
    \msgMainContent{\emph{ç”·å£°}}%
    %
}


\channelMsgEntry{%
    \msgRealSource{Mingcong Bai}{2020-01-01 15:57:00}%
    \msgMainContent{\emph{å‰§çƒˆæƒ…æ„Ÿ}}%
    %
}


\channelMsgEntry{%
    \msgRealSource{Mingcong Bai}{2020-01-01 15:57:00}%
    \msgMainContent{\emph{ç‹‚å¼}}%
    %
}


\channelMsgEntry{%
    \msgRealSource{Mingcong Bai}{2020-01-01 15:57:00}%
    \msgMainContent{è¿™åŒ…é‡Œå±…ç„¶æ²¡ç”°æ‰€}%
    %
}


\channelMsgEntry{%
    \msgRealSource{åŒå€å¤šå¤šå†°ğŸ§¶ | ğ¦ğŸğœğŸ}{2020-01-01 15:57:01}%
    \msgMainContent{ä½ ä¹Ÿ}%
    %
}


\channelMsgEntry{%
    \msgRealSource{Mingcong Bai}{2020-01-01 15:57:01}%
    \msgMainContent{ä½ ä¹Ÿ

å¤ªåçŸ¥åè§‰äº†ï¼ˆx}%
    %
}


\channelMsgEntry{%
    \msgRealSource{Lion}{2020-01-02 04:18:12}%
    \msgMainContent{è¯´åˆ°é“ä»”ï¼Œæˆ‘å‰å¤©å¸¦äººå»ç”µè„‘åŸé‡‡è´­ç”Ÿäº§åŠ›å·¥å…·}%
    %
}


\channelMsgEntry{%
    \msgRealSource{Lion}{2020-01-02 04:18:12}%
    \msgMainContent{å¼€å¿ƒ}%
    %
}


\channelMsgEntry{%
    \msgRealSource{Lion}{2020-01-02 04:18:12}%
    \msgMainContent{ä½ çŸ¥é“çš„ç”µè„‘åŸä¸€è¿›é—¨}%
    %
}


\channelMsgEntry{%
    \msgRealSource{Lion}{2020-01-02 04:18:12}%
    \msgMainContent{ä½ å°±æˆä¸ºäº†é“ä»”}%
    %
}


\channelMsgEntry{%
    \msgRealSource{Mingcong Bai}{2020-01-02 04:18:12}%
    \msgMainContent{ĞšÑ€Ğ°ÑĞ°Ğ²Ñ‡Ğ¸Ğº, Asus Ğ¿Ğ¾ĞºÑƒĞ¿Ğ°ĞµÑ‚Ğµ?}%
    %
}


\channelMsgEntry{%
    \msgRealSource{Lion}{2020-01-02 04:18:12}%
    \msgMainContent{ä¸€å¥è¯è¯´ä¸€ç™¾éå®ƒå°±æˆäº†å¯¹çš„}%
    %
}


\channelMsgEntry{%
    \msgRealSource{Lion}{2020-01-02 04:18:12}%
    \msgMainContent{é‚£ä¹ˆå¤šäººå«æˆ‘é“ä»”}%
    %
}


\channelMsgEntry{%
    \msgRealSource{Leo Shen}{2020-01-02 04:18:12}%
    \msgMainContent{ç¾ å®¹ é™¢}%
    %
}


\channelMsgEntry{%
    \msgRealSource{Mingcong Bai}{2020-01-02 04:18:12}%
    \msgMainContent{é“ä»”ï¼Œä¹°åç¡•å—}%
    %
}


\channelMsgEntry{%
    \msgRealSource{Lion}{2020-01-02 04:18:12}%
    \msgMainContent{é“ä»”ï¼è¦ä¹°å’©å•Šï¼Ÿ}%
    %
}


\channelMsgEntry{%
    \msgRealSource{cth451 ÇÉ”uÇÆƒÉ¹ÇÊŒá´‰p}{2020-01-02 07:59:50}%
    \msgMainContent{~AyyMD /}%
    %
}


\channelMsgEntry{%
    \msgRealSource{Kexy Biscuit | è¢«å­é¥¼ï¸ | ç™¾åˆãƒ¶å’²ã‚‹ã‚‹}{2020-01-02 07:59:50}%
    \msgMainContent{å˜¤å˜¤å˜¤ç‰¹å°”}%
    %
}


\channelMsgEntry{%
    \msgRealSource{Mingcong Bai}{2020-01-03 14:50:38}%
    \msgMainContent{ç‹®å­éƒ½ * å‡ºæ¥äº†ï¼Œç„¶ååˆ \emph{thomp} äº†å›å»ï¼ˆé€ƒ}%
    %
}


\channelMsgEntry{%
    \msgRealSource{Lion}{2020-01-03 14:50:54}%
    \msgMainContent{}%
    \nopagebreak\includegraphics[width=\linewidth]{./.tg-data/2020/photos/photo_118@03-01-2020_14-50-54.jpg}%
}


\channelMsgEntry{%
    \msgRealSource{Lion}{2020-01-03 15:33:24}%
    \msgMainContent{apt-gen-lust\ldots{} \ldots{} status \ldots{} list \ldots{} edit
\ldots{} enable/disable \ldots{} preset \ldots{} list-branches \ldots{}
set-branch}%
    %
}


\channelMsgEntry{%
    \msgRealSource{Lion}{2020-01-03 15:33:24}%
    \msgMainContent{è¿™æ‰æœ‰è£¤å‘³}%
    %
}


\channelMsgEntry{%
    \msgRealSource{Lion}{2020-01-03 15:33:24}%
    \msgMainContent{å†åŠ ä¸ª --help å’Œ --versionï¼Œéå¸¸ä¸­åº¸}%
    %
}


\channelMsgEntry{%
    \msgRealSource{Junde Yhi}{2020-01-03 15:33:24}%
    \msgMainContent{ä½†æ˜¯ä¹Ÿå¾ˆ biu å‡†}%
    %
}


\channelMsgEntry{%
    \msgRealSource{Junde Yhi}{2020-01-03 15:33:24}%
    \msgMainContent{æˆ‘å–œå biu å‡†æ—¢å‘½ä»¤}%
    %
}


\channelMsgEntry{%
    \msgRealSource{Xiaoxing}{2020-01-05 03:52:35}%
    \msgMainContent{\#æœå†»æ€ä¹ˆå«}%
    %
}


\channelMsgEntry{%
    \msgRealSource{Mingcong Bai}{2020-01-05 03:52:35}%
    \msgMainContent{å“¼ï¼Œå“¼}%
    %
}


\channelMsgEntry{%
    \msgRealSource{Mingcong Bai}{2020-01-05 03:52:35}%
    \msgMainContent{å•Šï¼Œå—¯}%
    %
}


\channelMsgEntry{%
    \msgRealSource{Mingcong Bai}{2020-01-05 03:52:35}%
    \msgMainContent{å•Šå•Šå•Šå•Šå•Šå•Šå•Šå•Šå•Šå•Šå•Šå•Šå•Š}%
    %
}


\channelMsgEntry{%
    \msgRealSource{Xiaoxing}{2020-01-07 16:42:26}%
    \msgMainContent{}%
    %
}


\channelMsgEntry{%
    \msgRealSource{Xiaoxing}{2020-01-07 16:42:26}%
    \msgMainContent{æˆ‘å»ç‚’ç²‰}%
    %
}


\channelMsgEntry{%
    \msgRealSource{Mingcong Bai}{2020-01-07 16:42:26}%
    \msgMainContent{è®©æˆ‘æ¥éªŒè¯ä¸‹ä½ çš„æŠ€èƒ½ï¼ˆ}%
    %
}


\channelMsgEntry{%
    \msgRealSource{Xiaoxing}{2020-01-07 16:42:26}%
    \msgMainContent{è®°å¾—ä¹°å¥½ä¿é™©}%
    %
}


\channelMsgEntry{%
    \msgRealSource{Lion}{2020-01-07 16:42:26}%
    \msgMainContent{ç‚’å‡ºæ¥çš„ç²‰ï¼Œé«˜è€¦åˆä½å†…èšå•çº¿ç¨‹é«˜å¹¶å‘ï¼Œè¿˜å¯ä»¥å‡½æ•°å¼åƒç²‰}%
    %
}


\channelMsgEntry{%
    \msgRealSource{Xiaoxing}{2020-01-07 16:42:26}%
    \msgMainContent{é«˜è€¦åˆï¼šæ²¹æ”¾å°‘äº† ä½å†…èšï¼šç²‰è¿‡æœŸäº† å•çº¿ç¨‹ï¼šå¤ªéš¾åƒåƒä¸ä¸‹å»
é«˜å¹¶å‘ï¼šåªèƒ½åˆ†ç»™åˆ«äººåƒ

å‡½æ•°å¼åƒç²‰ï¼šåƒè¿›å»çš„æ˜¯ä»€ä¹ˆï¼Œ*å‡ºæ¥çš„è¿˜æ˜¯ä»€ä¹ˆ}%
    %
}


\channelMsgEntry{%
    \msgRealSource{åŒå€å¤šå¤šå†°ğŸ§¶ | ğ¦ğŸğœğŸ}{2020-01-07 17:30:26}%
    \msgMainContent{å°¾é€’å½’ï¼šæ‹‰å‡ºæ¥ç»§ç»­å¼€åƒ}%
    %
}


\channelMsgEntry{%
    \msgRealSource{åŒå€å¤šå¤šå†°ğŸ§¶ | ğ¦ğŸğœğŸ}{2020-01-07 17:30:26}%
    \msgMainContent{ä½å†…èšä¹Ÿå¯èƒ½æ˜¯ç¿»ç‚’è¿‡åº¦æŠŠç²‰ç¿»ç¢äº†ï¼ˆ}%
    %
}


\channelMsgEntry{%
    \msgRealSource{Mingcong Bai}{2020-01-08 12:37:33}%
    \msgMainContent{æƒ³èµ·ä¸Šæ¬¡çƒ¹é¥ªæ¯”èµ›åšçš„æ°´ç…®ç‰›è‚‰}%
    %
}


\channelMsgEntry{%
    \msgRealSource{Mingcong Bai}{2020-01-08 12:37:33}%
    \msgMainContent{éŸ©å›½äººè¯´å¥½ï¼Œç¾å›½äººè¯´å¤ªè¾£ï¼Œå¢¨è¥¿å“¥äºº``è¿˜èƒ½å†è¾£ç‚¹ï¼Œè¿™æ ·æ‰èƒ½æŠŠå‘³é“æèµ·æ¥''}%
    %
}


\channelMsgEntry{%
    \msgRealSource{Mingcong Bai}{2020-01-08 12:37:33}%
    \msgMainContent{å¢¨è¥¿å“¥è¾£ç‚–èœ}%
    %
}


\channelMsgEntry{%
    \msgRealSource{Mingcong Bai}{2020-01-08 12:37:33}%
    \msgMainContent{ç¾å›½åƒçš„è·Ÿç©å…·ä¸€æ ·}%
    %
}


\channelMsgEntry{%
    \msgRealSource{Mingcong Bai}{2020-01-08 12:37:33}%
    \msgMainContent{ä¸Šæ¬¡åƒä¸€å¢¨è¥¿å“¥è€å¨˜åšçš„}%
    %
}


\channelMsgEntry{%
    \msgRealSource{Mingcong Bai}{2020-01-08 12:37:33}%
    \msgMainContent{æ­£å®—æ³»è¯}%
    %
}


\channelMsgEntry{%
    \msgRealSource{Mingcong Bai}{2020-01-08 12:37:33}%
    \msgMainContent{è¾£æ¤’ï¼Œç‰›è‚‰ï¼Œè¥¿çº¢æŸ¿ï¼Œè±†å­ï¼Œè±†å­ï¼Œè±†å­ï¼Œè±†å­ï¼Œè±†å­ï¼Œè±†å­ï¼Œè±†å­ï¼Œè±†å­ï¼Œè±†å­ï¼Œè±†å­}%
    %
}


\channelMsgEntry{%
    \msgRealSource{Mingcong Bai}{2020-01-08 12:37:33}%
    \msgMainContent{}%
    \nopagebreak\includegraphics[width=\linewidth]{./.tg-data/2020/photos/photo_119@08-01-2020_12-37-33.jpg}%
}


\channelMsgEntry{%
    \msgRealSource{Mingcong Bai}{2020-01-08 12:37:33}%
    \msgMainContent{å¢¨è¥¿å“¥ç‚–è±†è±†è±†è±†è±†è±†è±†è±†è±†è±†è±†è±†è±†è±†è±†è±†è±†è±†è±†è±†è‚‰è±†è±†è±†è±†è±†è±†è±†è±†è±†è±†è±†è±†è±†è±†è±†è¾£æ¤’è±†è±†è±†è±†è±†è±†è±†è±†è±†è±†è±†è±†è±†è±†è±†è¥¿çº¢æŸ¿è±†è±†è±†è±†è±†è±†è±†è±†è±†è±†è±†è±†è±†è±†è±†}%
    %
}


\channelMsgEntry{%
    \msgRealSource{cth451 ÇÉ”uÇÆƒÉ¹ÇÊŒá´‰p}{2020-01-08 12:38:38}%
    \msgMainContent{\#lost+found}%
    %
}


\channelMsgEntry{%
    \msgRealSource{Phoronix News}{2020-01-08 17:53:12}%
    \msgMainContent{Phoronix Systemd Will Be Working To Improve Out-Of-Memory Linux Handling
With Facebook OOMD

While more Linux distributions have begun packaging (and in the case of
Fedora, potentially deploying by default) EarlyOOM as the out-of-memory
monitoring daemon for trying to improve the Linux desktop's handling of
low memory situations, systemd ultimately should be picking up its own
out-of-memory daemon in the months ahead\ldots{}}%
    %
}


\channelMsgEntry{%
    \msgRealSource{åŒå€å¤šå¤šå†°ğŸ§¶ | ğ¦ğŸğœğŸ}{2020-01-08 17:53:13}%
    \msgMainContent{åº•è£¤å‡ºæ‰‹}%
    %
}


\channelMsgEntry{%
    \msgRealSource{Mingcong Bai}{2020-01-08 17:53:13}%
    \msgMainContent{\ldots\ldots åˆšè¦ç ”ç©¶ earlyoom LMAO}%
    %
}


\channelMsgEntry{%
    \msgRealSource{Mingcong Bai}{2020-01-08 17:53:13}%
    \msgMainContent{Lennart æ‡‚ä½  (R)}%
    %
}


\channelMsgEntry{%
    \msgRealSource{åŒå€å¤šå¤šå†°ğŸ§¶ | ğ¦ğŸğœğŸ}{2020-01-10 15:11:28}%
    \msgMainContent{æˆ‘å»å‡€èº«ï¼ˆä¸ï¼‰äº†}%
    %
}


\channelMsgEntry{%
    \msgRealSource{Lion}{2020-01-10 15:11:28}%
    \msgMainContent{é‡‘ç‰å·å–}%
    %
}


\channelMsgEntry{%
    \msgRealSource{Mingcong Bai}{2020-01-10 15:11:29}%
    \msgMainContent{ä½ æ…¢ç‚¹}%
    %
}


\channelMsgEntry{%
    \msgRealSource{Mingcong Bai}{2020-01-10 15:11:29}%
    \msgMainContent{ä¸»ç¾¤è·¯æ»‘}%
    %
}


\channelMsgEntry{%
    \msgRealSource{Lion}{2020-01-10 15:11:29}%
    \msgMainContent{ï¼ˆè½¦è¾†ç¢°æ’é¿å… æ¿€æ´»ï¼‰}%
    %
}


\channelMsgEntry{%
    \msgRealSource{Mingcong Bai}{2020-01-10 16:07:21}%
    \msgMainContent{\ldots\ldots ç­‰ç­‰æˆ‘çš„æœºå™¨ä¸æ”¯æŒ S3ï¼Œæ˜¯ S0ix}%
    %
}


\channelMsgEntry{%
    \msgRealSource{Mingcong Bai}{2020-01-10 16:07:22}%
    \msgMainContent{Linux å¤§æ¬¢å–œ}%
    %
}


\channelMsgEntry{%
    \msgRealSource{Junde Yhi}{2020-01-10 16:07:22}%
    \msgMainContent{ï¼ˆæˆ‘çœ‹çœ‹ S0ix æ˜¯ä»€ä¹ˆå®šä¹‰}%
    %
}


\channelMsgEntry{%
    \msgRealSource{Mingcong Bai}{2020-01-10 16:07:22}%
    \msgMainContent{Lucid masturbation}%
    %
}


\channelMsgEntry{%
    \msgRealSource{Mingcong Bai}{2020-01-10 16:19:22}%
    \msgMainContent{å—¯ï¼Œå¦å¤–æˆ‘è¿™ä¸ª lucid masturbation è¯´æ³•å…¶å®æ˜¯æœ‰ä¾æ®çš„ï¼ˆ}%
    %
}


\channelMsgEntry{%
    \msgRealSource{Mingcong Bai}{2020-01-10 16:19:22}%
    \msgMainContent{æœ‰çš„æ—¶å€™ç¡ä¸‹å»äº†}%
    %
}


\channelMsgEntry{%
    \msgRealSource{Mingcong Bai}{2020-01-10 16:19:22}%
    \msgMainContent{è¿‡äº†å‡ ä¸ªå°æ—¶çªç„¶``å“¼ï¼Œå“¼ï¼Œå•Šå•Šå•Šå•Š---------''å°±é†’è¿‡æ¥äº†}%
    %
}


\channelMsgEntry{%
    \msgRealSource{cth451 ÇÉ”uÇÆƒÉ¹ÇÊŒá´‰p}{2020-01-10 16:19:35}%
    \msgMainContent{\#nsfw}%
    %
}


\channelMsgEntry{%
    \msgRealSource{cth451 ÇÉ”uÇÆƒÉ¹ÇÊŒá´‰p}{2020-01-12 18:18:00}%
    \msgMainContent{Haskell çœ‹ä¹…äº†è¶Šçœ‹è¶Šæ­£å¸¸ä¹‹åï¼Œåˆ«äººçœ‹æˆ‘è¶Šæ¥è¶Šä¸æ­£å¸¸}%
    %
}


\channelMsgEntry{%
    \msgRealSource{Lion}{2020-01-12 18:18:00}%
    \msgMainContent{é“ç†å¾ˆç®€å•ï¼Œåªè¦ä¸­é—´å˜é‡è®¾ç½®å¾—å¤šï¼Œä½ å°±è¶Šåƒæ­£å¸¸äººï¼ˆ}%
    %
}


\channelMsgEntry{%
    \msgRealSource{Lion}{2020-01-12 18:18:00}%
    \msgMainContent{å¦‚æœä½ è¶Šçˆ±å¥—å¨ƒå’Œä¸€è¡Œæµï¼Œä½ å°±è¶Šåƒæ•°å­¦å®¶}%
    %
}


\channelMsgEntry{%
    \msgRealSource{Lion}{2020-01-12 18:18:00}%
    \msgMainContent{å‡½æ•°å¼è¿‡åº¦ä¸Šè„‘çš„ç»“æœå°±æ˜¯ï¼Œåˆ«äººçœ‹ä½ å°±åƒçœ‹æ•°å­¦å®¶ï¼ˆ}%
    %
}


\channelMsgEntry{%
    \msgRealSource{cth451 ÇÉ”uÇÆƒÉ¹ÇÊŒá´‰p}{2020-01-12 18:18:18}%
    \msgMainContent{ä½†æˆ‘æ˜¯åœ¨æ•°å­¦ç³»ä¸åŠ¡æ­£ä¸šçš„ CS äººï¼ˆ}%
    %
}


\channelMsgEntry{%
    \msgRealSource{Lion}{2020-01-12 18:18:18}%
    \msgMainContent{ä½ å¯èƒ½æ˜¯å¶å°”æƒ³ç©ç© CS çš„æœ¬è´¨æ•°å­¦å®¶ï¼ˆ}%
    %
}


\channelMsgEntry{%
    \msgRealSource{Leo Shen}{2020-01-20 19:45:18}%
    \msgMainContent{å› ä¸ºç£å¸¦çš„ read head åŠ å¤§åŠ›åº¦å°±å˜æˆ write head äº†å˜›(}%
    %
}


\channelMsgEntry{%
    \msgRealSource{å’¸é±¼}{2020-01-20 19:45:18}%
    \msgMainContent{å“¼}%
    %
}


\channelMsgEntry{%
    \msgRealSource{å’¸é±¼}{2020-01-20 19:45:18}%
    \msgMainContent{å“¼å“¼}%
    %
}


\channelMsgEntry{%
    \msgRealSource{å’¸é±¼}{2020-01-20 19:45:18}%
    \msgMainContent{å•Šå•Šå•Šå•Šå•Šå•Šå•Šå•Š}%
    %
}


\channelMsgEntry{%
    \msgRealSource{å’¸é±¼}{2020-01-20 19:45:18}%
    \msgMainContent{ï¼ˆx}%
    %
}


\channelMsgEntry{%
    \msgRealSource{Leo Shen}{2020-01-20 19:45:18}%
    \msgMainContent{\emph{oversaturated}}%
    %
}


\channelMsgEntry{%
    \msgRealSource{cth451 ÇÉ”uÇÆƒÉ¹ÇÊŒá´‰p}{2020-01-20 19:45:31}%
    \msgMainContent{\#æ€ä¹ˆå«}%
    %
}


\channelMsgEntry{%
    \msgRealSource{Mogician Yang}{2020-01-29 04:52:46}%
    \msgMainContent{\#NSFW}%
    %
}


\channelMsgEntry{%
    \msgRealSource{MoGeCâ‚â‚„N Yang}{2020-01-29 04:52:46}%
    \msgMainContent{ç‰¹é¦–è¿½åˆ°è°ï¼Œè°å°±å’Œä»–å˜¿ å˜¿ å˜¿}%
    %
}


\channelMsgEntry{%
    \msgRealSource{Lion}{2020-01-29 04:52:46}%
    \msgMainContent{è¿™ä¸ªå¥½ï¼Œå¿«æ¥è¿½æˆ‘ï¼ˆæµç€ä¸åŠ¨}%
    %
}


\channelMsgEntry{%
    \msgRealSource{Mingcong Bai}{2020-01-29 04:52:46}%
    \msgMainContent{è®©æˆ‘çœ‹çœ‹ä½ çš„è¿™ä¸ªæµ}%
    %
}


\channelMsgEntry{%
    \msgRealSource{å’¸é±¼}{2020-01-29 05:06:36}%
    \msgMainContent{ç¤¾åŒºæœ‰è§„å®šï¼ç¤¾å‘˜ä¸å¯ä»¥å•µç‰¹é¦–å˜´ï¼}%
    %
}


\channelMsgEntry{%
    \msgRealSource{Mingcong Bai}{2020-01-29 05:06:36}%
    \msgMainContent{ç¤¾åŒºæœ‰è§„å®šï¼å’¸é±¼ä»Šæ™šå¿…é¡»å•µç‹®å­å˜´ï¼ï¼ˆx}%
    %
}


\channelMsgEntry{%
    \msgRealSource{Mingcong Bai}{2020-01-29 05:06:37}%
    \msgMainContent{\#AffirmativeAction}%
    %
}


\channelMsgEntry{%
    \msgRealSource{Leo Shen}{2020-01-29 05:06:37}%
    \msgMainContent{é™„è®®! (x}%
    %
}


\channelMsgEntry{%
    \msgRealSource{Xiaoxing}{2020-01-29 05:06:37}%
    \msgMainContent{å·²ç»ç¤¾åŒºå¤‡æ¡ˆï¼Œäºˆä»¥æ‰§è¡Œ}%
    %
}


\channelMsgEntry{%
    \msgRealSource{å’¸é±¼}{2020-01-29 05:06:37}%
    \msgMainContent{ä¸Šè¯‰ï¼}%
    %
}


\channelMsgEntry{%
    \msgRealSource{Xiaoxing}{2020-01-29 05:06:37}%
    \msgMainContent{è®°å¾—ä¹°å¥½ä¿é™©}%
    %
}


\channelMsgEntry{%
    \msgRealSource{Xiaoxing}{2020-01-29 05:06:37}%
    \msgMainContent{è¯· @o0\_0b @TheSaltedFish åšå†³æ‰§è¡Œç¤¾åŒºå†³è®®ã€‚æ­¤å†³è®®ä¸ºæœ€ç»ˆå†³è®®ï¼Œä¸äºˆä¸Šè¯‰ã€‚}%
    %
}


\channelMsgEntry{%
    \msgRealSource{Mingcong Bai}{2020-01-29 05:06:37}%
    \msgMainContent{æ˜¯æ”¿æ²»ä»»åŠ¡ï¼ˆ}%
    %
}


\channelMsgEntry{%
    \msgRealSource{å’¸é±¼}{2020-01-29 05:06:37}%
    \msgMainContent{ä¸Šè¯‰ï¼}%
    %
}


\channelMsgEntry{%
    \msgRealSource{Lion}{2020-01-29 05:16:54}%
    \msgMainContent{å‘æ£€å¯Ÿé™¢æŠ—è¯‰ï¼ˆ}%
    %
}


\channelMsgEntry{%
    \msgRealSource{Lion}{2020-01-29 05:16:54}%
    \msgMainContent{æœ¬æ¡ˆå‘å›åŒçº§æ³•é™¢å†å®¡ï¼ˆ}%
    %
}


\channelMsgEntry{%
    \msgRealSource{Mingcong Bai}{2020-01-29 05:16:54}%
    \msgMainContent{è®©æˆ‘æ¥ç»´ç¨³}%
    %
}


\channelMsgEntry{%
    \msgRealSource{Xiaoxing}{2020-01-29 05:16:54}%
    \msgMainContent{æœ¬ç¤¾åŒºä¸è®¾æ£€å¯Ÿé™¢ï¼Œä¸€åˆ‡å†³è®®è§£é‡Šæƒå½’ç‰¹é¦–æ‰€æœ‰}%
    %
}


\channelMsgEntry{%
    \msgRealSource{å’¸é±¼}{2020-01-29 05:16:54}%
    \msgMainContent{æˆ‘å»å‹¾ç»“å¢ƒå¤–åŠ¿åŠ›}%
    %
}


\channelMsgEntry{%
    \msgRealSource{Lion}{2020-01-29 05:16:54}%
    \msgMainContent{æˆ‘å»å‹¾ç»“å¢ƒå†…åŠ¿åŠ›}%
    %
}


\channelMsgEntry{%
    \msgRealSource{Xiaoxing}{2020-01-29 05:16:54}%
    \msgMainContent{å–‚ä¿å®‰ï¼ŒæŠŠè¿™é±¼æŠ“èµ·æ¥}%
    %
}


\channelMsgEntry{%
    \msgRealSource{Xiaoxing}{2020-01-29 05:16:54}%
    \msgMainContent{å¼ºåˆ¶æ‰§è¡Œ}%
    %
}


\channelMsgEntry{%
    \msgRealSource{å’¸é±¼}{2020-01-29 05:16:54}%
    \msgMainContent{ç›ä¸‹é¢ä¸åªæ˜¯è¡€è‚‰ä¹‹èº¯ï¼Œè€Œæ˜¯ä¸€ç§æ€æƒ³ã€‚}%
    %
}


\channelMsgEntry{%
    \msgRealSource{å’¸é±¼}{2020-01-29 05:16:54}%
    \msgMainContent{æ€æƒ³æ˜¯ä¸æ€•å­å¼¹çš„ï¼}%
    %
}


\channelMsgEntry{%
    \msgRealSource{Mingcong Bai}{2020-01-29 05:16:54}%
    \msgMainContent{å…‰ä½ è€æ¯ï¼Œæ—¶ä½ è€è±†ï¼ˆ}%
    %
}


\channelMsgEntry{%
    \msgRealSource{Xiaoxing}{2020-01-30 18:09:31}%
    \msgMainContent{å”çªçˆ†ç¬‘äº‹ä»¶}%
    %
}


\channelMsgEntry{%
    \msgRealSource{æŸ10}{2020-02-05 05:53:02}%
    \msgMainContent{é—®ä¸ªé—®é¢˜ é­”çˆªè¿™ç§ä¸€å¤©èƒ½å–å‡ ç½ã€‚}%
    %
}


\channelMsgEntry{%
    \msgRealSource{Neo\_Chen (BU4AK)}{2020-02-05 05:53:02}%
    \msgMainContent{ä½ çš„è…æ’å¾—ä½å°±ç„¡é™ï¼ˆé€ƒ}%
    %
}


\channelMsgEntry{%
    \msgRealSource{ĞĞµĞ‘ÑƒÑ‚Ğ»ĞµĞ³ ï¼ˆè¿«çœŸï¼‰}{2020-02-05 05:53:03}%
    \msgMainContent{é‚£å¤©å¤§æ¦‚æ˜¯ä½ çš„ååŠè¾ˆå­}%
    %
}


\channelMsgEntry{%
    \msgRealSource{Mingcong Bai}{2020-02-05 05:53:03}%
    \msgMainContent{xs}%
    %
}


\channelMsgEntry{%
    \msgRealSource{Lion}{2020-02-05 06:39:24}%
    \msgMainContent{æˆ‘è¦çœ‹ï¼ˆæ’’å¨‡ï¼ˆï¼Ÿ}%
    %
}


\channelMsgEntry{%
    \msgRealSource{ĞĞµĞ‘ÑƒÑ‚Ğ»ĞµĞ³ ï¼ˆè¿«çœŸï¼‰}{2020-02-05 06:39:24}%
    \msgMainContent{æ’¤ä¾¨ï¼ˆx}%
    %
}


\channelMsgEntry{%
    \msgRealSource{Neruthes 0xAFB3373F5200DF38}{2020-02-06 19:02:23}%
    \msgMainContent{æ¥ä¸‹æ¥æˆ‘æ‰“ç®—æ¨å¹¿ã€Œè·å¼åˆ†è´¦ã€å’Œã€Œä¸­å¼åˆ†è´¦ã€}%
    %
}


\channelMsgEntry{%
    \msgRealSource{Neruthes 0xAFB3373F5200DF38}{2020-02-06 19:02:23}%
    \msgMainContent{è·å¼åˆ†è´¦ï¼šå„ä»˜å„è´¦ ä¸­å¼åˆ†è´¦ï¼šç®—æœ¯å¹³å‡}%
    %
}


\channelMsgEntry{%
    \msgRealSource{Neruthes 0xAFB3373F5200DF38}{2020-02-06 19:02:24}%
    \msgMainContent{å“¦å¯¹è¿˜æœ‰ä¸€ä¸ª}%
    %
}


\channelMsgEntry{%
    \msgRealSource{Neruthes 0xAFB3373F5200DF38}{2020-02-06 19:02:24}%
    \msgMainContent{å¹¿å¼åˆ†è´¦ï¼šèŒ¶ä½è´¹ä¸­å¼åˆ†è´¦ï¼Œèœå“è·å¼åˆ†è´¦}%
    %
}


\channelMsgEntry{%
    \msgRealSource{Lion}{2020-02-06 19:03:10}%
    \msgMainContent{æœ‰å‡ ä½•å¹³å‡å’Œè°ƒå’Œå¹³å‡ä»˜è´¦æ³•å—ï¼ˆ}%
    %
}


\channelMsgEntry{%
    \msgRealSource{Lion}{2020-02-06 19:03:10}%
    \msgMainContent{è¿™æ ·æˆ‘å°±å¯ä»¥æ‹¿å¤šç‚¹é’±äº†ï¼ˆ}%
    %
}


\channelMsgEntry{%
    \msgRealSource{Neruthes 0xAFB3373F5200DF38}{2020-02-06 19:03:21}%
    \msgMainContent{å®¢å®¶åˆ†è´¦ï¼Ÿ}%
    %
}


\channelMsgEntry{%
    \msgRealSource{Lion}{2020-02-07 16:36:06}%
    \msgMainContent{åˆ«æ€‚ï¼Œè€ç™½å–œæ¬¢è¢«äººæ­£é¢æ‰“è„¸ï¼ˆ}%
    %
}


\channelMsgEntry{%
    \msgRealSource{Mingcong Bai}{2020-02-07 16:36:06}%
    \msgMainContent{\begin{itemize}
\tightlist
\item
\end{itemize}}%
    %
}


\channelMsgEntry{%
    \msgRealSource{Mingcong Bai}{2020-02-08 04:18:02}%
    \msgMainContent{}%
    \nopagebreak\includegraphics[width=\linewidth]{./.tg-data/2020/photos/photo_120@08-02-2020_04-18-02.jpg}%
}


\channelMsgEntry{%
    \msgRealSource{ĞĞµĞ‘ÑƒÑ‚Ğ»ĞµĞ³ ï¼ˆè¿«çœŸï¼‰}{2020-02-08 04:18:02}%
    \msgMainContent{speedrunï¼ˆï¼Ÿ}%
    %
}


\channelMsgEntry{%
    \msgRealSource{liushuyu}{2020-02-08 04:18:02}%
    \msgMainContent{Linux kernel compiling speedrun Any\% 100\% (all yes config) (}%
    %
}


\channelMsgEntry{%
    \msgRealSource{liushuyu}{2020-02-08 04:18:15}%
    \msgMainContent{New strat found: ``\ldots{} by building in a \texttt{tmpfs}can shave off
2 seconds, thus a new PB'' (}%
    %
}


\channelMsgEntry{%
    \msgRealSource{ĞĞµĞ‘ÑƒÑ‚Ğ»ĞµĞ³ ï¼ˆè¿«çœŸï¼‰}{2020-02-08 10:02:41}%
    \msgMainContent{åŸæ¥æˆ¿è½¦å«RV}%
    %
}


\channelMsgEntry{%
    \msgRealSource{MoGeCâ‚â‚„N Yang}{2020-02-08 10:02:41}%
    \msgMainContent{é‚£AVæ˜¯ä»€ä¹ˆè½¦}%
    %
}


\channelMsgEntry{%
    \msgRealSource{Lion}{2020-02-08 10:02:41}%
    \msgMainContent{æ˜¯å¿«è½¦}%
    %
}


\channelMsgEntry{%
    \msgRealSource{ĞĞµĞ‘ÑƒÑ‚Ğ»ĞµĞ³ ï¼ˆè¿«çœŸï¼‰}{2020-02-08 10:02:41}%
    \msgMainContent{æ˜¯è½¦ç”¨å¸å°˜å™¨ï¼ˆx}%
    %
}


\channelMsgEntry{%
    \msgRealSource{Neo\_Chen (BU4AK)}{2020-02-08 10:02:41}%
    \msgMainContent{é»ƒè‰²çš„ï¼ˆ}%
    %
}


\channelMsgEntry{%
    \msgRealSource{MoGeCâ‚â‚„N Yang}{2020-02-08 10:02:41}%
    \msgMainContent{AV -\textgreater{} Any car ï¼ˆ}%
    %
}


\channelMsgEntry{%
    \msgRealSource{Neo\_Chen (BU4AK)}{2020-02-08 10:02:41}%
    \msgMainContent{*hentai.orgï¼ˆ}%
    %
}


\channelMsgEntry{%
    \msgRealSource{ĞĞµĞ‘ÑƒÑ‚Ğ»ĞµĞ³ ï¼ˆè¿«çœŸï¼‰}{2020-02-08 10:02:41}%
    \msgMainContent{Avis (x}%
    %
}


\channelMsgEntry{%
    \msgRealSource{MoGeCâ‚â‚„N Yang}{2020-02-08 10:02:41}%
    \msgMainContent{âˆ€x AV(x) â‡’ Car(x)}%
    %
}


\channelMsgEntry{%
    \msgRealSource{Felix Yan}{2020-02-08 22:26:13}%
    \msgMainContent{æˆ‘åœ¨å¼ºçƒˆè¦æ±‚ä»–ä»¬åšæˆé…ç½®é¡¹}%
    %
}


\channelMsgEntry{%
    \msgRealSource{å’¸é±¼}{2020-02-08 22:26:13}%
    \msgMainContent{ç„¶åç”¨æˆ·æ”¹æˆäº† COS}%
    %
}


\channelMsgEntry{%
    \msgRealSource{Felix Yan}{2020-02-08 22:26:13}%
    \msgMainContent{ç„¶åæ”¹æˆAOSC}%
    %
}


\channelMsgEntry{%
    \msgRealSource{Felix Yan}{2020-02-08 22:26:13}%
    \msgMainContent{å‘åˆ°è´´å§}%
    %
}


\channelMsgEntry{%
    \msgRealSource{å’¸é±¼}{2020-02-08 22:26:13}%
    \msgMainContent{ç­‰å¾… 114514 å¹´çš„ COS ç»ˆäºå‘å¸ƒäº†ï¼}%
    %
}


\channelMsgEntry{%
    \msgRealSource{å’¸é±¼}{2020-02-08 22:26:13}%
    \msgMainContent{AOSC å‰½çªƒæ·±åº¦}%
    %
}


\channelMsgEntry{%
    \msgRealSource{Lion}{2020-02-08 22:26:13}%
    \msgMainContent{æ·±åº¦å‰½çªƒ AOSC}%
    %
}


\channelMsgEntry{%
    \msgRealSource{Lion}{2020-02-08 22:26:13}%
    \msgMainContent{ä¸€ è½¬ æ”» åŠ¿}%
    %
}


\channelMsgEntry{%
    \msgRealSource{Mingcong Bai}{2020-02-09 06:09:49}%
    \msgMainContent{å›å‘³äº†ä¸‹ï¼Œ``å›½å®¶ç›‘å¯Ÿå§”å‘˜ä¼šè°ƒæŸ¥ç»„å·²æŠµè¾¾æ­¦æ±‰''æ„Ÿè§‰ç¿»è¯‘æˆ YOU DIED æ¯”è¾ƒå¥½ï¼ˆ}%
    %
}


\channelMsgEntry{%
    \msgRealSource{Xiaoxing}{2020-02-09 06:09:49}%
    \msgMainContent{}%
    %
}


\channelMsgEntry{%
    \msgRealSource{Mingcong Bai}{2020-02-09 19:44:06}%
    \msgMainContent{å¥½çš„ä¸€æ™šä¸Š 22333 æ²¡æ­»ï¼ˆ}%
    %
}


\channelMsgEntry{%
    \msgRealSource{Mingcong Bai}{2020-02-09 19:44:06}%
    \msgMainContent{å°±æ˜¯çœ‹èµ·æ¥æ²¡äººç”¨ï¼Œå¤„ç†å™¨æ¸©åº¦å¿«åˆ°å®¤æ¸©äº†ï¼ˆ}%
    %
}


\channelMsgEntry{%
    \msgRealSource{Junde Yhi}{2020-02-09 19:44:06}%
    \msgMainContent{ï¼ˆå’³ï¼‰è¦å‡å°‘æœºå™¨é—²ç½®æ—¶é—´ï¼ˆå’³}%
    %
}


\channelMsgEntry{%
    \msgRealSource{Lion}{2020-02-09 19:44:06}%
    \msgMainContent{åŠ ä¸ª BOINC å‘€}%
    %
}


\channelMsgEntry{%
    \msgRealSource{Lion}{2020-02-09 19:44:07}%
    \msgMainContent{è´¦å·æ³¨å†Œå°±å«åš AOSC å¥½äº†}%
    %
}


\channelMsgEntry{%
    \msgRealSource{Lion}{2020-02-09 19:44:07}%
    \msgMainContent{é—²æ—¶ç»™ç§‘å­¦ç•Œåšè´¡çŒ®ï¼ˆ}%
    %
}


\channelMsgEntry{%
    \msgRealSource{Mingcong Bai}{2020-02-09 19:44:07}%
    \msgMainContent{ç”µè´¹è¦é’±çš„å…ˆç”Ÿï¼ˆ}%
    %
}


\channelMsgEntry{%
    \msgRealSource{Mingcong Bai}{2020-02-09 19:44:07}%
    \msgMainContent{ä¸å¦‚ä¹° i9 æ‹¯æ•‘æ°”å€™é—®é¢˜}%
    \nopagebreak\includegraphics[width=\linewidth]{./.tg-data/2020/photos/photo_121@09-02-2020_19-44-07.jpg}%
}


\channelMsgEntry{%
    \msgRealSource{Lion}{2020-02-09 19:44:07}%
    \msgMainContent{}%
    \nopagebreak\includegraphics[width=\linewidth]{./.tg-data/2020/photos/photo_122@09-02-2020_19-44-07.jpg}%
}


\channelMsgEntry{%
    \msgRealSource{Lion}{2020-02-09 19:44:07}%
    \msgMainContent{ä¸€çœ¼å°±æ‰¾åˆ°äº† i9 çš„ä½ç½®}%
    %
}


\channelMsgEntry{%
    \msgRealSource{å’¸é±¼}{2020-02-10 05:41:03}%
    \msgMainContent{Surprise Motherhugger}%
    \nopagebreak\includegraphics[width=\linewidth]{./.tg-data/2020/photos/photo_123@10-02-2020_05-41-03.jpg}%
}


\channelMsgEntry{%
    \msgRealSource{Mingcong Bai}{2020-02-10 05:41:03}%
    \msgMainContent{è®²è¯é‚£ä¹ˆåŠ å·å¹²å•¥}%
    %
}


\channelMsgEntry{%
    \msgRealSource{Mingcong Bai}{2020-02-10 05:41:03}%
    \msgMainContent{è¿™é‡Œä»–å¦ˆçš„æ˜¯ AOSC ä¸ªé¸¡å§æ‰˜è…®ç¾¤å•Šï¼ˆx}%
    %
}


\channelMsgEntry{%
    \msgRealSource{Mingcong Bai}{2020-02-10 05:58:33}%
    \msgMainContent{}%
    %
}


\channelMsgEntry{%
    \msgRealSource{å’¸é±¼}{2020-02-10 05:58:33}%
    \msgMainContent{ä¼´å¥ï¼šè„‘åŠ›}%
    %
}


\channelMsgEntry{%
    \msgRealSource{Mingcong Bai}{2020-02-10 05:58:33}%
    \msgMainContent{}%
    %
}


\channelMsgEntry{%
    \msgRealSource{è‡­è‡­}{2020-02-10 05:58:33}%
    \msgMainContent{}%
    %
}


\channelMsgEntry{%
    \msgRealSource{Neo\_Chen (BU4AK)}{2020-02-10 05:58:33}%
    \msgMainContent{}%
    %
}


\channelMsgEntry{%
    \msgRealSource{Mingcong Bai}{2020-02-10 05:58:33}%
    \msgMainContent{}%
    %
}


\channelMsgEntry{%
    \msgRealSource{å’¸é±¼}{2020-02-10 06:00:29}%
    \msgMainContent{}%
    %
}


\channelMsgEntry{%
    \msgRealSource{Neo\_Chen (BU4AK)}{2020-02-10 06:02:30}%
    \msgMainContent{}%
    %
}


\channelMsgEntry{%
    \msgRealSource{Mingcong Bai}{2020-02-10 06:02:34}%
    \msgMainContent{æ‰˜è…®è¹¦è¿ªç°åœº}%
    %
}


\channelMsgEntry{%
    \msgRealSource{å’¸é±¼}{2020-02-10 06:09:31}%
    \msgMainContent{ç´¢ç´¢ï¼ï¼ˆå°–å«}%
    %
}


\channelMsgEntry{%
    \msgRealSource{å’¸é±¼}{2020-02-10 06:09:31}%
    \msgMainContent{ç´¢ç´¢ï¼ˆç ´éŸ³}%
    %
}


\channelMsgEntry{%
    \msgRealSource{å’¸é±¼}{2020-02-10 06:09:31}%
    \msgMainContent{ç´¢ç´¢ï¼ˆæ˜å¥}%
    %
}


\channelMsgEntry{%
    \msgRealSource{å’¸é±¼}{2020-02-10 06:10:28}%
    \msgMainContent{ï¼ˆåˆ«ä¹°}%
    %
}


\channelMsgEntry{%
    \msgRealSource{AOSC æ¢—}{2020-02-10 06:10:34}%
    \msgMainContent{\#æ€ä¹ˆå«}%
    %
}


\channelMsgEntry{%
    \msgRealSource{æƒ  /*ğŸ¦ŠmegumifoxğŸ¦Š*/}{2020-02-10 06:22:16}%
    \msgMainContent{}%
    %
}


\channelMsgEntry{%
    \msgRealSource{å’¸é±¼}{2020-02-10 06:22:17}%
    \msgMainContent{ä½ ä»–å¨˜çš„æŠŠç”°æ‰€æµ©äºŒæ‹‰å‡ºæ¥}%
    %
}


\channelMsgEntry{%
    \msgRealSource{MoGeCâ‚â‚„N Yang}{2020-02-10 06:22:17}%
    \msgMainContent{è¯·æ±‚é‡Šä¹‰ï¼š æ‹‰}%
    %
}


\channelMsgEntry{%
    \msgRealSource{ãƒ‹ãƒãƒ“ ï¸ï¸ï¸ï¸ï¸ï¸ï¸ï¸ï¸ï¸ï¸ï¸ï¸ï¸ï¸ï¸ï¸ï¸ï¸ï¸ï¸ï¸ï¸ï¸ï¸}{2020-02-10 20:22:58}%
    \msgMainContent{æ’¿åˆ°å¥³å­é«˜ä¸­ç”Ÿï¼ˆ}%
    %
}


\channelMsgEntry{%
    \msgRealSource{ãƒ‹ãƒãƒ“ ï¸ï¸ï¸ï¸ï¸ï¸ï¸ï¸ï¸ï¸ï¸ï¸ï¸ï¸ï¸ï¸ï¸ï¸ï¸ï¸ï¸ï¸ï¸ï¸ï¸}{2020-02-10 20:22:58}%
    \msgMainContent{å¥½æƒ³çœ‹ä¸‹ä¸€å·}%
    %
}


\channelMsgEntry{%
    \msgRealSource{ãƒ‹ãƒãƒ“ ï¸ï¸ï¸ï¸ï¸ï¸ï¸ï¸ï¸ï¸ï¸ï¸ï¸ï¸ï¸ï¸ï¸ï¸ï¸ï¸ï¸ï¸ï¸ï¸ï¸}{2020-02-10 20:22:59}%
    \msgMainContent{æ²™å„ªé†¬ç‚’å¯æ„›çš„}%
    %
}


\channelMsgEntry{%
    \msgRealSource{Leo Shen}{2020-02-10 20:22:59}%
    \msgMainContent{æ²™èŒ¶é…± (å¹»è§†}%
    %
}


\channelMsgEntry{%
    \msgRealSource{å’¸é±¼}{2020-02-10 20:22:59}%
    \msgMainContent{æ²™å—²é…±}%
    %
}


\channelMsgEntry{%
    \msgRealSource{Leo Shen}{2020-02-10 20:22:59}%
    \msgMainContent{\&\& è±ªçˆ¹æ²¹ (}%
    %
}


\channelMsgEntry{%
    \msgRealSource{Leo Shen}{2020-02-10 20:22:59}%
    \msgMainContent{AOSC ç«é”…å¼€ä¸šå•¦}%
    %
}


\channelMsgEntry{%
    \msgRealSource{Mingcong Bai}{2020-02-11 21:29:16}%
    \msgMainContent{https://www.notebookcheck.net/Massive-Intel-Arctic-Sound-500-W-GPU-with-3D-stacked-quad-chip-design-spotted-in-leaked-presentation-slides.453649.0.html}%
    %
}


\channelMsgEntry{%
    \msgRealSource{Mingcong Bai}{2020-02-11 21:29:16}%
    \msgMainContent{\emph{tuberculosis}}%
    %
}


\channelMsgEntry{%
    \msgRealSource{Mingcong Bai}{2020-02-11 21:29:16}%
    \msgMainContent{400 - 500W TDP}%
    %
}


\channelMsgEntry{%
    \msgRealSource{Leo Shen}{2020-02-11 21:29:16}%
    \msgMainContent{name: Arctic TDP: 400W+}%
    %
}


\channelMsgEntry{%
    \msgRealSource{å’¸é±¼}{2020-02-11 21:29:16}%
    \msgMainContent{A r c t i c R i p p e r}%
    %
}


\channelMsgEntry{%
    \msgRealSource{Neo\_Chen (BU4AK)}{2020-02-11 21:29:16}%
    \msgMainContent{åŒ—æ¥µé›·æ™®è€…ï¼ˆ}%
    %
}


\channelMsgEntry{%
    \msgRealSource{Neruthes 0xAFB3373F5200DF38}{2020-02-12 12:35:52}%
    \msgMainContent{21 ä¸–çºªçš„ä»Šå¤©ï¼Œäººä»¬å‡ºäºæ€æ ·çš„ç†ç”±é€‰æ‹©ä¸ä½¿ç”¨ vanilla UNIX å‘¢}%
    %
}


\channelMsgEntry{%
    \msgRealSource{Junde Yhi}{2020-02-12 12:35:52}%
    \msgMainContent{ğŸ¶ä»æ¥å°±æ²¡æœ‰ä»€ä¹ˆé¦™è‰ï¼Œä¹Ÿæ²¡æœ‰æ­£ç»Ÿ UNIX}%
    %
}


\channelMsgEntry{%
    \msgRealSource{Neruthes 0xAFB3373F5200DF38}{2020-02-12 12:35:52}%
    \msgMainContent{è¦å®ç°å…¨ä¸–ç•Œçš„ POSIXï¼Œå…¨é  GNU å’Œ Linux}%
    %
}


\channelMsgEntry{%
    \msgRealSource{Leo Shen}{2020-02-13 04:00:27}%
    \msgMainContent{è¯è¯´ AOSCC ä¸€èˆ¬åœ¨ä»€ä¹ˆæ—¶å€™?
(è¿™ä¹ˆä¸€æŠ˜è…¾æˆ‘å¤§æ¦‚éœ€è¦åˆ°å…«æœˆåº•æ‰èƒ½å›å›½äº†\ldots{}}%
    %
}


\channelMsgEntry{%
    \msgRealSource{Mingcong Bai}{2020-02-13 04:00:28}%
    \msgMainContent{ä»Šå¹´å¾ˆå¤§å¯èƒ½æ²¡æ³•çº¿ä¸‹ï¼ˆæ‚²}%
    %
}


\channelMsgEntry{%
    \msgRealSource{Neo\_Chen (BU4AK)}{2020-02-13 04:00:28}%
    \msgMainContent{æ„Ÿè¦ºæ‰€æœ‰è¨ˆç•«å¥½çš„æ±è¥¿éƒ½è¢«è‚ºç‚æ‰“äº‚äº†ï¼ˆ}%
    %
}


\channelMsgEntry{%
    \msgRealSource{Mingcong Bai}{2020-02-13 04:00:28}%
    \msgMainContent{å…ˆç­‰é£å¤´è¿‡å»å§}%
    %
}


\channelMsgEntry{%
    \msgRealSource{Mingcong Bai}{2020-02-13 04:00:28}%
    \msgMainContent{å…¶å®æˆ‘ä¹Ÿå¯ä»¥åˆ©ç”¨ç¤¾ä¼šå…³ç³»}%
    %
}


\channelMsgEntry{%
    \msgRealSource{Mingcong Bai}{2020-02-13 04:00:28}%
    \msgMainContent{å°±æ˜¯æˆ‘ä¸å¤ªå¥½æ„æ€}%
    %
}


\channelMsgEntry{%
    \msgRealSource{Mingcong Bai}{2020-02-13 04:00:28}%
    \msgMainContent{å¤§å®¶å¥½æˆ‘æ˜¯çº¦ç‘ŸèŠ¬Â·åºéº¦ç™½}%
    %
}


\channelMsgEntry{%
    \msgRealSource{cth451 ÇÉ”uÇÆƒÉ¹ÇÊŒá´‰p}{2020-02-16 06:34:30}%
    \msgMainContent{}%
    %
}


\channelMsgEntry{%
    \msgRealSource{Mingcong Bai}{2020-02-16 06:34:39}%
    \msgMainContent{æ‰˜è…®è¹¦è¿ªç°åœº}%
    %
}


\channelMsgEntry{%
    \msgRealSource{Mingcong Bai}{2020-02-17 05:29:56}%
    \msgMainContent{}%
    %
}


\channelMsgEntry{%
    \msgRealSource{Lion}{2020-02-17 05:29:56}%
    \msgMainContent{ğŸŒ}%
    %
}


\channelMsgEntry{%
    \msgRealSource{Lion}{2020-02-17 05:29:56}%
    \msgMainContent{å¿«å¾—åƒæ˜¯æ‰“åäº†åŒ…}%
    %
}


\channelMsgEntry{%
    \msgRealSource{Mag Mell}{2020-02-17 05:29:56}%
    \msgMainContent{}%
    %
}


\channelMsgEntry{%
    \msgRealSource{Mag Mell}{2020-02-17 05:29:56}%
    \msgMainContent{æµ‹è¯•äº†ä¸€ä¸‹ï¼Œæ²¡æœ‰é—®é¢˜}%
    %
}


\channelMsgEntry{%
    \msgRealSource{Mingcong Bai}{2020-02-17 05:29:56}%
    \msgMainContent{ä¸€ä¸ªå……æ»¡ç¤¾åŒºè‹¦éš¾çš„æ¢—ï¼ˆ}%
    %
}


\channelMsgEntry{%
    \msgRealSource{Lion}{2020-02-19 05:11:22}%
    \msgMainContent{èƒ½æŠ½è±¡ä¸€ç‚¹å—ï¼Œå†å¡é€šä¸€ç‚¹ï¼ˆ}%
    %
}


\channelMsgEntry{%
    \msgRealSource{Lion}{2020-02-19 05:11:22}%
    \msgMainContent{}%
    \nopagebreak\includegraphics[width=\linewidth]{./.tg-data/2020/photos/photo_124@19-02-2020_05-11-22.jpg}%
}


\channelMsgEntry{%
    \msgRealSource{Mingcong Bai}{2020-02-19 05:11:22}%
    \msgMainContent{ç‰ˆæƒï¼Ÿ}%
    %
}


\channelMsgEntry{%
    \msgRealSource{Mingcong Bai}{2020-02-19 05:11:23}%
    \msgMainContent{ä»»å¤©å ‚æˆ‘ä»¬æƒ¹ä¸èµ·çš„ï¼ˆ}%
    %
}


\channelMsgEntry{%
    \msgRealSource{Mingcong Bai}{2020-02-19 05:11:23}%
    \msgMainContent{å°±ç®—ä¸èµšé’±éƒ½ä¼šè¢« ass crackï¼ˆ}%
    %
}


\channelMsgEntry{%
    \msgRealSource{Mingcong Bai}{2020-02-19 05:11:23}%
    \msgMainContent{ï¼ˆOof å¥½ç–¼}%
    %
}


\channelMsgEntry{%
    \msgRealSource{Mingcong Bai}{2020-02-19 05:11:23}%
    \msgMainContent{Lever open your butt cheeks and \emph{thomp}}%
    %
}


\channelMsgEntry{%
    \msgRealSource{å’¸é±¼}{2020-02-20 03:19:06}%
    \msgMainContent{é‚£æ®µæ—¶é—´è¿˜å¹²äº†ä¸€ä¸ªäººå»åƒå›è½¬å¯¿å¸è¿™ç§å‡„æƒ¨äº‹æƒ…ï¼ˆ}%
    %
}


\channelMsgEntry{%
    \msgRealSource{ĞĞµĞ‘ÑƒÑ‚Ğ»ĞµĞ³ ï¼ˆè¿«çœŸï¼‰}{2020-02-20 03:19:06}%
    \msgMainContent{}%
    \nopagebreak\includegraphics[width=\linewidth]{./.tg-data/2020/photos/photo_125@20-02-2020_03-19-06.jpg}%
}


\channelMsgEntry{%
    \msgRealSource{å’¸é±¼}{2020-02-20 03:19:06}%
    \msgMainContent{é£è¯„è¢«å®³}%
    %
}


\channelMsgEntry{%
    \msgRealSource{ĞĞµĞ‘ÑƒÑ‚Ğ»ĞµĞ³ ï¼ˆè¿«çœŸï¼‰}{2020-02-20 21:25:59}%
    \msgMainContent{æœ‰ä¸€æ¬¡ï¼Œé™ˆè€æ¿è¸©æ›²å½’æ¥ï¼Œé˜´é˜³æ€ªæ°”åœ°è¯´ï¼š``ä½ ä»¬å•Šï¼æ‰“åäº†é¢†å¯¼äººæ˜¯è¦åŸåœ°æªæ¯™çš„ï¼''ã€‚æ¥ç€ä¾¿å¿ƒè™šåœ°æ’¤å›äº†ã€‚ä¸€æ—è¸©æ›²çš„Mogicianå¬åˆ°äº†è¿™å¥è¯ï¼Œäºæ˜¯ä¾¿èµ°è¿›ç‰¹é¦–çš„åŠå…¬å®¤æŠŠè¿™è¯å‘Šè¯‰äº†ç‰¹é¦–ã€‚

ç‰¹é¦–è®©äººæŠŠé™ˆè€æ¿å«äº†å›æ¥ã€‚é—®é“ï¼š``é™ˆåŒå¿—ï¼Œæ‚¨ä»æˆ‘é…’å‚é‡Œèµ°å‡ºå»æ—¶è¯´äº†ä¸€å¥ä»€ä¹ˆ`æ‰“åé¢†å¯¼äºº'ï¼Œæ‚¨æ˜¯åœ¨è¯´è°ï¼Ÿ''

\begin{verbatim}
â€œglibcå•Šï¼æˆ‘è¿˜èƒ½è¯´è°å‘¢?â€é™ˆè€æ¿è¯´åˆ°ã€‚

 ç‰¹é¦–å¬ç½¢ï¼Œæ„å‘³æ·±é•¿åœ°é—®Mogicianï¼šâ€œè†œæ³•å¸ˆåŒå¿—ï¼Œè€Œæ‚¨åˆæ˜¯åœ¨è¯´è°å‘¢?â€
\end{verbatim}}%
    %
}


\channelMsgEntry{%
    \msgRealSource{cth451 ÇÉ”uÇÆƒÉ¹ÇÊŒá´‰p}{2020-02-20 21:26:08}%
    \msgMainContent{\#è¸©æ›²}%
    %
}


\channelMsgEntry{%
    \msgRealSource{Mingcong Bai}{2020-02-27 10:38:06}%
    \msgMainContent{é—¨åæ˜¯ç»å¤§å¤šæ•° AOSC æ„å»ºæœº}%
    \nopagebreak\includegraphics[width=\linewidth]{./.tg-data/2020/photos/photo_126@27-02-2020_10-38-06.jpg}%
}


\channelMsgEntry{%
    \msgRealSource{Catten Linger 18576508396}{2020-02-27 10:38:06}%
    \msgMainContent{æ°´ æ¼« ç« ç„° å±±}%
    %
}


\channelMsgEntry{%
    \msgRealSource{Catten Linger 18576508396}{2020-02-27 10:38:06}%
    \msgMainContent{æ°´ æ¼« å®‰ åŒ}%
    %
}


\channelMsgEntry{%
    \msgRealSource{Vegetable}{2020-02-27 20:16:41}%
    \msgMainContent{æ‰€ä»¥è´µæ ¡é—¨å£ä¼šæœ‰å¾ˆå¤šç»™äººhighèµ·æ¥çš„åœ°æ–¹å—}%
    %
}


\channelMsgEntry{%
    \msgRealSource{MoGeCâ‚â‚„N Yang}{2020-02-27 20:16:41}%
    \msgMainContent{}%
    \nopagebreak\includegraphics[width=\linewidth]{./.tg-data/2020/photos/photo_127@27-02-2020_20-16-41.jpg}%
}


\channelMsgEntry{%
    \msgRealSource{MoGeCâ‚â‚„N Yang}{2020-02-27 20:16:41}%
    \msgMainContent{ä½ è¯´çš„è¿™ç§æŠŠäººä¸¾é«˜é«˜çš„ä¸œè¥¿å—ï¼ˆx}%
    %
}


\channelMsgEntry{%
    \msgRealSource{å’¸é±¼}{2020-03-03 21:35:22}%
    \msgMainContent{è¯´èµ·æ¥ç´¢ç´¢ PSV è¿˜æ˜¯å•¥æ¥ç€çš„é‚£ä¸ª key}%
    %
}


\channelMsgEntry{%
    \msgRealSource{å’¸é±¼}{2020-03-03 21:35:23}%
    \msgMainContent{AAAAAAAAAAAAAAAAAAAAAAAAAAAAAAAA æ˜¯å·§åˆè¿˜æ˜¯ä¸´æ—¶å·¥ï¼ˆ}%
    %
}


\channelMsgEntry{%
    \msgRealSource{CT1000MX500SSD1 1000.2 GB}{2020-03-03 21:35:23}%
    \msgMainContent{AAAAAAAAAAAAAAAAAAAAAAAAAAAAAAAA}%
    %
}


\channelMsgEntry{%
    \msgRealSource{CT1000MX500SSD1 1000.2 GB}{2020-03-03 21:35:24}%
    \msgMainContent{æ˜¯å’¸é±¼çš„å«å£°ï¼ˆä¸}%
    %
}


\channelMsgEntry{%
    \msgRealSource{å’¸é±¼}{2020-03-03 21:35:24}%
    \msgMainContent{å™«}%
    %
}


\channelMsgEntry{%
    \msgRealSource{å’¸é±¼}{2020-03-03 21:35:25}%
    \msgMainContent{å“¼}%
    %
}


\channelMsgEntry{%
    \msgRealSource{å’¸é±¼}{2020-03-03 21:35:25}%
    \msgMainContent{å“¼å“¼}%
    %
}


\channelMsgEntry{%
    \msgRealSource{Leo Shen}{2020-03-04 20:36:35}%
    \msgMainContent{Wow we actually have a user (x}%
    %
}


\channelMsgEntry{%
    \msgRealSource{ĞĞµĞ‘ÑƒÑ‚Ğ»ĞµĞ³ ï¼ˆè¿«çœŸï¼‰}{2020-03-04 20:36:35}%
    \msgMainContent{AOSCå±…ç„¶æœ‰ç”¨æˆ·äº†}%
    %
}


\channelMsgEntry{%
    \msgRealSource{CT1000MX500SSD1 1000.2 GB}{2020-03-07 01:24:25}%
    \msgMainContent{è‰åŸæ¥ä¸æ˜¯IVBæ˜¾å¡åƒåœ¾ä¹ˆ}%
    %
}


\channelMsgEntry{%
    \msgRealSource{CT1000MX500SSD1 1000.2 GB}{2020-03-07 01:24:25}%
    \msgMainContent{è¿™ä¸ªstickerçœŸçš„æ˜¯æ…¢ç‰ˆ}%
    %
}


\channelMsgEntry{%
    \msgRealSource{ĞĞµĞ‘ÑƒÑ‚Ğ»ĞµĞ³ ï¼ˆè¿«çœŸï¼‰}{2020-03-07 01:24:30}%
    \msgMainContent{ä½ æŠŠæˆ‘ç¬‘æ­»}%
    %
}


\channelMsgEntry{%
    \msgRealSource{Lion}{2020-03-11 17:39:49}%
    \msgMainContent{è€å®è¯´å°±æ˜¯å­¦æ•°å­¦çš„æ—¶å€™å­¦å—¨äº†ï¼Œä¸€æ—¶ç³Šæ¶‚ï¼ˆ}%
    %
}


\channelMsgEntry{%
    \msgRealSource{Lion}{2020-03-11 17:39:50}%
    \msgMainContent{è§‰å¾—å­—æ¯è¡¨é‡Œ p å¾ˆå¸…ï¼Œç„¶åè§‰å¾—å‘é‡ç©ºé—´å¾ˆç¥å¥‡ï¼Œå“¦å¥½äº†é‚£å°±å« p å‘é‡å§}%
    %
}


\channelMsgEntry{%
    \msgRealSource{Lion}{2020-03-11 17:39:50}%
    \msgMainContent{è®¤ç½ªæ‚”ç½ª.jpg}%
    %
}


\channelMsgEntry{%
    \msgRealSource{åŒå€å¤šå¤šå†°ğŸ§¶ | ğ¦ğŸğœğŸ}{2020-03-11 17:39:50}%
    \msgMainContent{package vector}%
    %
}


\channelMsgEntry{%
    \msgRealSource{Xiaoxing}{2020-03-11 17:39:50}%
    \msgMainContent{éš¾é“ä¸æ˜¯å— æˆ‘ä¸€ç›´ä»¥ä¸ºæ˜¯}%
    %
}


\channelMsgEntry{%
    \msgRealSource{Lion}{2020-03-11 17:39:50}%
    \msgMainContent{ä½ çœ‹å§ï¼ˆ}%
    %
}


\channelMsgEntry{%
    \msgRealSource{Lion}{2020-03-11 17:39:50}%
    \msgMainContent{``æ²¡æƒ³åˆ°ç«Ÿç„¶æ˜¯æ²™é›•ç‹®å­çš„é…’åä¹±èµ·å''}%
    %
}


\channelMsgEntry{%
    \msgRealSource{Lion}{2020-03-11 21:00:56}%
    \msgMainContent{}%
    \nopagebreak\includegraphics[width=\linewidth]{./.tg-data/2020/photos/photo_128@11-03-2020_21-00-56.jpg}%
}


\channelMsgEntry{%
    \msgRealSource{cth451 ÇÉ”uÇÆƒÉ¹ÇÊŒá´‰p}{2020-03-11 21:00:56}%
    \msgMainContent{è¿™å¤šå°‘ pt}%
    %
}


\channelMsgEntry{%
    \msgRealSource{ĞĞµĞ‘ÑƒÑ‚Ğ»ĞµĞ³ ï¼ˆè¿«çœŸï¼‰}{2020-03-11 21:00:56}%
    \msgMainContent{è¿™ä¸ªå¤šçœ‹ç€æˆ‘è…°æ‰­äº†ï¼ˆx}%
    %
}


\channelMsgEntry{%
    \msgRealSource{MoGeCâ‚â‚„N Yang}{2020-03-11 21:00:57}%
    \msgMainContent{AOSCå¼±è§†åä¼š}%
    %
}


\channelMsgEntry{%
    \msgRealSource{Mingcong Bai}{2020-03-11 21:00:57}%
    \msgMainContent{å¼±æ™º *}%
    %
}


\channelMsgEntry{%
    \msgRealSource{MoGeCâ‚â‚„N Yang}{2020-03-11 21:00:57}%
    \msgMainContent{ç‰¹é¦–é‡Šæ³•ï¼ˆ}%
    %
}


\channelMsgEntry{%
    \msgRealSource{Mingcong Bai}{2020-03-11 21:00:57}%
    \msgMainContent{å¼±æ™º *}%
    %
}


\channelMsgEntry{%
    \msgRealSource{Mingcong Bai}{2020-03-11 21:00:57}%
    \msgMainContent{å¼±æ™ºé‡Šæ³•ï¼Œç‰¹å¼±æ™ºæ³•ï¼Œç‰¹é¦–å¼±æ™º}%
    %
}


\channelMsgEntry{%
    \msgRealSource{Lion}{2020-03-11 21:00:57}%
    \msgMainContent{ä¸‰ æƒ åˆ† ç«‹}%
    %
}


\channelMsgEntry{%
    \msgRealSource{Mingcong Bai}{2020-03-11 21:00:57}%
    \msgMainContent{è‡ªç„¶è¯­è¨€çš„æ­£åˆ™ä¸å®‰å…¨æ€§ï¼ˆ}%
    %
}


\channelMsgEntry{%
    \msgRealSource{MoGeCâ‚â‚„N Yang}{2020-03-11 21:00:57}%
    \msgMainContent{ç²¾ ç¥ ç—… é™¢}%
    %
}


\channelMsgEntry{%
    \msgRealSource{å’¸é±¼}{2020-03-13 01:50:29}%
    \msgMainContent{https://youtu.be/lYyAMDYzJQM}%
    %
}


\channelMsgEntry{%
    \msgRealSource{cth451 ÇÉ”uÇÆƒÉ¹ÇÊŒá´‰p}{2020-03-13 01:50:30}%
    \msgMainContent{æ„Ÿè§‰æ˜¯é‚£ç§ useless machineï¼ˆ}%
    %
}


\channelMsgEntry{%
    \msgRealSource{å’¸é±¼}{2020-03-13 01:50:30}%
    \msgMainContent{æ˜¯}%
    %
}


\channelMsgEntry{%
    \msgRealSource{å’¸é±¼}{2020-03-13 01:50:31}%
    \msgMainContent{ä½†æ˜¯å¥½ç©å•Šï¼ˆï¼ˆ}%
    %
}


\channelMsgEntry{%
    \msgRealSource{å’¸é±¼}{2020-03-13 01:50:32}%
    \msgMainContent{æˆ‘ä¹Ÿæƒ³ç©ï¼ˆå¤§å£°}%
    %
}


\channelMsgEntry{%
    \msgRealSource{Neruthes 0xAFB3373F5200DF38}{2020-03-13 01:50:32}%
    \msgMainContent{\#è¿™ä¹ˆå«}%
    %
}


\channelMsgEntry{%
    \msgRealSource{cth451 ÇÉ”uÇÆƒÉ¹ÇÊŒá´‰p}{2020-03-13 02:01:05}%
    \msgMainContent{\#æ€ä¹ˆå«}%
    %
}


\channelMsgEntry{%
    \msgRealSource{Mingcong Bai}{2020-03-20 06:09:34}%
    \msgMainContent{Ain't nothing ``Think''ful in this photo (}%
    \nopagebreak\includegraphics[width=\linewidth]{./.tg-data/2020/photos/photo_129@20-03-2020_06-09-34.jpg}%
}


\channelMsgEntry{%
    \msgRealSource{Mingcong Bai}{2020-03-20 06:09:34}%
    \msgMainContent{å¦å¤–æœ€è¿‘è¿˜åœ¨ä¸­æ¯’é‚£ä¸ªä¸“è¾‘ï¼ˆæ”¾å¤§çœ‹ iPod}%
    %
}


\channelMsgEntry{%
    \msgRealSource{Mingcong Bai}{2020-03-20 06:09:34}%
    \msgMainContent{ï¼ˆä¸€ä¸ªæœˆå‰å¼€å§‹å¬ï¼Œç°åœ¨è¿˜åœ¨å¾ªç¯}%
    %
}


\channelMsgEntry{%
    \msgRealSource{MoGeCâ‚â‚„N Yang}{2020-03-20 06:09:35}%
    \msgMainContent{è½¦ ä¸‡ ï¼Ÿ}%
    %
}


\channelMsgEntry{%
    \msgRealSource{Mingcong Bai}{2020-03-20 06:09:35}%
    \msgMainContent{å—¯ï¼ˆ}%
    %
}


\channelMsgEntry{%
    \msgRealSource{MoGeCâ‚â‚„N Yang}{2020-03-20 06:09:35}%
    \msgMainContent{é‡äº‹ä¸å†³å°±çŒœè½¦ä¸‡ï¼ˆ}%
    %
}


\channelMsgEntry{%
    \msgRealSource{Leo Shen}{2020-03-20 06:09:35}%
    \msgMainContent{é‚£ä¹ˆè¥¿æ–¹ Project æ˜¯å•¥(}%
    %
}


\channelMsgEntry{%
    \msgRealSource{Leo Shen}{2020-03-20 06:09:35}%
    \msgMainContent{Manhattan Project ä¹ˆ(}%
    %
}


\channelMsgEntry{%
    \msgRealSource{MoGeCâ‚â‚„N Yang}{2020-03-20 06:09:35}%
    \msgMainContent{https://www.gnu.org/software/hurd/hurd.html}%
    %
}


\channelMsgEntry{%
    \msgRealSource{Mingcong Bai}{2020-03-21 01:06:18}%
    \msgMainContent{@o0\_0b åŒ…é€šå§”ç–‘ä¼¼æ•…éšœ}%
    %
}


\channelMsgEntry{%
    \msgRealSource{Lion}{2020-03-21 01:06:18}%
    \msgMainContent{huiæ¥äº†}%
    %
}


\channelMsgEntry{%
    \msgRealSource{Mingcong Bai}{2020-03-21 01:06:18}%
    \msgMainContent{å–·äº†}%
    %
}


\channelMsgEntry{%
    \msgRealSource{Mingcong Bai}{2020-03-21 01:06:18}%
    \msgMainContent{Ğ¥ÑƒĞ¹ - Hui - é¸¡å„¿}%
    %
}


\channelMsgEntry{%
    \msgRealSource{Leo Shen}{2020-03-21 01:06:18}%
    \msgMainContent{hhhhhhhhh}%
    %
}


\channelMsgEntry{%
    \msgRealSource{Leo Shen}{2020-03-21 01:06:18}%
    \msgMainContent{ç¬‘å¾—è¡€å‹é«˜}%
    %
}


\channelMsgEntry{%
    \msgRealSource{Lion}{2020-03-21 01:06:18}%
    \msgMainContent{æˆ‘ä¿„è¯­å­—éƒ½æ²¡è®¤å…¨ï¼Œå…ˆå­¦äº†æ€ä¹ˆè¯´è„å­—ï¼‰}%
    %
}


\channelMsgEntry{%
    \msgRealSource{Mingcong Bai}{2020-03-21 01:06:18}%
    \msgMainContent{å…ˆæŠŠè£¤å­ç»™æˆ‘ç©¿ä¸Šå•Šï¼ˆ}%
    %
}


\channelMsgEntry{%
    \msgRealSource{Lion}{2020-03-21 01:06:18}%
    \msgMainContent{ï¼‰}%
    %
}


\channelMsgEntry{%
    \msgRealSource{Hexhu}{2020-03-21 02:16:11}%
    \msgMainContent{b/c æ˜¯ because}%
    %
}


\channelMsgEntry{%
    \msgRealSource{Lion}{2020-03-21 02:16:12}%
    \msgMainContent{å‡è£…æ­£ç»çš„å•†åŠ¡ç®€å†™x}%
    %
}


\channelMsgEntry{%
    \msgRealSource{Lion}{2020-03-21 02:16:12}%
    \msgMainContent{ä¸æ­£ç»çš„æ—¥å¸¸ï¼šcos}%
    %
}


\channelMsgEntry{%
    \msgRealSource{Hexhu}{2020-03-21 02:16:12}%
    \msgMainContent{å’¦è¿™æ˜¯å•¥}%
    %
}


\channelMsgEntry{%
    \msgRealSource{Lion}{2020-03-21 02:16:12}%
    \msgMainContent{becauseï¼‰}%
    %
}


\channelMsgEntry{%
    \msgRealSource{Lion}{2020-03-21 02:16:12}%
    \msgMainContent{'cause}%
    %
}


\channelMsgEntry{%
    \msgRealSource{Junde Yhi}{2020-03-21 02:16:12}%
    \msgMainContent{cuz}%
    %
}


\channelMsgEntry{%
    \msgRealSource{Lion}{2020-03-21 02:16:12}%
    \msgMainContent{ä½ è¿™æ˜¯ç¾å›½ä»»å‘éŸ³}%
    %
}


\channelMsgEntry{%
    \msgRealSource{Lion}{2020-03-21 02:16:12}%
    \msgMainContent{cosæ˜¯è‹±å›½ä»»å‘éŸ³}%
    %
}


\channelMsgEntry{%
    \msgRealSource{MoGeCâ‚â‚„N Yang}{2020-03-21 02:16:12}%
    \msgMainContent{cosæ˜¯æ•°å­¦äººå‘éŸ³ï¼ˆ}%
    %
}


\channelMsgEntry{%
    \msgRealSource{liushuyu}{2020-03-29 03:37:21}%
    \msgMainContent{AOSC çš„ä¸»é¢˜è‰²æ˜¯ä»€ä¹ˆå‘¢ï¼ˆ}%
    %
}


\channelMsgEntry{%
    \msgRealSource{Mag Mell}{2020-03-29 03:37:21}%
    \msgMainContent{çº¢è“é»„é»‘ç™½}%
    %
}


\channelMsgEntry{%
    \msgRealSource{Neruthes 0xAFB3373F5200DF38}{2020-03-29 03:37:21}%
    \msgMainContent{äº”æ—å…±å’Œ}%
    %
}


\channelMsgEntry{%
    \msgRealSource{Mingcong Bai}{2020-03-30 05:31:08}%
    \msgMainContent{è¿™æ­Œåç»äº†}%
    \nopagebreak\includegraphics[width=\linewidth]{./.tg-data/2020/photos/photo_130@30-03-2020_05-31-08.jpg}%
}


\channelMsgEntry{%
    \msgRealSource{Mingcong Bai}{2020-03-30 05:31:09}%
    \msgMainContent{Onanist}%
    %
}


\channelMsgEntry{%
    \msgRealSource{Mingcong Bai}{2020-03-30 05:31:09}%
    \msgMainContent{è‡ªå·±æœç´¢ï¼ˆ}%
    %
}


\channelMsgEntry{%
    \msgRealSource{ĞĞµĞ‘ÑƒÑ‚Ğ»ĞµĞ³ ï¼ˆè¿«çœŸï¼‰}{2020-03-30 05:31:09}%
    \msgMainContent{onani}%
    %
}


\channelMsgEntry{%
    \msgRealSource{Lion}{2020-03-30 05:31:09}%
    \msgMainContent{å¯Ÿè§‰}%
    %
}


\channelMsgEntry{%
    \msgRealSource{ĞĞµĞ‘ÑƒÑ‚Ğ»ĞµĞ³ ï¼ˆè¿«çœŸï¼‰}{2020-03-30 05:31:09}%
    \msgMainContent{\#NSFW}%
    %
}


\channelMsgEntry{%
    \msgRealSource{Mingcong Bai}{2020-03-30 05:31:09}%
    \msgMainContent{æ˜¯è¿™ä¸ªæ„æ€}%
    %
}


\channelMsgEntry{%
    \msgRealSource{Mingcong Bai}{2020-03-30 05:31:09}%
    \msgMainContent{é™¤äº†é«˜æ½®å‰è¦æ’¤é€€ï¼ˆ}%
    %
}


\channelMsgEntry{%
    \msgRealSource{Mingcong Bai}{2020-03-30 05:31:09}%
    \msgMainContent{è¿™æ˜¯ä¸€ç§æ€§ç™–æˆ–è€…æ–‡åŒ–æ“å®ˆï¼ˆ}%
    %
}


\channelMsgEntry{%
    \msgRealSource{ĞĞµĞ‘ÑƒÑ‚Ğ»ĞµĞ³ ï¼ˆè¿«çœŸï¼‰}{2020-03-30 05:31:09}%
    \msgMainContent{å¤ªéš¾è¿‡äº†å§ï¼ˆ}%
    %
}


\channelMsgEntry{%
    \msgRealSource{Mingcong Bai}{2020-03-30 05:31:09}%
    \msgMainContent{ä¼¤èº«çš„ï¼ˆ}%
    %
}


\channelMsgEntry{%
    \msgRealSource{Mingcong Bai}{2020-03-30 05:31:09}%
    \msgMainContent{æ„Ÿè§‰å¯èƒ½ä¼šå¯¼è‡´å¿ƒæ¢—ï¼ˆ}%
    %
}


\channelMsgEntry{%
    \msgRealSource{Lion}{2020-03-30 05:31:09}%
    \msgMainContent{5.6 å¤ªå¥½ç©äº†ï¼ï¼ˆonanist ç‹‚çƒ­ï¼‰}%
    %
}


\channelMsgEntry{%
    \msgRealSource{Mingcong Bai}{2020-03-30 05:31:09}%
    \msgMainContent{åœ¨ dpkg å‹ç¼©çš„æ—¶å€™ \^{}C å—}%
    %
}


\channelMsgEntry{%
    \msgRealSource{Mingcong Bai}{2020-03-30 05:31:09}%
    \msgMainContent{æ¯æ¬¡éƒ½æ˜¯}%
    %
}


\channelMsgEntry{%
    \msgRealSource{Mingcong Bai}{2020-03-30 05:31:09}%
    \msgMainContent{``å“¦ï¼Œå“¦ï¼Œå•Šï¼Œç¼–è¯‘å¥½å¿«''}%
    %
}


\channelMsgEntry{%
    \msgRealSource{Mingcong Bai}{2020-03-30 05:31:09}%
    \msgMainContent{ç„¶åç¼–è¯‘å®Œäº†å°± \^{}Cï¼Œåªä¸ºç»§ç»­æ„Ÿå—è¿™ç§å¿«æ„Ÿï¼ˆ}%
    %
}


\channelMsgEntry{%
    \msgRealSource{Mingcong Bai}{2020-03-30 05:31:10}%
    \msgMainContent{ä½†è¿™ç§äº‹æƒ…åšå¤šäº† hui çˆ†ç‚¸çš„ï¼ˆ}%
    %
}


\channelMsgEntry{%
    \msgRealSource{liushuyu}{2020-04-06 06:39:05}%
    \msgMainContent{ä½ å†™å®Œä¹‹åå¯ä»¥æ‹¿ clippy æ£€æŸ¥ä¸€ä¸ªï¼ˆ}%
    %
}


\channelMsgEntry{%
    \msgRealSource{liushuyu}{2020-04-06 06:39:05}%
    \msgMainContent{cargo clippy}%
    %
}


\channelMsgEntry{%
    \msgRealSource{liushuyu}{2020-04-06 06:39:05}%
    \msgMainContent{äº«å— TA çº§å¾…é‡ï¼ˆ}%
    %
}


\channelMsgEntry{%
    \msgRealSource{liushuyu}{2020-04-06 06:39:05}%
    \msgMainContent{äººå®¶ä¼šæ•™ä½ æ€ä¹ˆä¿®æ”¹çš„ï¼Œæ˜¯è®¤çœŸè´Ÿè´£çš„ TAï¼ˆé›¾}%
    %
}


\channelMsgEntry{%
    \msgRealSource{ĞĞµĞ‘ÑƒÑ‚Ğ»ĞµĞ³ ï¼ˆè¿«çœŸï¼‰}{2020-04-06 06:39:05}%
    \msgMainContent{error: Clippy is no longer available via crates.io

help: please run rustup component add clippy-preview instead}%
    %
}


\channelMsgEntry{%
    \msgRealSource{ĞĞµĞ‘ÑƒÑ‚Ğ»ĞµĞ³ ï¼ˆè¿«çœŸï¼‰}{2020-04-06 06:39:05}%
    \msgMainContent{è‰}%
    %
}


\channelMsgEntry{%
    \msgRealSource{ĞĞµĞ‘ÑƒÑ‚Ğ»ĞµĞ³ ï¼ˆè¿«çœŸï¼‰}{2020-04-06 06:39:05}%
    \msgMainContent{TAè¢«å¼€é™¤äº†}%
    %
}


\channelMsgEntry{%
    \msgRealSource{liushuyu}{2020-04-06 06:39:05}%
    \msgMainContent{clippy ç°åœ¨æ˜¯ rust å·¥å…·é“¾é‡Œé¢çš„ï¼ˆ}%
    %
}


\channelMsgEntry{%
    \msgRealSource{ĞĞµĞ‘ÑƒÑ‚Ğ»ĞµĞ³ ï¼ˆè¿«çœŸï¼‰}{2020-04-06 06:39:05}%
    \msgMainContent{åŸæ¥æ˜¯å½“æ•™æˆäº†ï¼ˆx}%
    %
}


\channelMsgEntry{%
    \msgRealSource{liushuyu}{2020-04-06 06:39:05}%
    \msgMainContent{å‡èŒäº†ï¼ˆ}%
    %
}


\channelMsgEntry{%
    \msgRealSource{Lion}{2020-04-07 12:06:15}%
    \msgMainContent{ğŸ³ï¸â€ğŸŒˆ I am 92\% gay!}%
    %
}


\channelMsgEntry{%
    \msgRealSource{Lion}{2020-04-07 12:06:15}%
    \msgMainContent{.}%
    %
}


\channelMsgEntry{%
    \msgRealSource{Lion}{2020-04-07 12:06:15}%
    \msgMainContent{.}%
    %
}


\channelMsgEntry{%
    \msgRealSource{MoGeCâ‚â‚„N Yang}{2020-04-07 12:06:15}%
    \msgMainContent{å¤§çŒ«é‡‘ç‰å•ƒå¤šå°±å˜gayäº†å—}%
    %
}


\channelMsgEntry{%
    \msgRealSource{ĞĞµĞ‘ÑƒÑ‚Ğ»ĞµĞ³ ï¼ˆè¿«çœŸï¼‰}{2020-04-07 12:06:15}%
    \msgMainContent{åæ­£æ¯æ¬¡éƒ½æ˜¯éšæœºçš„}%
    %
}


\channelMsgEntry{%
    \msgRealSource{Lion}{2020-04-07 12:06:15}%
    \msgMainContent{æˆ‘å¼€å§‹æœ‰ç‚¹ç›¸ä¿¡è¿™ä¸ªæœºå™¨äººäº†ï¼ˆ}%
    %
}


\channelMsgEntry{%
    \msgRealSource{èˆŠå¤©ä¸‹ OriginCode // Ristaccia}{2020-04-07 12:06:15}%
    \msgMainContent{ğŸ³ï¸â€ğŸŒˆ I am 43\% gay!}%
    %
}


\channelMsgEntry{%
    \msgRealSource{ğŸ± æƒ³å‡ºé—¨}{2020-04-07 12:06:15}%
    \msgMainContent{ğŸ³ï¸â€ğŸŒˆ I am 36\% gay!}%
    %
}


\channelMsgEntry{%
    \msgRealSource{Lion}{2020-04-07 12:06:16}%
    \msgMainContent{ğŸ³ï¸â€ğŸŒˆ I am 99\% gay!}%
    %
}


\channelMsgEntry{%
    \msgRealSource{Lion}{2020-04-10 04:02:26}%
    \msgMainContent{}%
    %
}


\channelMsgEntry{%
    \msgRealSource{Lion}{2020-04-10 04:02:26}%
    \msgMainContent{ä»Šæ—¥ç»ƒç´ 1/1}%
    %
}


\channelMsgEntry{%
    \msgRealSource{Lion}{2020-04-10 04:02:26}%
    \msgMainContent{ãƒ‡ãƒ‡ãƒ‰ãƒ³}%
    %
}


\channelMsgEntry{%
    \msgRealSource{Neruthes Artwork Drafts}{2020-04-10 06:33:07}%
    \msgMainContent{}%
    \nopagebreak\includegraphics[width=\linewidth]{./.tg-data/2020/photos/photo_131@10-04-2020_06-33-07.jpg}%
}


\channelMsgEntry{%
    \msgRealSource{Neruthes 0xAFB3373F5200DF38}{2020-04-10 06:33:07}%
    \msgMainContent{Maybe something like this}%
    %
}


\channelMsgEntry{%
    \msgRealSource{Mingcong Bai}{2020-04-10 06:33:07}%
    \msgMainContent{What am I supposed to find in this pattern?}%
    %
}


\channelMsgEntry{%
    \msgRealSource{Mingcong Bai}{2020-04-10 06:33:08}%
    \msgMainContent{As in, how should I feel?}%
    %
}


\channelMsgEntry{%
    \msgRealSource{Neruthes 0xAFB3373F5200DF38}{2020-04-10 06:33:08}%
    \msgMainContent{A big cat who plays blue aqua}%
    %
}


\channelMsgEntry{%
    \msgRealSource{GitHub}{2020-04-10 15:06:02}%
    \msgMainContent{ğŸ”¨ 1 new commit to aosc-os-abbs:stable-proposed:

690d54b: aosc-os-repository-data: update mirrors by Plectranthus-fg}%
    %
}


\channelMsgEntry{%
    \msgRealSource{Plectranthus\_fg}{2020-04-10 15:06:02}%
    \msgMainContent{æˆ‘èƒ½ä¸èƒ½æˆä¸ºpeopleï¼ˆ}%
    %
}


\channelMsgEntry{%
    \msgRealSource{Kexy Biscuit | è¢«å­é¥¼ï¸ | ç™¾åˆãƒ¶å’²ã‚‹ã‚‹}{2020-04-10 15:06:02}%
    \msgMainContent{æˆä¸º people è«åç¬‘ç‚¹ï¼ˆ}%
    %
}


\channelMsgEntry{%
    \msgRealSource{Kexy Biscuit | è¢«å­é¥¼ï¸ | ç™¾åˆãƒ¶å’²ã‚‹ã‚‹}{2020-04-10 15:06:02}%
    \msgMainContent{æœ¬ç¾¤ä¸æä¾›è½¬ç”ŸæœåŠ¡ï¼ˆ}%
    %
}


\channelMsgEntry{%
    \msgRealSource{Lion}{2020-04-10 15:06:02}%
    \msgMainContent{å’±ä»¬æœ‰ä»€ä¹ˆæ‰‹ç»­å— @JeffBai}%
    %
}


\channelMsgEntry{%
    \msgRealSource{Kexy Biscuit | è¢«å­é¥¼ï¸ | ç™¾åˆãƒ¶å’²ã‚‹ã‚‹}{2020-04-10 15:06:03}%
    \msgMainContent{åŸåˆ™ä¸Šåªè¦æ˜¯ contributor å³å¯}%
    %
}


\channelMsgEntry{%
    \msgRealSource{Mingcong Bai}{2020-04-10 15:06:03}%
    \msgMainContent{AOSC: Become Human}%
    %
}


\channelMsgEntry{%
    \msgRealSource{Lion}{2020-04-13 05:08:25}%
    \msgMainContent{å•å°„æ˜¯ injection}%
    %
}


\channelMsgEntry{%
    \msgRealSource{Lion}{2020-04-13 05:08:25}%
    \msgMainContent{ï¼ˆå¯¹å§ï¼Ÿ}%
    %
}


\channelMsgEntry{%
    \msgRealSource{Lion}{2020-04-13 05:08:25}%
    \msgMainContent{å¦å¤–ä¸€ä¸ªæ˜¯ surjection}%
    %
}


\channelMsgEntry{%
    \msgRealSource{Lion}{2020-04-13 05:08:25}%
    \msgMainContent{ï¼ˆï¼Ÿå¯¹å§}%
    %
}


\channelMsgEntry{%
    \msgRealSource{Lion}{2020-04-13 05:08:25}%
    \msgMainContent{æ»¡å°„}%
    %
}


\channelMsgEntry{%
    \msgRealSource{MoGeCâ‚â‚„N Yang}{2020-04-13 05:08:25}%
    \msgMainContent{æ˜¯Ejaculateï¼ˆx}%
    %
}


\channelMsgEntry{%
    \msgRealSource{Lion}{2020-04-13 05:08:26}%
    \msgMainContent{å•Šå•Šå•Šå•Šå•Šå•Šå•Šå•Šå•Šå•Šå•Š}%
    %
}


\channelMsgEntry{%
    \msgRealSource{MoGeCâ‚â‚„N Yang}{2020-04-13 05:08:26}%
    \msgMainContent{å•Šå•Šå•Šå•Šå•Šå•Šå•Šå•Šå•Šå•Šå•Š}%
    %
}


\channelMsgEntry{%
    \msgRealSource{Lion}{2020-04-13 05:26:23}%
    \msgMainContent{ï¼ˆï¼‰åŸç¾¤ï¼Œï¼ˆç»“åˆï¼‰åŠç¾¤ï¼Œï¼ˆå¯é™¤ï¼‰æ‹Ÿç¾¤ï¼Œï¼ˆç»“åˆä¸”å•ä½å…ƒï¼‰å¹ºåŠè£™ï¼Œï¼ˆå¯é™¤ä¸”å•ä½å…ƒï¼‰ç¯ç¾¤ï¼Œï¼ˆç»“åˆä¸”å¯é™¤ä¸”å•ä½å…ƒï¼‰ç¾¤}%
    %
}


\channelMsgEntry{%
    \msgRealSource{Junde Yhi}{2020-04-13 05:26:23}%
    \msgMainContent{è£™å’Œç¾¤æœ‰ä»€ä¹ˆå…³ç³»}%
    %
}


\channelMsgEntry{%
    \msgRealSource{MoGeCâ‚â‚„N Yang}{2020-04-13 05:26:23}%
    \msgMainContent{å¥³è£…å’ŒGayçš„åŒºåˆ«ï¼ˆä¸æ˜¯}%
    %
}


\channelMsgEntry{%
    \msgRealSource{Mingcong Bai}{2020-04-15 03:53:11}%
    \msgMainContent{@Neo\_Chen æˆ‘ä¹Ÿæƒ³å…¥ä¸€å° P1120 äº†ï¼Œæµ‹è¯•å›¾å½¢æ–¹ä¾¿ï¼ˆ}%
    %
}


\channelMsgEntry{%
    \msgRealSource{Mingcong Bai}{2020-04-15 03:53:11}%
    \msgMainContent{è¯´æ¥ä½ è·‘è¿‡ Xäº†å—}%
    %
}


\channelMsgEntry{%
    \msgRealSource{Neo\_Chen (BU4AK)}{2020-04-15 03:53:11}%
    \msgMainContent{åœ¨ FreeBSD ä¸Šé¢èµ·ä¾†äº†}%
    %
}


\channelMsgEntry{%
    \msgRealSource{Neo\_Chen (BU4AK)}{2020-04-15 03:53:11}%
    \msgMainContent{ç„¶è€Œæˆ‘å‰›å‰›å¿˜è¨˜å®‰è£è¼¸å…¥é©…å‹• (xf86-input-*)}%
    %
}


\channelMsgEntry{%
    \msgRealSource{Neo\_Chen (BU4AK)}{2020-04-15 03:53:11}%
    \msgMainContent{æ–¼æ˜¯æ²’æ»‘é¼ ç”¨äº†ï¼ˆ}%
    %
}


\channelMsgEntry{%
    \msgRealSource{Mingcong Bai}{2020-04-15 03:53:12}%
    \msgMainContent{è¯·æ±‚ä¸€ä¸‹æ€§èƒ½ä½“éªŒï¼ˆ}%
    %
}


\channelMsgEntry{%
    \msgRealSource{Neo\_Chen (BU4AK)}{2020-04-15 03:53:12}%
    \msgMainContent{ç„¶å¾Œæˆ‘ç¾åœ¨äººåœ¨å»æ‰€ï¼Œé‚„æ²’è¾¦æ³•ï¼ˆ}%
    %
}


\channelMsgEntry{%
    \msgRealSource{Mingcong Bai}{2020-04-15 03:53:12}%
    \msgMainContent{Realtime development}%
    %
}


\channelMsgEntry{%
    \msgRealSource{Neo\_Chen (BU4AK)}{2020-04-15 03:53:12}%
    \msgMainContent{ç„¶å¾Œç¾åœ¨æ˜¯ I/O Waitï¼ˆ}%
    %
}


\channelMsgEntry{%
    \msgRealSource{Neo\_Chen (BU4AK)}{2020-04-15 03:53:12}%
    \msgMainContent{è€Œä¸”æ˜¯ Output çš„éƒ¨åˆ†ï¼ˆ}%
    %
}


\channelMsgEntry{%
    \msgRealSource{MoGeCâ‚â‚„N Yang}{2020-04-20 02:18:58}%
    \msgMainContent{åŠ å›½ä¹ŸMass shootingäº†å˜›ï¼ˆ}%
    %
}


\channelMsgEntry{%
    \msgRealSource{ĞĞµĞ‘ÑƒÑ‚Ğ»ĞµĞ³ ï¼ˆè¿«çœŸï¼‰}{2020-04-20 02:18:58}%
    \msgMainContent{æ¶ˆæ­§ä¹‰}%
    %
}


\channelMsgEntry{%
    \msgRealSource{ĞĞµĞ‘ÑƒÑ‚Ğ»ĞµĞ³ ï¼ˆè¿«çœŸï¼‰}{2020-04-20 02:18:58}%
    \msgMainContent{æ˜¯ä½ ä½çš„åŠ å›½è¿˜æ˜¯æŸ³æ ‘é±¼ä½çš„åŠ å›½ï¼ˆx}%
    %
}


\channelMsgEntry{%
    \msgRealSource{Mingcong Bai}{2020-04-20 02:18:58}%
    \msgMainContent{xs}%
    %
}


\channelMsgEntry{%
    \msgRealSource{Mingcong Bai}{2020-04-20 02:18:58}%
    \msgMainContent{åŠ å›½ the Nation State}%
    %
}


\channelMsgEntry{%
    \msgRealSource{ĞĞµĞ‘ÑƒÑ‚Ğ»ĞµĞ³ ï¼ˆè¿«çœŸï¼‰}{2020-04-20 02:18:58}%
    \msgMainContent{è¿˜æœ‰å°†æ¥ä½ è¦æ¥çš„ä¸å·®ç”µè´¹çš„é‚£ä¸ªï¼ˆx}%
    %
}


\channelMsgEntry{%
    \msgRealSource{Mingcong Bai}{2020-04-20 02:18:58}%
    \msgMainContent{æˆ‘å»çš„å°±æ˜¯ Nation State å‘€ï¼ˆ}%
    %
}


\channelMsgEntry{%
    \msgRealSource{ĞĞµĞ‘ÑƒÑ‚Ğ»ĞµĞ³ ï¼ˆè¿«çœŸï¼‰}{2020-04-20 02:18:58}%
    \msgMainContent{ï¼ˆï¼ˆï¼ˆ}%
    %
}


\channelMsgEntry{%
    \msgRealSource{ĞĞµĞ‘ÑƒÑ‚Ğ»ĞµĞ³ ï¼ˆè¿«çœŸï¼‰}{2020-04-20 02:18:58}%
    \msgMainContent{å’Œæˆ‘ä¸€èµ·}%
    %
}


\channelMsgEntry{%
    \msgRealSource{ĞĞµĞ‘ÑƒÑ‚Ğ»ĞµĞ³ ï¼ˆè¿«çœŸï¼‰}{2020-04-20 02:18:58}%
    \msgMainContent{ä¿®ä»™ï¼ˆä¸}%
    %
}


\channelMsgEntry{%
    \msgRealSource{Mingcong Bai}{2020-04-20 02:18:58}%
    \msgMainContent{æˆ‘æ¥è¿™é‡Œå•Šï¼Œgoal çœŸçš„åªæœ‰ä¸€ä¸ª}%
    %
}


\channelMsgEntry{%
    \msgRealSource{Mingcong Bai}{2020-04-20 02:18:58}%
    \msgMainContent{é‚£å°±æ˜¯ weathering with youï¼ˆx}%
    %
}


\channelMsgEntry{%
    \msgRealSource{Junde Yhi}{2020-04-23 07:11:33}%
    \msgMainContent{ä»€ä¹ˆæ°å®è®¾è®¡}%
    %
}


\channelMsgEntry{%
    \msgRealSource{Junde Yhi}{2020-04-23 07:11:33}%
    \msgMainContent{é‚£æˆ‘è¦ä¸€ä¸ª admin æƒé™ï¼ˆä¸è¦è„¸}%
    %
}


\channelMsgEntry{%
    \msgRealSource{Xiaoxing}{2020-04-23 07:11:33}%
    \msgMainContent{50 ä¸€ä¸ªï¼ŒåŒ…é‚®}%
    %
}


\channelMsgEntry{%
    \msgRealSource{Junde Yhi}{2020-04-23 07:11:33}%
    \msgMainContent{å¾®ä¿¡æ”¶ä¸€ä¸‹}%
    %
}


\channelMsgEntry{%
    \msgRealSource{MoGeCâ‚â‚„N Yang}{2020-04-23 07:11:33}%
    \msgMainContent{åˆ©ç”¨èŒæƒè´ªæ±¡å— hui ç½ª}%
    %
}


\channelMsgEntry{%
    \msgRealSource{Mingcong Bai}{2020-04-24 02:48:02}%
    \msgMainContent{12k?!}%
    %
}


\channelMsgEntry{%
    \msgRealSource{Mingcong Bai}{2020-04-24 02:48:03}%
    \msgMainContent{ä½ æ”¿åºœé‡‡è´­å—ï¼ˆ}%
    %
}


\channelMsgEntry{%
    \msgRealSource{ĞĞµĞ‘ÑƒÑ‚Ğ»ĞµĞ³ ï¼ˆè¿«çœŸï¼‰}{2020-04-24 16:23:34}%
    \msgMainContent{Windowsåœ¨T?40*ä¸Šä½“éªŒå’Œå¤§ç²ªä¸€æ ·}%
    %
}


\channelMsgEntry{%
    \msgRealSource{ĞĞµĞ‘ÑƒÑ‚Ğ»ĞµĞ³ ï¼ˆè¿«çœŸï¼‰}{2020-04-24 16:23:35}%
    \msgMainContent{è™½ç„¶å®Œå…¨æ˜¯è¢«synapticsæ¯äº†}%
    %
}


\channelMsgEntry{%
    \msgRealSource{CT1000MX500SSD1 1000.2 GB}{2020-04-24 16:23:35}%
    \msgMainContent{ä½ æ²¡æœ‰æ¢è§¦æ‘¸æ¿ï¼Ÿ}%
    %
}


\channelMsgEntry{%
    \msgRealSource{ĞĞµĞ‘ÑƒÑ‚Ğ»ĞµĞ³ ï¼ˆè¿«çœŸï¼‰}{2020-04-24 16:23:36}%
    \msgMainContent{æ¢äº†åªæœ‰Linuxä¸‹æ‰è®¤å¾—}%
    %
}


\channelMsgEntry{%
    \msgRealSource{ĞĞµĞ‘ÑƒÑ‚Ğ»ĞµĞ³ ï¼ˆè¿«çœŸï¼‰}{2020-04-24 16:23:37}%
    \msgMainContent{Windowsä¸‹è¿˜æ˜¯å½“æˆé‚£ä¸ªä¸€ä½“çš„}%
    %
}


\channelMsgEntry{%
    \msgRealSource{ĞĞµĞ‘ÑƒÑ‚Ğ»ĞµĞ³ ï¼ˆè¿«çœŸï¼‰}{2020-04-24 16:23:37}%
    \msgMainContent{Synapticså°±æ˜¯å‚»é€¼}%
    %
}


\channelMsgEntry{%
    \msgRealSource{CT1000MX500SSD1 1000.2 GB}{2020-04-24 16:23:38}%
    \msgMainContent{ä½ å¾—force updateé©±åŠ¨}%
    %
}


\channelMsgEntry{%
    \msgRealSource{CT1000MX500SSD1 1000.2 GB}{2020-04-24 16:23:39}%
    \msgMainContent{ç„¶åç¦æ­¢WUæ¨é€é©±åŠ¨}%
    %
}


\channelMsgEntry{%
    \msgRealSource{Mingcong Bai}{2020-04-24 16:23:40}%
    \msgMainContent{Sounds like Windows 10}%
    %
}


\channelMsgEntry{%
    \msgRealSource{CT1000MX500SSD1 1000.2 GB}{2020-04-24 16:23:40}%
    \msgMainContent{which requires Windows 10 Pro}%
    %
}


\channelMsgEntry{%
    \msgRealSource{Mingcong Bai}{2020-04-24 16:23:41}%
    \msgMainContent{LMAO}%
    %
}


\channelMsgEntry{%
    \msgRealSource{Mingcong Bai}{2020-04-24 16:23:42}%
    \msgMainContent{Exactly}%
    %
}


\channelMsgEntry{%
    \msgRealSource{ĞĞµĞ‘ÑƒÑ‚Ğ»ĞµĞ³ ï¼ˆè¿«çœŸï¼‰}{2020-04-24 16:23:42}%
    \msgMainContent{æˆ‘æœ‰}%
    %
}


\channelMsgEntry{%
    \msgRealSource{CT1000MX500SSD1 1000.2 GB}{2020-04-24 16:23:43}%
    \msgMainContent{by gpedit.msc}%
    %
}


\channelMsgEntry{%
    \msgRealSource{Mingcong Bai}{2020-04-24 16:23:44}%
    \msgMainContent{hhhhhh}%
    %
}


\channelMsgEntry{%
    \msgRealSource{ĞĞµĞ‘ÑƒÑ‚Ğ»ĞµĞ³ ï¼ˆè¿«çœŸï¼‰}{2020-04-24 16:23:45}%
    \msgMainContent{é‚£ç®—äº†}%
    %
}


\channelMsgEntry{%
    \msgRealSource{Mingcong Bai}{2020-04-24 16:23:46}%
    \msgMainContent{Wow 10/10 match}%
    %
}


\channelMsgEntry{%
    \msgRealSource{Mingcong Bai}{2020-04-24 16:23:46}%
    \msgMainContent{Too funny}%
    %
}


\channelMsgEntry{%
    \msgRealSource{CT1000MX500SSD1 1000.2 GB}{2020-04-24 16:23:47}%
    \msgMainContent{æˆ‘å¾—è¿™ä¹ˆåšï¼Œä¸ç„¶WUä¸€æ¨é€æ˜¾å¡é©±åŠ¨ï¼Œæˆ‘çš„AMDæ§åˆ¶é¢æ¿å°±ç‚¸äº†lmpo}%
    \nopagebreak\includegraphics[width=\linewidth]{./.tg-data/2020/photos/photo_132@24-04-2020_16-23-47.jpg}%
}


\channelMsgEntry{%
    \msgRealSource{Mingcong Bai}{2020-04-24 16:23:48}%
    \msgMainContent{Sounds like a commercial OS to me /s}%
    %
}


\channelMsgEntry{%
    \msgRealSource{CT1000MX500SSD1 1000.2 GB}{2020-04-24 16:23:48}%
    \msgMainContent{too brain upgrade?}%
    %
}


\channelMsgEntry{%
    \msgRealSource{Mingcong Bai}{2020-04-24 16:23:50}%
    \msgMainContent{è®²çœŸ}%
    %
}


\channelMsgEntry{%
    \msgRealSource{ĞĞµĞ‘ÑƒÑ‚Ğ»ĞµĞ³ ï¼ˆè¿«çœŸï¼‰}{2020-04-24 16:23:50}%
    \msgMainContent{too much brain fuck}%
    %
}


\channelMsgEntry{%
    \msgRealSource{Mingcong Bai}{2020-04-24 16:23:51}%
    \msgMainContent{Windows 10 æ¨è¿›äº†è®¡ç®—æœºçŸ¥è¯†æ™®åŠ}%
    %
}


\channelMsgEntry{%
    \msgRealSource{Mingcong Bai}{2020-04-24 16:23:51}%
    \msgMainContent{è‹±å›½å¾—æ„Ÿè°¢å¾®è½¯çš„}%
    %
}


\channelMsgEntry{%
    \msgRealSource{CT1000MX500SSD1 1000.2 GB}{2020-04-24 16:23:52}%
    \msgMainContent{ok so I am not the only one who absolutely hates group policy}%
    %
}


\channelMsgEntry{%
    \msgRealSource{ĞĞµĞ‘ÑƒÑ‚Ğ»ĞµĞ³ ï¼ˆè¿«çœŸï¼‰}{2020-04-24 16:23:53}%
    \msgMainContent{having to use it for yourself instead of an IT department should trigger
you}%
    %
}


\channelMsgEntry{%
    \msgRealSource{CT1000MX500SSD1 1000.2 GB}{2020-04-24 16:23:53}%
    \msgMainContent{Next time, I'll have to write my own Intune ruls lmpo}%
    %
}


\channelMsgEntry{%
    \msgRealSource{ĞĞµĞ‘ÑƒÑ‚Ğ»ĞµĞ³ ï¼ˆè¿«çœŸï¼‰}{2020-04-24 16:23:55}%
    \msgMainContent{è¯¥å»åº”è˜å½“ç½‘ç®¡äº†}%
    %
}


\channelMsgEntry{%
    \msgRealSource{ĞĞµĞ‘ÑƒÑ‚Ğ»ĞµĞ³ ï¼ˆè¿«çœŸï¼‰}{2020-04-24 16:23:55}%
    \msgMainContent{éå¸¸é€‚åˆä½ }%
    %
}


\channelMsgEntry{%
    \msgRealSource{ĞĞµĞ‘ÑƒÑ‚Ğ»ĞµĞ³ ï¼ˆè¿«çœŸï¼‰}{2020-04-24 16:23:57}%
    \msgMainContent{çœŸçš„ï¼Œä½ å…·å¤‡å¤šæ•°Linuxç”¨æˆ·ä¸ä¼šæ‹¥æœ‰çš„æ‰èƒ½}%
    %
}


\channelMsgEntry{%
    \msgRealSource{MoGeCâ‚â‚„N Yang}{2020-04-24 16:30:26}%
    \msgMainContent{è‰¹ï¼Œè¢«æ¢—é¢‘é“ç‚¸é†’äº†}%
    %
}


\channelMsgEntry{%
    \msgRealSource{Xiaoxing}{2020-04-24 16:30:26}%
    \msgMainContent{ç¬‘æ­»}%
    %
}


\channelMsgEntry{%
    \msgRealSource{Xiaoxing}{2020-04-24 16:30:26}%
    \msgMainContent{ï¼ˆè™½ç„¶æˆ‘ä¹Ÿè¢«å“åˆ°äº†}%
    %
}


\channelMsgEntry{%
    \msgRealSource{Leo Shen}{2020-04-24 16:30:26}%
    \msgMainContent{å¤§ æ”¾ æ°´(}%
    %
}


\channelMsgEntry{%
    \msgRealSource{Lion}{2020-04-25 02:55:21}%
    \msgMainContent{a + b æ˜¯æŒ‡é’ˆåŠ æ³•ä¸” = unknown behavior è¿™æ‰æ˜¯é‚ªæ•™}%
    %
}


\channelMsgEntry{%
    \msgRealSource{å¸ƒä¸ åŒ…}{2020-04-25 02:55:21}%
    \msgMainContent{æŒ‡é’ˆç®—æœ¯æ˜¯åæ–‡æ˜ï¼ˆ}%
    %
}


\channelMsgEntry{%
    \msgRealSource{Neruthes 0xAFB3373F5200DF38}{2020-04-25 02:55:21}%
    \msgMainContent{ç«Ÿç„¶è¿˜æœ‰è¿™ç§æ“ä½œï¼ˆå°–å«ï¼‰}%
    %
}


\channelMsgEntry{%
    \msgRealSource{cth451 ÇÉ”uÇÆƒÉ¹ÇÊŒá´‰p}{2020-04-25 02:55:29}%
    \msgMainContent{\#æ€ä¹ˆå«}%
    %
}


\channelMsgEntry{%
    \msgRealSource{å±‘ç‹ç‹¸ä¸æ˜¯è²“å’ª}{2020-04-25 03:39:34}%
    \msgMainContent{ä¸¤ä¸ªè›‹è›‹æ€ä¹ˆå«}%
    %
}


\channelMsgEntry{%
    \msgRealSource{Lion}{2020-04-25 03:39:34}%
    \msgMainContent{``ä»–å¦ˆæ‰“å¦ˆ''}%
    %
}


\channelMsgEntry{%
    \msgRealSource{Neruthes 0xAFB3373F5200DF38}{2020-04-25 03:39:34}%
    \msgMainContent{ç«Ÿç„¶ä¸æ˜¯ä»–å¦ˆå¤§å¦ˆ}%
    %
}


\channelMsgEntry{%
    \msgRealSource{Lion}{2020-04-25 08:22:44}%
    \msgMainContent{ï¼ˆè´­ä¹°ç”œå‘³å‰‚ï¼‰ ç¾¤å‹ï¼šè¿™æ‰¹è´§çº¯å—ï¼Ÿ ç‹®å­ï¼šçº¯ï¼Œæ™¶ä½“çº§ ç¾¤å‹ï¼šå¼€ä»·å¤šå°‘
ç‹®å­ï¼šä½ ç»™ä¸ªæ•° ç¾¤å‹ï¼š70ä¸€æ–¤ ç‹®å­ï¼š72ä¸€æ–¤æœ€ä½äº† ï¼ˆæ‰‹æœºå“äº†èµ·æ¥ï¼‰
ï¼ˆæœ‰å†…é¬¼ï¼Œç»ˆæ­¢äº¤æ˜“ï¼‰ ç‹®å­ï¼š\ldots\ldotsï¼ˆç´§å¼ ï¼Œæ‰‹ç¼“ç¼“ä¼¸å‘è¡£æœå£è¢‹ï¼‰}%
    %
}


\channelMsgEntry{%
    \msgRealSource{MoGeCâ‚â‚„N Yang}{2020-04-25 08:22:44}%
    \msgMainContent{é—¨å£ï¼šç¤¾åŒºé€å£ç½©ï¼ ç‹®å­ï¼š\emph{Shromp} ï¼ˆç‹®å­å€’åœ°ï¼‰
ï¼ˆæ³•åŒ»æ£€æµ‹ï¼Œå¤§çŒ«å®ƒ\ldots..é½æ­»äº†ï¼‰}%
    %
}


\channelMsgEntry{%
    \msgRealSource{fpsNoooob}{2020-04-25 08:23:39}%
    \msgMainContent{å®‰å…¨å—ï¼ˆ}%
    %
}


\channelMsgEntry{%
    \msgRealSource{Lion}{2020-04-25 08:23:39}%
    \msgMainContent{ä¸å¥½æ„æ€èƒ¸ğŸ‰ï¼Œæœ‰å†…é¬¼ï¼Œç»ˆæ­¢äº¤æ˜“}%
    %
}


\channelMsgEntry{%
    \msgRealSource{å±‘ç‹ç‹¸ä¸æ˜¯è²“å’ª}{2020-04-25 08:23:39}%
    \msgMainContent{æœ‰é‡‘ç‰å—ï¼Ÿä¾†å…©æ–¤}%
    %
}


\channelMsgEntry{%
    \msgRealSource{Lion}{2020-04-25 08:23:39}%
    \msgMainContent{æŠ¥è­¦äº†}%
    %
}


\channelMsgEntry{%
    \msgRealSource{å±‘ç‹ç‹¸ä¸æ˜¯è²“å’ª}{2020-04-25 08:23:39}%
    \msgMainContent{å¾ˆå¥½ï¼ŒæŠ“åˆ°å…§é¬¼äº†}%
    %
}


\channelMsgEntry{%
    \msgRealSource{Lion}{2020-04-25 08:23:39}%
    \msgMainContent{é‡‘ç‰é‡è´©ï¼Œç¦»è°±}%
    %
}


\channelMsgEntry{%
    \msgRealSource{Lion}{2020-04-25 08:28:35}%
    \msgMainContent{æˆ‘ä¸€åº¦æ€€ç–‘ä¸Šæµ·çš„é«˜è‚¥èƒ–ç‡ä¼šä¸ä¼šå’Œé«˜ç³–é¥®é£Ÿä¹ æƒ¯æœ‰å…³ï¼ˆï¼ˆ}%
    %
}


\channelMsgEntry{%
    \msgRealSource{MoGeCâ‚â‚„N Yang}{2020-04-25 08:28:35}%
    \msgMainContent{ä½ è§‰å¾—ä½ åœ¨é’ˆå¯¹æŸ´è€æ¿ï¼ˆx}%
    %
}


\channelMsgEntry{%
    \msgRealSource{MoGeCâ‚â‚„N Yang}{2020-04-25 08:28:35}%
    \msgMainContent{è€Œä¸”æˆ‘æœ‰è¯æ®}%
    %
}


\channelMsgEntry{%
    \msgRealSource{Staph Bridge}{2020-04-25 08:28:36}%
    \msgMainContent{{[}Lily-Ayta{]} æŸ´è€æ¿å¾ˆèƒ–ä¹ˆã€‚ã€‚ã€‚ã€‚}%
    %
}


\channelMsgEntry{%
    \msgRealSource{ĞĞµĞ‘ÑƒÑ‚Ğ»ĞµĞ³ ï¼ˆè¿«çœŸï¼‰}{2020-04-25 08:28:36}%
    \msgMainContent{ç¾å›½æ ‡å‡†æ˜¯ä¸èƒ–}%
    %
}


\channelMsgEntry{%
    \msgRealSource{Staph Bridge}{2020-04-25 08:28:36}%
    \msgMainContent{{[}Lily-Ayta{]} ç¾å›½æ ‡å‡†è‰}%
    %
}


\channelMsgEntry{%
    \msgRealSource{Lion}{2020-04-25 08:28:36}%
    \msgMainContent{æŸ´è€æ¿å¾ˆå¥½å•Šï¼ˆå·§å¦™é¿å¼€}%
    %
}


\channelMsgEntry{%
    \msgRealSource{å±‘ç‹ç‹¸ä¸æ˜¯è²“å’ª}{2020-04-25 08:28:36}%
    \msgMainContent{å»£æ±æ¨™æº–å‘¢}%
    %
}


\channelMsgEntry{%
    \msgRealSource{MoGeCâ‚â‚„N Yang}{2020-04-25 08:28:36}%
    \msgMainContent{é“ä»”ï¼ˆåå¼ºåŒ—æ ‡å‡†ï¼‰}%
    %
}


\channelMsgEntry{%
    \msgRealSource{Lion}{2020-04-25 08:28:36}%
    \msgMainContent{é“ä»”ï¼ˆæ— æ¡ä»¶}%
    %
}


\channelMsgEntry{%
    \msgRealSource{å±‘ç‹ç‹¸ä¸æ˜¯è²“å’ª}{2020-04-25 08:28:36}%
    \msgMainContent{ä½ å¾ˆè°æ˜å˜›}%
    %
}


\channelMsgEntry{%
    \msgRealSource{Mogician Yang}{2020-04-25 08:30:53}%
    \msgMainContent{``å¤§å®¶éƒ½æˆ˜èƒœäº†è‡ªå·±ï¼Œæˆ‘ä»¬çƒ­çˆ±æŸ´è€æ¿''}%
    %
}


\channelMsgEntry{%
    \msgRealSource{å’¸é±¼}{2020-04-29 21:14:44}%
    \msgMainContent{ç­‰ç­‰ iPhone SE çš„ç”µæ± æ‰ 1821mAh å—}%
    %
}


\channelMsgEntry{%
    \msgRealSource{Mingcong Bai}{2020-04-29 21:14:44}%
    \msgMainContent{æ‚¨ Alpha Centauri æ¥çš„å—ï¼ˆ}%
    %
}


\channelMsgEntry{%
    \msgRealSource{å’¸é±¼}{2020-04-29 21:14:44}%
    \msgMainContent{æˆ‘æ˜¯ Sagittarius A* æ¥çš„}%
    %
}


\channelMsgEntry{%
    \msgRealSource{ĞĞµĞ‘ÑƒÑ‚Ğ»ĞµĞ³ ï¼ˆè¿«çœŸï¼‰}{2020-05-01 09:00:09}%
    \msgMainContent{}%
    \nopagebreak\includegraphics[width=\linewidth]{./.tg-data/2020/photos/photo_133@01-05-2020_09-00-09.jpg}%
}


\channelMsgEntry{%
    \msgRealSource{ĞĞµĞ‘ÑƒÑ‚Ğ»ĞµĞ³ ï¼ˆè¿«çœŸï¼‰}{2020-05-01 09:00:09}%
    \msgMainContent{looongfox}%
    %
}


\channelMsgEntry{%
    \msgRealSource{åŒå€å¤šå¤šå†°ğŸ§¶ | ğ¦ğŸğœğŸ}{2020-05-01 09:00:09}%
    \msgMainContent{é¾™ç‹(TM)}%
    %
}


\channelMsgEntry{%
    \msgRealSource{ĞĞµĞ‘ÑƒÑ‚Ğ»ĞµĞ³ ï¼ˆè¿«çœŸï¼‰}{2020-05-01 09:00:09}%
    \msgMainContent{ä»¥åå†™ä¸ªmips64elçš„JITå°±å«è¿™ä¸ªå¥½äº†ï¼ˆx}%
    %
}


\channelMsgEntry{%
    \msgRealSource{Lion}{2020-05-01 11:19:47}%
    \msgMainContent{æˆ‘æ˜¯åœ¨å¤–æ¥ U ç›˜ä¸Š è·‘çš„ aosc os kde}%
    %
}


\channelMsgEntry{%
    \msgRealSource{Lion}{2020-05-01 11:19:47}%
    \msgMainContent{å¥½å¾—æ²¡è¯è¯´}%
    %
}


\channelMsgEntry{%
    \msgRealSource{ãƒ‹ãƒãƒ“ ï¸ï¸ï¸ï¸ï¸ï¸ï¸ï¸ï¸ï¸ï¸ï¸ï¸ï¸ï¸ï¸ï¸ï¸ï¸ï¸ï¸ï¸ï¸ï¸ï¸}{2020-05-01 11:19:47}%
    \msgMainContent{usb1.1çš„uç›¤ï¼Ÿ}%
    %
}


\channelMsgEntry{%
    \msgRealSource{Lion}{2020-05-01 11:19:47}%
    \msgMainContent{2.0ï¼ˆ}%
    %
}


\channelMsgEntry{%
    \msgRealSource{Mingcong Bai}{2020-05-01 11:19:47}%
    \msgMainContent{æ„Ÿåˆ°è¡€å‹å¢é«˜}%
    %
}


\channelMsgEntry{%
    \msgRealSource{Lion}{2020-05-01 11:19:47}%
    \msgMainContent{é”»ç‚¼å¥¶å­}%
    %
}


\channelMsgEntry{%
    \msgRealSource{Lion}{2020-05-01 11:19:47}%
    \msgMainContent{è€å¿ƒ*}%
    %
}


\channelMsgEntry{%
    \msgRealSource{Mingcong Bai}{2020-05-01 11:19:47}%
    \msgMainContent{ï¼Ÿï¼Ÿï¼Ÿ}%
    %
}


\channelMsgEntry{%
    \msgRealSource{Lion}{2020-05-01 11:19:47}%
    \msgMainContent{è‰è¿™ä¸ªè¾“å…¥æ³•}%
    %
}


\channelMsgEntry{%
    \msgRealSource{Mingcong Bai}{2020-05-01 11:19:47}%
    \msgMainContent{ä»€ä¹ˆäººå•Š}%
    %
}


\channelMsgEntry{%
    \msgRealSource{ãƒ‹ãƒãƒ“ ï¸ï¸ï¸ï¸ï¸ï¸ï¸ï¸ï¸ï¸ï¸ï¸ï¸ï¸ï¸ï¸ï¸ï¸ï¸ï¸ï¸ï¸ï¸ï¸ï¸}{2020-05-01 11:19:47}%
    \msgMainContent{æš´éœ²äº†}%
    %
}


\channelMsgEntry{%
    \msgRealSource{Lion}{2020-05-01 11:19:47}%
    \msgMainContent{x å’Œ z éš”å¾—å¤ªè¿‘}%
    %
}


\channelMsgEntry{%
    \msgRealSource{Lion}{2020-05-01 11:19:47}%
    \msgMainContent{è¾“å…¥æ³•æœ‰æ¨¡ç³Šä½ç½®è¾“å…¥çš„åŠŸèƒ½ï¼‰}%
    %
}


\channelMsgEntry{%
    \msgRealSource{Mingcong Bai}{2020-05-01 11:19:47}%
    \msgMainContent{è¶Šæè¶Šé»‘ï¼ˆ}%
    %
}


\channelMsgEntry{%
    \msgRealSource{Lion}{2020-05-01 11:19:48}%
    \msgMainContent{ï¼ˆæŠ±å¤´é€ƒè·‘}%
    %
}


\channelMsgEntry{%
    \msgRealSource{Jack Lee}{2020-05-04 03:58:22}%
    \msgMainContent{}%
    %
}


\channelMsgEntry{%
    \msgRealSource{Mingcong Bai}{2020-05-04 03:58:22}%
    \msgMainContent{\^{} Wiki.js working its magic}%
    %
}


\channelMsgEntry{%
    \msgRealSource{å’¸é±¼}{2020-05-05 17:25:23}%
    \msgMainContent{åæ­£éƒ½æ˜¯è‡ªå·±è£…ï¼Œæ•£ä»¶è·Ÿæ•´æœºæœ‰ä»€ä¹ˆåŒºåˆ«å—ï¼ï¼ˆæŒ¯å£°}%
    %
}


\channelMsgEntry{%
    \msgRealSource{å’¸é±¼}{2020-05-05 17:25:23}%
    \msgMainContent{ç¿»çª—å•Šï¼ˆå¤§å£°}%
    %
}


\channelMsgEntry{%
    \msgRealSource{å’¸é±¼}{2020-05-05 17:25:23}%
    \msgMainContent{ç ´é—¨å•Šï¼ˆx}%
    %
}


\channelMsgEntry{%
    \msgRealSource{cth451 ÇÉ”uÇÆƒÉ¹ÇÊŒá´‰p}{2020-05-05 17:25:31}%
    \msgMainContent{\#æ€ä¹ˆå«}%
    %
}


\channelMsgEntry{%
    \msgRealSource{MoGeCâ‚â‚„N Yang}{2020-05-06 02:39:36}%
    \msgMainContent{11 * (âˆš(4) + 5!) - 1 - 4 = 1337}%
    %
}


\channelMsgEntry{%
    \msgRealSource{MoGeCâ‚â‚„N Yang}{2020-05-06 02:39:36}%
    \msgMainContent{1337 å…ˆ è¾ˆ è¯´}%
    %
}


\channelMsgEntry{%
    \msgRealSource{MoGeCâ‚â‚„N Yang}{2020-05-06 02:39:36}%
    \msgMainContent{QED}%
    %
}


\channelMsgEntry{%
    \msgRealSource{Xiaoxing}{2020-05-06 05:36:49}%
    \msgMainContent{åœ¨ä½ è¯´æ”¹å¥½äº†æˆ‘æ‰è·‘çš„ -pï¼ˆ}%
    %
}


\channelMsgEntry{%
    \msgRealSource{Lion}{2020-05-06 05:36:50}%
    \msgMainContent{å¹‚ç­‰ï¼Œå¹‚ç­‰}%
    %
}


\channelMsgEntry{%
    \msgRealSource{Lion}{2020-05-06 05:36:50}%
    \msgMainContent{ï¼ˆ}%
    %
}


\channelMsgEntry{%
    \msgRealSource{Lion}{2020-05-06 05:36:51}%
    \msgMainContent{ç¡è§‰è§‰}%
    %
}


\channelMsgEntry{%
    \msgRealSource{Xiaoxing}{2020-05-06 05:36:51}%
    \msgMainContent{æŠ¢ç”Ÿæ„.jpg}%
    %
}


\channelMsgEntry{%
    \msgRealSource{Lion}{2020-05-06 05:36:52}%
    \msgMainContent{ç¡è§‰è§‰ï¼ˆæŒç»­å¤±ä¿¡åˆè§‰}%
    %
}


\channelMsgEntry{%
    \msgRealSource{Xiaoxing}{2020-05-06 05:36:53}%
    \msgMainContent{èµ·åºŠä¸Šç­äº†}%
    %
}


\channelMsgEntry{%
    \msgRealSource{Lion}{2020-05-06 05:36:53}%
    \msgMainContent{æ­»}%
    %
}


\channelMsgEntry{%
    \msgRealSource{Lion}{2020-05-06 05:36:55}%
    \msgMainContent{ç‹®å­è¦ç¡è°ä¹Ÿæ‹¦ä¸ä½}%
    %
}


\channelMsgEntry{%
    \msgRealSource{å’¸é±¼}{2020-05-07 02:52:36}%
    \msgMainContent{è‰}%
    %
}


\channelMsgEntry{%
    \msgRealSource{cth451 ÇÉ”uÇÆƒÉ¹ÇÊŒá´‰p}{2020-05-07 02:52:36}%
    \msgMainContent{è‰ä»€ä¹ˆè‰}%
    %
}


\channelMsgEntry{%
    \msgRealSource{MoGeCâ‚â‚„N Yang}{2020-05-07 02:52:36}%
    \msgMainContent{é±¼ä»€ä¹ˆé±¼}%
    %
}


\channelMsgEntry{%
    \msgRealSource{è‡­è‡­}{2020-05-07 06:54:00}%
    \msgMainContent{ğŸ³ï¸â€ğŸŒˆ I am 0\% gay!}%
    %
}


\channelMsgEntry{%
    \msgRealSource{Mingcong Bai}{2020-05-07 06:54:00}%
    \msgMainContent{åˆä¸€ä¸ª ç¥}%
    %
}


\channelMsgEntry{%
    \msgRealSource{ĞĞµĞ‘ÑƒÑ‚Ğ»ĞµĞ³ ï¼ˆè¿«çœŸï¼‰}{2020-05-07 06:54:00}%
    \msgMainContent{ä»€ä¹ˆï¼Œé’¢é“ç›´ç”·å°±æ˜¯ä½ }%
    %
}


\channelMsgEntry{%
    \msgRealSource{æ‰˜å°”é…±çš„æ¢—å›¾ä¸FW}{2020-05-12 05:47:14}%
    \msgMainContent{\#NSFW}%
    \nopagebreak\includegraphics[width=\linewidth]{./.tg-data/2020/photos/photo_134@12-05-2020_05-47-14.jpg}%
}


\channelMsgEntry{%
    \msgRealSource{Lion}{2020-05-12 05:47:14}%
    \msgMainContent{æ¢å›Šå–ç‰© \#NSFW}%
    %
}


\channelMsgEntry{%
    \msgRealSource{Lion}{2020-05-12 05:47:14}%
    \msgMainContent{è¿™ç§ç›´æ¥å®šç›—çªƒç½ª}%
    %
}


\channelMsgEntry{%
    \msgRealSource{liushuyu}{2020-05-13 07:57:43}%
    \msgMainContent{}%
    \nopagebreak\includegraphics[width=\linewidth]{./.tg-data/2020/photos/photo_135@13-05-2020_07-57-43.jpg}%
}


\channelMsgEntry{%
    \msgRealSource{liushuyu}{2020-05-13 07:57:43}%
    \msgMainContent{Perl ä¸¥æ ¼æ¨¡å¼ä¸‹é¢å…¨å±€å˜é‡è¦åŠ  our ï¼ˆ}%
    %
}


\channelMsgEntry{%
    \msgRealSource{Mingcong Bai}{2020-05-13 07:57:44}%
    \msgMainContent{\emph{soyuz nerushinikh}}%
    %
}


\channelMsgEntry{%
    \msgRealSource{Lion}{2020-05-13 07:57:44}%
    \msgMainContent{æˆ‘ä»¬çš„åŒå¿—ï¼ˆæ°”çª}%
    %
}


\channelMsgEntry{%
    \msgRealSource{Mingcong Bai}{2020-05-13 07:57:44}%
    \msgMainContent{\emph{respublik svobodnikh}}%
    %
}


\channelMsgEntry{%
    \msgRealSource{Kexy Biscuit | è¢«å­é¥¼ï¸ | ç™¾åˆãƒ¶å’²ã‚‹ã‚‹}{2020-05-15 07:33:40}%
    \msgMainContent{NVMe æœ¬è´¨ä¸Šè¿˜æ˜¯ SCSI å§ï¼Ÿ}%
    %
}


\channelMsgEntry{%
    \msgRealSource{Kexy Biscuit | è¢«å­é¥¼ï¸ | ç™¾åˆãƒ¶å’²ã‚‹ã‚‹}{2020-05-15 07:33:41}%
    \msgMainContent{æˆ‘è®°å¾—æŒ‡ä»¤æœ‰ä¸å°‘ç›¸ä¼¼çš„åœ°æ–¹}%
    %
}


\channelMsgEntry{%
    \msgRealSource{åŒå€å¤šå¤šå†°ğŸ§¶ | ğ¦ğŸğœğŸ}{2020-05-15 07:33:42}%
    \msgMainContent{ä½ å»é—®ç¬¨ç‹}%
    %
}


\channelMsgEntry{%
    \msgRealSource{åŒå€å¤šå¤šå†°ğŸ§¶ | ğ¦ğŸğœğŸ}{2020-05-15 07:33:42}%
    \msgMainContent{æˆ‘å¯¹å¥³ä¹ˆä¸ç†Ÿ}%
    %
}


\channelMsgEntry{%
    \msgRealSource{åŒå€å¤šå¤šå†°ğŸ§¶ | ğ¦ğŸğœğŸ}{2020-05-15 07:33:43}%
    \msgMainContent{æˆ‘åªæ˜¯ä¸ªæ— æƒ…çš„å¥³ä¹ˆç”¨æˆ·}%
    %
}


\channelMsgEntry{%
    \msgRealSource{Junde Yhi}{2020-05-15 07:33:43}%
    \msgMainContent{å¥³ä¹ˆç¬‘æ­»}%
    %
}


\channelMsgEntry{%
    \msgRealSource{ĞĞµĞ‘ÑƒÑ‚Ğ»ĞµĞ³ ï¼ˆè¿«çœŸï¼‰}{2020-05-17 02:43:15}%
    \msgMainContent{ä»Šå¤©ä½ huiè®²ä¸Šæµ·è¯äº†å—ï¼Ÿï¼ˆx}%
    %
}


\channelMsgEntry{%
    \msgRealSource{ĞĞµĞ‘ÑƒÑ‚Ğ»ĞµĞ³ ï¼ˆè¿«çœŸï¼‰}{2020-05-17 02:43:15}%
    \msgMainContent{huiè¯}%
    %
}


\channelMsgEntry{%
    \msgRealSource{MoGeCâ‚â‚„N Yang}{2020-05-17 03:09:56}%
    \msgMainContent{å®‰å¾½åŒå¿—äº¤æµç¤¾åŒºå½“ç„¶è¦è®² hui è¯å•¦}%
    %
}


\channelMsgEntry{%
    \msgRealSource{Lion}{2020-05-17 03:09:56}%
    \msgMainContent{é‚£ä¸­ç§‘å¤§ç¾¤é‡Œå²‚ä¸æ˜¯å¤©å¤© å´è¨€ hui è¯­ï¼Ÿ}%
    %
}


\channelMsgEntry{%
    \msgRealSource{å’¸é±¼}{2020-05-18 04:09:23}%
    \msgMainContent{ADADADADADADADADADADADï¼ˆx}%
    %
}


\channelMsgEntry{%
    \msgRealSource{imbushuo [Highly Confidential / HBI]}{2020-05-18 04:09:23}%
    \msgMainContent{å’¸é±¼å«.avi}%
    %
}


\channelMsgEntry{%
    \msgRealSource{cth451 ÇÉ”uÇÆƒÉ¹ÇÊŒá´‰p}{2020-05-18 04:09:29}%
    \msgMainContent{\#æ€ä¹ˆå«}%
    %
}


\channelMsgEntry{%
    \msgRealSource{ĞĞµĞ‘ÑƒÑ‚Ğ»ĞµĞ³ ï¼ˆè¿«çœŸï¼‰}{2020-05-27 05:31:34}%
    \msgMainContent{canada bushfire (x}%
    %
}


\channelMsgEntry{%
    \msgRealSource{ĞĞµĞ‘ÑƒÑ‚Ğ»ĞµĞ³ ï¼ˆè¿«çœŸï¼‰}{2020-05-27 05:31:34}%
    \msgMainContent{hypotonic \emph{chubbyemu intensifies}}%
    %
}


\channelMsgEntry{%
    \msgRealSource{ĞĞµĞ‘ÑƒÑ‚Ğ»ĞµĞ³ ï¼ˆè¿«çœŸï¼‰}{2020-05-27 05:31:34}%
    \msgMainContent{we have chubbyemu at home! chubbyemu at home:}%
    %
}


\channelMsgEntry{%
    \msgRealSource{Junde Yhi}{2020-05-27 05:31:34}%
    \msgMainContent{presenting to heme channel}%
    %
}


\channelMsgEntry{%
    \msgRealSource{Junde Yhi}{2020-05-27 05:31:34}%
    \msgMainContent{conscious}%
    %
}


\channelMsgEntry{%
    \msgRealSource{cth451 ÇÉ”uÇÆƒÉ¹ÇÊŒá´‰p}{2020-05-27 05:31:43}%
    \msgMainContent{\begin{itemize}
\tightlist
\item
  AOSC meme channel
\end{itemize}}%
    %
}


\channelMsgEntry{%
    \msgRealSource{ĞĞµĞ‘ÑƒÑ‚Ğ»ĞµĞ³ ï¼ˆè¿«çœŸï¼‰}{2020-05-28 09:13:42}%
    \msgMainContent{è¯è¯´LTSåŸæ¥æ˜¯æç”°æ‰€çš„æ„æ€ï¼ˆx}%
    %
}


\channelMsgEntry{%
    \msgRealSource{ĞĞµĞ‘ÑƒÑ‚Ğ»ĞµĞ³ ï¼ˆè¿«çœŸï¼‰}{2020-05-28 09:13:42}%
    \msgMainContent{LTSå†…æ ¸ï¼ŒLTSå‘è¡Œç‰ˆ}%
    %
}


\channelMsgEntry{%
    \msgRealSource{ĞĞµĞ‘ÑƒÑ‚Ğ»ĞµĞ³ ï¼ˆè¿«çœŸï¼‰}{2020-05-28 09:13:43}%
    \msgMainContent{å°±åƒé“¶æ¢¦åœ¨å‘å”®ååˆ°ç°åœ¨è¿˜æœ‰æŠ€æœ¯æ”¯æŒï¼ˆè¿«çœŸï¼‰ä¸€æ ·}%
    %
}


\channelMsgEntry{%
    \msgRealSource{MoGeCâ‚â‚„N Yang}{2020-05-28 09:13:43}%
    \msgMainContent{æ€ªä¸å¾—å¤§å®¶éƒ½å–œæ¬¢åœ¨ç¨³å®šçš„æœåŠ¡å™¨ä¸Šç”¨LTSï¼ˆç¡®ä¿¡}%
    %
}


\channelMsgEntry{%
    \msgRealSource{Lion}{2020-05-31 08:12:59}%
    \msgMainContent{AOSC OS æ²¡æœ‰ imapsync}%
    %
}


\channelMsgEntry{%
    \msgRealSource{gumblex}{2020-05-31 08:13:00}%
    \msgMainContent{è°åŠ æ€¥ä¸€ä¸‹ï¼ˆï¼ˆ}%
    %
}


\channelMsgEntry{%
    \msgRealSource{liushuyu}{2020-05-31 08:13:00}%
    \msgMainContent{imapsync ä¾èµ–è¿‡å¤šï¼ˆ}%
    %
}


\channelMsgEntry{%
    \msgRealSource{CT1000MX500SSD1 1000.2 GB}{2020-05-31 08:13:01}%
    \msgMainContent{}%
    \nopagebreak\includegraphics[width=\linewidth]{./.tg-data/2020/photos/photo_136@31-05-2020_08-13-01.jpg}%
}


\channelMsgEntry{%
    \msgRealSource{CT1000MX500SSD1 1000.2 GB}{2020-05-31 08:13:02}%
    \msgMainContent{Sounds linke Node.js (}%
    %
}


\channelMsgEntry{%
    \msgRealSource{liushuyu}{2020-05-31 08:13:02}%
    \msgMainContent{æœ‰åŒ…ç®¡ç†çš„è¯­è¨€éƒ½å·®ä¸å¤šï¼ˆGo é™¤å¤–}%
    %
}


\channelMsgEntry{%
    \msgRealSource{IDeletedAccount}{2020-05-31 08:13:20}%
    \msgMainContent{è€Œ AOSC é‚®ç®±è¿ç§»éœ€è¦ imapsync}%
    %
}


\channelMsgEntry{%
    \msgRealSource{IDeletedAccount}{2020-05-31 08:13:37}%
    \msgMainContent{æ‰€ä»¥ä½ å¾—æ‰¾ä¸€ä¸ª non-AOSC OS æ¥è¿ç§»ï¼ˆ}%
    %
}


\channelMsgEntry{%
    \msgRealSource{Mingcong Bai}{2020-05-31 08:13:59}%
    \msgMainContent{æˆ–è€…è¿™ä¸ªåŒ…æ˜å¤©å°±åœ¨ stable åˆ†æ”¯å‡ºç°}%
    %
}


\channelMsgEntry{%
    \msgRealSource{liushuyu}{2020-05-31 09:58:48}%
    \msgMainContent{æˆ‘æ—¥ï¼Œ imapsync æ˜¯ä¸ª 1 ä¸‡ 7 åƒè¡Œçš„è„šæœ¬}%
    %
}


\channelMsgEntry{%
    \msgRealSource{Lion}{2020-05-31 09:58:48}%
    \msgMainContent{ï¼ˆæˆ‘è‰æ³¥èŠ­ï¼Œå°±æ²¡ä¸ªè½»æ¾ç‚¹çš„ä»£æ›¿å“å—}%
    %
}


\channelMsgEntry{%
    \msgRealSource{CT1000MX500SSD1 1000.2 GB}{2020-05-31 09:58:49}%
    \msgMainContent{You speak so Californian (}%
    %
}


\channelMsgEntry{%
    \msgRealSource{MoGeCâ‚â‚„N Yang}{2020-06-06 17:32:20}%
    \msgMainContent{æœ‰ä¸€æ¬¡ï¼Œ@Mogician çœ‹åˆ° @MarvelousBlack å‘çš„å›¾ï¼Œæ€’æ°”å†²å†²åœ°è¯´ï¼š
``å…¨æ˜¯è¿™äº›é¸¡å„¿é¸¡å„¿çš„é»„è‰²ç©æ„ï¼''

æ­£åœ¨æ¥å¾…å®¤çš„ @MarvelousBlack å¬åˆ°äº†è¿™å¥è¯ï¼Œä»–èµ°è¿› @o0\_0b
çš„åŠå…¬è¯•å›¾æŠŠè¿™è¯å‘Šè¯‰äº† @o0\_0b ã€‚

@o0\_0b è®©äººæŠŠ @Mogician å«äº†å›æ¥ï¼š ``@Mogician
åŒå¿—ï¼Œæ‚¨ä»æˆ‘åŠå…¬å®¤å‡ºå¾€æ—¶è¯´äº†ä¸€å¥`é»„è‰²é¸¡å„¿ç©æ„'ï¼Œæ‚¨æ˜¯åœ¨æš—ç¤ºä»€ä¹ˆå‘¢?''

``å°±å–µå’ªè¢«é¸¡æ·¹æ²¡ï¼Œä¸çŸ¥æ‰€æª https://t.me/c/1004506152/1287693''

@o0\_0b é—®é“''``@MarvelousBlack åŒå¿—ï¼Œè€Œæ‚¨åˆæ˜¯åœ¨æƒ³ä»€ä¹ˆå‘¢?''

``https://t.me/c/1004506152/1287695''}%
    %
}


\channelMsgEntry{%
    \msgRealSource{ĞĞµĞ‘ÑƒÑ‚Ğ»ĞµĞ³ ï¼ˆè¿«çœŸï¼‰}{2020-06-09 02:24:41}%
    \msgMainContent{ç‰¹é¦–è¢«èƒèŸ¹å¤¹äº†ï¼ˆot}%
    %
}


\channelMsgEntry{%
    \msgRealSource{Mingcong Bai}{2020-06-09 02:24:41}%
    \msgMainContent{å“ˆï¼Ÿ}%
    %
}


\channelMsgEntry{%
    \msgRealSource{ĞĞµĞ‘ÑƒÑ‚Ğ»ĞµĞ³ ï¼ˆè¿«çœŸï¼‰}{2020-06-09 02:24:41}%
    \msgMainContent{rustå‰ç¥¥ç‰©ï¼ˆ}%
    %
}


\channelMsgEntry{%
    \msgRealSource{Mingcong Bai}{2020-06-09 02:24:41}%
    \msgMainContent{æˆ‘å°±æƒ³èµ·è¿™ä¸ª}%
    %
}


\channelMsgEntry{%
    \msgRealSource{Mingcong Bai}{2020-06-09 02:24:41}%
    \msgMainContent{}%
    %
}


\channelMsgEntry{%
    \msgRealSource{ĞĞµĞ‘ÑƒÑ‚Ğ»ĞµĞ³ ï¼ˆè¿«çœŸï¼‰}{2020-06-09 02:24:41}%
    \msgMainContent{è¯·é—®å›¾é‡Œæ‰€æœ‰èƒèŸ¹æ˜¯å¦éƒ½ä¾èµ–serdeï¼ˆx}%
    %
}


\channelMsgEntry{%
    \msgRealSource{liushuyu}{2020-06-09 03:26:09}%
    \msgMainContent{}%
    \nopagebreak\includegraphics[width=\linewidth]{./.tg-data/2020/photos/photo_137@09-06-2020_03-26-09.jpg}%
}


\channelMsgEntry{%
    \msgRealSource{Mingcong Bai}{2020-06-09 03:26:09}%
    \msgMainContent{Fuck offï¼ˆ}%
    %
}


\channelMsgEntry{%
    \msgRealSource{DY DY EliteBook 745 G6}{2020-06-09 23:46:36}%
    \msgMainContent{å­—ä½“æˆè¿™æ ·äº†}%
    \nopagebreak\includegraphics[width=\linewidth]{./.tg-data/2020/photos/photo_138@09-06-2020_23-46-36.jpg}%
}


\channelMsgEntry{%
    \msgRealSource{MoGeCâ‚â‚„N Yang}{2020-06-09 23:46:36}%
    \msgMainContent{e x F A T}%
    %
}


\channelMsgEntry{%
    \msgRealSource{ĞĞµĞ‘ÑƒÑ‚Ğ»ĞµĞ³ ï¼ˆè¿«çœŸï¼‰}{2020-06-11 04:30:10}%
    \msgMainContent{With the NVIDIA Jetson AGX Xavier developer kit, you can easily create
and deploy end-to-end AI robotics applications for manufacturing,
delivery, retail, smart cities, and more. Jelly: haha armv7 packages go
brrr brrr}%
    %
}


\channelMsgEntry{%
    \msgRealSource{Lion}{2020-06-14 14:33:32}%
    \msgMainContent{æˆ‘çš„ç§é’¥å£ä»¤ï¼Œç»ˆäºæƒ³èµ·æ¥äº†ï¼}%
    %
}


\channelMsgEntry{%
    \msgRealSource{Lion}{2020-06-14 14:33:32}%
    \msgMainContent{æ—¶éš”åŠä¸ªæœˆ}%
    %
}


\channelMsgEntry{%
    \msgRealSource{Lion}{2020-06-14 14:33:32}%
    \msgMainContent{åšæ¢¦çš„æ—¶å€™æ¢¦åˆ°äº†è‡ªå·±ç™»ç»ˆç«¯è¾“å¯†é’¥å£ä»¤ï¼ˆ}%
    %
}


\channelMsgEntry{%
    \msgRealSource{MoGeCâ‚â‚„N Yang}{2020-06-14 14:33:32}%
    \msgMainContent{æ¶‰å¯†ä¸ç¡è§‰ï¼Œç¡è§‰ä¸æ¶‰å¯†}%
    %
}


\channelMsgEntry{%
    \msgRealSource{Neruthes 0xAFB3373F5200DF38}{2020-06-14 14:33:32}%
    \msgMainContent{æœç„¶æœ€è–„å¼±çš„ç¯èŠ‚è¿˜æ˜¯å¤§è„‘çš®å±‚åœ¨å¯åŠ¨é˜¶æ®µè¢«ä¾§ä¿¡é“æ”»å‡»}%
    %
}


\channelMsgEntry{%
    \msgRealSource{Neruthes 0xAFB3373F5200DF38}{2020-06-14 14:33:32}%
    \msgMainContent{éœ€è¦å¯ä¿¡åšæ¢¦}%
    %
}


\channelMsgEntry{%
    \msgRealSource{cth451 ÇÉ”uÇÆƒÉ¹ÇÊŒá´‰p}{2020-06-14 19:41:07}%
    \msgMainContent{}%
    \nopagebreak\includegraphics[width=\linewidth]{./.tg-data/2020/photos/photo_139@14-06-2020_19-41-07.jpg}%
}


\channelMsgEntry{%
    \msgRealSource{cth451 ÇÉ”uÇÆƒÉ¹ÇÊŒá´‰p}{2020-06-14 19:41:07}%
    \msgMainContent{è¿™è¢‹éƒ½æ²¡å¼€è¿‡ orz}%
    %
}


\channelMsgEntry{%
    \msgRealSource{å’¸é±¼}{2020-06-14 19:41:07}%
    \msgMainContent{ç§ç›†å­é‡Œå°±èƒ½å½“ç›†æ ½äº†ï¼ˆx}%
    %
}


\channelMsgEntry{%
    \msgRealSource{cth451 ÇÉ”uÇÆƒÉ¹ÇÊŒá´‰p}{2020-06-14 19:41:07}%
    \msgMainContent{}%
    \nopagebreak\includegraphics[width=\linewidth]{./.tg-data/2020/photos/photo_140@14-06-2020_19-41-07.jpg}%
}


\channelMsgEntry{%
    \msgRealSource{MoGeCâ‚â‚„N Yang}{2020-06-14 19:41:07}%
    \msgMainContent{cursed æ°´ä»™èŠ±}%
    %
}


\channelMsgEntry{%
    \msgRealSource{å’¸é±¼}{2020-06-14 19:41:07}%
    \msgMainContent{ğŸ¶ å¦‚æœä½ ä¸€å±‚ä¸€å±‚ä¸€å±‚å¾—å‰¥å¼€}%
    %
}


\channelMsgEntry{%
    \msgRealSource{ĞĞµĞ‘ÑƒÑ‚Ğ»ĞµĞ³ ï¼ˆè¿«çœŸï¼‰}{2020-06-14 19:41:07}%
    \msgMainContent{Onion router (}%
    %
}


\channelMsgEntry{%
    \msgRealSource{cth451 ÇÉ”uÇÆƒÉ¹ÇÊŒá´‰p}{2020-06-14 19:41:07}%
    \msgMainContent{Stack trace}%
    %
}


\channelMsgEntry{%
    \msgRealSource{MoGeCâ‚â‚„N Yang}{2020-06-14 19:41:07}%
    \msgMainContent{ä¸€ä¸ªä¸€ä¸ªï¼}%
    %
}


\channelMsgEntry{%
    \msgRealSource{MoGeCâ‚â‚„N Yang}{2020-06-14 19:41:07}%
    \msgMainContent{@cth451 ä½ ä¸æŠŠä½ æ°´ä»™èŠ±çš„å›¾æ”¾è¿›æ¢—ç¾¤çš„å—}%
    %
}


\channelMsgEntry{%
    \msgRealSource{ĞĞµĞ‘ÑƒÑ‚Ğ»ĞµĞ³ ï¼ˆè¿«çœŸï¼‰}{2020-06-16 00:10:12}%
    \msgMainContent{ä»Šå¤©æˆ‘æŠ„stackoverflowä»£ç 
æ˜å¤©å°±ä¸Šçº¿æˆ‘äº²æ‰‹å†™çš„ä¸è®©æˆ‘çœ‹stackoverflowçš„é¡¹ç›®}%
    %
}


\channelMsgEntry{%
    \msgRealSource{ĞĞµĞ‘ÑƒÑ‚Ğ»ĞµĞ³ ï¼ˆè¿«çœŸï¼‰}{2020-06-16 00:10:12}%
    \msgMainContent{è¿™ä»€ä¹ˆå¿ƒæƒ…ï¼ˆ}%
    %
}


\channelMsgEntry{%
    \msgRealSource{MoGeCâ‚â‚„N Yang}{2020-06-16 00:10:12}%
    \msgMainContent{NTR}%
    %
}


\channelMsgEntry{%
    \msgRealSource{ĞĞµĞ‘ÑƒÑ‚Ğ»ĞµĞ³ ï¼ˆè¿«çœŸï¼‰}{2020-06-16 08:48:29}%
    \msgMainContent{ç°åœ¨è¹²å‘éƒ½èƒ½é—»åˆ°ç•ªèŒ„å‘³}%
    %
}


\channelMsgEntry{%
    \msgRealSource{MoGeCâ‚â‚„N Yang}{2020-06-16 08:48:30}%
    \msgMainContent{}%
    \nopagebreak\includegraphics[width=\linewidth]{./.tg-data/2020/photos/photo_141@16-06-2020_08-48-30.jpg}%
}


\channelMsgEntry{%
    \msgRealSource{ĞĞµĞ‘ÑƒÑ‚Ğ»ĞµĞ³ ï¼ˆè¿«çœŸï¼‰}{2020-06-16 08:48:30}%
    \msgMainContent{è¿™ä¸ªæ²¡åŠ²ï¼ˆ}%
    %
}


\channelMsgEntry{%
    \msgRealSource{Bocchi the Gif}{2020-06-16 08:48:30}%
    \msgMainContent{å’–å–±å‘³çš„å¤§ä¾¿}%
    %
}


\channelMsgEntry{%
    \msgRealSource{MoGeCâ‚â‚„N Yang}{2020-06-16 08:48:30}%
    \msgMainContent{å¦‚æœå®ƒçœ‹èµ·æ¥åƒå’–å–±ï¼Œé—»èµ·æ¥ä¹Ÿåƒå’–å–±ï¼Œå°èµ·æ¥ä¹Ÿåƒå’–å–±ï¼Œé‚£å®ƒå°±æ˜¯å’–å–±}%
    %
}


\channelMsgEntry{%
    \msgRealSource{ĞĞµĞ‘ÑƒÑ‚Ğ»ĞµĞ³ ï¼ˆè¿«çœŸï¼‰}{2020-06-16 08:48:30}%
    \msgMainContent{å¦‚æœæ²¡è‡­å‘³é‚£è’™ç€çœ¼ç›åƒä¸‹å»ä¹Ÿæ²¡äººçŸ¥é“ï¼ˆx}%
    %
}


\channelMsgEntry{%
    \msgRealSource{Leo Shen}{2020-06-16 08:48:30}%
    \msgMainContent{Curry typing (}%
    %
}


\channelMsgEntry{%
    \msgRealSource{ĞĞµĞ‘ÑƒÑ‚Ğ»ĞµĞ³ ï¼ˆè¿«çœŸï¼‰}{2020-06-16 08:48:30}%
    \msgMainContent{curryingï¼ˆfunctional programming}%
    %
}


\channelMsgEntry{%
    \msgRealSource{Bocchi the Gif}{2020-06-16 08:48:30}%
    \msgMainContent{Currified shxt}%
    %
}


\channelMsgEntry{%
    \msgRealSource{MoGeCâ‚â‚„N Yang}{2020-06-16 08:48:30}%
    \msgMainContent{https://en.wikipedia.org/wiki/Currying}%
    %
}


\channelMsgEntry{%
    \msgRealSource{Leo Shen}{2020-06-16 08:48:32}%
    \msgMainContent{-\textgreater{} (curry shit)}%
    %
}


\channelMsgEntry{%
    \msgRealSource{MoGeCâ‚â‚„N Yang}{2020-06-16 08:48:32}%
    \msgMainContent{Ah, we love curry (}%
    %
}


\channelMsgEntry{%
    \msgRealSource{Leo Shen}{2020-06-16 08:48:32}%
    \msgMainContent{é‚£ä¹ˆ uncurry æ€ä¹ˆåŠ(}%
    %
}


\channelMsgEntry{%
    \msgRealSource{MoGeCâ‚â‚„N Yang}{2020-06-16 08:48:32}%
    \msgMainContent{å½“ä½ æ„è¯†åˆ°å®ƒå…¶å®æ˜¯ç¿”çš„æ—¶å€™ï¼Œå°±å®Œæˆäº†uncurry}%
    %
}


\channelMsgEntry{%
    \msgRealSource{å’¸é±¼}{2020-06-17 07:06:40}%
    \msgMainContent{ä½ è¿™å†…æ ¸ä¸å¤Ÿå¤šå•Šï¼ˆx}%
    %
}


\channelMsgEntry{%
    \msgRealSource{å’¸é±¼}{2020-06-17 07:06:41}%
    \msgMainContent{ä½ çœ‹åŒæ ¸æµè§ˆå™¨å¤šå¥½}%
    %
}


\channelMsgEntry{%
    \msgRealSource{å’¸é±¼}{2020-06-17 07:06:41}%
    \msgMainContent{ä¹‹å‰ä¸å°±æœ‰ä¸€å¤§å †åŒæ ¸æµè§ˆå™¨}%
    %
}


\channelMsgEntry{%
    \msgRealSource{å’¸é±¼}{2020-06-17 07:06:41}%
    \msgMainContent{è€Œä¸”æ”¾åœ¨é‚£æ—¶å€™è¿˜çœŸå°±ç¬¦åˆå®é™…éœ€æ±‚ï¼ˆx}%
    %
}


\channelMsgEntry{%
    \msgRealSource{å’¸é±¼}{2020-06-17 07:06:41}%
    \msgMainContent{åŒæ ¸æµè§ˆå™¨ == Blink + Trident Chrom\{e,ium\} == OS == Blink GNU/Linux ==
OS

åŒæ ¸æµè§ˆå™¨ \textgreater{} Chrom\{e,ium\} == GNU/Linux

åŒæ ¸æµè§ˆå™¨ == Chrom\{e,ium\} + Trident == OS + Trident == GNU/Linux +
Trident

æ‰€ä»¥æ²¡æœ‰ Trident çš„ Linux æ˜¯æ¯”åŒæ ¸æµè§ˆå™¨æ›´å±‘çš„å±‘ã€‚

Q.E.D.}%
    %
}


\channelMsgEntry{%
    \msgRealSource{å’¸é±¼}{2020-06-17 07:16:01}%
    \msgMainContent{è‰}%
    %
}


\channelMsgEntry{%
    \msgRealSource{å’¸é±¼}{2020-06-17 07:16:01}%
    \msgMainContent{è‰æ­»äº†ï¼è‰æ­»äº†ï¼ï¼ˆå¯¹ç€è‰å–Šé“}%
    %
}


\channelMsgEntry{%
    \msgRealSource{cth451 ÇÉ”uÇÆƒÉ¹ÇÊŒá´‰p}{2020-06-17 07:16:06}%
    \msgMainContent{\#æ€ä¹ˆå«}%
    %
}


\channelMsgEntry{%
    \msgRealSource{Leo Shen}{2020-06-18 05:44:14}%
    \msgMainContent{LxQt è¿˜å¾ˆæ–°çš„æ ·å­, ç»™å®ƒç‚¹æ—¶é—´(}%
    %
}


\channelMsgEntry{%
    \msgRealSource{Mingcong Bai}{2020-06-18 05:44:14}%
    \msgMainContent{è‡³å°‘å››äº”å¹´äº†ï¼ˆ}%
    %
}


\channelMsgEntry{%
    \msgRealSource{Mingcong Bai}{2020-06-18 05:44:14}%
    \msgMainContent{ä¹‹å‰å« RazorQt}%
    %
}


\channelMsgEntry{%
    \msgRealSource{Leo Shen}{2020-06-18 05:44:14}%
    \msgMainContent{Oh rly (}%
    %
}


\channelMsgEntry{%
    \msgRealSource{Mingcong Bai}{2020-06-18 05:44:14}%
    \msgMainContent{O O O O'Reily --- auto parts, ow!!}%
    %
}


\channelMsgEntry{%
    \msgRealSource{Neruthes 0xAFB3373F5200DF38}{2020-06-19 00:17:09}%
    \msgMainContent{å¸Œæœ›äººç±»ç¤¾ä¼šæ—©æ—¥å®ç°å…‰åˆ»æœºæ‰©æ•£}%
    %
}


\channelMsgEntry{%
    \msgRealSource{Neruthes 0xAFB3373F5200DF38}{2020-06-19 00:17:09}%
    \msgMainContent{é«˜è¶…éŸ³é€Ÿå¯¼å¼¹æ‰©æ•£}%
    %
}


\channelMsgEntry{%
    \msgRealSource{Neruthes 0xAFB3373F5200DF38}{2020-06-19 00:17:10}%
    \msgMainContent{è¿™éƒ½æ˜¯æ¯”æ ¸æ‰©æ•£æ›´æœ‰æ„ä¹‰çš„æ‰©æ•£}%
    %
}


\channelMsgEntry{%
    \msgRealSource{cth451 ÇÉ”uÇÆƒÉ¹ÇÊŒá´‰p}{2020-06-19 00:17:10}%
    \msgMainContent{å¼ºçƒˆè¦æ±‚é«˜é€Ÿé“è·¯æ‰©æ•£}%
    %
}


\channelMsgEntry{%
    \msgRealSource{cth451 ÇÉ”uÇÆƒÉ¹ÇÊŒá´‰p}{2020-06-19 00:17:11}%
    \msgMainContent{å¼ºçƒˆè¦æ±‚ Amtrak ç”µæ°”åŒ–ï¼Œé«˜é€ŸåŒ–ï¼Œå¤çº¿åŒ–}%
    %
}


\channelMsgEntry{%
    \msgRealSource{CT1000MX500SSD1 1000.2 GB}{2020-06-19 00:17:12}%
    \msgMainContent{å¤©æœé“é“å°‘å¥³ä¸–ç•Œå§è¿™æ˜¯ï¼ˆä¸æ˜¯}%
    %
}


\channelMsgEntry{%
    \msgRealSource{cth451 ÇÉ”uÇÆƒÉ¹ÇÊŒá´‰p}{2020-06-19 00:17:12}%
    \msgMainContent{è¿™ä¹ˆè¯´èµ·æ¥æ˜¯ä¸æ˜¯åº”è¯¥ç»™å…±å’Œå…šæ”¯æŒè€…å®‰åˆ©è¿™ä¸ª}%
    %
}


\channelMsgEntry{%
    \msgRealSource{cth451 ÇÉ”uÇÆƒÉ¹ÇÊŒá´‰p}{2020-06-19 00:17:13}%
    \msgMainContent{Wis æœ¬æ¥æ˜¯è¦è®¡åˆ’ Chicago - Madison - Minneapolis çš„é€šå‹¤é“è·¯çš„}%
    %
}


\channelMsgEntry{%
    \msgRealSource{cth451 ÇÉ”uÇÆƒÉ¹ÇÊŒá´‰p}{2020-06-19 00:17:14}%
    \msgMainContent{ç„¶åå…±å’Œå…šçš„å·é•¿ä¸Šæ¥ä¹‹åæŠŠè¿™ä¸ªè®¡åˆ’ç äº†}%
    %
}


\channelMsgEntry{%
    \msgRealSource{CT1000MX500SSD1 1000.2 GB}{2020-06-19 00:17:15}%
    \msgMainContent{æˆ‘çŸ¥é“}%
    %
}


\channelMsgEntry{%
    \msgRealSource{CT1000MX500SSD1 1000.2 GB}{2020-06-19 00:17:15}%
    \msgMainContent{ç»è´¹éƒ½ä¸‹æ¥äº†}%
    %
}


\channelMsgEntry{%
    \msgRealSource{CT1000MX500SSD1 1000.2 GB}{2020-06-19 00:17:16}%
    \msgMainContent{ç äº†}%
    %
}


\channelMsgEntry{%
    \msgRealSource{cth451 ÇÉ”uÇÆƒÉ¹ÇÊŒá´‰p}{2020-06-19 00:17:17}%
    \msgMainContent{æŠŠè¿™å¸®äººéƒ½å®‰åˆ©æˆèŒè±šå°±æœ‰å¸Œæœ›äº†ï¼ˆ}%
    %
}


\channelMsgEntry{%
    \msgRealSource{ĞĞµĞ‘ÑƒÑ‚Ğ»ĞµĞ³ ï¼ˆè¿«çœŸï¼‰}{2020-06-19 04:00:10}%
    \msgMainContent{}%
    \nopagebreak\includegraphics[width=\linewidth]{./.tg-data/2020/photos/photo_142@19-06-2020_04-00-10.jpg}%
}


\channelMsgEntry{%
    \msgRealSource{ĞĞµĞ‘ÑƒÑ‚Ğ»ĞµĞ³ ï¼ˆè¿«çœŸï¼‰}{2020-06-19 04:00:11}%
    \msgMainContent{é¾™èŠ¯æŠŠç¡¬ç›˜æå¾—å’ŒBSPä¸€æ ·ï¼ˆx}%
    %
}


\channelMsgEntry{%
    \msgRealSource{Lion}{2020-06-19 13:49:58}%
    \msgMainContent{æˆ‘æœ‰ä¸ªé—®é¢˜}%
    %
}


\channelMsgEntry{%
    \msgRealSource{ĞĞµĞ‘ÑƒÑ‚Ğ»ĞµĞ³ ï¼ˆè¿«çœŸï¼‰}{2020-06-19 13:49:58}%
    \msgMainContent{ä½ åœ¨é©¬æ¡¶ä¸Šæ€è€ƒå—}%
    %
}


\channelMsgEntry{%
    \msgRealSource{Lion}{2020-06-19 13:49:58}%
    \msgMainContent{ä¸ºä»€ä¹ˆå®ƒçš„å±ngienæ²¡æœ‰å¯¹ç€ä¸‹é¢}%
    %
}


\channelMsgEntry{%
    \msgRealSource{MoGeCâ‚â‚„N Yang}{2020-06-19 13:49:58}%
    \msgMainContent{é‚£ä¸ªæ˜¯è‚šè„ï¼ˆ}%
    %
}


\channelMsgEntry{%
    \msgRealSource{Lion}{2020-06-19 13:49:58}%
    \msgMainContent{å–”ï¼Œæ˜ç™½äº†}%
    %
}


\channelMsgEntry{%
    \msgRealSource{æƒ }{2020-06-19 13:49:58}%
    \msgMainContent{ä½ çœ‹å•¥éƒ½æ˜¯py}%
    %
}


\channelMsgEntry{%
    \msgRealSource{SuperMarioSF | Trust Platform Builder (?)}{2020-06-22 05:43:06}%
    \msgMainContent{æˆ‘çªç„¶æœ‰ä¸ªå¤§èƒ†çš„æƒ³æ³•ï¼ˆ}%
    %
}


\channelMsgEntry{%
    \msgRealSource{SuperMarioSF | Trust Platform Builder (?)}{2020-06-22 05:43:06}%
    \msgMainContent{linux kernel as ROM ï¼ˆx}%
    %
}


\channelMsgEntry{%
    \msgRealSource{SuperMarioSF | Trust Platform Builder (?)}{2020-06-22 05:43:06}%
    \msgMainContent{æˆ‘çš„æ„æ€æ˜¯ä½œä¸ºå¯ä»¥æ’è¿›æœºå™¨çš„Optional ROMï¼ˆ}%
    %
}


\channelMsgEntry{%
    \msgRealSource{åŒå€å¤šå¤šå†°ğŸ§¶ | ğ¦ğŸğœğŸ}{2020-06-22 05:43:06}%
    \msgMainContent{æˆ‘è§‰å¾—ä¸è¡Œ}%
    %
}


\channelMsgEntry{%
    \msgRealSource{åŒå€å¤šå¤šå†°ğŸ§¶ | ğ¦ğŸğœğŸ}{2020-06-22 05:43:06}%
    \msgMainContent{x86 å†…æ ¸ä¸æ”¯æŒ XIP}%
    %
}


\channelMsgEntry{%
    \msgRealSource{SuperMarioSF | Trust Platform Builder (?)}{2020-06-22 05:43:07}%
    \msgMainContent{XIPæ˜¯å•¥}%
    %
}


\channelMsgEntry{%
    \msgRealSource{åŒå€å¤šå¤šå†°ğŸ§¶ | ğ¦ğŸğœğŸ}{2020-06-22 05:43:07}%
    \msgMainContent{eXecute In Place}%
    %
}


\channelMsgEntry{%
    \msgRealSource{ĞĞµĞ‘ÑƒÑ‚Ğ»ĞµĞ³ ï¼ˆè¿«çœŸï¼‰}{2020-06-22 05:43:07}%
    \msgMainContent{å°±åœ°æ­£æ³•ï¼ˆx}%
    %
}


\channelMsgEntry{%
    \msgRealSource{Neruthes 0xAFB3373F5200DF38}{2020-06-22 07:20:04}%
    \msgMainContent{}%
    \nopagebreak\includegraphics[width=\linewidth]{./.tg-data/2020/photos/photo_143@22-06-2020_07-20-04.jpg}%
}


\channelMsgEntry{%
    \msgRealSource{Neruthes 0xAFB3373F5200DF38}{2020-06-22 07:20:04}%
    \msgMainContent{æ€¥éœ€ä¸€ä¸ªã€å·²åˆ†äº«åˆ°æ¢—é¢‘é“ã€‘}%
    %
}


\channelMsgEntry{%
    \msgRealSource{Leo Shen}{2020-06-22 07:20:04}%
    \msgMainContent{ä»¥åŠè¿™æ¡æ¶ˆæ¯ä½¿ AOSCæ¢— å˜æˆäº† AOSC meta-æ¢— (}%
    %
}


\channelMsgEntry{%
    \msgRealSource{Junde Yhi}{2020-06-22 07:20:04}%
    \msgMainContent{å…ƒæ¢—è‰}%
    %
}


\channelMsgEntry{%
    \msgRealSource{ĞĞµĞ‘ÑƒÑ‚Ğ»ĞµĞ³ ï¼ˆè¿«çœŸï¼‰}{2020-06-22 07:20:04}%
    \msgMainContent{MOMï¼ˆmeme of meme}%
    %
}


\channelMsgEntry{%
    \msgRealSource{Leo Shen}{2020-06-22 07:20:04}%
    \msgMainContent{I actually like metamemes (}%
    %
}


\channelMsgEntry{%
    \msgRealSource{cth451 ÇÉ”uÇÆƒÉ¹ÇÊŒá´‰p}{2020-06-22 07:20:17}%
    \msgMainContent{\#æ”¾é€äº‹æ•…}%
    %
}


\channelMsgEntry{%
    \msgRealSource{MoGeCâ‚â‚„N Yang}{2020-06-22 07:32:47}%
    \msgMainContent{æ‰“ç ´ç¬¬å››å µå¢™}%
    %
}


\channelMsgEntry{%
    \msgRealSource{Junde Yhi}{2020-06-22 07:32:47}%
    \msgMainContent{å…ƒæ¢—è‰}%
    %
}


\channelMsgEntry{%
    \msgRealSource{MoGeCâ‚â‚„N Yang}{2020-06-22 07:32:47}%
    \msgMainContent{å¿«ï¼Œç»™ç‰¹é¦–æŠ•ç¨¿ï¼ˆ}%
    %
}


\channelMsgEntry{%
    \msgRealSource{å’¸é±¼}{2020-06-23 03:59:19}%
    \msgMainContent{https://twitter.com/zmt0516/status/1275242296733245440

è‰å•Š hhhhhhh}%
    %
}


\channelMsgEntry{%
    \msgRealSource{ĞĞµĞ‘ÑƒÑ‚Ğ»ĞµĞ³ ï¼ˆè¿«çœŸï¼‰}{2020-06-23 03:59:19}%
    \msgMainContent{ä¸Šç­çš„æ—¶å€™å¯ä»¥å……ç”µ}%
    %
}


\channelMsgEntry{%
    \msgRealSource{ĞĞµĞ‘ÑƒÑ‚Ğ»ĞµĞ³ ï¼ˆè¿«çœŸï¼‰}{2020-06-23 03:59:19}%
    \msgMainContent{å› ä¸º007ä¸åº”è¯¥çœ‹æ—¶é—´}%
    %
}


\channelMsgEntry{%
    \msgRealSource{Deleted Conan}{2020-06-23 03:59:19}%
    \msgMainContent{007 é‚£ä¸ºä»€ä¹ˆè¦ä¹°è¡¨ï¼Œåˆä¸ç”¨ç¡çœ ç›‘æµ‹}%
    %
}


\channelMsgEntry{%
    \msgRealSource{CT1000MX500SSD1 1000.2 GB}{2020-06-24 00:17:43}%
    \msgMainContent{http://0pointer.net/blog/projects/stateless.html åº•è£¤å¼€å§‹å–·ç«äº†}%
    %
}


\channelMsgEntry{%
    \msgRealSource{Mingcong Bai}{2020-06-24 00:17:43}%
    \msgMainContent{ä½ çš„ç«æ˜Ÿèˆ°ç»ˆäºç‚¹ç«å‰å¾€åœ°çƒäº†ï¼ˆx}%
    %
}


\channelMsgEntry{%
    \msgRealSource{GLOWAY YCT512GS3-S7 Pro}{2020-06-24 00:17:59}%
    \msgMainContent{}%
    %
}


\channelMsgEntry{%
    \msgRealSource{Mingcong Bai}{2020-06-26 22:35:23}%
    \msgMainContent{force push for days}%
    %
}


\channelMsgEntry{%
    \msgRealSource{liushuyu}{2020-06-26 22:35:23}%
    \msgMainContent{\ldots{} normal push for nights? (}%
    %
}


\channelMsgEntry{%
    \msgRealSource{æ¯æ—¥æ²™é›•å¢™}{2020-06-29 02:20:41}%
    \msgMainContent{}%
    %
}


\channelMsgEntry{%
    \msgRealSource{Mingcong Bai}{2020-06-29 02:20:41}%
    \msgMainContent{https://en.wikipedia.org/wiki/Chicken\_hypnotism}%
    %
}


\channelMsgEntry{%
    \msgRealSource{ĞĞµĞ‘ÑƒÑ‚Ğ»ĞµĞ³ ï¼ˆè¿«çœŸï¼‰}{2020-06-29 02:20:42}%
    \msgMainContent{æ˜ç¡é›·æ™®ï¼ˆx}%
    %
}


\channelMsgEntry{%
    \msgRealSource{Mingcong Bai}{2020-06-29 02:20:42}%
    \msgMainContent{é¸¡.exe has stopped responding}%
    %
}


\channelMsgEntry{%
    \msgRealSource{Mingcong Bai}{2020-06-29 02:20:42}%
    \msgMainContent{é¸¡}%
    %
}


\channelMsgEntry{%
    \msgRealSource{ĞĞµĞ‘ÑƒÑ‚Ğ»ĞµĞ³ ï¼ˆè¿«çœŸï¼‰}{2020-06-29 02:20:42}%
    \msgMainContent{é¸¡å§}%
    %
}


\channelMsgEntry{%
    \msgRealSource{Mingcong Bai}{2020-06-29 02:20:42}%
    \msgMainContent{é—»é¸¡èµ·èˆ}%
    %
}


\channelMsgEntry{%
    \msgRealSource{ĞĞµĞ‘ÑƒÑ‚Ğ»ĞµĞ³ ï¼ˆè¿«çœŸï¼‰}{2020-06-29 02:20:42}%
    \msgMainContent{æ…æ‹Œé¸¡}%
    %
}


\channelMsgEntry{%
    \msgRealSource{GitHub}{2020-06-29 04:11:53}%
    \msgMainContent{ğŸ”¨ 2 new commits to aosc-os-abbs:stable:

7667cae: blender: upgrade to 2.82a by Tianhao Chai 4fc4f30:
virt-manager: add missing dependency gtksourceview-4 by Tianhao Chai}%
    %
}


\channelMsgEntry{%
    \msgRealSource{cth451 ÇÉ”uÇÆƒÉ¹ÇÊŒá´‰p}{2020-06-29 04:11:53}%
    \msgMainContent{å—¯ï¼Ÿ}%
    %
}


\channelMsgEntry{%
    \msgRealSource{cth451 ÇÉ”uÇÆƒÉ¹ÇÊŒá´‰p}{2020-06-29 04:11:53}%
    \msgMainContent{æ€ä¹ˆæœ‰ä¸ª blender}%
    %
}


\channelMsgEntry{%
    \msgRealSource{cth451 ÇÉ”uÇÆƒÉ¹ÇÊŒá´‰p}{2020-06-29 04:11:53}%
    \msgMainContent{}%
    \nopagebreak\includegraphics[width=\linewidth]{./.tg-data/2020/photos/photo_144@29-06-2020_04-11-53.jpg}%
}


\channelMsgEntry{%
    \msgRealSource{cth451 ÇÉ”uÇÆƒÉ¹ÇÊŒá´‰p}{2020-06-29 04:11:53}%
    \msgMainContent{right. æ˜¯ä¸€ä¸ªåœ¨æˆ‘çš„ fork ä¸Šå‘†äº†å¿«ä¸€ä¸ªæœˆçš„ commit}%
    %
}


\channelMsgEntry{%
    \msgRealSource{cth451 ÇÉ”uÇÆƒÉ¹ÇÊŒá´‰p}{2020-06-29 04:11:53}%
    \msgMainContent{ç°åœ¨è¢« rebase äº†}%
    %
}


\channelMsgEntry{%
    \msgRealSource{cth451 ÇÉ”uÇÆƒÉ¹ÇÊŒá´‰p}{2020-06-29 04:11:53}%
    \msgMainContent{è¦è¢«æœå†»æš´æ‰“äº†}%
    %
}


\channelMsgEntry{%
    \msgRealSource{Mingcong Bai}{2020-06-29 04:11:53}%
    \msgMainContent{}%
    \nopagebreak\includegraphics[width=\linewidth]{./.tg-data/2020/photos/photo_145@29-06-2020_04-11-53.jpg}%
}


\channelMsgEntry{%
    \msgRealSource{æŸ10}{2020-07-02 13:23:37}%
    \msgMainContent{çŒ«æ˜¯å…‰é€šä¿¡ï¼Ÿ}%
    %
}


\channelMsgEntry{%
    \msgRealSource{æŸ10}{2020-07-02 13:23:37}%
    \msgMainContent{}%
    \nopagebreak\includegraphics[width=\linewidth]{./.tg-data/2020/photos/photo_146@02-07-2020_13-23-37.jpg}%
}


\channelMsgEntry{%
    \msgRealSource{æŸ10}{2020-07-02 13:23:37}%
    \msgMainContent{}%
    \nopagebreak\includegraphics[width=\linewidth]{./.tg-data/2020/photos/photo_147@02-07-2020_13-23-37.jpg}%
}


\channelMsgEntry{%
    \msgRealSource{Neruthes 0xAFB3373F5200DF38}{2020-07-02 13:23:37}%
    \msgMainContent{å…‰çŒ«}%
    %
}


\channelMsgEntry{%
    \msgRealSource{æŸ10}{2020-07-02 13:23:37}%
    \msgMainContent{å…‰ çŒ« é€š ä¿¡}%
    %
}


\channelMsgEntry{%
    \msgRealSource{Leo Shen}{2020-07-02 13:23:38}%
    \msgMainContent{æ¡ æ‰‹ æˆ åŠŸ}%
    %
}


\channelMsgEntry{%
    \msgRealSource{MoGeCâ‚â‚„N Yang}{2020-07-02 13:23:38}%
    \msgMainContent{æ¡ çˆª æˆ åŠŸ}%
    %
}


\channelMsgEntry{%
    \msgRealSource{æƒ }{2020-07-04 00:57:02}%
    \msgMainContent{}%
    \nopagebreak\includegraphics[width=\linewidth]{./.tg-data/2020/photos/photo_148@04-07-2020_00-57-02.jpg}%
}


\channelMsgEntry{%
    \msgRealSource{ĞĞµĞ‘ÑƒÑ‚Ğ»ĞµĞ³ ï¼ˆè¿«çœŸï¼‰}{2020-07-04 00:57:02}%
    \msgMainContent{æç”°æ‰€}%
    %
}


\channelMsgEntry{%
    \msgRealSource{æƒ }{2020-07-04 00:57:02}%
    \msgMainContent{æç”°æ‰€å’Œä¸æç”°æ‰€æœ‰ä»€éº¼å€åˆ¥}%
    %
}


\channelMsgEntry{%
    \msgRealSource{cth451 ÇÉ”uÇÆƒÉ¹ÇÊŒá´‰p}{2020-07-04 00:57:02}%
    \msgMainContent{å‰è€…æ¯”è¾ƒè‡­}%
    %
}


\channelMsgEntry{%
    \msgRealSource{cth451 ÇÉ”uÇÆƒÉ¹ÇÊŒá´‰p}{2020-07-04 00:57:02}%
    \msgMainContent{ä½ çœ‹åˆ°å¤è‘£å†…æ ¸ï¼Œæƒ³è‡ªå·±æ”¹ config æ‰“è¡¥ä¸çš„æ—¶å€™ä¼šåƒå…ˆè¾ˆä¸€æ ·å¤§å«}%
    %
}


\channelMsgEntry{%
    \msgRealSource{Jinyu Meng}{2020-07-05 04:29:36}%
    \msgMainContent{}%
    %
}


\channelMsgEntry{%
    \msgRealSource{Jinyu Meng}{2020-07-05 04:29:36}%
    \msgMainContent{åˆš SwiftUI ç”»äº†ä¸ªé’¢ç´é”®ç›˜}%
    %
}


\channelMsgEntry{%
    \msgRealSource{Lion}{2020-07-05 04:29:36}%
    \msgMainContent{è¿™æ˜¯æ€ä¹ˆå‘å£°çš„ï¼Ÿ}%
    %
}


\channelMsgEntry{%
    \msgRealSource{Mingcong Bai}{2020-07-05 04:29:36}%
    \msgMainContent{æ˜¯æ— æƒ§å¼ºæƒå‘å£°çš„}%
    %
}


\channelMsgEntry{%
    \msgRealSource{Staph. aureus | In your GI Tract}{2020-07-05 05:36:08}%
    \msgMainContent{HK\_Nat\_Sec\_Law (æˆ‘è™Ÿå‘¢ï¼Ÿ)}%
    %
}


\channelMsgEntry{%
    \msgRealSource{Lion}{2020-07-05 05:36:08}%
    \msgMainContent{}%
    \nopagebreak\includegraphics[width=\linewidth]{./.tg-data/2020/photos/photo_149@05-07-2020_05-36-08.jpg}%
}


\channelMsgEntry{%
    \msgRealSource{Single Image Random Dot Stereogram}{2020-07-05 06:35:19}%
    \msgMainContent{å…¶ä»–åŸŸåè¿‡æ¥çš„å¥½åƒé—®é¢˜ä¸å¤§}%
    \nopagebreak\includegraphics[width=\linewidth]{./.tg-data/2020/photos/photo_150@05-07-2020_06-35-19.jpg}%
}


\channelMsgEntry{%
    \msgRealSource{Neo\_Chen (BU4AK)}{2020-07-05 06:35:19}%
    \msgMainContent{è‰}%
    %
}


\channelMsgEntry{%
    \msgRealSource{Neo\_Chen (BU4AK)}{2020-07-05 06:35:19}%
    \msgMainContent{Abstract: Probably Not}%
    %
}


\channelMsgEntry{%
    \msgRealSource{Single Image Random Dot Stereogram}{2020-07-05 06:35:19}%
    \msgMainContent{æ¢—}%
    \nopagebreak\includegraphics[width=\linewidth]{./.tg-data/2020/photos/photo_151@05-07-2020_06-35-19.jpg}%
}


\channelMsgEntry{%
    \msgRealSource{A Place Of Happiness}{2020-07-06 15:03:05}%
    \msgMainContent{cat with chicks https://redd.it/hlfs61 @get\_happiness}%
    \nopagebreak\includegraphics[width=\linewidth]{./.tg-data/2020/photos/photo_152@06-07-2020_15-03-05.jpg}%
}


\channelMsgEntry{%
    \msgRealSource{æƒ }{2020-07-06 15:03:06}%
    \msgMainContent{å¤§è²“è¢«é›å…’åŒ…åœ}%
    %
}


\channelMsgEntry{%
    \msgRealSource{MoGeCâ‚â‚„N Yang}{2020-07-06 15:03:06}%
    \msgMainContent{ä½ å¥½å¼å“¦ï¼ˆ}%
    %
}


\channelMsgEntry{%
    \msgRealSource{Kexy Biscuit | è¢«å­é¥¼ï¸ | ç™¾åˆãƒ¶å’²ã‚‹ã‚‹}{2020-07-07 21:23:05}%
    \msgMainContent{éº»çƒ¦ä¸Šçº¿ä¸ª relay-ap.aosc.io CNAME =\textgreater{}
aosc-relay-asiapacific.edge.biscuit.moe å§}%
    %
}


\channelMsgEntry{%
    \msgRealSource{CT1000MX500SSD1 1000.2 GB}{2020-07-07 21:23:06}%
    \msgMainContent{ä½ ä»¬çš„FQDNæ€ä¹ˆè¿™ä¹ˆé•¿}%
    %
}


\channelMsgEntry{%
    \msgRealSource{Deleted Conan}{2020-07-07 21:23:06}%
    \msgMainContent{descriptive}%
    %
}


\channelMsgEntry{%
    \msgRealSource{Deleted Conan}{2020-07-07 21:23:07}%
    \msgMainContent{ä¸‹ä¸€æ­¥æä¸ª
Anthon-open-source-community-relay-server-in-Asia-on-azure.edge.biscuit.moe}%
    %
}


\channelMsgEntry{%
    \msgRealSource{Lion}{2020-07-08 02:34:47}%
    \msgMainContent{see-https-wiki-aosc-io-for-more-information.relay.aosc.io}%
    %
}


\channelMsgEntry{%
    \msgRealSource{Deleted Conan}{2020-07-08 02:34:48}%
    \msgMainContent{descriptive}%
    %
}


\channelMsgEntry{%
    \msgRealSource{MoGeCâ‚â‚„N Yang}{2020-07-09 04:29:52}%
    \msgMainContent{}%
    \nopagebreak\includegraphics[width=\linewidth]{./.tg-data/2020/photos/photo_153@09-07-2020_04-29-52.jpg}%
}


