
\channelMsgEntry{%
    \msgRealSource{cth451 ÇÉ”uÇÆƒÉ¹ÇÊŒá´‰p}{2021-01-05 02:26:42}%
    \msgMainContent{dafuq is SIGFPE}%
    %
}


\channelMsgEntry{%
    \msgRealSource{Mingcong Bai}{2021-01-05 02:26:42}%
    \msgMainContent{SIG Fucking Penis Error}%
    %
}


\channelMsgEntry{%
    \msgRealSource{liushuyu}{2021-01-07 04:03:28}%
    \msgMainContent{@JeffBai ä½ åœ¨é¾™è™¾ä¸Šä¸Šå®Œå•æ‰€è·Ÿæˆ‘è¯´ä¸€ä¸‹ï¼ˆ}%
    %
}


\channelMsgEntry{%
    \msgRealSource{Mingcong Bai}{2021-01-07 04:03:28}%
    \msgMainContent{ä¼šä¸€ç›´ä¸Šï¼Œæ¥å’Œæˆ‘æŠ¢å‘å§}%
    %
}


\channelMsgEntry{%
    \msgRealSource{Mingcong Bai}{2021-01-07 04:03:28}%
    \msgMainContent{è° æ€• è°}%
    %
}


\channelMsgEntry{%
    \msgRealSource{liushuyu}{2021-01-07 04:03:28}%
    \msgMainContent{è¿™ä¸è¡Œï¼Œä¼š OOM çš„ï¼ˆ}%
    %
}


\channelMsgEntry{%
    \msgRealSource{liushuyu}{2021-01-07 04:03:28}%
    \msgMainContent{å•æ‰€å µäº†è°è´Ÿè´£ç–é€šï¼ˆ}%
    %
}


\channelMsgEntry{%
    \msgRealSource{Mingcong Bai}{2021-01-07 04:03:28}%
    \msgMainContent{OOM äº†å†äº‰ï¼ˆ}%
    %
}


\channelMsgEntry{%
    \msgRealSource{Mingcong Bai}{2021-01-07 04:03:28}%
    \msgMainContent{16G çº¯é‡‘åŒå­”èŒ…å‘è¦å¥½å¥½åˆ©ç”¨}%
    %
}


\channelMsgEntry{%
    \msgRealSource{liushuyu}{2021-01-11 01:12:24}%
    \msgMainContent{çœ‹æ¥æˆ‘éœ€è¦ä¸€ä¸ªè™šæ‹Ÿæœºï¼Œæµ‹è¯•/è°ƒè¯• systemd æ¯”è¾ƒå±é™©ï¼ˆ}%
    %
}


\channelMsgEntry{%
    \msgRealSource{ĞĞµĞ‘ÑƒÑ‚Ğ»ĞµĞ³ ï¼ˆè¿«çœŸï¼‰}{2021-01-11 01:12:25}%
    \msgMainContent{fuck-up counter:}%
    %
}


\channelMsgEntry{%
    \msgRealSource{ĞĞµĞ‘ÑƒÑ‚Ğ»ĞµĞ³ ï¼ˆè¿«çœŸï¼‰}{2021-01-11 01:12:25}%
    \msgMainContent{\emph{æ‹›æ‰‹}}%
    %
}


\channelMsgEntry{%
    \msgRealSource{Mingcong Bai}{2021-01-11 01:12:26}%
    \msgMainContent{è‡ªå·±æ—¥è‡ªå·±ï¼Œæ¯”è¢« systemd è„±åº•è£¤æ—¥å¼ºï¼ˆ}%
    %
}


\channelMsgEntry{%
    \msgRealSource{liushuyu}{2021-01-11 01:12:27}%
    \msgMainContent{ï¼ˆéš¾é“è¿™ä¸ª Logo å°±æ˜¯è¿™ä¸ªæ„æ€ä¹ˆ}%
    \nopagebreak\includegraphics[width=\linewidth]{./.tg-data/2021/photos/photo_181@11-01-2021_01-12-27.jpg}%
}


\channelMsgEntry{%
    \msgRealSource{Mingcong Bai}{2021-01-22 09:09:53}%
    \msgMainContent{Apple no use vector, bad bad}%
    %
}


\channelMsgEntry{%
    \msgRealSource{Mingcong Bai}{2021-01-22 09:09:53}%
    \msgMainContent{}%
    \nopagebreak\includegraphics[width=\linewidth]{./.tg-data/2021/photos/photo_182@22-01-2021_09-09-53.jpg}%
}


\channelMsgEntry{%
    \msgRealSource{Leo Shen}{2021-01-22 09:09:53}%
    \msgMainContent{OCD detected (x}%
    %
}


\channelMsgEntry{%
    \msgRealSource{Mingcong Bai}{2021-01-22 09:09:53}%
    \msgMainContent{Too easy (}%
    %
}


\channelMsgEntry{%
    \msgRealSource{å’¸é±¼}{2021-01-22 09:09:53}%
    \msgMainContent{Apple too many bugs, sell me 50 bucks, I do recycle}%
    %
}


\channelMsgEntry{%
    \msgRealSource{Mingcong Bai}{2021-01-22 09:09:53}%
    \msgMainContent{50 too little, you no respect, sad}%
    %
}


\channelMsgEntry{%
    \msgRealSource{å’¸é±¼}{2021-01-22 09:09:53}%
    \msgMainContent{50 already big money, you needy greedy}%
    %
}


\channelMsgEntry{%
    \msgRealSource{Mingcong Bai}{2021-01-22 09:09:53}%
    \msgMainContent{No no you greedy, you rob iPad with 50, I report to police}%
    %
}


\channelMsgEntry{%
    \msgRealSource{å’¸é±¼}{2021-01-22 09:09:54}%
    \msgMainContent{Police will say you small things big talk, they no help you}%
    %
}


\channelMsgEntry{%
    \msgRealSource{Junde Yhi}{2021-01-22 09:09:54}%
    \msgMainContent{you say what?i dont undrestand.}%
    %
}


\channelMsgEntry{%
    \msgRealSource{Mingcong Bai}{2021-01-22 09:14:00}%
    \msgMainContent{Huh! You no know how world work, you too young, they teach you lesson}%
    %
}


\channelMsgEntry{%
    \msgRealSource{å’¸é±¼}{2021-01-22 09:14:00}%
    \msgMainContent{Oh I can raise 1 buck}%
    %
}


\channelMsgEntry{%
    \msgRealSource{å’¸é±¼}{2021-01-22 09:14:00}%
    \msgMainContent{No more bucks}%
    %
}


\channelMsgEntry{%
    \msgRealSource{Mingcong Bai}{2021-01-22 09:14:00}%
    \msgMainContent{Young man need to study, or you beg whole life and cry}%
    %
}


\channelMsgEntry{%
    \msgRealSource{liushuyu}{2021-01-22 09:14:00}%
    \msgMainContent{You say you self?}%
    %
}


\channelMsgEntry{%
    \msgRealSource{å’¸é±¼}{2021-01-22 09:14:00}%
    \msgMainContent{Yong strong then nation strong, you know nothing}%
    %
}


\channelMsgEntry{%
    \msgRealSource{Mingcong Bai}{2021-01-22 09:14:00}%
    \msgMainContent{51 no sell, go to taobao and deal with Chinese}%
    %
}


\channelMsgEntry{%
    \msgRealSource{å’¸é±¼}{2021-01-22 09:14:00}%
    \msgMainContent{Chinese liars, I no trust taobao}%
    %
}


\channelMsgEntry{%
    \msgRealSource{Mingcong Bai}{2021-01-22 09:14:00}%
    \msgMainContent{You have no money and you liar too, you not able buy from JD, sad}%
    %
}


\channelMsgEntry{%
    \msgRealSource{Lion III}{2021-01-22 17:00:22}%
    \msgMainContent{ç¡è§‰è§‰å»æƒ¹}%
    %
}


\channelMsgEntry{%
    \msgRealSource{Deleted Conan}{2021-01-22 17:00:22}%
    \msgMainContent{è°æ˜¯è§‰è§‰}%
    %
}


\channelMsgEntry{%
    \msgRealSource{Lion III}{2021-01-22 17:00:22}%
    \msgMainContent{ä½ }%
    %
}


\channelMsgEntry{%
    \msgRealSource{è‡­è‡­}{2021-01-22 17:00:22}%
    \msgMainContent{hso}%
    %
}


\channelMsgEntry{%
    \msgRealSource{/dev/null}{2021-01-23 14:20:31}%
    \msgMainContent{}%
    \nopagebreak\includegraphics[width=\linewidth]{./.tg-data/2021/photos/photo_183@23-01-2021_14-20-31.jpg}%
}


\channelMsgEntry{%
    \msgRealSource{è‡­è‡­}{2021-01-23 14:20:32}%
    \msgMainContent{æ€ä¹ˆæœ‰å£°éŸ³}%
    %
}


\channelMsgEntry{%
    \msgRealSource{Junde Yhi}{2021-01-23 14:20:32}%
    \msgMainContent{äº‹æ–°çš„ PNG æ‰©å±•}%
    %
}


\channelMsgEntry{%
    \msgRealSource{Junde Yhi}{2021-01-23 14:20:32}%
    \msgMainContent{å¯ä»¥åœ¨ PNG é‡Œæ”¾ç½®äººå·¥å­¦ä¹ ç¼–ç çš„éŸ³é¢‘æµ}%
    %
}


\channelMsgEntry{%
    \msgRealSource{cth451 ÇÉ”uÇÆƒÉ¹ÇÊŒá´‰p}{2021-01-27 21:51:56}%
    \msgMainContent{Gnome\ldots\ldots{}}%
    \nopagebreak\includegraphics[width=\linewidth]{./.tg-data/2021/photos/photo_184@27-01-2021_21-51-56.jpg}%
}


\channelMsgEntry{%
    \msgRealSource{Mingcong Bai}{2021-01-27 21:51:56}%
    \msgMainContent{ä¸è¦ä½ è§‰å¾—ï¼Œæˆ‘è¦æˆ‘è§‰å¾—}%
    %
}


\channelMsgEntry{%
    \msgRealSource{cth451 ÇÉ”uÇÆƒÉ¹ÇÊŒá´‰p}{2021-01-27 21:51:56}%
    \msgMainContent{}%
    \nopagebreak\includegraphics[width=\linewidth]{./.tg-data/2021/photos/photo_185@27-01-2021_21-51-56.jpg}%
}


\channelMsgEntry{%
    \msgRealSource{cth451 ÇÉ”uÇÆƒÉ¹ÇÊŒá´‰p}{2021-01-27 21:51:57}%
    \msgMainContent{}%
    \nopagebreak\includegraphics[width=\linewidth]{./.tg-data/2021/photos/photo_186@27-01-2021_21-51-57.jpg}%
}


\channelMsgEntry{%
    \msgRealSource{liushuyu}{2021-02-06 02:55:25}%
    \msgMainContent{æˆ‘è‰ï¼Œè¿™æ˜¯è°åœ¨ rollback æˆ‘çš„å®¹å™¨ï¼ˆ}%
    %
}


\channelMsgEntry{%
    \msgRealSource{liushuyu}{2021-02-06 02:55:25}%
    \msgMainContent{}%
    \nopagebreak\includegraphics[width=\linewidth]{./.tg-data/2021/photos/photo_187@06-02-2021_02-55-25.jpg}%
}


\channelMsgEntry{%
    \msgRealSource{Mingcong Bai}{2021-02-06 02:55:25}%
    \msgMainContent{Cephï¼Ÿ}%
    %
}


\channelMsgEntry{%
    \msgRealSource{liushuyu}{2021-02-06 02:55:25}%
    \msgMainContent{å¯¹}%
    %
}


\channelMsgEntry{%
    \msgRealSource{liushuyu}{2021-02-06 02:55:25}%
    \msgMainContent{-j30}%
    %
}


\channelMsgEntry{%
    \msgRealSource{ĞĞµĞ‘ÑƒÑ‚Ğ»ĞµĞ³ ï¼ˆè¿«çœŸï¼‰}{2021-02-06 02:55:25}%
    \msgMainContent{åª³å¦‡å„¿ï¼šä½ æƒ³LTOï¼Ÿï¼ˆx}%
    %
}


\channelMsgEntry{%
    \msgRealSource{Mingcong Bai}{2021-02-10 07:23:02}%
    \msgMainContent{}%
    \nopagebreak\includegraphics[width=\linewidth]{./.tg-data/2021/photos/photo_188@10-02-2021_07-23-02.jpg}%
}


\channelMsgEntry{%
    \msgRealSource{MoGeCâ‚â‚„N Yang}{2021-02-10 07:23:02}%
    \msgMainContent{è€ç™½ä¸‹é¢ç»™è‡ªå·±åƒ.webp}%
    %
}


\channelMsgEntry{%
    \msgRealSource{Mingcong Bai}{2021-02-10 07:23:02}%
    \msgMainContent{æ›´é«˜ï¼Œæ›´å¿«ï¼Œæ›´å¼º æ›´å¤§ï¼Œæ›´è‚¥ï¼Œæ›´å¤šæ±}%
    %
}


\channelMsgEntry{%
    \msgRealSource{GitHub}{2021-02-20 17:11:07}%
    \msgMainContent{ğŸ’¬ New comment on aosc-os-abbs\#2795 bind: security update to 9.16.12 by
@MingcongBai

\begin{quote}
Can u pwease accept my wocket senpai?!! UwU rocket
\end{quote}

What in the name of fuck.

Reply to this message to post a comment on GitHub.}%
    %
}


\channelMsgEntry{%
    \msgRealSource{GitHub}{2021-02-20 17:11:08}%
    \msgMainContent{ğŸ’¬ New comment on aosc-os-abbs\#2796 llvm: update to 11.1.0, rebuild all
reverse dependencies by @RedL0tus

Looks gud to mii senpai!

Reply to this message to post a comment on GitHub.}%
    %
}


\channelMsgEntry{%
    \msgRealSource{å’¸é±¼}{2021-02-21 10:04:38}%
    \msgMainContent{C o s p l a y}%
    \nopagebreak\includegraphics[width=\linewidth]{./.tg-data/2021/photos/photo_189@21-02-2021_10-04-38.jpg}%
}


\channelMsgEntry{%
    \msgRealSource{Yangff}{2021-02-23 05:40:09}%
    \msgMainContent{å¥½å¥‡ä½ ä»¬å¹³å¸¸ä¸Šè¯¾}%
    %
}


\channelMsgEntry{%
    \msgRealSource{Mingcong Bai}{2021-02-23 05:40:09}%
    \msgMainContent{COVIDï¼Œæ²¡äººå¬çš„}%
    %
}


\channelMsgEntry{%
    \msgRealSource{å’¸é±¼}{2021-03-11 23:10:35}%
    \msgMainContent{æˆ‘å‰ä¸¤å¤©å¥½åƒåˆšè¯´è¿‡å†ç¢°åµŒå…¥å¼æˆ‘æ˜¯ç‹—æ¥ç€}%
    %
}


\channelMsgEntry{%
    \msgRealSource{MoGeCâ‚â‚„N Yang}{2021-03-11 23:10:35}%
    \msgMainContent{æ²¡äº‹ï¼Œä½ å½“æ—¶å°±å«äº†}%
    %
}


\channelMsgEntry{%
    \msgRealSource{å’¸é±¼}{2021-03-11 23:10:35}%
    \msgMainContent{æ±ª}%
    %
}


\channelMsgEntry{%
    \msgRealSource{MoGeCâ‚â‚„N Yang}{2021-03-11 23:10:35}%
    \msgMainContent{\#æ€ä¹ˆå«}%
    %
}


\channelMsgEntry{%
    \msgRealSource{Mingcong Bai}{2021-03-13 09:13:16}%
    \msgMainContent{Approved}%
    %
}


\channelMsgEntry{%
    \msgRealSource{å’¸é±¼}{2021-03-13 09:13:16}%
    \msgMainContent{Arigatou Senpai! OwO}%
    %
}


\channelMsgEntry{%
    \msgRealSource{Mingcong Bai}{2021-03-13 09:13:17}%
    \msgMainContent{Jesus fucking Christ}%
    %
}


\channelMsgEntry{%
    \msgRealSource{Mingcong Bai}{2021-03-13 09:13:17}%
    \msgMainContent{\emph{applies deodorant}}%
    %
}


\channelMsgEntry{%
    \msgRealSource{å’¸é±¼}{2021-03-13 09:19:13}%
    \msgMainContent{æ¥ KTV å†™ syllabus}%
    %
}


\channelMsgEntry{%
    \msgRealSource{Mingcong Bai}{2021-03-13 09:19:13}%
    \msgMainContent{æ‹¿æˆ‘å¾—å†™åˆ°æ˜å¤©æ—©ä¸Šå…­ç‚¹ï¼ˆ}%
    %
}


\channelMsgEntry{%
    \msgRealSource{Mingcong Bai}{2021-03-13 09:19:13}%
    \msgMainContent{é‚£ *}%
    %
}


\channelMsgEntry{%
    \msgRealSource{å’¸é±¼}{2021-03-13 09:19:13}%
    \msgMainContent{å†™å¤Ÿä¸€ç™¾ä»½å†å†™ä¸€ä¸‡ä»½}%
    %
}


\channelMsgEntry{%
    \msgRealSource{Mingcong Bai}{2021-03-13 09:19:13}%
    \msgMainContent{å†é—¹è…¾æŠŠä½ æ‰¯æ¥ UCSD ä¸Šè¿™è¯¾ï¼ˆx}%
    %
}


\channelMsgEntry{%
    \msgRealSource{å’¸é±¼}{2021-03-13 09:19:13}%
    \msgMainContent{ä½ æ ¡åˆä¸è¦æˆ‘ï¼ˆx}%
    %
}


\channelMsgEntry{%
    \msgRealSource{cth451 ÇÉ”uÇÆƒÉ¹ÇÊŒá´‰p}{2021-03-13 09:19:13}%
    \msgMainContent{å’¸é±¼è¦æ˜¯æ¥çº¢è‰² UW æˆ‘å°±å» TA å’¸é±¼ä¸Šçš„è¯¾ï¼ˆæ”¾è¯}%
    %
}


\channelMsgEntry{%
    \msgRealSource{liushuyu}{2021-03-13 09:19:13}%
    \msgMainContent{ç„¶åä¸“ä¸šç»™å’¸é±¼ D+ï¼ˆ}%
    %
}


\channelMsgEntry{%
    \msgRealSource{å’¸é±¼}{2021-03-13 09:19:14}%
    \msgMainContent{Lemme pass Senpai! QAQ}%
    %
}


\channelMsgEntry{%
    \msgRealSource{Mingcong Bai}{2021-03-13 09:19:14}%
    \msgMainContent{å’¸é±¼è¦æ˜¯æ¥ UCSD çš„è¯æˆ‘å°± TA åˆ°ä»– Academic Probationï¼ˆæ”¾è¯}%
    %
}


\channelMsgEntry{%
    \msgRealSource{Mingcong Bai}{2021-03-26 07:28:54}%
    \msgMainContent{Uh, was going to be a packager, you know, with AOSC OS and uh, GNOME.
And uh, you know, after a hundred or two packages and new dependencies,
you know, I decided, you know, I had enough\ldots{}}%
    %
}


\channelMsgEntry{%
    \msgRealSource{Mingcong Bai}{2021-03-26 07:29:53}%
    \msgMainContent{I'm an packager, \ldots, I'm a GNOME packager}%
    %
}


\channelMsgEntry{%
    \msgRealSource{Mingcong Bai}{2021-03-26 07:29:53}%
    \msgMainContent{I'm hired for people to update their GNOME timely, their shiny new GNOME
40}%
    %
}


\channelMsgEntry{%
    \msgRealSource{Mingcong Bai}{2021-03-26 07:30:05}%
    \msgMainContent{GNOME 40\ldots{} is 400 packges}%
    %
}


\channelMsgEntry{%
    \msgRealSource{Mingcong Bai}{2021-03-26 07:32:02}%
    \msgMainContent{And uh, usually the dependencies are pretty much high on acid, \ldots,
to get really high\ldots{} You know, I have this fast, juicy AMD
buildbot that builds all the way through them}%
    %
}


\channelMsgEntry{%
    \msgRealSource{Mingcong Bai}{2021-03-26 07:35:46}%
    \msgMainContent{And just Ciel it up, and uh, it's a long process, you know, to build all
400 packages}%
    %
}


\channelMsgEntry{%
    \msgRealSource{Mingcong Bai}{2021-03-26 07:37:40}%
    \msgMainContent{But uh, it's an intense experience for the packager. I think for myself
too, it's uh, you're building packages that uh, even though it's open
source with the projects, but for some reason it's\ldots{} also more
obscured. It's more metaphysical too and GNOME and I, you know, reach
the same place}%
    %
}


\channelMsgEntry{%
    \msgRealSource{cth451 ÇÉ”uÇÆƒÉ¹ÇÊŒá´‰p}{2021-03-28 21:40:32}%
    \msgMainContent{oh yeah losers don't run g++ on 40gbit RDMA NFS}%
    %
}


\channelMsgEntry{%
    \msgRealSource{Mingcong Bai}{2021-04-02 06:31:39}%
    \msgMainContent{@cth451 äº”å¤„ä¿®æ”¹æ„è§}%
    %
}


\channelMsgEntry{%
    \msgRealSource{cth451 ÇÉ”uÇÆƒÉ¹ÇÊŒá´‰p}{2021-04-02 06:31:39}%
    \msgMainContent{ç°åœ¨æ‰€æœ‰è„šæœ¬éƒ½å¯ä»¥å‡å®šå·²ç»åœ¨ \$SRCDIR äº†ï¼Ÿ}%
    %
}


\channelMsgEntry{%
    \msgRealSource{Mingcong Bai}{2021-04-02 06:31:39}%
    \msgMainContent{æœ¬æ¥å°±æ˜¯ï¼ˆ}%
    %
}


\channelMsgEntry{%
    \msgRealSource{Mingcong Bai}{2021-04-02 06:31:39}%
    \msgMainContent{ä½ é‚£æ˜¯ PKGBUILD è¡Œä¸ºï¼ˆ}%
    %
}


\channelMsgEntry{%
    \msgRealSource{Mingcong Bai}{2021-04-02 06:31:39}%
    \msgMainContent{æˆ‘ä»¬ SRCDIR = SUBDIR}%
    %
}


\channelMsgEntry{%
    \msgRealSource{cth451 ÇÉ”uÇÆƒÉ¹ÇÊŒá´‰p}{2021-04-02 06:31:39}%
    \msgMainContent{ok}%
    %
}


\channelMsgEntry{%
    \msgRealSource{Mingcong Bai}{2021-04-02 06:31:39}%
    \msgMainContent{è¿™ç–«è‹—ä¸è¡Œå•Šï¼ˆ}%
    %
}


\channelMsgEntry{%
    \msgRealSource{å’¸é±¼}{2021-04-04 01:16:28}%
    \msgMainContent{æŸ´å“¥å“¥æ¥ KTV å•Š}%
    %
}


\channelMsgEntry{%
    \msgRealSource{å’¸é±¼}{2021-04-04 01:16:28}%
    \msgMainContent{å§¥å§¥è¯´æƒ³ä½ äº†}%
    %
}


\channelMsgEntry{%
    \msgRealSource{cth451 ÇÉ”uÇÆƒÉ¹ÇÊŒá´‰p}{2021-04-04 01:16:28}%
    \msgMainContent{è¿™ä¹ˆæ¬²æ±‚ä¸æ»¡çš„å—}%
    %
}


\channelMsgEntry{%
    \msgRealSource{å’¸é±¼}{2021-04-04 01:16:28}%
    \msgMainContent{æ˜¯å§¥å§¥æƒ³ä½ äº†}%
    %
}


\channelMsgEntry{%
    \msgRealSource{David Thril}{2021-04-04 01:16:28}%
    \msgMainContent{æŸ´è€æ¿è¦å‡»å‰‘å—}%
    %
}


\channelMsgEntry{%
    \msgRealSource{liushuyu}{2021-04-04 01:16:28}%
    \msgMainContent{æˆ‘ä»€ä¹ˆæ—¶å€™è¯´è¿‡è¿™è¯ï¼ˆ}%
    %
}


\channelMsgEntry{%
    \msgRealSource{liushuyu}{2021-04-04 01:16:28}%
    \msgMainContent{æ˜æ˜æ˜¯å’¸é±¼è¦æ†‹ä¸ä½äº†ï¼ˆ}%
    %
}


\channelMsgEntry{%
    \msgRealSource{å’¸é±¼}{2021-04-04 01:16:28}%
    \msgMainContent{æˆ‘å¤œé‡Œæ¨ªç«–ç¡ä¸ç€}%
    %
}


\channelMsgEntry{%
    \msgRealSource{å’¸é±¼}{2021-04-04 01:16:28}%
    \msgMainContent{çœ‹äº†åŠå¤©}%
    %
}


\channelMsgEntry{%
    \msgRealSource{å’¸é±¼}{2021-04-04 01:16:28}%
    \msgMainContent{æ‰ä»å§¥å§¥è¯´çš„è¯çš„å­—ç¼é‡Œ}%
    %
}


\channelMsgEntry{%
    \msgRealSource{å’¸é±¼}{2021-04-04 01:16:28}%
    \msgMainContent{çœ‹åˆ°æ»¡æ»¡çš„éƒ½æ˜¯}%
    %
}


\channelMsgEntry{%
    \msgRealSource{å’¸é±¼}{2021-04-04 01:16:29}%
    \msgMainContent{``æƒ³æŸ´å“¥å“¥äº†''}%
    %
}


\channelMsgEntry{%
    \msgRealSource{liushuyu}{2021-04-04 01:16:29}%
    \msgMainContent{çœ‹äº†åŠå¤©å‘ç°åºŠæ˜¯æ¹¿çš„ï¼ˆ}%
    %
}


\channelMsgEntry{%
    \msgRealSource{GitHub}{2021-04-05 02:05:34}%
    \msgMainContent{ğŸ”¨ 1 new commit to atm:staging:

924e847: i18n: adds i18n framework by liushuyu}%
    %
}


\channelMsgEntry{%
    \msgRealSource{Mingcong Bai}{2021-04-05 02:05:35}%
    \msgMainContent{æ—¶æ€é”™äº†ï¼ˆx}%
    %
}


\channelMsgEntry{%
    \msgRealSource{Mingcong Bai}{2021-04-05 02:05:35}%
    \msgMainContent{ä½ ä¹Ÿæ‰“äº†ç–«è‹—ï¼Ÿï¼ˆx}%
    %
}


\channelMsgEntry{%
    \msgRealSource{liushuyu}{2021-04-05 02:05:35}%
    \msgMainContent{æˆ‘å¤©ç„¶ç–«è‹—ï¼ˆ}%
    %
}


\channelMsgEntry{%
    \msgRealSource{å’¸é±¼}{2021-04-06 09:08:27}%
    \msgMainContent{æ­£åœ¨è·Ÿå§¥å§¥å…±äº« tmux çš„æˆ‘}%
    \nopagebreak\includegraphics[width=\linewidth]{./.tg-data/2021/photos/photo_190@06-04-2021_09-08-27.jpg}%
}


\channelMsgEntry{%
    \msgRealSource{Mingcong Bai}{2021-04-06 09:08:27}%
    \msgMainContent{Collectivist mentality}%
    %
}


\channelMsgEntry{%
    \msgRealSource{Mingcong Bai}{2021-04-06 09:08:28}%
    \msgMainContent{OUR Tmux}%
    %
}


\channelMsgEntry{%
    \msgRealSource{å’¸é±¼}{2021-04-06 09:08:55}%
    \msgMainContent{é‚£ç†è®ºä¸Šå¯ä»¥æ‹‰åˆ°æˆ‘è¿™è¾¹å››å—å±å¹•çš„å°ºå¯¸}%
    %
}


\channelMsgEntry{%
    \msgRealSource{å’¸é±¼}{2021-04-06 09:08:55}%
    \msgMainContent{@JeffBai ä½ çš„ screen real estate å‚¨å¤‡è¿˜å¤Ÿç”¨å—ï¼ˆæ¬ æ}%
    %
}


\channelMsgEntry{%
    \msgRealSource{Mingcong Bai}{2021-04-06 09:08:56}%
    \msgMainContent{ä¸å¤Ÿç”¨å°±å¾ç”¨ä½ çš„ï¼ˆ}%
    %
}


\channelMsgEntry{%
    \msgRealSource{Mingcong Bai}{2021-04-06 09:08:57}%
    \msgMainContent{å¯Œå†œå±å¹•è¿™ä¹ˆå¤§}%
    %
}


\channelMsgEntry{%
    \msgRealSource{Mingcong Bai}{2021-04-06 09:09:53}%
    \msgMainContent{GNOME 40 is readdddddyyyyyyyy}%
    %
}


\channelMsgEntry{%
    \msgRealSource{Mingcong Bai}{2021-04-06 09:09:53}%
    \msgMainContent{å…¶ä»–ä¸‰ä¸ªæ¶æ„æ­£åœ¨ç€ç«åœ¨æ‰€æœ‰åœ†æŸ±}%
    %
}


\channelMsgEntry{%
    \msgRealSource{Rick Liu}{2021-04-06 09:09:53}%
    \msgMainContent{x86æ„æ¶çš„å‘å‹å€™é€‰äººè¢«æµ‹è¯•è¿‡å—}%
    %
}


\channelMsgEntry{%
    \msgRealSource{Mingcong Bai}{2021-04-06 09:09:53}%
    \msgMainContent{ä»€ä¹ˆçš„å‘è¡Œå€™é€‰äººï¼ˆ}%
    %
}


\channelMsgEntry{%
    \msgRealSource{Mingcong Bai}{2021-04-06 09:09:53}%
    \msgMainContent{çŸ®äººå››åå—}%
    %
}


\channelMsgEntry{%
    \msgRealSource{Mingcong Bai}{2021-04-06 09:09:53}%
    \msgMainContent{å¦å¤–æ˜¯å…«å…­ç³»æ¶æ„ *}%
    %
}


\channelMsgEntry{%
    \msgRealSource{GLOWAY YCT512GS3-S7 Pro}{2021-04-06 09:09:53}%
    \msgMainContent{åœ°ç²¾å››åï¼Ÿ}%
    %
}


\channelMsgEntry{%
    \msgRealSource{å’¸é±¼}{2021-04-06 09:09:53}%
    \msgMainContent{å¤§è„š 40}%
    %
}


\channelMsgEntry{%
    \msgRealSource{Mingcong Bai}{2021-04-06 09:09:53}%
    \msgMainContent{å¯¹ï¼Œæ¥è‡ªåœ°ç²¾æŠ€æœ¯å§”å‘˜ä¼šçš„äºŒã€‡äºŒä¸€æ˜¥å­£å€¾æƒ…å¤§ä½œ}%
    %
}


\channelMsgEntry{%
    \msgRealSource{Mingcong Bai}{2021-04-06 09:09:54}%
    \msgMainContent{æ˜¯ç¬¦åˆè‡ªç”±æ¡Œé¢ Â· ç»„ç»‡çš„ç°ä»£åŒ–æ¡Œé¢ç¯å¢ƒ}%
    %
}


\channelMsgEntry{%
    \msgRealSource{Kexy Biscuit | è¢«å­é¥¼ï¸ | ç™¾åˆãƒ¶å’²ã‚‹ã‚‹}{2021-04-06 09:09:54}%
    \msgMainContent{è¿™æ˜¯ä¸­å®£éƒ¨è°ƒæŸ¥ç»„å…¥é©»äº†å—ï¼ˆ}%
    %
}


\channelMsgEntry{%
    \msgRealSource{liushuyu}{2021-04-06 09:09:54}%
    \msgMainContent{æ˜æ˜æ˜¯ï¼Œåœ°ç²¾ä¼¦ç†é“å¾·äººæ ¼ä¿æŠ¤æ”¿æ²»å€¾å‘å¯¼å‘å®£ä¼ å…¼æŠ€æœ¯å§”å‘˜ä¼š}%
    %
}


\channelMsgEntry{%
    \msgRealSource{Mingcong Bai}{2021-04-06 09:09:54}%
    \msgMainContent{\ldots\ldots{} çš„æ˜¥å­£å‘å±•çº²è¦ç²¾ç¥}%
    %
}


\channelMsgEntry{%
    \msgRealSource{Rick Liu}{2021-04-06 09:09:54}%
    \msgMainContent{å¯¹ å®‰åŒå¼€æºç¤¾åŒºé€šç”¨ä¼é¹…æ“ä½œç³»ç»ŸçŸ®äººå››åçš„å‘å‹å€™é€‰äºº}%
    %
}


\channelMsgEntry{%
    \msgRealSource{Mingcong Bai}{2021-04-06 09:09:54}%
    \msgMainContent{æ²¡æœ‰ï¼Œæˆ‘è¿™é‡Œåœ¨è·‘ KDEï¼Œå‡†å¤‡æ˜å¤©æµ‹ï¼Œä½ ç°åœ¨å¯ä»¥ç”¨ atmï¼ˆ}%
    %
}


\channelMsgEntry{%
    \msgRealSource{Mingcong Bai}{2021-04-06 09:09:54}%
    \msgMainContent{é…·æ¡Œé¢ç¯å¢ƒ *}%
    %
}


\channelMsgEntry{%
    \msgRealSource{Mingcong Bai}{2021-04-06 09:09:54}%
    \msgMainContent{ç¤¾åŒºè‡ªåŠ¨åŒ–æµ‹è¯•ä¸»é¢˜æŠ¥åå¤„ *}%
    %
}


\channelMsgEntry{%
    \msgRealSource{liushuyu}{2021-04-06 09:09:54}%
    \msgMainContent{ç”±åœ°ç²¾å§”å‘˜ä¼šå§”å‘˜é•¿ï¼Œåœ°ç²¾åŸºé‡‘ä¼šä¼šé•¿ï¼Œåœ°ç²¾å®£ä¼ éƒ¨éƒ¨é•¿ï¼Œåœ°ç²¾æ¨ç‰¹å¸å·ç®¡ç†å‘˜
ç½—ä¼¯ç‰¹ å‘è¡¨çš„é‡è¦è®²è¯ç²¾ç¥}%
    %
}


\channelMsgEntry{%
    \msgRealSource{å’¸é±¼}{2021-04-06 09:12:44}%
    \msgMainContent{å…¶ä¸­ä¸€å—è¿˜æ˜¯ç‰¹é¦–é‚£è¾¹è¿‡ç»§æ¥çš„}%
    %
}


\channelMsgEntry{%
    \msgRealSource{Mingcong Bai}{2021-04-06 09:12:45}%
    \msgMainContent{æ˜¯å¯Œå†œæŠ¢çš„}%
    %
}


\channelMsgEntry{%
    \msgRealSource{å’¸é±¼}{2021-04-06 09:12:45}%
    \msgMainContent{ä½ æ€ä¹ˆå¯ä»¥å‡­ç©ºæ±¡äººæ¸…ç™½}%
    %
}


\channelMsgEntry{%
    \msgRealSource{Mingcong Bai}{2021-04-06 09:12:46}%
    \msgMainContent{è´«å†œè®²è¯çš„æ—¶å€™åœ°ä¸»æ¶éœ¸æ³¨æ„æ€åº¦------ï¼ˆ}%
    %
}


\channelMsgEntry{%
    \msgRealSource{GitHub}{2021-04-06 20:59:11}%
    \msgMainContent{ğŸ”¨ 1 new commit to aosc-os-abbs:file-5.39-arm64-fix:

b02542b: file: fix seccomp on arm64 by Mingcong Bai}%
    %
}


\channelMsgEntry{%
    \msgRealSource{Mingcong Bai}{2021-04-06 20:59:11}%
    \msgMainContent{We have an imposter!}%
    %
}


\channelMsgEntry{%
    \msgRealSource{Mingcong Bai}{2021-04-06 20:59:11}%
    \msgMainContent{Sire!}%
    %
}


\channelMsgEntry{%
    \msgRealSource{cth451 ÇÉ”uÇÆƒÉ¹ÇÊŒá´‰p}{2021-04-12 01:38:19}%
    \msgMainContent{ooooooooooooooooooooh whitelist}%
    \nopagebreak\includegraphics[width=\linewidth]{./.tg-data/2021/photos/photo_191@12-04-2021_01-38-19.jpg}%
}


\channelMsgEntry{%
    \msgRealSource{Mingcong Bai}{2021-04-12 01:38:20}%
    \msgMainContent{Oooooooooh they ded}%
    %
}


\channelMsgEntry{%
    \msgRealSource{CT1000MX500SSD1 1000.2 GB}{2021-04-12 01:38:21}%
    \msgMainContent{èšçˆ¹æ²¹}%
    %
}


\channelMsgEntry{%
    \msgRealSource{Neruthes 0xAFB3373F5200DF38}{2021-04-14 10:41:46}%
    \msgMainContent{\emph{Mysterious Hexagon Creature Screaming}}%
    \nopagebreak\includegraphics[width=\linewidth]{./.tg-data/2021/photos/photo_192@14-04-2021_10-41-46.jpg}%
}


\channelMsgEntry{%
    \msgRealSource{Neruthes 0xAFB3373F5200DF38}{2021-04-14 10:41:46}%
    \msgMainContent{è¿œçœ‹æµ·å¤©ç››å®´}%
    %
}


\channelMsgEntry{%
    \msgRealSource{Neruthes 0xAFB3373F5200DF38}{2021-04-14 10:41:46}%
    \msgMainContent{è¿‘çœ‹åšé³ŒåŒºå—è¿å¤§ä¼š}%
    %
}


\channelMsgEntry{%
    \msgRealSource{å’¸é±¼}{2021-04-21 01:59:04}%
    \msgMainContent{åˆ«äººçš„å¨±ä¹æ˜¯æ‰¾å¥³æœ‹å‹ï¼Œç‰¹é¦–çš„å¨±ä¹æ˜¯ï¼š}%
    %
}


\channelMsgEntry{%
    \msgRealSource{Mingcong Bai}{2021-04-21 01:59:04}%
    \msgMainContent{é…äº†ä¸ª 486 çº§æœºå™¨ç”¨çš„å†…æ ¸}%
    %
}


\channelMsgEntry{%
    \msgRealSource{Mingcong Bai}{2021-04-21 02:02:51}%
    \msgMainContent{é‚£å°±æ¥è¾¹å¢ƒï¼Œæˆ‘æ•™ä½ æ‰¾å¥³æœ‹å‹ï¼ˆ}%
    %
}


\channelMsgEntry{%
    \msgRealSource{å’¸é±¼}{2021-04-21 02:02:52}%
    \msgMainContent{å¥³äººåªä¼šå‡å°‘æˆ‘ç¡è§‰çš„æ—¶é—´.webp}%
    %
}


\channelMsgEntry{%
    \msgRealSource{cth451 ÇÉ”uÇÆƒÉ¹ÇÊŒá´‰p}{2021-04-21 21:35:48}%
    \msgMainContent{è¿·æƒ‘è¡Œä¸ºç°åœº}%
    \nopagebreak\includegraphics[width=\linewidth]{./.tg-data/2021/photos/photo_193@21-04-2021_21-35-48.jpg}%
}


\channelMsgEntry{%
    \msgRealSource{cth451 ÇÉ”uÇÆƒÉ¹ÇÊŒá´‰p}{2021-04-21 21:35:49}%
    \msgMainContent{ç®€ä½“ä¸­æ–‡ä¸å°‘å­—ç”»ä¸å‡ºæ¥ï¼ˆ}%
    %
}


\channelMsgEntry{%
    \msgRealSource{cth451 ÇÉ”uÇÆƒÉ¹ÇÊŒá´‰p}{2021-04-21 21:35:50}%
    \msgMainContent{(?}%
    \nopagebreak\includegraphics[width=\linewidth]{./.tg-data/2021/photos/photo_194@21-04-2021_21-35-50.jpg}%
}


\channelMsgEntry{%
    \msgRealSource{Mingcong Bai}{2021-04-21 21:35:50}%
    \msgMainContent{My eyes, thanks}%
    %
}


\channelMsgEntry{%
    \msgRealSource{cth451 ÇÉ”uÇÆƒÉ¹ÇÊŒá´‰p}{2021-04-21 21:35:51}%
    \msgMainContent{ç‚¹é˜µå­—ä»–ä¸é¦™å—ï¼Ÿ}%
    %
}


\channelMsgEntry{%
    \msgRealSource{Mingcong Bai}{2021-04-21 21:35:52}%
    \msgMainContent{è¿™ç§ä¸ï¼ˆ}%
    %
}


\channelMsgEntry{%
    \msgRealSource{MoGeCâ‚â‚„N Yang}{2021-04-21 21:44:02}%
    \msgMainContent{å ä»¨å¹²ä»–ä¸èˆŒå—ï¼Ÿ}%
    %
}


\channelMsgEntry{%
    \msgRealSource{liushuyu}{2021-04-23 23:55:24}%
    \msgMainContent{å¦å¤–å„ä½å¼€å‘è€…æ³¨æ„äº†ï¼Œç°åœ¨æ‰€æœ‰æºçš„ Pull Request é‡Œé¢çš„ CI éœ€è¦æ‰‹åŠ¨
approve æ‰èƒ½è¿è¡Œï¼ˆå¥½åƒä»…é™å¤–éƒ¨è´¡çŒ®è€…ï¼‰}%
    %
}


\channelMsgEntry{%
    \msgRealSource{liushuyu}{2021-04-23 23:55:25}%
    \msgMainContent{è¿™æ˜¯ GitHub é˜²æ­¢æœ‰äººæ‹¿ GitHub Actions æŒ–çŸ¿çš„é¢„é˜²æ€§æªæ–½}%
    %
}


\channelMsgEntry{%
    \msgRealSource{ĞĞµĞ‘ÑƒÑ‚Ğ»ĞµĞ³ ï¼ˆè¿«çœŸï¼‰}{2021-04-23 23:55:25}%
    \msgMainContent{å¥½çš„ï¼ˆ}%
    %
}


\channelMsgEntry{%
    \msgRealSource{ĞĞµĞ‘ÑƒÑ‚Ğ»ĞµĞ³ ï¼ˆè¿«çœŸï¼‰}{2021-04-23 23:55:26}%
    \msgMainContent{ç„¶ååˆ›å»ºäº†åä¸€ä¸‡å››åƒäº”ç™¾ä¸€åå››ä¸ªprï¼ˆï¼Ÿ}%
    %
}


\channelMsgEntry{%
    \msgRealSource{Junde Yhi}{2021-04-25 10:12:10}%
    \msgMainContent{Who the f2k typed this description}%
    \nopagebreak\includegraphics[width=\linewidth]{./.tg-data/2021/photos/photo_195@25-04-2021_10-12-10.jpg}%
}


\channelMsgEntry{%
    \msgRealSource{èˆŠå¤©ä¸‹ OriginCode // Ristaccia}{2021-04-25 10:12:11}%
    \msgMainContent{https://github.com/AOSC-Dev/aosc-os-abbs/blame/stable/extra-java/gradle/autobuild/defines\#L4
@JeffBai äº”å¹´å‰æŸä¸€æ—¶åˆ»ä½ é­”æ€”äº†}%
    %
}


\channelMsgEntry{%
    \msgRealSource{Staph Bridge}{2021-04-27 19:44:38}%
    \msgMainContent{{[}D-Fearyncess{]} åœ¨å›½å†… èµ«æ›¼ç±³å‹’å’¸é±¼ä¸Šæ‰“äº†å¥½å¤šå¹´çš„æŠ˜}%
    %
}


\channelMsgEntry{%
    \msgRealSource{å’¸é±¼}{2021-04-27 19:44:38}%
    \msgMainContent{æ˜¯é—²é±¼ï¼}%
    %
}


\channelMsgEntry{%
    \msgRealSource{å’¸é±¼}{2021-04-27 19:44:38}%
    \msgMainContent{é—²é±¼ï¼ï¼ˆæ˜å¥}%
    %
}


\channelMsgEntry{%
    \msgRealSource{Staph Bridge}{2021-04-27 19:44:38}%
    \msgMainContent{{[}D-Fearyncess{]} å’¸é±¼é—²é±¼ å’¸é±¼é±¼é—² é—²é±¼é±¼é—²}%
    %
}


\channelMsgEntry{%
    \msgRealSource{cth451 ÇÉ”uÇÆƒÉ¹ÇÊŒá´‰p}{2021-04-27 19:44:43}%
    \msgMainContent{\#æ€ä¹ˆå«}%
    %
}


\channelMsgEntry{%
    \msgRealSource{Junde Yhi}{2021-04-29 22:28:23}%
    \msgMainContent{æˆ‘æˆ¿å­è¿˜è›®å¤§çš„ï¼Œæ¬¢è¿ä½ ä»¬æ¥æˆ‘å®¶ç©ï¼Œç©ç´¯äº†å°±ç›´æ¥ç¡è§‰ï¼Œæ²¡é—®é¢˜çš„}%
    %
}


\channelMsgEntry{%
    \msgRealSource{å’¸é±¼}{2021-04-29 22:28:23}%
    \msgMainContent{é»å“¥ä¸è¦å•Šé»å“¥}%
    %
}


\channelMsgEntry{%
    \msgRealSource{åŒå€å¤šå¤šå†°ğŸ§¶ | ğ¦ğŸğœğŸ}{2021-04-30 04:29:19}%
    \msgMainContent{}%
    \nopagebreak\includegraphics[width=\linewidth]{./.tg-data/2021/photos/photo_196@30-04-2021_04-29-19.jpg}%
}


\channelMsgEntry{%
    \msgRealSource{å’¸é±¼}{2021-05-07 05:44:18}%
    \msgMainContent{https://www.amazon.co.jp/dp/B08P4F5N3C/}%
    %
}


\channelMsgEntry{%
    \msgRealSource{å’¸é±¼}{2021-05-07 05:44:19}%
    \msgMainContent{ä¹°è¿™ä¸ª}%
    %
}


\channelMsgEntry{%
    \msgRealSource{å’¸é±¼}{2021-05-07 05:44:19}%
    \msgMainContent{ä½ çœ‹æˆ‘ç…§æ ·åœ¨ä¹°ï¼ˆx}%
    %
}


\channelMsgEntry{%
    \msgRealSource{å’¸é±¼}{2021-05-07 05:44:19}%
    \msgMainContent{ä½†æ˜¯ä½ å¿…é¡»ä¹°ï¼ˆæš´è¨€}%
    %
}


\channelMsgEntry{%
    \msgRealSource{å’¸é±¼}{2021-05-07 05:44:19}%
    \msgMainContent{å¿…é¡»ä¹°ï¼ˆæš´è¨€}%
    %
}


\channelMsgEntry{%
    \msgRealSource{å’¸é±¼}{2021-05-07 05:44:19}%
    \msgMainContent{ï¼ˆç„¶è€Œæˆ‘è‡ªå·±è¿˜æ²¡ä¹°}%
    %
}


\channelMsgEntry{%
    \msgRealSource{cth451 ÇÉ”uÇÆƒÉ¹ÇÊŒá´‰p}{2021-05-07 05:44:23}%
    \msgMainContent{\#æ€ä¹ˆå«}%
    %
}


\channelMsgEntry{%
    \msgRealSource{Mag Mell}{2021-05-08 05:05:41}%
    \msgMainContent{./extra-admin/arch-install-scripts/01-genfstab}%
    %
}


\channelMsgEntry{%
    \msgRealSource{Mag Mell}{2021-05-08 05:05:41}%
    \msgMainContent{è©±èªªé€™ç¨®åŒ…æ­£å¼åå«ä»€éº¼ä¾†ç€ï¼Ÿ}%
    %
}


\channelMsgEntry{%
    \msgRealSource{Mingcong Bai}{2021-05-08 05:05:41}%
    \msgMainContent{å­åŒ…/å‰¯åŒ…}%
    %
}


\channelMsgEntry{%
    \msgRealSource{Mag Mell}{2021-05-08 05:05:41}%
    \msgMainContent{meta package?}%
    %
}


\channelMsgEntry{%
    \msgRealSource{Mingcong Bai}{2021-05-08 05:05:41}%
    \msgMainContent{subpackage}%
    %
}


\channelMsgEntry{%
    \msgRealSource{Mingcong Bai}{2021-05-08 05:05:41}%
    \msgMainContent{è¿™æ˜¯``å…ƒåŒ…''ï¼Œæ¯”å¦‚ gnome-base}%
    %
}


\channelMsgEntry{%
    \msgRealSource{ĞĞµĞ‘ÑƒÑ‚Ğ»ĞµĞ³ ï¼ˆè¿«çœŸï¼‰}{2021-05-08 05:05:42}%
    \msgMainContent{å½¢è€Œä¸ŠåŒ…ï¼ˆx}%
    %
}


\channelMsgEntry{%
    \msgRealSource{Mingcong Bai}{2021-05-08 05:05:42}%
    \msgMainContent{Sir, you have to leave-}%
    %
}


\channelMsgEntry{%
    \msgRealSource{Leo Shen}{2021-05-08 05:05:42}%
    \msgMainContent{åŒ…çš„æœ¬ä½“è®º (x}%
    %
}


\channelMsgEntry{%
    \msgRealSource{Leo Shen}{2021-05-08 05:05:42}%
    \msgMainContent{I autobuild therefore I am}%
    %
}


\channelMsgEntry{%
    \msgRealSource{å’¸é±¼}{2021-05-13 23:57:51}%
    \msgMainContent{è€Œä¸”é±¼ç¼¸ç°åœ¨ä¹Ÿæ²¡åœ°æ–¹æ”¾}%
    %
}


\channelMsgEntry{%
    \msgRealSource{cth451 ÇÉ”uÇÆƒÉ¹ÇÊŒá´‰p}{2021-05-13 23:57:51}%
    \msgMainContent{å’¸é±¼æ€ä¹ˆä¹Ÿå…»è‡ªå·±äº†}%
    %
}


\channelMsgEntry{%
    \msgRealSource{MoGeCâ‚â‚„N Yang}{2021-05-13 23:57:51}%
    \msgMainContent{ï¼šéƒ½æ€ªç‰¹é¦–}%
    %
}


\channelMsgEntry{%
    \msgRealSource{MoGeCâ‚â‚„N Yang}{2021-05-13 23:57:51}%
    \msgMainContent{ä¹°å®Œå’¸é±¼ä¹°é²¨é±¼}%
    %
}


\channelMsgEntry{%
    \msgRealSource{MoGeCâ‚â‚„N Yang}{2021-05-13 23:57:51}%
    \msgMainContent{ä¹°å®Œé²¨é±¼ä¹°æ´»é±¼}%
    %
}


\channelMsgEntry{%
    \msgRealSource{MoGeCâ‚â‚„N Yang}{2021-05-13 23:57:51}%
    \msgMainContent{ä¸€ æ­¥ é”™}%
    %
}


\channelMsgEntry{%
    \msgRealSource{MoGeCâ‚â‚„N Yang}{2021-05-13 23:57:51}%
    \msgMainContent{æ­¥ æ­¥ é”™}%
    %
}


\channelMsgEntry{%
    \msgRealSource{CT1000MX500SSD1 1000.2 GB}{2021-05-14 00:49:11}%
    \msgMainContent{æ‰€ä»¥è‚¥çŒ«ç”¨çš„å•¥é²¤é±¼ç‹}%
    %
}


\channelMsgEntry{%
    \msgRealSource{CT1000MX500SSD1 1000.2 GB}{2021-05-14 00:49:12}%
    \msgMainContent{HiFive Unleashed?}%
    %
}


\channelMsgEntry{%
    \msgRealSource{Felix Yan}{2021-05-14 00:49:13}%
    \msgMainContent{åœ¨unleashedå’Œunmatchedä¸Šéƒ½æµ‹è¿‡ï¼‰}%
    %
}


\channelMsgEntry{%
    \msgRealSource{Felix Yan}{2021-05-14 00:49:13}%
    \msgMainContent{ï¼ˆä¸Šæ¬¡æˆ‘é»‘ä»–ä»¬è¯´ä½ ä»¬ä¸‹ä¸€ä»£å°±æ˜¯undefinedï¼‰}%
    %
}


\channelMsgEntry{%
    \msgRealSource{å’¸é±¼}{2021-05-25 00:10:31}%
    \msgMainContent{æˆ‘å®¶é‡Œè¿˜è›®å¤§çš„\ldots{}}%
    %
}


\channelMsgEntry{%
    \msgRealSource{å’¸é±¼}{2021-05-25 00:10:31}%
    \msgMainContent{è¦ä¸è¦æ¥æˆ‘å®¶é‡Œæ‰“ç”µåŠ¨ï¼Ÿ}%
    %
}


\channelMsgEntry{%
    \msgRealSource{cth451 ÇÉ”uÇÆƒÉ¹ÇÊŒá´‰p}{2021-05-25 00:10:31}%
    \msgMainContent{å¥½ï¼Œå°±è®©ä½ æ¥å½“ AOSC colocation center}%
    %
}


\channelMsgEntry{%
    \msgRealSource{Mingcong Bai}{2021-05-25 00:10:31}%
    \msgMainContent{å¬ Horï¼æ‰“ç”µåŠ¨}%
    %
}


\channelMsgEntry{%
    \msgRealSource{cth451 ÇÉ”uÇÆƒÉ¹ÇÊŒá´‰p}{2021-05-25 00:10:31}%
    \msgMainContent{ï¼ˆæ‰€æœ‰çš„æœºå™¨å…¨éƒ¨æ”¾ä½ å®¶}%
    %
}


\channelMsgEntry{%
    \msgRealSource{cth451 ÇÉ”uÇÆƒÉ¹ÇÊŒá´‰p}{2021-05-25 00:10:31}%
    \msgMainContent{ç„¶åæˆ‘å°±æ”¾å¿ƒå¤§èƒ†æŠŠæ€ªçŒ«çš„é£æ‰‡å¼€åˆ°æ»¡é€Ÿ}%
    %
}


\channelMsgEntry{%
    \msgRealSource{cth451 ÇÉ”uÇÆƒÉ¹ÇÊŒá´‰p}{2021-05-25 00:10:31}%
    \msgMainContent{è®©å’¸é±¼æ•´æ™šä¸èƒ½ç¡è§‰ï¼ˆï¼Ÿï¼Ÿï¼Ÿï¼Ÿï¼‰}%
    %
}


\channelMsgEntry{%
    \msgRealSource{liushuyu}{2021-05-29 10:17:46}%
    \msgMainContent{é¾™è™¾ LLVM 12 åŒ…æ¨äº†}%
    %
}


\channelMsgEntry{%
    \msgRealSource{Mingcong Bai}{2021-05-29 10:17:46}%
    \msgMainContent{å¥½}%
    %
}


\channelMsgEntry{%
    \msgRealSource{liushuyu}{2021-05-29 10:17:47}%
    \msgMainContent{I can't believe it did it! (}%
    %
}


\channelMsgEntry{%
    \msgRealSource{ĞĞµĞ‘ÑƒÑ‚Ğ»ĞµĞ³ ï¼ˆè¿«çœŸï¼‰}{2021-05-29 10:17:48}%
    \msgMainContent{æ€ä¹ˆå¯ä»¥æ‰“å‡ºæ¥å‘¢ï¼ˆx}%
    %
}


\channelMsgEntry{%
    \msgRealSource{Mingcong Bai}{2021-05-29 10:17:48}%
    \msgMainContent{You're great however you are Loongson!! Proud of you!}%
    %
}


\channelMsgEntry{%
    \msgRealSource{Mingcong Bai}{2021-05-29 10:17:49}%
    \msgMainContent{ï¼ˆå‘•}%
    %
}


\channelMsgEntry{%
    \msgRealSource{CT1000MX500SSD1 1000.2 GB}{2021-05-29 10:17:50}%
    \msgMainContent{é¾™è™¾ï¼}%
    %
}


\channelMsgEntry{%
    \msgRealSource{liushuyu}{2021-05-29 10:17:59}%
    \msgMainContent{``é¾™è™¾é¾™è™¾é¾™è™¾ï¼''}%
    %
}


\channelMsgEntry{%
    \msgRealSource{GLOWAY YCT512GS3-S7 Pro}{2021-05-29 10:19:27}%
    \msgMainContent{\#æ€ä¹ˆå«}%
    %
}


\channelMsgEntry{%
    \msgRealSource{å’¸é±¼}{2021-05-30 07:23:04}%
    \msgMainContent{å¤´å­æµå¼Šï¼ˆå°–å«}%
    %
}


\channelMsgEntry{%
    \msgRealSource{cth451 ÇÉ”uÇÆƒÉ¹ÇÊŒá´‰p}{2021-05-30 07:23:09}%
    \msgMainContent{\#æ€ä¹ˆå«}%
    %
}


\channelMsgEntry{%
    \msgRealSource{MoGeCâ‚â‚„N Yang}{2021-06-01 01:41:10}%
    \msgMainContent{ç‰¹é¦–å®¶æˆ¿å­è¿˜è›®å¤§çš„}%
    %
}


\channelMsgEntry{%
    \msgRealSource{Mingcong Bai}{2021-06-01 01:41:10}%
    \msgMainContent{è¶…å¤§çš„ï¼Œè¿˜æœ‰ç‹¬ç«‹å«ç”Ÿé—´}%
    %
}


\channelMsgEntry{%
    \msgRealSource{Mingcong Bai}{2021-06-01 01:41:11}%
    \msgMainContent{ç”šè‡³æœ‰å¨æˆ¿}%
    %
}


\channelMsgEntry{%
    \msgRealSource{Mingcong Bai}{2021-06-01 01:41:12}%
    \msgMainContent{å°åº·}%
    %
}


\channelMsgEntry{%
    \msgRealSource{å’¸é±¼}{2021-06-01 01:41:12}%
    \msgMainContent{ä½ è¿™åº”è¯¥ç®—æ˜¯ç¡åœ¨å¨æˆ¿é‡Œ}%
    %
}


\channelMsgEntry{%
    \msgRealSource{å’¸é±¼}{2021-06-01 01:41:13}%
    \msgMainContent{è¿˜æ˜¯åœ¨å§å®¤é‡Œåšé¥­}%
    %
}


\channelMsgEntry{%
    \msgRealSource{Mingcong Bai}{2021-06-01 01:41:14}%
    \msgMainContent{è¿™æ˜¯æ— äº§é˜¶çº§çš„ç”Ÿæ´»æ–¹å¼}%
    %
}


\channelMsgEntry{%
    \msgRealSource{Mingcong Bai}{2021-06-01 01:41:23}%
    \msgMainContent{å¯Œå†œä½ æ˜¯ä¸ä¼šæ‡‚çš„}%
    %
}


\channelMsgEntry{%
    \msgRealSource{MoGeCâ‚â‚„N Yang}{2021-06-01 23:01:16}%
    \msgMainContent{é‚£ä½ éƒ½å‘ç¼–è¯‘å™¨ä¿è¯func1ä¸ä¼šçˆ†ç‚¸çš„ï¼ˆ}%
    %
}


\channelMsgEntry{%
    \msgRealSource{MoGeCâ‚â‚„N Yang}{2021-06-01 23:01:16}%
    \msgMainContent{æ¸£ç”·ï¼}%
    %
}


\channelMsgEntry{%
    \msgRealSource{cth451 ÇÉ”uÇÆƒÉ¹ÇÊŒá´‰p}{2021-06-01 23:01:16}%
    \msgMainContent{rustcï¼šä½ å¬æˆ‘è®²ï¼Œè¿™æ ·æ¸£å¤ªæ˜æ˜¾äº†ï¼Œæˆ‘æ¥æ•™ä½ æ€ä¹ˆå½“æ—¶é—´ç®¡ç†å¤§å¸ˆ}%
    %
}


\channelMsgEntry{%
    \msgRealSource{Mingcong Bai}{2021-06-01 23:24:33}%
    \msgMainContent{æˆ‘åœ¨è®¤çœŸè€ƒè™‘ mATX + EPYC}%
    %
}


\channelMsgEntry{%
    \msgRealSource{cth451 ÇÉ”uÇÆƒÉ¹ÇÊŒá´‰p}{2021-06-01 23:24:34}%
    \msgMainContent{æˆ‘è§‰å¾— matx éš¾}%
    %
}


\channelMsgEntry{%
    \msgRealSource{cth451 ÇÉ”uÇÆƒÉ¹ÇÊŒá´‰p}{2021-06-01 23:24:34}%
    \msgMainContent{è‡³å°‘è¦ atx æˆ–è€… eatx}%
    %
}


\channelMsgEntry{%
    \msgRealSource{CT1000MX500SSD1 1000.2 GB}{2021-06-01 23:24:35}%
    \msgMainContent{ä½ ä¸ºä»€ä¹ˆä¸ç›¸ä¿¡ ASRock Rack}%
    %
}


\channelMsgEntry{%
    \msgRealSource{ĞĞµĞ‘ÑƒÑ‚Ğ»ĞµĞ³ ï¼ˆè¿«çœŸï¼‰}{2021-06-01 23:24:36}%
    \msgMainContent{é‚£å¾—é—®ç‰¹é¦–ä¿¡ä»»ä¸ä¿¡ä»»å±è‚¡çŸ³å¤´ï¼ˆx}%
    %
}


\channelMsgEntry{%
    \msgRealSource{GitHub}{2021-06-04 21:40:49}%
    \msgMainContent{ğŸ”¨ 1 new commit to aosc-os-abbs:obs-27.0:

8c55882: obs-studio: update cef to
89.0.18+gb36241d+chromium-89.0.4389.114 \ldots{}

\ldots{} this version is also tested to work with obs-studio 27.0.0 by
liushuyu}%
    %
}


\channelMsgEntry{%
    \msgRealSource{cth451 ÇÉ”uÇÆƒÉ¹ÇÊŒá´‰p}{2021-06-04 21:40:49}%
    \msgMainContent{çœŸæ cef}%
    %
}


\channelMsgEntry{%
    \msgRealSource{liushuyu}{2021-06-04 21:40:50}%
    \msgMainContent{é‚£ä½œä¸º AOSC é‚£ä¸æ˜¯åŠŸèƒ½éƒ½æ‰“å¼€ï¼ˆ}%
    %
}


\channelMsgEntry{%
    \msgRealSource{cth451 ÇÉ”uÇÆƒÉ¹ÇÊŒá´‰p}{2021-06-04 21:40:51}%
    \msgMainContent{ï¼ˆEh ç„¶åæˆ‘çš„ç³»ç»Ÿé‡Œå°±ä¼šå†å¤šä¸€ä¸ªæµè§ˆå™¨}%
    %
}


\channelMsgEntry{%
    \msgRealSource{liushuyu}{2021-06-04 21:40:51}%
    \msgMainContent{æˆ–è€…æ‹†åŒ…ï¼ˆ}%
    %
}


\channelMsgEntry{%
    \msgRealSource{liushuyu}{2021-06-04 21:40:52}%
    \msgMainContent{æŠŠ cef æ’ä»¶æ‹†å‡ºæ¥ï¼ˆä½†æ˜¯æˆ‘ä»¬æ˜¯ä¸æ˜¯ä¸€èˆ¬ä¸è¿™ä¹ˆåš}%
    %
}


\channelMsgEntry{%
    \msgRealSource{cth451 ÇÉ”uÇÆƒÉ¹ÇÊŒá´‰p}{2021-06-04 21:40:53}%
    \msgMainContent{ï¼ˆç„¶è€Œ AOSC æ˜¯ä¸ªä¸æ‹†åŒ…çš„å‘è¡Œç‰ˆ}%
    %
}


\channelMsgEntry{%
    \msgRealSource{cth451 ÇÉ”uÇÆƒÉ¹ÇÊŒá´‰p}{2021-06-04 21:40:54}%
    \msgMainContent{ç§‰æ‰¿æ·¦ä½ å¨˜å¡çˆ†çš„åŸåˆ™}%
    %
}


\channelMsgEntry{%
    \msgRealSource{liushuyu}{2021-06-04 21:40:55}%
    \msgMainContent{obs å¤§å° 4.8 MB -\textgreater{} 65 MB ï¼ˆ}%
    %
}


\channelMsgEntry{%
    \msgRealSource{Lion III}{2021-06-06 07:20:14}%
    \msgMainContent{å¤ªä»¤äººæŒ¯å¥‹äº†ï¼ˆå±å±±è¡Œï¼‰}%
    \nopagebreak\includegraphics[width=\linewidth]{./.tg-data/2021/photos/photo_197@06-06-2021_07-20-14.jpg}%
}


\channelMsgEntry{%
    \msgRealSource{CT1000MX500SSD1 1000.2 GB}{2021-06-06 07:20:15}%
    \msgMainContent{åœ°ä¸»ï¼}%
    %
}


\channelMsgEntry{%
    \msgRealSource{Lion III}{2021-06-06 07:20:16}%
    \msgMainContent{èƒ¡è¯´ï¼åœŸæ”¹ä»¥ååœ°ä¸»å·²ç»ä¸å­˜åœ¨äº†ï¼}%
    %
}


\channelMsgEntry{%
    \msgRealSource{Lion III}{2021-06-06 07:20:17}%
    \msgMainContent{æˆ‘è¿™å«ä½œ\ldots\ldots æ°‘æ—\ldots\ldots å›¤è´§å®¶}%
    %
}


\channelMsgEntry{%
    \msgRealSource{Lion III}{2021-06-06 07:20:17}%
    \msgMainContent{ï¼ˆç‹—å¤´ï¼‰}%
    %
}


\channelMsgEntry{%
    \msgRealSource{Lion III}{2021-06-06 07:28:39}%
    \msgMainContent{è¯´ä¸ªä¸æ­£ç»çš„äº‹æƒ…ï¼ˆutils ä¹‹æµï¼Œä½çº§è™šæœºã€æ¬§å…ƒã€æ­Œå¥´ä¸‰è€…æ¯”ï¼Œåˆ™ä½•å¦‚ï¼Ÿï¼‰}%
    \nopagebreak\includegraphics[width=\linewidth]{./.tg-data/2021/photos/photo_198@06-06-2021_07-28-39.jpg}%
}


\channelMsgEntry{%
    \msgRealSource{Junde Yhi}{2021-06-06 07:28:39}%
    \msgMainContent{è¿‘æ—¥æœ‰ä½¿ç”¨ä½çº§è™šæœºä¹‹æ ¼å¼å·¥å…·}%
    %
}


\channelMsgEntry{%
    \msgRealSource{Junde Yhi}{2021-06-06 07:28:40}%
    \msgMainContent{å–„å“‰ï¼Œåªå¯¹é»˜è®¤æ•°ä¸ªåŸºå‡†æ„Ÿåˆ°å›°æƒ‘}%
    %
}


\channelMsgEntry{%
    \msgRealSource{Lion III}{2021-06-06 07:28:41}%
    \msgMainContent{}%
    \nopagebreak\includegraphics[width=\linewidth]{./.tg-data/2021/photos/photo_199@06-06-2021_07-28-41.jpg}%
}


\channelMsgEntry{%
    \msgRealSource{Lion III}{2021-06-06 07:28:41}%
    \msgMainContent{ä½çº§è™šæœºä¹‹å·¥å…·å°èƒœæ¬§å…ƒ}%
    %
}


\channelMsgEntry{%
    \msgRealSource{Lion III}{2021-06-06 07:28:42}%
    \msgMainContent{äºŒè€…è¿œèƒœäºæ­Œå¥´ä¹‹é˜…è¯»æ•ˆæœ}%
    %
}


\channelMsgEntry{%
    \msgRealSource{Lion III}{2021-06-06 07:30:15}%
    \msgMainContent{ä½çº§è™šæœºä¹‹ è§‚æ„Ÿä¸Šä½³ æ˜“äºç†è§£ å’¨è¯¢é›†ä¸­}%
    \nopagebreak\includegraphics[width=\linewidth]{./.tg-data/2021/photos/photo_200@06-06-2021_07-30-15.jpg}%
}


\channelMsgEntry{%
    \msgRealSource{CT1000MX500SSD1 1000.2 GB}{2021-06-06 07:30:16}%
    \msgMainContent{ä»€ä¹ˆä½çº§è™šæ‹Ÿæœº}%
    %
}


\channelMsgEntry{%
    \msgRealSource{CT1000MX500SSD1 1000.2 GB}{2021-06-06 07:30:16}%
    \msgMainContent{æ˜æ˜æ˜¯ çˆ±ç”Ÿæ´»è™šæ‹Ÿæœº}%
    %
}


\channelMsgEntry{%
    \msgRealSource{Lion III}{2021-06-06 07:30:17}%
    \msgMainContent{çˆ±ç›´æ’­è™šæ‹Ÿæœº}%
    %
}


\channelMsgEntry{%
    \msgRealSource{Lion III}{2021-06-06 07:30:18}%
    \msgMainContent{ä½ å¬è¯´äº†å—ï¼Ÿæ—¥æœ¬å‰äº›å¹´æœ‰ä¸€ä¸ªçˆ±ç›´æ’­ç»„åˆï¼Œå¥½å¤šå°å¥³ç”Ÿ}%
    %
}


\channelMsgEntry{%
    \msgRealSource{GitHub}{2021-06-07 06:49:14}%
    \msgMainContent{ğŸ’¬ New comment on aosc-os-abbs\#3137 firefox: security update to 89.0 by
@RedL0tus

{[}Raspberry
400{]}(https://user-images.githubusercontent.com/16459559/120971558-9efa8b00-c721-11eb-8629-6e952b6b09aa.png)
Senpai saikou! UwU

Reply to this message to post a comment on GitHub.}%
    %
}


\channelMsgEntry{%
    \msgRealSource{CT1000MX500SSD1 1000.2 GB}{2021-06-07 06:49:14}%
    \msgMainContent{\emph{applies deodorant}}%
    %
}


\channelMsgEntry{%
    \msgRealSource{GLOWAY YCT512GS3-S7 Pro}{2021-06-07 06:49:29}%
    \msgMainContent{\#æ€ä¹ˆå« \#å†æ”¾é€}%
    %
}


\channelMsgEntry{%
    \msgRealSource{GLOWAY YCT512GS3-S7 Pro}{2021-06-07 07:06:32}%
    \msgMainContent{ï¼ˆæ¥ä¸Šæ¡ï¼‰}%
    %
}


\channelMsgEntry{%
    \msgRealSource{ĞĞµĞ‘ÑƒÑ‚Ğ»ĞµĞ³ ï¼ˆè¿«çœŸï¼‰}{2021-06-07 07:06:38}%
    \msgMainContent{ç›ˆé€šèŠ±å«æ˜¾å¡é¦™è–°ï¼ˆx}%
    %
}


\channelMsgEntry{%
    \msgRealSource{GLOWAY YCT512GS3-S7 Pro}{2021-06-07 21:14:54}%
    \msgMainContent{}%
    \nopagebreak\includegraphics[width=\linewidth]{./.tg-data/2021/photos/photo_201@07-06-2021_21-14-54.jpg}%
}


\channelMsgEntry{%
    \msgRealSource{cth451 ÇÉ”uÇÆƒÉ¹ÇÊŒá´‰p}{2021-06-07 21:14:55}%
    \msgMainContent{å…±äº«äº†ä¹‹åæ‰€æœ‰äººéƒ½çŸ¥é“æˆ‘æ˜¯è‚¥å®….webm}%
    %
}


\channelMsgEntry{%
    \msgRealSource{GLOWAY YCT512GS3-S7 Pro}{2021-06-07 21:14:56}%
    \msgMainContent{è¿˜æœ‰è°ä¸çŸ¥é“å—}%
    %
}


\channelMsgEntry{%
    \msgRealSource{èˆŠå¤©ä¸‹ OriginCode // Ristaccia}{2021-06-08 20:45:21}%
    \msgMainContent{æœ‰é»æƒ³åƒåŠ ã€Œè‡ªç”±åŠå¼€æºè½¯ä»¶ç®€ä¸­æœ¬åœ°åŒ–å·¥ä½œã€ ç„¶å¾Œè¢«ç™½è€å¸«å½ˆhuihui}%
    %
}


\channelMsgEntry{%
    \msgRealSource{ĞĞµĞ‘ÑƒÑ‚Ğ»ĞµĞ³ ï¼ˆè¿«çœŸï¼‰}{2021-06-08 20:45:21}%
    \msgMainContent{ç›´æ¥è¯´æƒ³è¢«å¼¹å°±è¡Œï¼ˆot}%
    %
}


\channelMsgEntry{%
    \msgRealSource{å’¸é±¼}{2021-06-08 20:45:22}%
    \msgMainContent{ç‰¹é¦–ä»Šå¹´æš‘å‡ä¼šå» WAï¼Œä½ ç­‰ç€è¢«å¼¹å§}%
    %
}


\channelMsgEntry{%
    \msgRealSource{å’¸é±¼}{2021-06-08 20:47:02}%
    \msgMainContent{LVM å}%
    %
}


\channelMsgEntry{%
    \msgRealSource{å’¸é±¼}{2021-06-08 20:47:02}%
    \msgMainContent{ç«‹åˆ» ZFS}%
    %
}


\channelMsgEntry{%
    \msgRealSource{å’¸é±¼}{2021-06-08 20:47:02}%
    \msgMainContent{ä¹°ç¡¬ç›˜ï¼ˆå¤§å£°}%
    %
}


\channelMsgEntry{%
    \msgRealSource{å’¸é±¼}{2021-06-08 20:47:02}%
    \msgMainContent{æ¢æœºå™¨ï¼ˆå¤§å£°}%
    %
}


\channelMsgEntry{%
    \msgRealSource{cth451 ÇÉ”uÇÆƒÉ¹ÇÊŒá´‰p}{2021-06-08 20:47:04}%
    \msgMainContent{\#æ€ä¹ˆå«}%
    %
}


\channelMsgEntry{%
    \msgRealSource{cth451 ÇÉ”uÇÆƒÉ¹ÇÊŒá´‰p}{2021-06-09 03:11:33}%
    \msgMainContent{ï¼ˆï¼Ÿï¼Ÿï¼Ÿï¼Ÿï¼Ÿï¼‰}%
    \nopagebreak\includegraphics[width=\linewidth]{./.tg-data/2021/photos/photo_202@09-06-2021_03-11-33.jpg}%
}


\channelMsgEntry{%
    \msgRealSource{Kexy Biscuit | è¢«å­é¥¼ï¸ | ç™¾åˆãƒ¶å’²ã‚‹ã‚‹}{2021-06-09 09:34:08}%
    \msgMainContent{æŒ‰æˆ‘ç†è§£ä¸ä¼šæ¯” Rackï¼Œå¼ºè°ƒè¿™ä¸€ç‚¹ä¸»è¦æ˜¯å› ä¸ºå¾ˆå°çš„è¯å¤§æ¦‚è°éƒ½å¯ä»¥æ‰˜ç®¡äº†ï¼ˆ}%
    %
}


\channelMsgEntry{%
    \msgRealSource{Mingcong Bai}{2021-06-09 09:34:09}%
    \msgMainContent{è¿™å°è‚¯å®šæ˜¯ E-ATXï¼ˆ}%
    %
}


\channelMsgEntry{%
    \msgRealSource{Mingcong Bai}{2021-06-09 09:34:10}%
    \msgMainContent{åŒè·¯æ¿å­}%
    %
}


\channelMsgEntry{%
    \msgRealSource{CT1000MX500SSD1 1000.2 GB}{2021-06-09 09:34:10}%
    \msgMainContent{Steve: EATX does not exist}%
    %
}


\channelMsgEntry{%
    \msgRealSource{Mingcong Bai}{2021-06-09 09:34:11}%
    \msgMainContent{Sure, Jesus}%
    %
}


\channelMsgEntry{%
    \msgRealSource{Yangff}{2021-06-09 22:03:50}%
    \msgMainContent{}%
    \nopagebreak\includegraphics[width=\linewidth]{./.tg-data/2021/photos/photo_203@09-06-2021_22-03-50.jpg}%
}


\channelMsgEntry{%
    \msgRealSource{Yangff}{2021-06-09 22:03:50}%
    \msgMainContent{ç»™æˆ‘æ•´ä¸ä¼šäº†}%
    %
}


\channelMsgEntry{%
    \msgRealSource{Yangff}{2021-06-09 22:03:51}%
    \msgMainContent{Linuxä¸æ˜¯æ“ä½œç³»ç»Ÿï¼Œæ˜¯æ“ä½œç³»ç»Ÿå†…æ ¸}%
    %
}


\channelMsgEntry{%
    \msgRealSource{CT1000MX500SSD1 1000.2 GB}{2021-06-09 22:03:52}%
    \msgMainContent{GNU/Linux}%
    %
}


\channelMsgEntry{%
    \msgRealSource{CT1000MX500SSD1 1000.2 GB}{2021-06-09 22:03:52}%
    \msgMainContent{Userland æ˜¯ GNU}%
    %
}


\channelMsgEntry{%
    \msgRealSource{CT1000MX500SSD1 1000.2 GB}{2021-06-09 22:03:53}%
    \msgMainContent{ä¸å¯¹ç°åœ¨åº”è¯¥æ˜¯ systemd/Wayland/X11/LLVM/GNU/Linux}%
    %
}


\channelMsgEntry{%
    \msgRealSource{å’¸é±¼}{2021-06-09 22:03:53}%
    \msgMainContent{é¡ºä¾¿ç°åœ¨ Linux å‘è¡Œç‰ˆåº”è¯¥è¢«å«åš Lennart/Linux}%
    %
}


\channelMsgEntry{%
    \msgRealSource{cth451 ÇÉ”uÇÆƒÉ¹ÇÊŒá´‰p}{2021-06-09 22:03:54}%
    \msgMainContent{è¿™ä¸è¡Œ}%
    %
}


\channelMsgEntry{%
    \msgRealSource{cth451 ÇÉ”uÇÆƒÉ¹ÇÊŒá´‰p}{2021-06-09 22:03:58}%
    \msgMainContent{Linux-underpants}%
    %
}


\channelMsgEntry{%
    \msgRealSource{å’¸é±¼}{2021-06-09 22:03:59}%
    \msgMainContent{NoPants/Linux}%
    %
}


\channelMsgEntry{%
    \msgRealSource{å’¸é±¼}{2021-06-09 22:03:59}%
    \msgMainContent{Look ma, no pants!}%
    %
}


\channelMsgEntry{%
    \msgRealSource{cth451 ÇÉ”uÇÆƒÉ¹ÇÊŒá´‰p}{2021-06-09 22:05:12}%
    \msgMainContent{æˆ–è€…é‚£äº›ä¸ç”¨ systemd çš„å« Linux+underpants}%
    %
}


\channelMsgEntry{%
    \msgRealSource{cth451 ÇÉ”uÇÆƒÉ¹ÇÊŒá´‰p}{2021-06-09 22:15:19}%
    \msgMainContent{æ‰€ä»¥ä¸è¦ freeipa}%
    %
}


\channelMsgEntry{%
    \msgRealSource{cth451 ÇÉ”uÇÆƒÉ¹ÇÊŒá´‰p}{2021-06-09 22:15:20}%
    \msgMainContent{ç›´æ¥ slapd}%
    %
}


\channelMsgEntry{%
    \msgRealSource{å’¸é±¼}{2021-06-09 22:15:21}%
    \msgMainContent{è¿™æ´»æˆ‘å‰é¢å¹²è¿‡æ¥ç€ï¼ˆx}%
    %
}


\channelMsgEntry{%
    \msgRealSource{å’¸é±¼}{2021-06-09 22:15:21}%
    \msgMainContent{æ„Ÿæƒ³å°±æ˜¯}%
    %
}


\channelMsgEntry{%
    \msgRealSource{å’¸é±¼}{2021-06-09 22:15:22}%
    \msgMainContent{æˆ‘ç”¨çš„æ—¶å€™è¿˜æœ‰ä¸ª Nix å¸®æˆ‘æŠŠç¨‹åºéƒ¨ç½²èµ·æ¥ï¼Œæˆ‘å†™è§„åˆ™å°±è¡Œäº†ï¼ˆx}%
    %
}


\channelMsgEntry{%
    \msgRealSource{cth451 ÇÉ”uÇÆƒÉ¹ÇÊŒá´‰p}{2021-06-09 22:15:22}%
    \msgMainContent{æ¬¢è¿ä½¿ç”¨ centos 6}%
    %
}


\channelMsgEntry{%
    \msgRealSource{å’¸é±¼}{2021-06-09 22:15:23}%
    \msgMainContent{ä¸è¦ï¼ˆx}%
    %
}


\channelMsgEntry{%
    \msgRealSource{cth451 ÇÉ”uÇÆƒÉ¹ÇÊŒá´‰p}{2021-06-09 22:15:24}%
    \msgMainContent{ï¼ˆuncle roger å¼çš„å£éŸ³ï¼‰don't be pussy, learn to be sysadmin}%
    %
}


\channelMsgEntry{%
    \msgRealSource{å’¸é±¼}{2021-06-09 22:15:49}%
    \msgMainContent{åˆšåˆšæ‰“äº† Moderna ç¬¬äºŒé’ˆ}%
    %
}


\channelMsgEntry{%
    \msgRealSource{å’¸é±¼}{2021-06-09 22:15:50}%
    \msgMainContent{æ˜¯ä¸æ˜¯åº”è¯¥æš‚æ—¶æŠŠæˆ‘çš„ pubkey ä» dev-pubkeys å»æ‰ï¼ˆx}%
    %
}


\channelMsgEntry{%
    \msgRealSource{GitHub}{2021-06-10 01:30:22}%
    \msgMainContent{ğŸ”¨ 1 new commit to apt-gen-list-rs:master:

84540d3: Status: use indexmap

Now get, add, remove source item are O(1) by eatradish}%
    %
}


\channelMsgEntry{%
    \msgRealSource{GitHub}{2021-06-10 01:30:23}%
    \msgMainContent{ğŸ”¨ 1 new commit to apt-gen-list-rs:master:

0ed9b74: meta: cargo clippy by eatradish}%
    %
}


\channelMsgEntry{%
    \msgRealSource{liushuyu}{2021-06-10 01:30:23}%
    \msgMainContent{Your commit message, very descriptive}%
    %
}


\channelMsgEntry{%
    \msgRealSource{CT1000MX500SSD1 1000.2 GB}{2021-06-10 01:30:24}%
    \msgMainContent{such clippy}%
    %
}


\channelMsgEntry{%
    \msgRealSource{Mingcong Bai}{2021-06-10 01:30:25}%
    \msgMainContent{This commit message grandma very happy}%
    %
}


\channelMsgEntry{%
    \msgRealSource{èˆŠå¤©ä¸‹ OriginCode // Ristaccia}{2021-06-10 01:31:15}%
    \msgMainContent{very desc}%
    %
}


\channelMsgEntry{%
    \msgRealSource{Mingcong Bai}{2021-06-10 01:31:16}%
    \msgMainContent{Very dick}%
    %
}


\channelMsgEntry{%
    \msgRealSource{Mingcong Bai}{2021-06-10 01:31:17}%
    \msgMainContent{\emph{cough}}%
    %
}


\channelMsgEntry{%
    \msgRealSource{èˆŠå¤©ä¸‹ OriginCode // Ristaccia}{2021-06-10 01:31:17}%
    \msgMainContent{v.d.}%
    %
}


\channelMsgEntry{%
    \msgRealSource{Mingcong Bai}{2021-06-10 01:32:29}%
    \msgMainContent{Bump ä½ ä¸ªå¤§å¤´é¬¼å“¦------}%
    %
}


\channelMsgEntry{%
    \msgRealSource{å’¸é±¼}{2021-06-10 01:32:30}%
    \msgMainContent{big endian ghost}%
    %
}


\channelMsgEntry{%
    \msgRealSource{å’¸é±¼}{2021-06-10 01:37:37}%
    \msgMainContent{è¯´èµ·æ¥ç‰¹é¦–çš„ hAP AC2 åº”è¯¥æ˜¯çœŸçš„å¤§å¤´è™¾}%
    %
}


\channelMsgEntry{%
    \msgRealSource{å’¸é±¼}{2021-06-10 01:37:38}%
    \msgMainContent{MIPSBE}%
    %
}


\channelMsgEntry{%
    \msgRealSource{Mingcong Bai}{2021-06-10 01:37:39}%
    \msgMainContent{Buggy as fuck}%
    %
}


\channelMsgEntry{%
    \msgRealSource{Leo Shen}{2021-06-10 01:37:39}%
    \msgMainContent{BugTik: You don't exist}%
    %
}


\channelMsgEntry{%
    \msgRealSource{Mingcong Bai}{2021-06-10 01:37:40}%
    \msgMainContent{Me: How'd you know}%
    %
}


\channelMsgEntry{%
    \msgRealSource{Leo Shen}{2021-06-10 01:37:40}%
    \msgMainContent{Descartes approves (x}%
    %
}


\channelMsgEntry{%
    \msgRealSource{Mingcong Bai}{2021-06-12 04:33:59}%
    \msgMainContent{æœ‰ä¸ªè¡¥ä¸éœ€è¦é‡å‘½å}%
    %
}


\channelMsgEntry{%
    \msgRealSource{cth451 ÇÉ”uÇÆƒÉ¹ÇÊŒá´‰p}{2021-06-12 04:34:00}%
    \msgMainContent{rename æˆå•¥}%
    %
}


\channelMsgEntry{%
    \msgRealSource{cth451 ÇÉ”uÇÆƒÉ¹ÇÊŒá´‰p}{2021-06-12 04:34:00}%
    \msgMainContent{gcc-10ï¼Ÿ}%
    %
}


\channelMsgEntry{%
    \msgRealSource{Mingcong Bai}{2021-06-12 04:34:01}%
    \msgMainContent{ä½ æ‰“ç¬¬ä¸‰é’ˆç–«è‹—å•¦ï¼Ÿï¼ˆ}%
    %
}


\channelMsgEntry{%
    \msgRealSource{Mingcong Bai}{2021-06-12 04:34:02}%
    \msgMainContent{NNNN-COMMENT.patch}%
    %
}


\channelMsgEntry{%
    \msgRealSource{cth451 ÇÉ”uÇÆƒÉ¹ÇÊŒá´‰p}{2021-06-12 04:34:02}%
    \msgMainContent{}%
    \nopagebreak\includegraphics[width=\linewidth]{./.tg-data/2021/photos/photo_204@12-06-2021_04-34-02.jpg}%
}


\channelMsgEntry{%
    \msgRealSource{Mingcong Bai}{2021-06-12 04:34:03}%
    \msgMainContent{Huh}%
    %
}


\channelMsgEntry{%
    \msgRealSource{Mingcong Bai}{2021-06-12 04:34:04}%
    \msgMainContent{ä¸ºä»€ä¹ˆæˆ‘çœ‹ PR é‚£é‡Œçœ‹ä¸åˆ°å‰ç¼€}%
    %
}


\channelMsgEntry{%
    \msgRealSource{CT1000MX500SSD1 1000.2 GB}{2021-06-12 04:34:05}%
    \msgMainContent{çœ‹ è¿˜æ˜¯æ‰“äº†å‡ç–«è‹—}%
    %
}


\channelMsgEntry{%
    \msgRealSource{cth451 ÇÉ”uÇÆƒÉ¹ÇÊŒá´‰p}{2021-06-12 04:34:06}%
    \msgMainContent{å› ä¸ºæˆ‘è¿˜æ²¡åŸåŠ›æ¨é€}%
    %
}


\channelMsgEntry{%
    \msgRealSource{CT1000MX500SSD1 1000.2 GB}{2021-06-12 04:34:06}%
    \msgMainContent{å°ç™½å°±åœ¨é‚£é‡Œï¼}%
    %
}


\channelMsgEntry{%
    \msgRealSource{GitHub}{2021-06-12 09:06:50}%
    \msgMainContent{ğŸ”¨ 1 new commit to wiki:master:

915907d: arm-mac-m1-installation-zh: update by eatradish}%
    %
}


\channelMsgEntry{%
    \msgRealSource{Mingcong Bai}{2021-06-12 09:06:50}%
    \msgMainContent{è¿™ commit msg å®åœ¨ä¸åŠæ ¼ï¼ˆ}%
    %
}


\channelMsgEntry{%
    \msgRealSource{CT1000MX500SSD1 1000.2 GB}{2021-06-12 09:06:51}%
    \msgMainContent{æ‰“ç–«è‹—äº†ï¼Ÿ}%
    %
}


\channelMsgEntry{%
    \msgRealSource{CT1000MX500SSD1 1000.2 GB}{2021-06-12 09:46:39}%
    \msgMainContent{}%
    \nopagebreak\includegraphics[width=\linewidth]{./.tg-data/2021/photos/photo_205@12-06-2021_09-46-39.jpg}%
}


\channelMsgEntry{%
    \msgRealSource{Lion III}{2021-06-12 09:46:40}%
    \msgMainContent{è½¬å‘åˆ° aosc æ‰“åŒ…å°é˜Ÿç¾¤é‡Œ}%
    %
}


\channelMsgEntry{%
    \msgRealSource{Lion III}{2021-06-12 09:46:40}%
    \msgMainContent{ç¾å¥½çš„ç¥ç¦ï¼ˆï¼Ÿï¼‰}%
    %
}


\channelMsgEntry{%
    \msgRealSource{Mili}{2021-06-12 09:46:41}%
    \msgMainContent{ç„¶è€Œä¸å‡ºåŒ…è¿™é‡Œæœ‰æ­§ä¹‰ï¼ˆå–‚}%
    %
}


\channelMsgEntry{%
    \msgRealSource{liushuyu}{2021-06-12 23:02:38}%
    \msgMainContent{æˆ‘å‘ç°å¦ä¸€ä¸ªå¾ˆæœ‰ç²¾ç¥çš„æƒ…å†µï¼Œç¼–è¯‘æœ‰æ—¶ä¼š SIGSEGVï¼Œä½†æ˜¯å¦‚æœæˆ‘ç¦»å¼€ tmux
å°±èƒ½é€šè¿‡ï¼ˆ}%
    %
}


\channelMsgEntry{%
    \msgRealSource{cth451 ÇÉ”uÇÆƒÉ¹ÇÊŒá´‰p}{2021-06-12 23:02:39}%
    \msgMainContent{ç¼–è¯‘å™¨ï¼šuwu senpai is looking at me * seg fault *}%
    %
}


\channelMsgEntry{%
    \msgRealSource{Mingcong Bai}{2021-06-13 08:08:28}%
    \msgMainContent{æ ¸å­æœåŠ¡å™¨}%
    \nopagebreak\includegraphics[width=\linewidth]{./.tg-data/2021/photos/photo_206@13-06-2021_08-08-28.jpg}%
}


\channelMsgEntry{%
    \msgRealSource{CT1000MX500SSD1 1000.2 GB}{2021-06-15 05:55:05}%
    \msgMainContent{æˆ‘ä»Šå¤©æ‰çŸ¥é“}%
    %
}


\channelMsgEntry{%
    \msgRealSource{CT1000MX500SSD1 1000.2 GB}{2021-06-15 05:55:06}%
    \msgMainContent{å‰å¤©æ™šä¸Šè¯´ æŸ´è€æ¿åšæ³•äº‹}%
    %
}


\channelMsgEntry{%
    \msgRealSource{CT1000MX500SSD1 1000.2 GB}{2021-06-15 05:55:07}%
    \msgMainContent{æŒ‡çš„æ˜¯ mkfs}%
    %
}


\channelMsgEntry{%
    \msgRealSource{Megumi ã‹ã‚ã„ã„ã¯æ­£ç¾©ï¼}{2021-06-15 05:55:07}%
    \msgMainContent{ä½ ä»¥ç‚ºæ˜¯ä»€éº¼}%
    %
}


\channelMsgEntry{%
    \msgRealSource{Megumi ã‹ã‚ã„ã„ã¯æ­£ç¾©ï¼}{2021-06-15 05:55:08}%
    \msgMainContent{å»æ‹œä½›ï¼Ÿ}%
    %
}


\channelMsgEntry{%
    \msgRealSource{CT1000MX500SSD1 1000.2 GB}{2021-06-15 05:55:09}%
    \msgMainContent{ä¹–ä¹–}%
    %
}


\channelMsgEntry{%
    \msgRealSource{Megumi ã‹ã‚ã„ã„ã¯æ­£ç¾©ï¼}{2021-06-15 05:55:09}%
    \msgMainContent{ä½›èªªä½ è¦æŒ¯}%
    %
}


\channelMsgEntry{%
    \msgRealSource{èˆŠå¤©ä¸‹ OriginCode // Ristaccia}{2021-06-15 05:55:34}%
    \msgMainContent{ä½ ä¾¿æŒ¯äº†}%
    %
}


\channelMsgEntry{%
    \msgRealSource{Staph Bridge}{2021-06-15 08:00:09}%
    \msgMainContent{{[}D-RedL0tus{]} ;;p éš¾å¿˜ä»Šå®µ}%
    %
}


\channelMsgEntry{%
    \msgRealSource{Staph Bridge}{2021-06-15 08:00:10}%
    \msgMainContent{{[}D-FredBoatPatron{]} Song \textbf{\#1} has been selected:
\textbf{æè°·ä¸€ - éš¾å¿˜ä»Šå®µ} (04:17)}%
    %
}


\channelMsgEntry{%
    \msgRealSource{Staph Bridge}{2021-06-15 08:00:10}%
    \msgMainContent{{[}D-RedL0tus{]} ;;1}%
    %
}


\channelMsgEntry{%
    \msgRealSource{CT1000MX500SSD1 1000.2 GB}{2021-06-15 08:00:11}%
    \msgMainContent{çº¢è²å¤§ä½¬}%
    %
}


\channelMsgEntry{%
    \msgRealSource{CT1000MX500SSD1 1000.2 GB}{2021-06-15 08:00:12}%
    \msgMainContent{é”™é¢‘é“äº†}%
    %
}


\channelMsgEntry{%
    \msgRealSource{CT1000MX500SSD1 1000.2 GB}{2021-06-15 08:00:12}%
    \msgMainContent{è¿™æ˜¯ retro ä¸æ˜¯ Botcmd}%
    %
}


\channelMsgEntry{%
    \msgRealSource{ĞĞµĞ‘ÑƒÑ‚Ğ»ĞµĞ³ ï¼ˆè¿«çœŸï¼‰}{2021-06-15 08:00:13}%
    \msgMainContent{å’¸é±¼çœ¼ç›å¤§æ¦‚è¿›äº†ç‚¹ç›}%
    %
}


\channelMsgEntry{%
    \msgRealSource{Mingcong Bai}{2021-06-16 06:13:02}%
    \msgMainContent{@CyrixInstead å¸®ä½ åˆå¹¶äº†ï¼ˆ}%
    %
}


\channelMsgEntry{%
    \msgRealSource{Mingcong Bai}{2021-06-16 06:13:03}%
    \msgMainContent{è‰ï¼Œä½ çš„ commit msg é”™äº†ï¼ˆ}%
    %
}


\channelMsgEntry{%
    \msgRealSource{Mingcong Bai}{2021-06-16 06:13:04}%
    \msgMainContent{åäººå ‚è¯·}%
    %
}


\channelMsgEntry{%
    \msgRealSource{Mingcong Bai}{2021-06-16 06:13:04}%
    \msgMainContent{ä½ åœ¨ç”¨ Vim å§}%
    %
}


\channelMsgEntry{%
    \msgRealSource{Mingcong Bai}{2021-06-16 06:13:05}%
    \msgMainContent{Get Nano today}%
    %
}


\channelMsgEntry{%
    \msgRealSource{cth451 ÇÉ”uÇÆƒÉ¹ÇÊŒá´‰p}{2021-06-16 06:15:35}%
    \msgMainContent{vim:}%
    \nopagebreak\includegraphics[width=\linewidth]{./.tg-data/2021/photos/photo_207@16-06-2021_06-15-35.jpg}%
}


\channelMsgEntry{%
    \msgRealSource{cth451 ÇÉ”uÇÆƒÉ¹ÇÊŒá´‰p}{2021-06-16 06:15:36}%
    \msgMainContent{nano:}%
    \nopagebreak\includegraphics[width=\linewidth]{./.tg-data/2021/photos/photo_208@16-06-2021_06-15-36.jpg}%
}


\channelMsgEntry{%
    \msgRealSource{Deteled Account}{2021-06-16 13:00:12}%
    \msgMainContent{ä½ çš„ä¸‹ä¸€ä¸ªdeepinï¼Œä½•å¿…æ˜¯linux}%
    %
}


\channelMsgEntry{%
    \msgRealSource{CT1000MX500SSD1 1000.2 GB}{2021-06-16 21:29:38}%
    \msgMainContent{ç»™ç¤¾åŒºæœåŠ¡å™¨ä¹°æŠŠé”}%
    \nopagebreak\includegraphics[width=\linewidth]{./.tg-data/2021/photos/photo_209@16-06-2021_21-29-38.jpg}%
}


\channelMsgEntry{%
    \msgRealSource{Mingcong Bai}{2021-06-16 21:29:39}%
    \msgMainContent{ä¸è®¤è¯†ä½ }%
    %
}


\channelMsgEntry{%
    \msgRealSource{CT1000MX500SSD1 1000.2 GB}{2021-06-17 01:52:19}%
    \msgMainContent{ä»¥ä½ ä»¬ç¾å›½äººçš„é“è·¯è¿è¥æ°´å¹³ï¼Œæˆ‘ä¸å¸¦ç‚¹æŠ¤èº«ç¬¦éƒ½ä¸æ•¢åç«è½¦}%
    %
}


\channelMsgEntry{%
    \msgRealSource{liushuyu}{2021-06-17 01:52:19}%
    \msgMainContent{ä½ è¿™è¯è¯´çš„ï¼Œè¯´çš„å¥½åƒæœ‰æŠ¤èº«ç¬¦èƒ½é•‡å¾—ä½ä¸€æ ·ï¼Œç¿»ä¸ç¿»è½¦ä¸ä¸€å¬å¤©å‘½ï¼ˆ}%
    %
}


\channelMsgEntry{%
    \msgRealSource{CT1000MX500SSD1 1000.2 GB}{2021-06-17 01:52:32}%
    \msgMainContent{ä½ ä¸ªä¹Œé¸¦å˜´}%
    \nopagebreak\includegraphics[width=\linewidth]{./.tg-data/2021/photos/photo_210@17-06-2021_01-52-32.jpg}%
}


\channelMsgEntry{%
    \msgRealSource{CT1000MX500SSD1 1000.2 GB}{2021-06-17 01:52:32}%
    \msgMainContent{å›ç¨‹ç‚¸é£äº†}%
    %
}


\channelMsgEntry{%
    \msgRealSource{CT1000MX500SSD1 1000.2 GB}{2021-06-17 01:52:33}%
    \msgMainContent{åœ¨è½¦ç«™ç­‰çš„æ—¶é—´å’Œæˆ‘é€›å®œå®¶çš„æ—¶é—´å·®ä¸å¤šé•¿äº†}%
    %
}


\channelMsgEntry{%
    \msgRealSource{Staph Bridge}{2021-06-20 04:52:24}%
    \msgMainContent{{[}D-Fearyncess{]} ;;vol 40}%
    %
}


\channelMsgEntry{%
    \msgRealSource{Staph Bridge}{2021-06-20 04:52:25}%
    \msgMainContent{{[}D-FredBoatPatron{]} Changed volume from \textbf{100\%} to
\textbf{40\%}.}%
    %
}


\channelMsgEntry{%
    \msgRealSource{å’¸é±¼}{2021-06-20 04:52:25}%
    \msgMainContent{æ²¡æƒ³åˆ°ä½ ä¹Ÿæœ‰é”™ç¾¤çš„ä¸€å¤©}%
    %
}


\channelMsgEntry{%
    \msgRealSource{cth451 ÇÉ”uÇÆƒÉ¹ÇÊŒá´‰p}{2021-06-22 03:48:47}%
    \msgMainContent{ç”µå­æŠ–åŠ¨æ˜¯ä»€ä¹ˆé¬¼}%
    %
}


\channelMsgEntry{%
    \msgRealSource{Mingcong Bai}{2021-06-22 03:48:48}%
    \msgMainContent{æ˜¯ä¸ªè€æœ¬åœ°åŒ–é”™è¯¯}%
    %
}


\channelMsgEntry{%
    \msgRealSource{Mingcong Bai}{2021-06-22 03:48:48}%
    \msgMainContent{Digital Vibrancy}%
    %
}


\channelMsgEntry{%
    \msgRealSource{cth451 ÇÉ”uÇÆƒÉ¹ÇÊŒá´‰p}{2021-06-22 03:48:49}%
    \msgMainContent{\emph{Vibrancy}}%
    \nopagebreak\includegraphics[width=\linewidth]{./.tg-data/2021/photos/photo_211@22-06-2021_03-48-49.jpg}%
}


\channelMsgEntry{%
    \msgRealSource{Mingcong Bai}{2021-06-22 03:48:50}%
    \msgMainContent{My titanium canine eyes}%
    %
}


\channelMsgEntry{%
    \msgRealSource{cth451 ÇÉ”uÇÆƒÉ¹ÇÊŒá´‰p}{2021-06-22 04:42:12}%
    \msgMainContent{ï¼ˆæ„Ÿè§‰æœå†»å®é™…ä¸Šä¹Ÿåº”è¯¥å¾ˆå—æ¬¢è¿}%
    %
}


\channelMsgEntry{%
    \msgRealSource{Mingcong Bai}{2021-06-22 04:42:12}%
    \msgMainContent{åƒé¥­çš„æ—¶å€™å¤§æ¦‚æ˜¯ï¼ˆx}%
    %
}


\channelMsgEntry{%
    \msgRealSource{Mingcong Bai}{2021-06-22 04:42:12}%
    \msgMainContent{æœ€è¿‘éº¦è¿ªé€Šæ¥äº†å‡ ä¸ªå­¦é•¿å­¦å§æ¥åƒé¥­ï¼ŒæŠŠå’¸é±¼æŠ˜è…¾äº†ä¸€ä¸‹åˆï¼ˆx}%
    %
}


\channelMsgEntry{%
    \msgRealSource{MoGeCâ‚â‚„N Yang}{2021-06-22 04:42:12}%
    \msgMainContent{æœå†»------æˆ‘è¢«å„ç³»ç¾å°‘å¥³åŒ…å›´çš„æ— å¥ˆæ ¡å›­ç”Ÿæ´»}%
    %
}


\channelMsgEntry{%
    \msgRealSource{Mingcong Bai}{2021-06-22 04:42:12}%
    \msgMainContent{é‚£ä¸ºä½•æˆ‘ç°åœ¨è¿˜æ˜¯å•èº«ï¼Œä¸‡äººè¿·æ¨å“¥å“¥å¿«å‘Šè¯‰æˆ‘ï¼ˆ}%
    %
}


\channelMsgEntry{%
    \msgRealSource{MoGeCâ‚â‚„N Yang}{2021-06-22 04:42:12}%
    \msgMainContent{æœå†»ä¸ºäº†ç»´æŒé«˜å†·çš„äººè®¾}%
    %
}


\channelMsgEntry{%
    \msgRealSource{MoGeCâ‚â‚„N Yang}{2021-06-22 04:42:12}%
    \msgMainContent{ä¸ç„¶å¯èƒ½è¦å¿«è¿›åˆ°æ—¥åœ¨æ ¡å›­çš„å‰§æƒ…}%
    %
}


\channelMsgEntry{%
    \msgRealSource{Staph Bridge}{2021-06-22 17:22:46}%
    \msgMainContent{{[}L-YuutaW{]} \#join aosc-offtopic}%
    %
}


\channelMsgEntry{%
    \msgRealSource{ä½œä¸šæ˜¯å†™ä¸å®Œçš„ a.k.a. Yuuta ğŸ“ğŸ€ã…¤}{2021-06-22 17:22:47}%
    \msgMainContent{ç‰¹åˆ«å°´å°¬}%
    %
}


\channelMsgEntry{%
    \msgRealSource{ä½œä¸šæ˜¯å†™ä¸å®Œçš„ a.k.a. Yuuta ğŸ“ğŸ€ã…¤}{2021-06-22 17:22:47}%
    \msgMainContent{æˆ‘æ‰‹å¤ªå¿«ï¼Œå¿˜è®° / äº†}%
    %
}


\channelMsgEntry{%
    \msgRealSource{ä½œä¸šæ˜¯å†™ä¸å®Œçš„ a.k.a. Yuuta ğŸ“ğŸ€ã…¤}{2021-06-22 17:22:47}%
    \msgMainContent{è€Œä¸” \# å¥½åƒè¿˜é”™ä½äº†}%
    %
}


\channelMsgEntry{%
    \msgRealSource{ä½œä¸šæ˜¯å†™ä¸å®Œçš„ a.k.a. Yuuta ğŸ“ğŸ€ã…¤}{2021-06-22 17:22:47}%
    \msgMainContent{concurrency.heif}%
    %
}


\channelMsgEntry{%
    \msgRealSource{Mingcong Bai}{2021-06-22 17:22:47}%
    \msgMainContent{é†‰é…’ä¸Šç½‘æ€ä¹ˆç½šï¼ˆ}%
    %
}


\channelMsgEntry{%
    \msgRealSource{cth451 ÇÉ”uÇÆƒÉ¹ÇÊŒá´‰p}{2021-06-22 17:22:51}%
    \msgMainContent{è¿™ä¹ˆç½š}%
    %
}


\channelMsgEntry{%
    \msgRealSource{liushuyu}{2021-06-22 21:48:01}%
    \msgMainContent{}%
    \nopagebreak\includegraphics[width=\linewidth]{./.tg-data/2021/photos/photo_212@22-06-2021_21-48-01.jpg}%
}


\channelMsgEntry{%
    \msgRealSource{ĞĞµĞ‘ÑƒÑ‚Ğ»ĞµĞ³ ï¼ˆè¿«çœŸï¼‰}{2021-06-22 21:48:02}%
    \msgMainContent{ä½ çš„bash promptä¸è¡Œï¼ˆx}%
    %
}


\channelMsgEntry{%
    \msgRealSource{liushuyu}{2021-06-22 21:48:02}%
    \msgMainContent{æ³¨æ„çœ‹æ˜¯è°çš„ promptï¼ˆ}%
    %
}


\channelMsgEntry{%
    \msgRealSource{ĞĞµĞ‘ÑƒÑ‚Ğ»ĞµĞ³ ï¼ˆè¿«çœŸï¼‰}{2021-06-22 21:48:03}%
    \msgMainContent{æ›´ä¸è¡Œäº†ï¼ˆx}%
    %
}


\channelMsgEntry{%
    \msgRealSource{ĞĞµĞ‘ÑƒÑ‚Ğ»ĞµĞ³ ï¼ˆè¿«çœŸï¼‰}{2021-06-22 21:48:03}%
    \msgMainContent{è¦ä»``æº''å¤´è§£å†³bashä¸å¥½ç”¨çš„é—®é¢˜ï¼ˆx}%
    %
}


\channelMsgEntry{%
    \msgRealSource{CT1000MX500SSD1 1000.2 GB}{2021-06-22 21:48:04}%
    \msgMainContent{æ²¡äº‹ï¼Œè¿‡å‡ å¤©æºå°±å˜æˆå§¥å§¥çš„å½¢çŠ¶äº†ï¼ˆx}%
    %
}


\channelMsgEntry{%
    \msgRealSource{CT1000MX500SSD1 1000.2 GB}{2021-06-23 00:33:02}%
    \msgMainContent{}%
    \nopagebreak\includegraphics[width=\linewidth]{./.tg-data/2021/photos/photo_213@23-06-2021_00-33-02.jpg}%
}


\channelMsgEntry{%
    \msgRealSource{cth451 ÇÉ”uÇÆƒÉ¹ÇÊŒá´‰p}{2021-06-23 00:33:02}%
    \msgMainContent{Heh 8620}%
    %
}


\channelMsgEntry{%
    \msgRealSource{CT1000MX500SSD1 1000.2 GB}{2021-06-23 00:33:03}%
    \msgMainContent{çœ‹åˆ°ç¥èå·äº†å—ï¼Ÿ}%
    %
}


\channelMsgEntry{%
    \msgRealSource{cth451 ÇÉ”uÇÆƒÉ¹ÇÊŒá´‰p}{2021-06-27 22:58:27}%
    \msgMainContent{è¿™ä¹ˆæ—©å°± ktv}%
    %
}


\channelMsgEntry{%
    \msgRealSource{Mingcong Bai}{2021-06-27 22:58:28}%
    \msgMainContent{å”±æ­Œå”±åˆ°å–‰å’™è‡­}%
    %
}


\channelMsgEntry{%
    \msgRealSource{ĞĞµĞ‘ÑƒÑ‚Ğ»ĞµĞ³ ï¼ˆè¿«çœŸï¼‰}{2021-06-27 22:58:29}%
    \msgMainContent{å¤šè¿œé—»åˆ°å–‰å’™è‡­}%
    %
}


\channelMsgEntry{%
    \msgRealSource{cth451 ÇÉ”uÇÆƒÉ¹ÇÊŒá´‰p}{2021-06-27 22:58:40}%
    \msgMainContent{äºµæ¸è¡Œä¸ºç°åœº}%
    \nopagebreak\includegraphics[width=\linewidth]{./.tg-data/2021/photos/photo_214@27-06-2021_22-58-40.jpg}%
}


\channelMsgEntry{%
    \msgRealSource{cth451 ÇÉ”uÇÆƒÉ¹ÇÊŒá´‰p}{2021-06-27 22:58:40}%
    \msgMainContent{ï¼ˆé”™è¿‡äº†ä½¿ç”¨ zfs çš„æ—¶æœº}%
    %
}


\channelMsgEntry{%
    \msgRealSource{Mingcong Bai}{2021-06-27 22:58:41}%
    \msgMainContent{@TheSaltedFish @TheSaltedFish @TheSaltedFish @TheSaltedFish
@TheSaltedFish @TheSaltedFish}%
    %
}


\channelMsgEntry{%
    \msgRealSource{å’¸é±¼}{2021-06-27 23:06:53}%
    \msgMainContent{shet}%
    %
}


\channelMsgEntry{%
    \msgRealSource{å’¸é±¼}{2021-06-27 23:06:54}%
    \msgMainContent{ä½ é€€ç¾¤å§ï¼ˆx}%
    %
}


\channelMsgEntry{%
    \msgRealSource{åŒå€å¤šå¤šå†°ğŸ§¶ | ğ¦ğŸğœğŸ}{2021-06-29 06:38:07}%
    \msgMainContent{åˆšæ‰è¶…çº§å¹»è§†}%
    %
}


\channelMsgEntry{%
    \msgRealSource{åŒå€å¤šå¤šå†°ğŸ§¶ | ğ¦ğŸğœğŸ}{2021-06-29 06:38:08}%
    \msgMainContent{æŠŠ åè¶…çº§å— ï¼ˆmount å¤±è´¥çš„é”™è¯¯ä¿¡æ¯çš„ä¸€éƒ¨åˆ†ï¼‰}%
    %
}


\channelMsgEntry{%
    \msgRealSource{åŒå€å¤šå¤šå†°ğŸ§¶ | ğ¦ğŸğœğŸ}{2021-06-29 06:38:08}%
    \msgMainContent{çœ‹æˆäº† è¶…çº§åå—}%
    %
}


\channelMsgEntry{%
    \msgRealSource{weitao23333}{2021-07-01 05:01:21}%
    \msgMainContent{é‚£ä½ ç°åœ¨æ€ä¹ˆçœ‹veket}%
    %
}


\channelMsgEntry{%
    \msgRealSource{Mingcong Bai}{2021-07-01 05:01:21}%
    \msgMainContent{æˆ‘æ•¬é‡ä»–ä»¬}%
    %
}


\channelMsgEntry{%
    \msgRealSource{weitao23333}{2021-07-01 05:01:21}%
    \msgMainContent{åƒçœ‹è€å‰è¾ˆé‚£æ ·çš„ï¼Ÿ}%
    %
}


\channelMsgEntry{%
    \msgRealSource{Mingcong Bai}{2021-07-01 05:01:21}%
    \msgMainContent{æ²¡å•Šï¼Œè‡³å°‘ä»–ä»¬åœ¨åšäº‹}%
    %
}


\channelMsgEntry{%
    \msgRealSource{weitao23333}{2021-07-01 05:01:22}%
    \msgMainContent{æ¯”å¦‚}%
    %
}


\channelMsgEntry{%
    \msgRealSource{Mingcong Bai}{2021-07-01 05:01:22}%
    \msgMainContent{æ¯”å¦‚ä¸åƒä½ ç°åœ¨åœ¨æ°´ç¾¤ï¼ˆ}%
    %
}


\channelMsgEntry{%
    \msgRealSource{Mingcong Bai}{2021-07-01 15:00:06}%
    \msgMainContent{AOSC ç°åœ¨éƒ½å¿«å˜æˆä¸ªæŠ€ç ”ä¼šäº†}%
    %
}


\channelMsgEntry{%
    \msgRealSource{Mingcong Bai}{2021-07-01 15:00:06}%
    \msgMainContent{æ˜¯è¯¥æƒ³æƒ³æ€æ ·èµ°å‘å¸‚åœºäº†ï¼ˆ}%
    %
}


\channelMsgEntry{%
    \msgRealSource{Junde Yhi}{2021-07-01 15:00:06}%
    \msgMainContent{æœ€é«˜æŒ‡ç¤º}%
    %
}


\channelMsgEntry{%
    \msgRealSource{æ°¸ç¥¥}{2021-07-01 15:00:06}%
    \msgMainContent{æ›´å¤šçš„æ¢—ï¼Ÿ}%
    %
}


\channelMsgEntry{%
    \msgRealSource{imi415}{2021-07-02 21:00:15}%
    \msgMainContent{aosc osï¼Œå…³çˆ±æ‚¨ã€æ‚¨çš„å¼€å‘æ¿ã€æ‚¨çš„è°œä¹‹å¤„ç†å™¨å’Œæ‚¨çš„å²å‰é—äº§}%
    %
}


\channelMsgEntry{%
    \msgRealSource{Mili}{2021-07-02 21:00:15}%
    \msgMainContent{è™šå‡å¹¿å‘Šï¼Œä¸æ”¯æŒæˆ‘çš„DEC PWS 500aï¼ˆé€ƒ}%
    %
}


\channelMsgEntry{%
    \msgRealSource{å’¸é±¼}{2021-07-03 04:23:53}%
    \msgMainContent{Senpaiiii sugoiiiiiii! UwU}%
    %
}


\channelMsgEntry{%
    \msgRealSource{CT1000MX500SSD1 1000.2 GB}{2021-07-03 04:23:54}%
    \msgMainContent{Stop it, get some help.}%
    %
}


\channelMsgEntry{%
    \msgRealSource{CT1000MX500SSD1 1000.2 GB}{2021-07-03 04:23:54}%
    \msgMainContent{Applies Yeston 6700XT perfumes.}%
    %
}


\channelMsgEntry{%
    \msgRealSource{liushuyu}{2021-07-03 04:23:55}%
    \msgMainContent{Latest and greatest in the Surface Mount Technology: perfume soldering (}%
    %
}


\channelMsgEntry{%
    \msgRealSource{Kexy Biscuit | è¢«å­é¥¼ï¸ | ç™¾åˆãƒ¶å’²ã‚‹ã‚‹}{2021-07-09 05:03:13}%
    \msgMainContent{https://wiki.aosc.io/community/privacy-policy/}%
    %
}


\channelMsgEntry{%
    \msgRealSource{Mingcong Bai}{2021-07-09 05:03:14}%
    \msgMainContent{åº”è¯¥åŠ ä¸€å¥

This should make Microsoft happy.}%
    %
}


\channelMsgEntry{%
    \msgRealSource{Staph Bridge}{2021-07-09 05:03:15}%
    \msgMainContent{{[}D-Fearyncess{]} xs ç„¶åç§’æ‹’å—ï¼ˆ}%
    %
}


\channelMsgEntry{%
    \msgRealSource{liushuyu}{2021-07-09 14:32:36}%
    \msgMainContent{è¶…çº§ï¼Œä¸¥é‡ï¼Œè¿‡åº¦è®¾è®¡ï¼ˆ}%
    \nopagebreak\includegraphics[width=\linewidth]{./.tg-data/2021/photos/photo_215@09-07-2021_14-32-36.jpg}%
}


\channelMsgEntry{%
    \msgRealSource{ĞĞµĞ‘ÑƒÑ‚Ğ»ĞµĞ³ ï¼ˆè¿«çœŸï¼‰}{2021-07-09 14:32:36}%
    \msgMainContent{ç‚¹é’æµ·æ˜Ÿ}%
    %
}


\channelMsgEntry{%
    \msgRealSource{Staph Bridge}{2021-07-09 14:32:36}%
    \msgMainContent{{[}D-Fearyncess{]} ç¬‘æ­»}%
    %
}


\channelMsgEntry{%
    \msgRealSource{Staph Bridge}{2021-07-09 14:32:36}%
    \msgMainContent{{[}D-Fearyncess{]} ç‚¹é’}%
    %
}


\channelMsgEntry{%
    \msgRealSource{Junde Yhi}{2021-07-09 14:32:36}%
    \msgMainContent{å£°éŸ³å‡ºæ¥äº†}%
    %
}


\channelMsgEntry{%
    \msgRealSource{Junde Yhi}{2021-07-09 14:32:37}%
    \msgMainContent{é‚£ä¹ˆé€‰æ‹©åˆ†æ”¯æ˜¯å¦åº”è¯¥å«ä½œ Withdraw}%
    %
}


\channelMsgEntry{%
    \msgRealSource{èˆŠå¤©ä¸‹ OriginCode // Ristaccia}{2021-07-09 14:32:37}%
    \msgMainContent{ğŸ¤£}%
    %
}


\channelMsgEntry{%
    \msgRealSource{Lion III}{2021-07-19 01:01:21}%
    \msgMainContent{\emph{aeugh} (è¶…å°å£°)}%
    %
}


\channelMsgEntry{%
    \msgRealSource{cth451 ÇÉ”uÇÆƒÉ¹ÇÊŒá´‰p}{2021-07-19 01:01:25}%
    \msgMainContent{\#æ€ä¹ˆå«}%
    %
}


\channelMsgEntry{%
    \msgRealSource{Leo Shen}{2021-07-19 04:00:11}%
    \msgMainContent{}%
    \nopagebreak\includegraphics[width=\linewidth]{./.tg-data/2021/photos/photo_216@19-07-2021_04-00-11.jpg}%
}


\channelMsgEntry{%
    \msgRealSource{åŒå€å¤šå¤šå†°ğŸ§¶ | ğ¦ğŸğœğŸ}{2021-07-19 04:00:12}%
    \msgMainContent{æ°´äº§ï¼Ÿ}%
    %
}


\channelMsgEntry{%
    \msgRealSource{Leo Shen}{2021-07-19 04:00:13}%
    \msgMainContent{åŒè·¯æ°´äº§ ()}%
    %
}


\channelMsgEntry{%
    \msgRealSource{Mingcong Bai}{2021-07-19 04:00:13}%
    \msgMainContent{å¯¹è™¾}%
    %
}


\channelMsgEntry{%
    \msgRealSource{Mag Mell}{2021-07-19 09:43:03}%
    \msgMainContent{@JeffBai 5.12.2+wk5.212.0+kde20210713 é€™æ¨£ï¼Ÿ}%
    %
}


\channelMsgEntry{%
    \msgRealSource{Mingcong Bai}{2021-07-19 09:43:03}%
    \msgMainContent{æŠŠ Qt 5 drop äº†å§}%
    %
}


\channelMsgEntry{%
    \msgRealSource{Mingcong Bai}{2021-07-19 09:43:03}%
    \msgMainContent{çœ‹ç€é‚£ç‰ˆæœ¬å·æˆ‘å°±æƒ³è§£æ•£ AOSCï¼ˆx}%
    %
}


\channelMsgEntry{%
    \msgRealSource{Kexy Biscuit | è¢«å­é¥¼ï¸ | ç™¾åˆãƒ¶å’²ã‚‹ã‚‹}{2021-07-19 09:43:03}%
    \msgMainContent{Two OSC æˆç«‹ï¼ˆï¼Ÿ}%
    %
}


\channelMsgEntry{%
    \msgRealSource{åŒå€å¤šå¤šå†°ğŸ§¶ | ğ¦ğŸğœğŸ}{2021-07-22 11:06:43}%
    \msgMainContent{åŒ—å†¥æœ‰é±¼ï¼Œå…¶åä¸ºé²²ã€‚é²²ä¹‹å¤§ï¼Œè¶…è¿‡ 32 ä½åœ°å€ç©ºé—´}%
    %
}


\channelMsgEntry{%
    \msgRealSource{ĞĞµĞ‘ÑƒÑ‚Ğ»ĞµĞ³ ï¼ˆè¿«çœŸï¼‰}{2021-07-24 03:56:17}%
    \msgMainContent{}%
    \nopagebreak\includegraphics[width=\linewidth]{./.tg-data/2021/photos/photo_217@24-07-2021_03-56-17.jpg}%
}


\channelMsgEntry{%
    \msgRealSource{ĞĞµĞ‘ÑƒÑ‚Ğ»ĞµĞ³ ï¼ˆè¿«çœŸï¼‰}{2021-07-24 03:56:18}%
    \msgMainContent{è¿™ä¸ªè¡¨ç›˜åƒä»€ä¹ˆï¼ˆx}%
    %
}


\channelMsgEntry{%
    \msgRealSource{Mingcong Bai}{2021-07-24 03:56:19}%
    \msgMainContent{Huh}%
    %
}


\channelMsgEntry{%
    \msgRealSource{Mingcong Bai}{2021-07-24 03:56:19}%
    \msgMainContent{æ˜å¤©å‘Šåä¸º}%
    %
}


\channelMsgEntry{%
    \msgRealSource{MoGeCâ‚â‚„N Yang}{2021-07-24 04:02:26}%
    \msgMainContent{ç„¶åAOSCæ²¡æœ‰Â®åªæœ‰â‘¨}%
    %
}


\channelMsgEntry{%
    \msgRealSource{GLOWAY YCT512GS3-S7 Pro}{2021-07-24 04:02:26}%
    \msgMainContent{ä¹†ï¼Ÿ}%
    %
}


\channelMsgEntry{%
    \msgRealSource{Mingcong Bai}{2021-07-24 04:02:26}%
    \msgMainContent{ä¹†ï¼}%
    %
}


\channelMsgEntry{%
    \msgRealSource{åŒå€å¤šå¤šå†°ğŸ§¶ | ğ¦ğŸğœğŸ}{2021-07-26 01:40:34}%
    \msgMainContent{åŒå¤§ä¸€ä¸ª Allwinner æ°´å°ï¼ˆé€ƒ}%
    %
}


\channelMsgEntry{%
    \msgRealSource{åŒå€å¤šå¤šå†°ğŸ§¶ | ğ¦ğŸğœğŸ}{2021-07-26 01:40:35}%
    \msgMainContent{}%
    \nopagebreak\includegraphics[width=\linewidth]{./.tg-data/2021/photos/photo_218@26-07-2021_01-40-35.jpg}%
}


\channelMsgEntry{%
    \msgRealSource{CT1000MX500SSD1 1000.2 GB}{2021-07-26 01:40:35}%
    \msgMainContent{èµ¢éº»äº†å…¬å¸}%
    %
}


\channelMsgEntry{%
    \msgRealSource{å’¸é±¼}{2021-07-26 01:57:41}%
    \msgMainContent{ä½ ä»¬è¿™ç¾¤æ‹¿å‹å·å½“æ˜µç§°çš„äººå•Šï¼Œå•§å•§å•§}%
    %
}


\channelMsgEntry{%
    \msgRealSource{å’¸é±¼}{2021-07-26 01:57:46}%
    \msgMainContent{å•§å•§å•§å•§å•§å•§}%
    %
}


\channelMsgEntry{%
    \msgRealSource{å’¸é±¼}{2021-07-26 01:57:58}%
    \msgMainContent{æ ¹æœ¬è®¤ä¸å‡ºæ¥è°æ˜¯è°}%
    %
}


\channelMsgEntry{%
    \msgRealSource{GLOWAY YCT512GS3-S7 Pro}{2021-07-27 12:04:46}%
    \msgMainContent{äººè‚‰å¤åˆ»}%
    \nopagebreak\includegraphics[width=\linewidth]{./.tg-data/2021/photos/photo_219@27-07-2021_12-04-46.jpg}%
}


\channelMsgEntry{%
    \msgRealSource{liushuyu}{2021-07-28 23:31:49}%
    \msgMainContent{@jyuzoungaangengjan @JeffBai å¦‚æœæ²¡æœ‰åˆ«çš„é—®é¢˜æˆ‘å°±åˆå¹¶äº†}%
    %
}


\channelMsgEntry{%
    \msgRealSource{Mingcong Bai}{2021-07-28 23:31:49}%
    \msgMainContent{ç¨åå•æ‰€}%
    %
}


\channelMsgEntry{%
    \msgRealSource{Mingcong Bai}{2021-07-30 01:03:01}%
    \msgMainContent{åœ¨ KTV}%
    %
}


\channelMsgEntry{%
    \msgRealSource{liushuyu}{2021-07-30 01:03:01}%
    \msgMainContent{æˆ‘è¿‡ä¼šå„¿æ¥ï¼ˆ}%
    %
}


\channelMsgEntry{%
    \msgRealSource{Mingcong Bai}{2021-07-30 01:03:01}%
    \msgMainContent{æ™šäº†ï¼Œä½ è¢«å¼€é™¤äº†ï¼ˆx}%
    %
}


\channelMsgEntry{%
    \msgRealSource{liushuyu}{2021-07-30 01:03:01}%
    \msgMainContent{è‰ï¼Œè¿™ä¹ˆå‹è¿«çš„å—ï¼ˆ}%
    %
}


\channelMsgEntry{%
    \msgRealSource{Mingcong Bai}{2021-07-31 23:05:22}%
    \msgMainContent{}%
    \nopagebreak\includegraphics[width=\linewidth]{./.tg-data/2021/photos/photo_220@31-07-2021_23-05-22.jpg}%
}


\channelMsgEntry{%
    \msgRealSource{Mingcong Bai}{2021-07-31 23:05:22}%
    \msgMainContent{ä» ProLiant åˆ° Jornada}%
    %
}


\channelMsgEntry{%
    \msgRealSource{Mingcong Bai}{2021-07-31 23:05:23}%
    \msgMainContent{æ²¡äººèƒ½ä¿ä½åº•è£¤}%
    %
}


\channelMsgEntry{%
    \msgRealSource{åŒå€å¤šå¤šå†°ğŸ§¶ | ğ¦ğŸğœğŸ}{2021-08-01 04:42:45}%
    \msgMainContent{AOSC people are not Systemd haters, and I use systemd on my devices,
from servers to a phone. --- Icenowy}%
    %
}


\channelMsgEntry{%
    \msgRealSource{liushuyu}{2021-08-10 02:44:44}%
    \msgMainContent{ä½ çœŸçš„æœŸæœ› Citra é‡Œé¢æœ‰äººèƒ½çœ‹æ‡‚ä½ çš„é‚®ä»¶ï¼Ÿï¼ˆ}%
    \nopagebreak\includegraphics[width=\linewidth]{./.tg-data/2021/photos/photo_221@10-08-2021_02-44-44.jpg}%
}


\channelMsgEntry{%
    \msgRealSource{Boyuan Yang}{2021-08-10 02:44:45}%
    \msgMainContent{é‚£ä½ ä¸æ˜¯çœ‹æ‡‚äº†ä¹ˆï¼ˆ}%
    %
}


\channelMsgEntry{%
    \msgRealSource{Mingcong Bai}{2021-08-10 06:51:40}%
    \msgMainContent{è‰ºæœ¯çš„çŠ¶æ€------åœ¨ ARMv4 è®¾å¤‡ä¸Šåˆ©ç”¨ io\_uring æŠ€æœ¯}%
    \nopagebreak\includegraphics[width=\linewidth]{./.tg-data/2021/photos/photo_222@10-08-2021_06-51-40.jpg}%
}


\channelMsgEntry{%
    \msgRealSource{åŒå€å¤šå¤šå†°ğŸ§¶ | ğ¦ğŸğœğŸ}{2021-08-14 00:51:54}%
    \msgMainContent{ä½ ä¹Ÿæ½˜æ¾å°¼å…‹}%
    %
}


\channelMsgEntry{%
    \msgRealSource{Mingcong Bai}{2021-08-14 00:51:54}%
    \msgMainContent{ä»–æŠ¢æˆ‘è€å©†}%
    %
}


\channelMsgEntry{%
    \msgRealSource{Mingcong Bai}{2021-08-14 00:51:54}%
    \msgMainContent{éƒ‘å¸ˆå‚…è¯„è¯„ç†}%
    %
}


\channelMsgEntry{%
    \msgRealSource{åŒå€å¤šå¤šå†°ğŸ§¶ | ğ¦ğŸğœğŸ}{2021-08-15 01:52:02}%
    \msgMainContent{ä¹‹å‰æ‹¿æ¥è·‘ AOSC çš„æˆ‘å¸æ‰­æ›²ä¸œè¥¿ä¸Šæ¶äº†ï¼ˆé€ƒ}%
    \nopagebreak\includegraphics[width=\linewidth]{./.tg-data/2021/photos/photo_223@15-08-2021_01-52-02.jpg}%
}


\channelMsgEntry{%
    \msgRealSource{Mingcong Bai}{2021-08-15 01:52:03}%
    \msgMainContent{SiFive but peed}%
    %
}


\channelMsgEntry{%
    \msgRealSource{åŒå€å¤šå¤šå†°ğŸ§¶ | ğ¦ğŸğœğŸ}{2021-08-18 17:44:08}%
    \msgMainContent{ç°åœ¨æ˜¯ https://avatars.githubusercontent.com/u/1918868?s=200\&v=4}%
    %
}


\channelMsgEntry{%
    \msgRealSource{RongrongğŸ§Š | å¯å£å¯çˆ±}{2021-08-18 17:44:09}%
    \msgMainContent{ç«–è¿‡æ¥çœ‹ï¼Œå°±æ˜¯ä¸ªç©¿è£™å­çš„å°äººï¼Œè€Œå›¾ä¸­éšå»äº†æ‰‹è„šï¼Œå°±ä»¤äººç”Ÿç–‘ï¼šæ²¡æœ‰è…¿è„šæ€ä¹ˆç©¿å†…è£¤å‘¢ï¼Ÿ}%
    %
}


\channelMsgEntry{%
    \msgRealSource{Mingcong Bai}{2021-08-21 01:01:04}%
    \msgMainContent{AOSC ä¸Šæµ·å¸®è¦æ¥å¤ºå¹¿ä¸œå¸®çš„æƒ}%
    %
}


\channelMsgEntry{%
    \msgRealSource{Rick Liu}{2021-08-21 01:01:04}%
    \msgMainContent{ä¸æ˜¯å·²ç»æœ‰å¹¿ä¸œåŠ¿åŠ›æ‰“å…¥ä¸Šæµ·å¸®äº†å˜›ï¼ˆ}%
    %
}


\channelMsgEntry{%
    \msgRealSource{å’¸é±¼}{2021-08-21 01:01:05}%
    \msgMainContent{æµ™æ±ŸåŠ¿åŠ›ä»€ä¹ˆæ—¶å€™æ‰èƒ½ç«™èµ·æ¥.svg}%
    %
}


\channelMsgEntry{%
    \msgRealSource{Mingcong Bai}{2021-08-21 01:01:05}%
    \msgMainContent{é¾™èŠ¯éª‚åŒ—äº¬äººï¼ŒAOSC éª‚ä¸Šæµ·äºº}%
    %
}


\channelMsgEntry{%
    \msgRealSource{Mingcong Bai}{2021-08-21 01:01:05}%
    \msgMainContent{æŒºå¥½çš„ï¼Œå¤ªé˜³ä¾ç„¶ç…§å¸¸å‡èµ·}%
    %
}


\channelMsgEntry{%
    \msgRealSource{CT1000MX500SSD4 1000.2 GB}{2021-08-21 01:01:05}%
    \msgMainContent{æ±Ÿè‹äººï¼ˆæŒ‡å‡ºï¼‰}%
    %
}


\channelMsgEntry{%
    \msgRealSource{CT1000MX500SSD4 1000.2 GB}{2021-08-21 01:01:05}%
    \msgMainContent{ï¼ˆæŒ‡é¾™æ¢¦ï¼‰}%
    %
}


\channelMsgEntry{%
    \msgRealSource{Mingcong Bai}{2021-08-21 01:01:05}%
    \msgMainContent{ä½†æ˜¯ AOSC æ´»ä½›åœ¨æ­¦æ±‰}%
    %
}


\channelMsgEntry{%
    \msgRealSource{å’¸é±¼}{2021-08-21 01:01:05}%
    \msgMainContent{ç¦»å¼€å§¥å§¥ä½ ä»¬ä»€ä¹ˆéƒ½ä¸æ˜¯ï¼}%
    %
}


\channelMsgEntry{%
    \msgRealSource{MoGeCâ‚â‚„N Yang}{2021-08-21 01:01:05}%
    \msgMainContent{ä¼ å‡ºå»ï¼Œå’¸é±¼è¯´å§¥å§¥ä»€ä¹ˆéƒ½ä¸æ˜¯}%
    %
}


\channelMsgEntry{%
    \msgRealSource{lain.dll alt-lily}{2021-08-23 19:00:07}%
    \msgMainContent{IO stall}%
    %
}


\channelMsgEntry{%
    \msgRealSource{lain.dll alt-lily}{2021-08-23 19:00:07}%
    \msgMainContent{PULL-UP PULL-UP}%
    %
}


\channelMsgEntry{%
    \msgRealSource{åŒå€å¤šå¤šå†°ğŸ§¶ | ğ¦ğŸğœğŸ}{2021-08-30 13:13:20}%
    \msgMainContent{è‰¹}%
    %
}


\channelMsgEntry{%
    \msgRealSource{åŒå€å¤šå¤šå†°ğŸ§¶ | ğ¦ğŸğœğŸ}{2021-08-30 13:13:21}%
    \msgMainContent{æˆ‘åˆšæ‰çªç„¶ DNS æ²¡æ³•è§£æ}%
    %
}


\channelMsgEntry{%
    \msgRealSource{åŒå€å¤šå¤šå†°ğŸ§¶ | ğ¦ğŸğœğŸ}{2021-08-30 13:13:22}%
    \msgMainContent{è¿˜ä»¥ä¸ºç½‘æŒ‚äº†}%
    %
}


\channelMsgEntry{%
    \msgRealSource{åŒå€å¤šå¤šå†°ğŸ§¶ | ğ¦ğŸğœğŸ}{2021-08-30 13:13:22}%
    \msgMainContent{ç»“æœåªæ˜¯ systemd-resolved æŒ‚äº†}%
    %
}


\channelMsgEntry{%
    \msgRealSource{åŒå€å¤šå¤šå†°ğŸ§¶ | ğ¦ğŸğœğŸ}{2021-08-30 13:13:23}%
    \msgMainContent{å±è‚¡ä¸€å‡‰}%
    %
}


\channelMsgEntry{%
    \msgRealSource{CT1000MX500SSD1 1000.2 GB}{2021-08-30 13:13:24}%
    \msgMainContent{è¿™æ˜¯åº•è£¤ç€ç«äº†}%
    %
}


\channelMsgEntry{%
    \msgRealSource{CT1000MX500SSD1 1000.2 GB}{2021-08-30 13:13:24}%
    \msgMainContent{å±è‚¡ä¸€çƒ­}%
    %
}


\channelMsgEntry{%
    \msgRealSource{CT1000MX500SSD1 1000.2 GB}{2021-08-30 13:13:30}%
    \msgMainContent{ç„¶åå‡å¤©äº†}%
    %
}


\channelMsgEntry{%
    \msgRealSource{CT1000MX500SSD1 1000.2 GB}{2021-08-30 13:13:30}%
    \msgMainContent{è¿˜å‘å‡ºå…ˆè¾ˆä¸€èˆ¬çš„å«å£°}%
    %
}


\channelMsgEntry{%
    \msgRealSource{Junde Yhi}{2021-08-30 13:13:31}%
    \msgMainContent{å‡å¤©ï¼ˆæŒ‡ attempt to kill init}%
    %
}


\channelMsgEntry{%
    \msgRealSource{èˆŠå¤©ä¸‹ OriginCode // Ristaccia}{2021-08-30 23:02:42}%
    \msgMainContent{ç™½å“¥å“¥ï¼Œæˆ‘çš„ kamiï¼}%
    %
}


\channelMsgEntry{%
    \msgRealSource{Mingcong Bai}{2021-08-30 23:02:43}%
    \msgMainContent{Ğ‘Ğ»ÑÑÑÑÑÑÑÑÑ}%
    %
}


\channelMsgEntry{%
    \msgRealSource{Lion III}{2021-09-02 21:40:53}%
    \msgMainContent{é‚®ç®±æ˜¯åªæœ‰ 2GB å—ï¼Œçœ‹èµ·æ¥æˆ‘çš„å¿«è£…æ»¡äº†}%
    %
}


\channelMsgEntry{%
    \msgRealSource{U+200D}{2021-09-02 21:40:54}%
    \msgMainContent{é‚®ç®±ä¼šè‡ªåŠ¨é•¿å¤§çš„}%
    %
}


\channelMsgEntry{%
    \msgRealSource{U+200D}{2021-09-02 21:40:55}%
    \msgMainContent{Current usage + 80Mb}%
    %
}


\channelMsgEntry{%
    \msgRealSource{U+200D}{2021-09-02 21:40:55}%
    \msgMainContent{ä¸¤å¹´å‰å†™çš„ cronjobï¼ˆæ®‹å¿µ}%
    %
}


\channelMsgEntry{%
    \msgRealSource{U+200D}{2021-09-02 21:40:56}%
    \msgMainContent{æˆ‘ç”šè‡³å¿˜è®°å®ƒåœ¨å­¦æ ¡å“ªå°æœºå­ä¸Šäº†}%
    %
}


\channelMsgEntry{%
    \msgRealSource{U+200D}{2021-09-02 21:40:56}%
    \msgMainContent{æˆ‘åªçŸ¥é“å®ƒè¿˜åœ¨è·‘}%
    %
}


\channelMsgEntry{%
    \msgRealSource{Lion III}{2021-09-02 21:40:57}%
    \msgMainContent{äººç±»ç­ç»ä¹‹åï¼Œ@aosc.io çš„ cronjob è¿˜åœ¨è¿è¡Œ}%
    %
}


\channelMsgEntry{%
    \msgRealSource{å’¸é±¼}{2021-09-20 03:22:46}%
    \msgMainContent{å§¥å§¥åˆšåˆšè¯´æƒ³è·Ÿæœå†»æ¿€å»}%
    %
}


\channelMsgEntry{%
    \msgRealSource{å’¸é±¼}{2021-09-20 03:22:46}%
    \msgMainContent{è¿™æ ·}%
    %
}


\channelMsgEntry{%
    \msgRealSource{liushuyu}{2021-09-20 03:22:46}%
    \msgMainContent{æ²¡æœ‰å•Š}%
    %
}


\channelMsgEntry{%
    \msgRealSource{liushuyu}{2021-09-20 03:22:46}%
    \msgMainContent{ä½ å’¸é±¼åˆåœ¨é‚£é‡Œå‡æ–°é—»}%
    %
}


\channelMsgEntry{%
    \msgRealSource{å’¸é±¼}{2021-09-20 03:22:46}%
    \msgMainContent{ä¼ ä¸‹å»}%
    %
}


\channelMsgEntry{%
    \msgRealSource{Mingcong Bai}{2021-09-20 03:26:39}%
    \msgMainContent{ä½ å°å¿ƒæˆ‘æŠŠä½ æ‹¿å»å–‚å‰‘å°¾ï¼ˆ}%
    %
}


\channelMsgEntry{%
    \msgRealSource{Mingcong Bai}{2021-09-20 03:26:39}%
    \msgMainContent{äººå®¶é¥¿ç€å‘¢}%
    %
}


\channelMsgEntry{%
    \msgRealSource{å’¸é±¼}{2021-09-20 04:08:54}%
    \msgMainContent{è¿™èƒ½å«é€ è°£å—ï¼Œæ²¡æœ‰è¯æ®çš„äº‹æƒ…èƒ½å«é€ è°£å—}%
    %
}


\channelMsgEntry{%
    \msgRealSource{liushuyu}{2021-09-21 07:45:18}%
    \msgMainContent{ä¿®äº†ï¼Œé¡ºä¾¿è°ƒæ•´äº†ä¸€ä¸‹ thumbnailï¼ˆ}%
    \nopagebreak\includegraphics[width=\linewidth]{./.tg-data/2021/photos/photo_224@21-09-2021_07-45-18.jpg}%
}


\channelMsgEntry{%
    \msgRealSource{Kexy Biscuit | è¢«å­é¥¼ï¸ | ç™¾åˆãƒ¶å’²ã‚‹ã‚‹}{2021-09-21 07:45:18}%
    \msgMainContent{è´¢å¯Œå¯†ç }%
    %
}


\channelMsgEntry{%
    \msgRealSource{FlyGoat}{2021-09-26 23:10:01}%
    \msgMainContent{osuå’Œç´«è‰²uwå¼€å­¦å·®ä¸€ä¸ªæœˆ}%
    %
}


\channelMsgEntry{%
    \msgRealSource{å’¸é±¼}{2021-09-26 23:10:01}%
    \msgMainContent{Click the Circles!}%
    %
}


\channelMsgEntry{%
    \msgRealSource{Junde Yhi}{2021-09-26 23:10:01}%
    \msgMainContent{To the beat!}%
    %
}


\channelMsgEntry{%
    \msgRealSource{Give Way}{2021-09-29 23:41:40}%
    \msgMainContent{ç¾¤æˆ‘ä¸ç´«UW}%
    %
}


\channelMsgEntry{%
    \msgRealSource{Give Way}{2021-09-29 23:41:41}%
    \msgMainContent{ä½†æ˜¯æ‚¨è‡³å°‘ä¹ŸUW}%
    %
}


\channelMsgEntry{%
    \msgRealSource{cth451 ÇÉ”uÇÆƒÉ¹ÇÊŒá´‰p}{2021-09-29 23:41:42}%
    \msgMainContent{UW å’Œ UW ä¹‹é—´å¹¶ä¸å¹³ç­‰}%
    %
}


\channelMsgEntry{%
    \msgRealSource{ãªãªã¿ çª“è¾º}{2021-10-03 01:31:59}%
    \msgMainContent{ğŸ˜˜ğŸ˜˜ğŸ˜˜ğŸ˜˜ğŸ˜˜ğŸ˜˜ @liushuyu}%
    %
}


\channelMsgEntry{%
    \msgRealSource{ãªãªã¿ çª“è¾º}{2021-10-03 01:31:59}%
    \msgMainContent{å¯çˆ±æŸ³æ ‘é±¼}%
    %
}


\channelMsgEntry{%
    \msgRealSource{liushuyu}{2021-10-03 01:31:59}%
    \msgMainContent{ï¼Ÿï¼Ÿï¼Ÿ}%
    %
}


\channelMsgEntry{%
    \msgRealSource{ãªãªã¿ çª“è¾º}{2021-10-03 01:31:59}%
    \msgMainContent{è´´è´´}%
    %
}


\channelMsgEntry{%
    \msgRealSource{Mingcong Bai}{2021-10-03 01:31:59}%
    \msgMainContent{Windows 7 - the horniest OS ever}%
    %
}


\channelMsgEntry{%
    \msgRealSource{FlyGoat}{2021-10-03 20:58:47}%
    \msgMainContent{}%
    \nopagebreak\includegraphics[width=\linewidth]{./.tg-data/2021/photos/photo_225@03-10-2021_20-58-47.jpg}%
}


\channelMsgEntry{%
    \msgRealSource{FlyGoat}{2021-10-03 20:58:47}%
    \msgMainContent{rpiç«Ÿç„¶æ˜¯é…¸çš„}%
    %
}


\channelMsgEntry{%
    \msgRealSource{FlyGoat}{2021-10-03 20:58:48}%
    \msgMainContent{èµ”é’±}%
    %
}


\channelMsgEntry{%
    \msgRealSource{å’¸é±¼}{2021-10-03 20:58:49}%
    \msgMainContent{ä½ åœ¨æœŸå¾…ä»€ä¹ˆï¼ˆx}%
    %
}


\channelMsgEntry{%
    \msgRealSource{FlyGoat}{2021-10-03 20:58:49}%
    \msgMainContent{åªèƒ½è¯´ RaspberryPiè¿™ä¸ªåå­—ç»™äº†æˆ‘ä¸€ç§ä»–åº”è¯¥å¾ˆå¥½åƒçš„é”™è§‰}%
    %
}


\channelMsgEntry{%
    \msgRealSource{å’¸é±¼}{2021-10-03 20:58:50}%
    \msgMainContent{ä½ æ€ä¹ˆå¯ä»¥æŠŠä½ å¯¹æ ‘è“çš„æœŸæœ›å¸¦å…¥åˆ°æ‰€æœ‰äººèº«ä¸Šï¼}%
    %
}


\channelMsgEntry{%
    \msgRealSource{å’¸é±¼}{2021-10-03 20:58:50}%
    \msgMainContent{å¿«å¯¹æ ‘è“é“æ­‰ï¼}%
    %
}


\channelMsgEntry{%
    \msgRealSource{ç›ä¸½äºšÂ·åºå·´è¿ª}{2021-10-04 08:00:44}%
    \msgMainContent{ä½ ä¸ºä½•è´´å‡ºè¿™ç¯‡å›ç­”ï¼ˆï¼‰}%
    %
}


\channelMsgEntry{%
    \msgRealSource{åŒå€å¤šå¤šå†°ğŸ§¶ | ğ¦ğŸğœğŸ}{2021-10-04 08:00:44}%
    \msgMainContent{å¾€ç¾¤é‡Œå€’å±ï¼ˆé€ƒ}%
    %
}


\channelMsgEntry{%
    \msgRealSource{åŒå€å¤šå¤šå†°ğŸ§¶ | ğ¦ğŸğœğŸ}{2021-10-04 08:00:44}%
    \msgMainContent{åªè¦æˆ‘æ‰¿è®¤æˆ‘åœ¨å¾€ç¾¤é‡Œå€’å±}%
    %
}


\channelMsgEntry{%
    \msgRealSource{åŒå€å¤šå¤šå†°ğŸ§¶ | ğ¦ğŸğœğŸ}{2021-10-04 08:00:44}%
    \msgMainContent{ä½ å°±ä¸èƒ½å› ä¸ºæˆ‘å¾€ç¾¤é‡Œå€’å±}%
    %
}


\channelMsgEntry{%
    \msgRealSource{åŒå€å¤šå¤šå†°ğŸ§¶ | ğ¦ğŸğœğŸ}{2021-10-04 08:00:44}%
    \msgMainContent{è°´è´£æˆ‘}%
    %
}


\channelMsgEntry{%
    \msgRealSource{Mingcong Bai}{2021-10-06 19:20:18}%
    \msgMainContent{Merde}%
    %
}


\channelMsgEntry{%
    \msgRealSource{Mingcong Bai}{2021-10-06 19:20:18}%
    \msgMainContent{è¿™ GNOME æå¾— libsoup éƒ½è¦åŒç‰ˆæœ¬äº†}%
    %
}


\channelMsgEntry{%
    \msgRealSource{Mingcong Bai}{2021-10-06 19:20:19}%
    \msgMainContent{æˆ‘å¯ä»¥ drop GNOME å—æŸ´è€æ¿ @cth451}%
    %
}


\channelMsgEntry{%
    \msgRealSource{Mingcong Bai}{2021-10-06 19:20:19}%
    \msgMainContent{Fucking-diculous}%
    %
}


\channelMsgEntry{%
    \msgRealSource{å’¸é±¼}{2021-10-11 21:54:45}%
    \msgMainContent{OC gie gie èƒŒç€æˆ‘æ‰¾ç”·äºº}%
    %
}


\channelMsgEntry{%
    \msgRealSource{å’¸é±¼}{2021-10-11 21:54:46}%
    \msgMainContent{ç¯ gie gie ä¹ŸèƒŒç€æˆ‘æ‰¾ç”·äºº}%
    %
}


\channelMsgEntry{%
    \msgRealSource{å’¸é±¼}{2021-10-11 21:54:46}%
    \msgMainContent{ä½ è´Ÿå¿ƒæ±‰ä½ è‡ªå·±æ¥}%
    %
}


\channelMsgEntry{%
    \msgRealSource{å’¸é±¼}{2021-10-11 21:54:47}%
    \msgMainContent{å‡­ä»€ä¹ˆæˆ‘è¦å»æ‰¾è´Ÿå¿ƒæ±‰ï¼ˆï¼Ÿ}%
    %
}


\channelMsgEntry{%
    \msgRealSource{U+200D}{2021-10-11 21:54:48}%
    \msgMainContent{ä½ å¿«åŒ—ä¸Š}%
    %
}


\channelMsgEntry{%
    \msgRealSource{U+200D}{2021-10-11 21:54:48}%
    \msgMainContent{å¯ä»¥ 3p}%
    %
}


\channelMsgEntry{%
    \msgRealSource{å’¸é±¼}{2021-10-11 21:54:49}%
    \msgMainContent{æˆ‘ä»¥ä¸ºæˆ‘å·²ç»å¾ˆæ€ªäº†}%
    %
}


\channelMsgEntry{%
    \msgRealSource{å’¸é±¼}{2021-10-11 21:54:54}%
    \msgMainContent{ä½ ä»¬ç¯æ¯”æˆ‘è¿˜æ€ª}%
    %
}


\channelMsgEntry{%
    \msgRealSource{cth451 ÇÉ”uÇÆƒÉ¹ÇÊŒá´‰p}{2021-10-11 22:14:02}%
    \msgMainContent{ä½ çœ‹çœ‹ä½ è¿™ä¸ªå’¸é±¼æ•´å¤©å«åˆ«äººè‡­ç”·äºº}%
    %
}


\channelMsgEntry{%
    \msgRealSource{cth451 ÇÉ”uÇÆƒÉ¹ÇÊŒá´‰p}{2021-10-11 22:14:02}%
    \msgMainContent{æˆ‘ä»¬åº”è¯¥ç»Ÿè®¡ä¸€ä¸‹è¢«å’¸é±¼å«è¿‡çš„è‡­ç”·äººçš„æ•°é‡}%
    %
}


\channelMsgEntry{%
    \msgRealSource{cth451 ÇÉ”uÇÆƒÉ¹ÇÊŒá´‰p}{2021-10-11 22:14:03}%
    \msgMainContent{æ¥çœ‹çœ‹å’¸é±¼è‡ªå·±æ˜¯ä¸æ˜¯è‡­ç”·äºº}%
    %
}


\channelMsgEntry{%
    \msgRealSource{å’¸é±¼}{2021-10-15 04:36:24}%
    \msgMainContent{æˆ‘å·²ç»æœ‰é©¾ç…§äº†}%
    %
}


\channelMsgEntry{%
    \msgRealSource{å’¸é±¼}{2021-10-15 04:36:24}%
    \msgMainContent{ä¸ç„¶æ€ä¹ˆå»è·Ÿç™½ gie gie è´´è´´çš„}%
    %
}


\channelMsgEntry{%
    \msgRealSource{liushuyu}{2021-10-15 04:36:24}%
    \msgMainContent{çœŸæ¶å¿ƒï¼ˆ}%
    %
}


\channelMsgEntry{%
    \msgRealSource{å’¸é±¼}{2021-10-15 04:36:24}%
    \msgMainContent{æˆ‘çŸ¥é“å§¥å§¥å¿ƒé‡Œå…¶å®æœ€æƒ³è´´è´´äº†}%
    %
}


\channelMsgEntry{%
    \msgRealSource{Mingcong Bai}{2021-10-15 04:36:24}%
    \msgMainContent{å…¶å®å’¸é±¼æ˜¯è¯­è¨€èƒ½åŠ›ä¸è¡Œ}%
    %
}


\channelMsgEntry{%
    \msgRealSource{Mingcong Bai}{2021-10-15 04:36:24}%
    \msgMainContent{æˆ‘æ˜¯è¯·ä»–è¿‡æ¥ï¼ŒæŠŠä»–åšæˆé”…è´´çš„}%
    %
}


\channelMsgEntry{%
    \msgRealSource{liushuyu}{2021-10-15 04:36:24}%
    \msgMainContent{è¿™ä¹ˆå’¸çš„é”…è´´æ€•ä¸æ˜¯åƒäº†å°±ä¸Š ChubbyEmu çš„èŠ‚ç›®äº†ï¼ˆ}%
    %
}


\channelMsgEntry{%
    \msgRealSource{cth451 ÇÉ”uÇÆƒÉ¹ÇÊŒá´‰p}{2021-10-15 04:36:43}%
    \msgMainContent{ä¸‹ä¸€æœŸè´´çº¸å’¸é±¼é¥ºå­é¢„å®š}%
    %
}


\channelMsgEntry{%
    \msgRealSource{GitHub}{2021-10-19 08:49:41}%
    \msgMainContent{ğŸ’¬ New comment on aosc-os-abbs\#3600 {[}ci{]} vim: security update to
8.2.3536; \#3587 by @KexyBiscuit

\textsuperscript{C}C\textsuperscript{C}C\textsuperscript{C}C:q

Smoke test passed on AMD64.

Reply to this message to post a comment on GitHub.}%
    %
}


\channelMsgEntry{%
    \msgRealSource{å’¸é±¼}{2021-10-22 23:09:00}%
    \msgMainContent{Dear Bai Sir,

æ˜¨æ™šå¹²å˜›ä¸å•µå˜´å•Š}%
    %
}


\channelMsgEntry{%
    \msgRealSource{å’¸é±¼}{2021-10-22 23:09:01}%
    \msgMainContent{ç¤¾åŒºæœ‰è§„å®šï¼Œæˆå‘˜å¿…é¡»å•µç‰¹é¦–å˜´}%
    %
}


\channelMsgEntry{%
    \msgRealSource{weitao23333}{2021-11-02 21:53:33}%
    \msgMainContent{https://zhuanlan.zhihu.com/p/427608157}%
    %
}


\channelMsgEntry{%
    \msgRealSource{Kexy Biscuit | è¢«å­é¥¼ï¸ | ç™¾åˆãƒ¶å’²ã‚‹ã‚‹}{2021-11-02 21:53:34}%
    \msgMainContent{çœ‹è¿‡è¿™ç¯‡ï¼Œä¸æ˜æ‰€ä»¥}%
    %
}


\channelMsgEntry{%
    \msgRealSource{weitao23333}{2021-11-02 21:53:34}%
    \msgMainContent{ä¸ºä»€ä¹ˆ}%
    %
}


\channelMsgEntry{%
    \msgRealSource{Mingcong Bai}{2021-11-02 21:53:35}%
    \msgMainContent{å†…å®¹ç¢ç‰‡åŒ–è¿‡äºä¸¥é‡}%
    %
}


\channelMsgEntry{%
    \msgRealSource{CT1000MX500SSD1 1000.2 GB}{2021-11-02 21:53:36}%
    \msgMainContent{å†å²åšå£«åœ¨è¯»æ•™ä½ å¦‚ä½•å†™ä½œæ–‡ï¼ˆå…‰é€Ÿé€ƒ}%
    %
}


\channelMsgEntry{%
    \msgRealSource{Mingcong Bai}{2021-11-02 21:53:36}%
    \msgMainContent{å¯¹ä¸èµ·åˆå¦„è®®æ–‡å­¦äº†ï¼ˆ}%
    %
}


\channelMsgEntry{%
    \msgRealSource{CT1000MX500SSD1 1000.2 GB}{2021-11-05 19:26:23}%
    \msgMainContent{https://www.intel.com/content/www/us/en/support/articles/000057520/graphics/graphics-for-4th-generation-intel-processors.html}%
    %
}


\channelMsgEntry{%
    \msgRealSource{CT1000MX500SSD1 1000.2 GB}{2021-11-05 19:26:24}%
    \msgMainContent{Haswell, now officially retro}%
    %
}


\channelMsgEntry{%
    \msgRealSource{cth451 ÇÉ”uÇÆƒÉ¹ÇÊŒá´‰p}{2021-11-05 19:26:25}%
    \msgMainContent{Surface Pro 3}%
    %
}


\channelMsgEntry{%
    \msgRealSource{cth451 ÇÉ”uÇÆƒÉ¹ÇÊŒá´‰p}{2021-11-05 19:26:25}%
    \msgMainContent{Retro}%
    %
}


\channelMsgEntry{%
    \msgRealSource{cth451 ÇÉ”uÇÆƒÉ¹ÇÊŒá´‰p}{2021-11-16 04:07:13}%
    \msgMainContent{æˆ‘ç”šè‡³æ‰¾åˆ°äº†å¥‡æ€ªçš„ä¸œè¥¿}%
    %
}


\channelMsgEntry{%
    \msgRealSource{cth451 ÇÉ”uÇÆƒÉ¹ÇÊŒá´‰p}{2021-11-16 04:07:14}%
    \msgMainContent{}%
    \nopagebreak\includegraphics[width=\linewidth]{./.tg-data/2021/photos/photo_226@16-11-2021_04-07-14.jpg}%
}


\channelMsgEntry{%
    \msgRealSource{CT1000MX500SSD4 1000.2 GB}{2021-11-16 04:07:27}%
    \msgMainContent{\#å’¸é±¼æ€ä¹ˆå«}%
    %
}


\channelMsgEntry{%
    \msgRealSource{CT1000MX500SSD4 1000.2 GB}{2021-11-16 04:07:39}%
    \msgMainContent{\#æ€ä¹ˆå«}%
    %
}


\channelMsgEntry{%
    \msgRealSource{Mag Mell}{2021-11-19 10:34:12}%
    \msgMainContent{https://github.com/gmg137/netease-cloud-music-gtk ä¸å¯ç”¨ï¼Œä¸Šæ¸¸ä¹Ÿæ²’æœ‰å‹•ä½œ}%
    %
}


\channelMsgEntry{%
    \msgRealSource{Mingcong Bai}{2021-11-19 10:34:12}%
    \msgMainContent{Drop}%
    %
}


\channelMsgEntry{%
    \msgRealSource{Mingcong Bai}{2021-11-19 10:34:12}%
    \msgMainContent{Drop}%
    %
}


\channelMsgEntry{%
    \msgRealSource{Mingcong Bai}{2021-11-19 10:34:12}%
    \msgMainContent{Drop}%
    %
}


\channelMsgEntry{%
    \msgRealSource{liushuyu}{2021-11-19 10:34:12}%
    \msgMainContent{Drop}%
    %
}


\channelMsgEntry{%
    \msgRealSource{Mingcong Bai}{2021-11-19 10:34:12}%
    \msgMainContent{è¿™ä¹ˆå¤šä¸ª drop æ˜¯è¦ç© dubstep å—ï¼ˆ}%
    %
}


\channelMsgEntry{%
    \msgRealSource{Kexy Biscuit | è¢«å­é¥¼ï¸ | ç™¾åˆãƒ¶å’²ã‚‹ã‚‹}{2021-11-19 10:34:12}%
    \msgMainContent{Drop https://t.me/SuperShoppingNow/118}%
    %
}


\channelMsgEntry{%
    \msgRealSource{Kexy Biscuit | è¢«å­é¥¼ï¸ | ç™¾åˆãƒ¶å’²ã‚‹ã‚‹}{2021-11-19 10:34:22}%
    \msgMainContent{\#NSFW}%
    %
}


\channelMsgEntry{%
    \msgRealSource{Hana ist ein Narr}{2021-11-19 10:34:22}%
    \msgMainContent{å•Šï¼ï¼AOSC\ldots\ldots ä¸è¦åœ\ldots Debianï¼ï¼å””ï¼ï¼å—¯ï¼ï¼ä¸è¦\ldots å•Šå•Š\ldots\ldots RedHatã€ã€å—¯\ldots Arch\ldots å¥½å˜æ€\ldots\ldots Ubuntuã€ã€ã€å“‡å•Šï¼å””\ldots ç»§ç»­ï¼ï¼å•Šå•Šå•Šï¼}%
    %
}


\channelMsgEntry{%
    \msgRealSource{èˆŠå¤©ä¸‹ OriginCode // Ristaccia}{2021-12-03 08:17:53}%
    \msgMainContent{æˆ‘åœ¨æƒ³æ˜å¤©ä¸Š CSE è¦ä¸è¦å¸¶ PBP å»ï¼ˆx}%
    %
}


\channelMsgEntry{%
    \msgRealSource{èˆŠå¤©ä¸‹ OriginCode // Ristaccia}{2021-12-03 08:17:53}%
    \msgMainContent{ç„¶å¾Œç•¶å ´è¡¨æ¼”å€‹éˆè»Šæ¼‚ç§»}%
    %
}


\channelMsgEntry{%
    \msgRealSource{Mingcong Bai}{2021-12-03 08:17:53}%
    \msgMainContent{Fucking Pine64 simp (}%
    %
}


\channelMsgEntry{%
    \msgRealSource{åŒå€å¤šå¤šå†°ğŸ§¶ | ğ¦ğŸğœğŸ}{2021-12-06 18:52:53}%
    \msgMainContent{æ¢—é¢‘é“ç®¡ç†å‘˜é›†ä½“å¯¹å…¶ä¸­çš„å«å£°}%
    %
}


\channelMsgEntry{%
    \msgRealSource{åŒå€å¤šå¤šå†°ğŸ§¶ | ğ¦ğŸğœğŸ}{2021-12-06 18:52:53}%
    \msgMainContent{è¡¨ç¤ºå®Œå…¨ä¸è´Ÿè´£}%
    %
}


\channelMsgEntry{%
    \msgRealSource{Staph Bridge}{2021-12-08 05:50:57}%
    \msgMainContent{{[}I-WPlanck{[}m{]}{]} Thanks}%
    %
}


\channelMsgEntry{%
    \msgRealSource{Staph Bridge}{2021-12-08 05:50:57}%
    \msgMainContent{{[}I-WPlanck{[}m{]}{]} @JeffBai click\textasciitilde click}%
    %
}


\channelMsgEntry{%
    \msgRealSource{Mingcong Bai}{2021-12-08 05:50:57}%
    \msgMainContent{?}%
    %
}


\channelMsgEntry{%
    \msgRealSource{Mingcong Bai}{2021-12-08 05:50:57}%
    \msgMainContent{wink-wink * ?}%
    %
}


\channelMsgEntry{%
    \msgRealSource{Kexy Biscuit | è¢«å­é¥¼ï¸ | ç™¾åˆãƒ¶å’²ã‚‹ã‚‹}{2021-12-09 23:21:19}%
    \msgMainContent{å¼ºçƒˆæ¨èæ„¿æ„çº¿ä¸‹èšä¼šçš„ç”³è¯·äººé€‰æ‹©æ‹¼å›¢å“¦\textasciitilde å¯ä»¥èŠ‚çº¦é‚®è´¹ï¼Œè¿˜å¯ä»¥å‡è£…ä»Šå¹´æœ‰å¼€çº¿ä¸‹
AOSCC}%
    %
}


\channelMsgEntry{%
    \msgRealSource{æ°¸ç¥¥}{2021-12-09 23:21:19}%
    \msgMainContent{æ‰€ä»¥ä¸Šæµ·çš„åœ¨æµ¦ä¸œè¿˜æ˜¯æµ¦è¥¿ä¸¾åŠï¼Ÿï¼ˆé€ƒ}%
    %
}


\channelMsgEntry{%
    \msgRealSource{å¾¡å‚0x4e21}{2021-12-09 23:21:19}%
    \msgMainContent{å®Œäº†æˆ‘ç°åœ¨æ— æ³•ç›´è§†æµ¦è¥¿è¿™ä¸ªåœ°åäº†}%
    %
}


\channelMsgEntry{%
    \msgRealSource{Senaruk}{2021-12-09 23:21:19}%
    \msgMainContent{ä½ ä»¬æµ¦è¥¿äººä¸è¦ä¹±è¹­}%
    %
}


\channelMsgEntry{%
    \msgRealSource{Junde Yhi}{2021-12-09 23:23:53}%
    \msgMainContent{æ²¡æœ‰ systemd å°±æ²¡æœ‰æ–° Linux}%
    %
}


\channelMsgEntry{%
    \msgRealSource{Mingcong Bai}{2021-12-09 23:23:54}%
    \msgMainContent{ä¸­å…±ä¸­å¤®æ€» systemdï¼Œ å›½å®¶ systemdï¼Œä¸­å¤® systemdï¼Œsystemd å‘è¡¨é‡è¦è®²è¯}%
    %
}


\channelMsgEntry{%
    \msgRealSource{Kexy Biscuit | è¢«å­é¥¼ï¸ | ç™¾åˆãƒ¶å’²ã‚‹ã‚‹}{2021-12-09 23:23:54}%
    \msgMainContent{ä¸­å›½ç‰¹è‰² daemon ä¸»ä¹‰}%
    %
}


\channelMsgEntry{%
    \msgRealSource{Junde Yhi}{2021-12-09 23:23:54}%
    \msgMainContent{å‘è¡¨é‡è¦è®²è¯ï¼ˆæŒ‡åœ¨ D-Bus å¹¿æ’­å…³æœºæ¶ˆæ¯}%
    %
}


\channelMsgEntry{%
    \msgRealSource{Mingcong Bai}{2021-12-09 23:23:54}%
    \msgMainContent{systemd æ€»å°ï¼ˆè¯‘ï¼šMothership}%
    %
}


\channelMsgEntry{%
    \msgRealSource{Kexy Biscuit | è¢«å­é¥¼ï¸ | ç™¾åˆãƒ¶å’²ã‚‹ã‚‹}{2021-12-09 23:23:54}%
    \msgMainContent{Unicode ä¸­å¤®æ€»æœå†»ï¼Œå›½å®¶ä¸»å†»ï¼Œä¸­å¤®é›¶å§”ä¸»å†»ï¼ŒNoto Emoji æœå†»å‘è¡¨é‡è¦è®²è¯}%
    %
}


\channelMsgEntry{%
    \msgRealSource{cth451 ÇÉ”uÇÆƒÉ¹ÇÊŒá´‰p}{2021-12-14 06:00:57}%
    \msgMainContent{æˆ‘è¦æ¥è°¢ç½ªï¼Œæˆ‘å¿ä¸ä½åœ¨é¾™èŠ¯å’Œ power ä¸Šè£…äº† vim}%
    %
}


\channelMsgEntry{%
    \msgRealSource{Mingcong Bai}{2021-12-14 06:00:57}%
    \msgMainContent{æˆ‘æ”¯æŒåœ¨ BuildBot ä¸Šç”¨ Vim}%
    %
}


\channelMsgEntry{%
    \msgRealSource{Mingcong Bai}{2021-12-14 06:00:57}%
    \msgMainContent{ä½ ä»¬å¯ä»¥æ‰“æˆ‘äº†}%
    %
}