
\channelMsgEntry{%
    \msgRealSource{Mingcong Bai}{2022-01-06 00:32:19}%
    \msgMainContent{Chromium è¿™ä¹ˆç»™é¢å­ï¼Œå¥½åƒä¸ç”¨åŠ è¡¥ä¸ï¼ˆ}%
    %
}


\channelMsgEntry{%
    \msgRealSource{Mingcong Bai}{2022-01-06 00:32:20}%
    \msgMainContent{ç¡®å®è·‘å‡ºæ¥äº†ï¼ˆ}%
    %
}


\channelMsgEntry{%
    \msgRealSource{Mingcong Bai}{2022-01-06 00:32:20}%
    \msgMainContent{è°¢è°¢è°·æ­Œçˆ¹çˆ¹}%
    %
}


\channelMsgEntry{%
    \msgRealSource{åŒå€å¤šå¤šå†°ğŸ§¶ | ğ¦ğŸğœğŸ}{2022-01-07 12:15:20}%
    \msgMainContent{å•Šï¼Œé€›å’¸é±¼çœ‹åˆ°æœ‰äººå– Lifebook P1510}%
    %
}


\channelMsgEntry{%
    \msgRealSource{å’¸é±¼}{2022-01-07 12:15:21}%
    \msgMainContent{ã‚“?}%
    %
}


\channelMsgEntry{%
    \msgRealSource{å’¸é±¼}{2022-01-07 12:15:21}%
    \msgMainContent{é‡ç‚¹æ˜¯}%
    %
}


\channelMsgEntry{%
    \msgRealSource{å’¸é±¼}{2022-01-07 12:15:22}%
    \msgMainContent{é—²é±¼è­¦å¯Ÿå‡ºè­¦}%
    %
}


\channelMsgEntry{%
    \msgRealSource{åŒå€å¤šå¤šå†°ğŸ§¶ | ğ¦ğŸğœğŸ}{2022-01-07 12:15:22}%
    \msgMainContent{å’¸é±¼å°±æ˜¯é—²é±¼}%
    %
}


\channelMsgEntry{%
    \msgRealSource{åŒå€å¤šå¤šå†°ğŸ§¶ | ğ¦ğŸğœğŸ}{2022-01-07 12:15:23}%
    \msgMainContent{é—²é±¼å°±æ˜¯å’¸é±¼}%
    %
}


\channelMsgEntry{%
    \msgRealSource{åŒå€å¤šå¤šå†°ğŸ§¶ | ğ¦ğŸğœğŸ}{2022-01-07 12:15:24}%
    \msgMainContent{ä¸æ¥å—å‡ºè­¦ã€‚}%
    %
}


\channelMsgEntry{%
    \msgRealSource{å’¸é±¼}{2022-01-07 12:15:29}%
    \msgMainContent{æ²¡æ•‘äº†}%
    %
}


\channelMsgEntry{%
    \msgRealSource{å’¸é±¼}{2022-01-07 12:15:29}%
    \msgMainContent{é€®æ•äº†}%
    %
}


\channelMsgEntry{%
    \msgRealSource{Mingcong Bai}{2022-01-18 06:53:38}%
    \msgMainContent{æˆ‘å°±è¯´å¥½åƒç”Ÿæ´»ç¼ºå°‘äº†å•¥}%
    %
}


\channelMsgEntry{%
    \msgRealSource{Mingcong Bai}{2022-01-18 06:53:38}%
    \msgMainContent{æ‰æƒ³èµ·æ¥è€³æœºä¸è§äº†ï¼ˆ}%
    %
}


\channelMsgEntry{%
    \msgRealSource{cth451 ÇÉ”uÇÆƒÉ¹ÇÊŒá´‰p}{2022-01-18 06:53:38}%
    \msgMainContent{è¿™å°±æ˜¯ä½ ä¸æ¥ ktv çš„ç†ç”±å—ï¼ˆ}%
    %
}


\channelMsgEntry{%
    \msgRealSource{Mingcong Bai}{2022-01-18 06:53:38}%
    \msgMainContent{ä¸»è¦æ˜¯è¿™ç©æ„æ¯”ä½ ä»¬è¿™å¸®å‚»é€¼æœ‰æ„æ€å¤šäº†ï¼ˆè¿«çœŸ}%
    \nopagebreak\includegraphics[width=\linewidth]{./.tg-data/2022/photos/photo_227@18-01-2022_06-53-38.jpg}%
}


\channelMsgEntry{%
    \msgRealSource{å’¸é±¼}{2022-01-18 06:54:15}%
    \msgMainContent{å‘œå‘œå‘œç™½ gie gie å«Œå¼ƒæˆ‘äº†}%
    %
}


\channelMsgEntry{%
    \msgRealSource{å’¸é±¼}{2022-01-18 06:54:15}%
    \msgMainContent{å˜¤å˜¤å˜¤}%
    %
}


\channelMsgEntry{%
    \msgRealSource{Rick Liu}{2022-01-18 07:01:28}%
    \msgMainContent{ä¸å¦‚ä¹°å’¸é±¼å…†èŠ¯çµè½¦}%
    %
}


\channelMsgEntry{%
    \msgRealSource{Rick Liu}{2022-01-18 07:01:29}%
    \msgMainContent{ï¼ˆé—²é±¼è­¦å¯Ÿç«‹åˆ»å‡ºè­¦}%
    %
}


\channelMsgEntry{%
    \msgRealSource{å’¸é±¼}{2022-01-18 07:01:29}%
    \msgMainContent{é—²é±¼è­¦å¯Ÿå‡ºè­¦}%
    %
}


\channelMsgEntry{%
    \msgRealSource{Junde Yhi}{2022-01-18 19:56:45}%
    \msgMainContent{Anthonæ—¥ç›Šæˆä¸ºä¸»æµLinuxï¼Œå› ä¸ºæœç‰¹é¦–å¯¹å‘è¡Œç‰ˆæå‡ºç–‘é—®------ @AOSCNews}%
    %
}


\channelMsgEntry{%
    \msgRealSource{Junde Yhi}{2022-01-18 19:56:45}%
    \msgMainContent{AOSCçš„åˆ›å§‹äººå’Œé¦–å¸­æ‰§è¡Œå®˜Jeff
Baiåœ¨ä»–çš„ç¤¾åŒºé¢‘é“ä¸­è¡¨è¾¾äº†å¯¹Linuxæ¡Œé¢çš„æå¤§æ”¯æŒ --- @AOSCNews}%
    %
}


\channelMsgEntry{%
    \msgRealSource{ç›ä¸½äºšÂ·åºå·´è¿ª}{2022-01-24 03:57:48}%
    \msgMainContent{å¿«è¿›åˆ°AOSCæ¢—}%
    %
}


\channelMsgEntry{%
    \msgRealSource{ZHITAI PC005 Active 1TB}{2022-01-24 03:57:49}%
    \msgMainContent{ä½ æ˜¯ç¼–è¾‘ä½ è‡ªå·±è½¬}%
    %
}


\channelMsgEntry{%
    \msgRealSource{ç›ä¸½äºšÂ·åºå·´è¿ª}{2022-01-24 03:57:50}%
    \msgMainContent{ä¸å¥½è½¬å›¾å•Š}%
    %
}


\channelMsgEntry{%
    \msgRealSource{dfceaef | ğŸ˜‹}{2022-01-24 03:58:16}%
    \msgMainContent{å°å‚»é±¼}%
    %
}


\channelMsgEntry{%
    \msgRealSource{Mingcong Bai}{2022-01-24 03:58:17}%
    \msgMainContent{å£äº†ä½ ï¼}%
    %
}


\channelMsgEntry{%
    \msgRealSource{CT1000MX500SSD4 1000.2 GB}{2022-01-24 03:58:32}%
    \msgMainContent{è¿™éƒ½è¦æˆ‘æ•™}%
    %
}


\channelMsgEntry{%
    \msgRealSource{cth451 ÇÉ”uÇÆƒÉ¹ÇÊŒá´‰p}{2022-01-27 07:15:01}%
    \msgMainContent{https://archlinux.org/news/linux-firmware-202201190c6a7b3-2-requires-kernel-53-and-package-splitting/}%
    %
}


\channelMsgEntry{%
    \msgRealSource{cth451 ÇÉ”uÇÆƒÉ¹ÇÊŒá´‰p}{2022-01-27 07:15:01}%
    \msgMainContent{Arrrrgh fuck}%
    %
}


\channelMsgEntry{%
    \msgRealSource{cth451 ÇÉ”uÇÆƒÉ¹ÇÊŒá´‰p}{2022-01-27 07:15:02}%
    \msgMainContent{æˆ‘è¯´æˆ‘ä»–å¦ˆçš„æ€ä¹ˆä¸€å¼€æœºç½‘å¡æ²¡äº†}%
    %
}


\channelMsgEntry{%
    \msgRealSource{cth451 ÇÉ”uÇÆƒÉ¹ÇÊŒá´‰p}{2022-01-27 07:15:03}%
    \msgMainContent{What the actual fuck}%
    %
}


\channelMsgEntry{%
    \msgRealSource{åŒå€å¤šå¤šå†°ğŸ§¶ | ğ¦ğŸğœğŸ}{2022-01-27 07:15:03}%
    \msgMainContent{è‡ªä½œä¸»å¼ æ‹†åŒ…ï¼Œå¤©è¯›åˆåœ°ç­}%
    %
}


\channelMsgEntry{%
    \msgRealSource{åŒå€å¤šå¤šå†°ğŸ§¶ | ğ¦ğŸğœğŸ}{2022-01-28 10:37:45}%
    \msgMainContent{\begin{itemize}
\tightlist
\item
  How modern?
\item
  With systemd. ï¼ˆè®¾è®¡å¯¹ç™½
\end{itemize}}%
    %
}


\channelMsgEntry{%
    \msgRealSource{åŒå€å¤šå¤šå†°ğŸ§¶ | ğ¦ğŸğœğŸ}{2022-01-28 10:41:49}%
    \msgMainContent{\begin{itemize}
\tightlist
\item
  How modern?
\item
  Without underpants.
\end{itemize}}%
    %
}


\channelMsgEntry{%
    \msgRealSource{Staph Bridge}{2022-01-30 05:50:59}%
    \msgMainContent{{[}D-Fearyncess{]} @jeffbai ä½ ä¸æ˜¯æœºæ€§æ‹å—ï¼ˆx}%
    %
}


\channelMsgEntry{%
    \msgRealSource{Mingcong Bai}{2022-01-30 05:51:00}%
    \msgMainContent{å°±åƒæ¯”åˆ©çä¸æ˜¯æˆ‘å„¿å­ä¸€æ ·ï¼Œæœºå™¨ä¸æ˜¯æˆ‘çˆ±äººï¼ˆ}%
    %
}


\channelMsgEntry{%
    \msgRealSource{æ­£ç‰ˆ ï¼ˆè¿«çœŸï¼‰}{2022-01-31 01:23:45}%
    \msgMainContent{çªå‡ºå±±æ‰“åŒ…äº†ï¼ˆx}%
    %
}


\channelMsgEntry{%
    \msgRealSource{Mingcong Bai}{2022-01-31 01:23:46}%
    \msgMainContent{Ğ¥ÑƒĞ¹ Ñ Ğ³Ğ¾Ñ€Ñ‹}%
    %
}


\channelMsgEntry{%
    \msgRealSource{æ­£ç‰ˆ ï¼ˆè¿«çœŸï¼‰}{2022-01-31 01:23:47}%
    \msgMainContent{huiä»å±±æ¥}%
    %
}


\channelMsgEntry{%
    \msgRealSource{Mingcong Bai}{2022-01-31 01:23:47}%
    \msgMainContent{https://andreygarin.livejournal.com/119768.html}%
    %
}


\channelMsgEntry{%
    \msgRealSource{æ­£ç‰ˆ ï¼ˆè¿«çœŸï¼‰}{2022-01-31 01:23:48}%
    \msgMainContent{Literally: A penis from the mountain}%
    %
}


\channelMsgEntry{%
    \msgRealSource{CT1000MX500SSD4 1000.2 GB}{2022-01-31 01:23:50}%
    \msgMainContent{\#nsfw}%
    %
}


\channelMsgEntry{%
    \msgRealSource{cth451 ÇÉ”uÇÆƒÉ¹ÇÊŒá´‰p}{2022-02-03 23:03:32}%
    \msgMainContent{ä½ æ²¡å‘ç°åˆå¹¶æ‰çš„åˆ†æ”¯ä¼šè¿ç€ repo ä¸Šçš„ topic ä¸€èµ·æ¶ˆå¤±å—}%
    %
}


\channelMsgEntry{%
    \msgRealSource{å’¸é±¼}{2022-02-03 23:03:32}%
    \msgMainContent{æ²¡å‘ç°ï¼ˆx}%
    %
}


\channelMsgEntry{%
    \msgRealSource{å’¸é±¼}{2022-02-03 23:03:32}%
    \msgMainContent{å› ä¸ºæˆ‘è¿™ä¸¤ä¸ªæœˆå¤©å¤©æ‘¸é±¼ï¼ˆç†ç›´æ°”å£®}%
    %
}


\channelMsgEntry{%
    \msgRealSource{å’¸é±¼}{2022-02-03 23:03:32}%
    \msgMainContent{å˜¤å˜¤å˜¤}%
    %
}


\channelMsgEntry{%
    \msgRealSource{cth451 ÇÉ”uÇÆƒÉ¹ÇÊŒá´‰p}{2022-02-03 23:03:34}%
    \msgMainContent{\#æ€ä¹ˆå«}%
    %
}


\channelMsgEntry{%
    \msgRealSource{liushuyu}{2022-02-08 15:24:12}%
    \msgMainContent{å¯èƒ½è¯¥ä¹°ç¡¬ç›˜äº†ï¼ˆ}%
    \nopagebreak\includegraphics[width=\linewidth]{./.tg-data/2022/photos/photo_228@08-02-2022_15-24-12.jpg}%
}


\channelMsgEntry{%
    \msgRealSource{Mingcong Bai}{2022-02-08 15:24:12}%
    \msgMainContent{I am once again asking for your financial support}%
    %
}


\channelMsgEntry{%
    \msgRealSource{Mingcong Bai}{2022-02-08 15:24:12}%
    \msgMainContent{Two units of 1TB NVMe Storage in the name of democracy}%
    %
}


\channelMsgEntry{%
    \msgRealSource{liushuyu}{2022-02-08 15:24:12}%
    \msgMainContent{Donate to the cause}%
    %
}


\channelMsgEntry{%
    \msgRealSource{Mingcong Bai}{2022-02-08 15:24:12}%
    \msgMainContent{ED æ¢—ï¼ˆ}%
    %
}


\channelMsgEntry{%
    \msgRealSource{Mingcong Bai}{2022-02-08 15:24:12}%
    \msgMainContent{æ¯”å¦‚ Deliver two tonnes of organic waste in the name of democracyï¼ˆ}%
    %
}


\channelMsgEntry{%
    \msgRealSource{liushuyu}{2022-02-08 15:24:13}%
    \msgMainContent{æˆ‘çŸ¥é“ï¼Œæ–° UI ä¸Šé¢ä¼šæ˜¾ç¤º Donate to the cause
ï¼ˆçœ‹æ¥ä½ å¾ˆä¹…æ²¡ç©è¿‡è¿™åƒåœ¾æ¸¸æˆäº†}%
    %
}


\channelMsgEntry{%
    \msgRealSource{WPlanck}{2022-02-13 19:31:01}%
    \msgMainContent{ï¼ˆï¼ˆ}%
    \nopagebreak\includegraphics[width=\linewidth]{./.tg-data/2022/photos/photo_229@13-02-2022_19-31-01.jpg}%
}


\channelMsgEntry{%
    \msgRealSource{SuperMarioSF | Trust Platform Builder (?)}{2022-02-20 12:04:06}%
    \msgMainContent{pakreq: https://github.com/marktext/marktext

MITè®¸å¯è¯}%
    %
}


\channelMsgEntry{%
    \msgRealSource{åŒå€å¤šå¤šå†°ğŸ§¶ | ğ¦ğŸğœğŸ}{2022-02-20 12:04:07}%
    \msgMainContent{æŸ³æ ‘é±¼ï¼šè¯·å‹¿å€¾å€’ç”µå­åƒåœ¾}%
    %
}


\channelMsgEntry{%
    \msgRealSource{Junde Yhi}{2022-03-08 19:25:36}%
    \msgMainContent{iPhone LTS}%
    %
}


\channelMsgEntry{%
    \msgRealSource{Junde Yhi}{2022-03-08 19:25:36}%
    \msgMainContent{åŸºäº Apple(r) iPhone(r) 8.0 æ‰“é€ }%
    %
}


\channelMsgEntry{%
    \msgRealSource{Junde Yhi}{2022-03-08 19:25:36}%
    \msgMainContent{å®‰å…¨ï¼Œç¨³å®šï¼Œå£°èª‰}%
    %
}


\channelMsgEntry{%
    \msgRealSource{Mingcong Bai}{2022-03-08 19:25:36}%
    \msgMainContent{}%
    %
}


\channelMsgEntry{%
    \msgRealSource{Mingcong Bai}{2022-03-18 09:23:11}%
    \msgMainContent{My Little Systemd: Concurrency is Magic}%
    %
}


\channelMsgEntry{%
    \msgRealSource{è´¢ç»æ…¢æŠ¥}{2022-03-24 18:19:06}%
    \msgMainContent{æ³•å›½æ€»ç»Ÿé©¬å…‹é¾™ï¼šä¿„ç½—æ–¯å¯¹ä¹Œç‰¹åˆ«å†›äº‹è¡ŒåŠ¨å°±åƒç»™åŒ—çº¦è¿›è¡Œäº† ``ç”µå‡»''ã€‚}%
    %
}


\channelMsgEntry{%
    \msgRealSource{Mingcong Bai}{2022-03-24 18:19:06}%
    \msgMainContent{ä»€ä¹ˆé¬¼æ¯”å–»}%
    %
}


\channelMsgEntry{%
    \msgRealSource{Kexy Biscuit | è¢«å­é¥¼ï¸ | ç™¾åˆãƒ¶å’²ã‚‹ã‚‹}{2022-03-24 18:19:06}%
    \msgMainContent{æš—å–» SM?}%
    %
}


\channelMsgEntry{%
    \msgRealSource{liushuyu}{2022-03-24 18:19:06}%
    \msgMainContent{ä½ è¿™æ€æƒ³å¾ˆå¥åº·ï¼ˆ}%
    %
}


\channelMsgEntry{%
    \msgRealSource{å’¸é±¼}{2022-04-01 00:06:48}%
    \msgMainContent{ä»Šå¹´æ„šäººèŠ‚æœ‰äººæ•´æ´»å—}%
    %
}


\channelMsgEntry{%
    \msgRealSource{Give Way}{2022-04-01 00:06:48}%
    \msgMainContent{åœ° çƒ å’¸ é±¼ åŒ–}%
    %
}


\channelMsgEntry{%
    \msgRealSource{å’¸é±¼}{2022-04-01 00:06:48}%
    \msgMainContent{é†’é†’ï¼ŒAOSC å‰ç¥¥ç‰©ä¸æ˜¯é±¼äººæ˜¯ä¸ªåŠå…”äºº}%
    %
}


\channelMsgEntry{%
    \msgRealSource{cth451 ÇÉ”uÇÆƒÉ¹ÇÊŒá´‰p}{2022-04-01 00:06:48}%
    \msgMainContent{æ˜¯ä¸ªèµ›åšæ ¼}%
    %
}


\channelMsgEntry{%
    \msgRealSource{å’¸é±¼}{2022-04-01 00:06:48}%
    \msgMainContent{èµ›åšç¦ç‘}%
    %
}


\channelMsgEntry{%
    \msgRealSource{liushuyu}{2022-04-01 00:06:48}%
    \msgMainContent{ä¸æ˜¯èµ›åšæ ¼ï¼ˆç”»å¸ˆè§£é‡Šè¿‡}%
    %
}


\channelMsgEntry{%
    \msgRealSource{å’¸é±¼}{2022-04-01 00:06:48}%
    \msgMainContent{æ˜¯å˜äº†çš„å…”å­}%
    %
}


\channelMsgEntry{%
    \msgRealSource{Mingcong Bai}{2022-04-01 00:06:48}%
    \msgMainContent{ä¼ å‡ºå»ï¼Œæ˜¯å˜æ€å…”å­}%
    %
}


\channelMsgEntry{%
    \msgRealSource{èˆŠå¤©ä¸‹ OriginCode // Ristaccia}{2022-04-15 06:16:12}%
    \msgMainContent{}%
    \nopagebreak\includegraphics[width=\linewidth]{./.tg-data/2022/photos/photo_230@15-04-2022_06-16-12.jpg}%
}


\channelMsgEntry{%
    \msgRealSource{èˆŠå¤©ä¸‹ OriginCode // Ristaccia}{2022-04-15 06:16:12}%
    \msgMainContent{shet}%
    %
}


\channelMsgEntry{%
    \msgRealSource{èˆŠå¤©ä¸‹ OriginCode // Ristaccia}{2022-04-15 06:16:12}%
    \msgMainContent{ç™¼ç”Ÿä»€éº¼äº‹äº†}%
    %
}


\channelMsgEntry{%
    \msgRealSource{ĞĞµĞ‘ÑƒÑ‚Ğ»ĞµĞ³ ï¼ˆè¿«çœŸï¼‰}{2022-04-15 06:16:12}%
    \msgMainContent{å¯¹è™¾åœ¨é‡Šæ”¾è‡ªæˆ‘}%
    %
}


\channelMsgEntry{%
    \msgRealSource{èˆŠå¤©ä¸‹ OriginCode // Ristaccia}{2022-04-15 06:16:12}%
    \msgMainContent{å•Šå•Šå•Šå•Šå•Š}%
    %
}


\channelMsgEntry{%
    \msgRealSource{èˆŠå¤©ä¸‹ OriginCode // Ristaccia}{2022-04-15 06:16:12}%
    \msgMainContent{èµ°æˆ‘çš„è·¯}%
    %
}


\channelMsgEntry{%
    \msgRealSource{èˆŠå¤©ä¸‹ OriginCode // Ristaccia}{2022-04-15 06:16:12}%
    \msgMainContent{å‡é¢é¾è¦ï¼ˆx}%
    %
}


\channelMsgEntry{%
    \msgRealSource{èˆŠå¤©ä¸‹ OriginCode // Ristaccia}{2022-04-15 06:16:12}%
    \msgMainContent{å°å°å°å°è¦}%
    %
}


\channelMsgEntry{%
    \msgRealSource{ĞĞµĞ‘ÑƒÑ‚Ğ»ĞµĞ³ ï¼ˆè¿«çœŸï¼‰}{2022-04-15 06:16:13}%
    \msgMainContent{ä¸€æ—¦æ¥å—äº†è‡ªå·±çš„MMU}%
    %
}


\channelMsgEntry{%
    \msgRealSource{ĞĞµĞ‘ÑƒÑ‚Ğ»ĞµĞ³ ï¼ˆè¿«çœŸï¼‰}{2022-04-15 06:16:13}%
    \msgMainContent{é‚£æˆ‘å°±æ˜¯}%
    %
}


\channelMsgEntry{%
    \msgRealSource{ĞĞµĞ‘ÑƒÑ‚Ğ»ĞµĞ³ ï¼ˆè¿«çœŸï¼‰}{2022-04-15 06:16:13}%
    \msgMainContent{ICE}%
    %
}


\channelMsgEntry{%
    \msgRealSource{ĞĞµĞ‘ÑƒÑ‚Ğ»ĞµĞ³ ï¼ˆè¿«çœŸï¼‰}{2022-04-15 06:16:13}%
    \msgMainContent{å•Šå•Šå•Šå•Šå•Šå•Šï¼ˆä¸–ç•Œçº§ç¾å£°ï¼‰}%
    %
}


\channelMsgEntry{%
    \msgRealSource{èˆŠå¤©ä¸‹ OriginCode // Ristaccia}{2022-04-17 02:42:47}%
    \msgMainContent{@JeffBai https://github.com/AOSC-Dev/aosc-os-abbs/pull/3928 re-review
request}%
    %
}


\channelMsgEntry{%
    \msgRealSource{cth451 ÇÉ”uÇÆƒÉ¹ÇÊŒá´‰p}{2022-04-17 02:42:48}%
    \msgMainContent{æœ‰åŒ…äº†å—}%
    %
}


\channelMsgEntry{%
    \msgRealSource{èˆŠå¤©ä¸‹ OriginCode // Ristaccia}{2022-04-17 02:42:48}%
    \msgMainContent{å¥½åƒæ²’å‚³ï¼ˆ}%
    %
}


\channelMsgEntry{%
    \msgRealSource{èˆŠå¤©ä¸‹ OriginCode // Ristaccia}{2022-04-17 02:42:48}%
    \msgMainContent{ä¸€æœƒå…’å‚³}%
    %
}


\channelMsgEntry{%
    \msgRealSource{cth451 ÇÉ”uÇÆƒÉ¹ÇÊŒá´‰p}{2022-04-17 02:42:48}%
    \msgMainContent{æ²¡ä¼ è¿˜æƒ³ approve}%
    %
}


\channelMsgEntry{%
    \msgRealSource{cth451 ÇÉ”uÇÆƒÉ¹ÇÊŒá´‰p}{2022-04-17 02:42:48}%
    \msgMainContent{ï¼ˆæ¥ä¸ä¸Šæµ·å†›æ¢—äº†}%
    %
}


\channelMsgEntry{%
    \msgRealSource{Mingcong Bai}{2022-04-17 02:42:48}%
    \msgMainContent{æ²¡åŒ…ï¼ä»€ä¹ˆå•Šï¼æ²¡æœ‰åŒ…ï¼æ ¹æœ¬çœ‹ä¸è§ï¼è£…ä¸ä¸Šï¼ï¼ˆä¼—è®®ï¼‰}%
    %
}


\channelMsgEntry{%
    \msgRealSource{Mingcong Bai}{2022-04-28 23:05:00}%
    \msgMainContent{https://web.archive.org/web/20220428222654/http://pc110.yyzkevin.com/cgi-bin/info.sh}%
    %
}


\channelMsgEntry{%
    \msgRealSource{liushuyu}{2022-04-28 23:05:00}%
    \msgMainContent{å…¶å®ä½ å¯ä»¥ç§‘æ™®ä¸€ä¸‹ CGI æ˜¯ä»€ä¹ˆæ„æ€
https://httpd.apache.org/docs/2.4/howto/cgi.html}%
    %
}


\channelMsgEntry{%
    \msgRealSource{å’¸é±¼}{2022-04-28 23:05:00}%
    \msgMainContent{Common Granny Interface}%
    %
}


\channelMsgEntry{%
    \msgRealSource{å’¸é±¼}{2022-05-01 07:49:53}%
    \msgMainContent{}%
    \nopagebreak\includegraphics[width=\linewidth]{./.tg-data/2022/photos/photo_231@01-05-2022_07-49-53.jpg}%
}


\channelMsgEntry{%
    \msgRealSource{å’¸é±¼}{2022-05-01 07:50:12}%
    \msgMainContent{}%
    \nopagebreak\includegraphics[width=\linewidth]{./.tg-data/2022/photos/photo_232@01-05-2022_07-50-12.jpg}%
}


\channelMsgEntry{%
    \msgRealSource{å’¸é±¼}{2022-05-01 07:50:37}%
    \msgMainContent{}%
    \nopagebreak\includegraphics[width=\linewidth]{./.tg-data/2022/photos/photo_233@01-05-2022_07-50-37.jpg}%
}


\channelMsgEntry{%
    \msgRealSource{å’¸é±¼}{2022-05-01 07:51:38}%
    \msgMainContent{}%
    \nopagebreak\includegraphics[width=\linewidth]{./.tg-data/2022/photos/photo_234@01-05-2022_07-51-38.jpg}%
}


\channelMsgEntry{%
    \msgRealSource{Mingcong Bai}{2022-05-05 07:04:19}%
    \msgMainContent{æœ€è¿‘æœ‰ç‚¹æƒ³è¦å° X260/270}%
    %
}


\channelMsgEntry{%
    \msgRealSource{å’¸é±¼}{2022-05-05 07:04:19}%
    \msgMainContent{ä½ ä¿®æ•´å®Œçš„ T420 æˆ‘ 50 æ”¶ï¼ˆx}%
    %
}


\channelMsgEntry{%
    \msgRealSource{Mingcong Bai}{2022-05-05 07:04:19}%
    \msgMainContent{ä¸å¼€ç©ç¬‘ä½ å¯ä»¥ 50 æ‹¿èµ°ï¼ˆ}%
    %
}


\channelMsgEntry{%
    \msgRealSource{Mingcong Bai}{2022-05-05 07:04:19}%
    \msgMainContent{åˆ«æé”™å•ä½å°±å¥½}%
    %
}


\channelMsgEntry{%
    \msgRealSource{å’¸é±¼}{2022-05-05 07:04:19}%
    \msgMainContent{JPY}%
    %
}


\channelMsgEntry{%
    \msgRealSource{liushuyu}{2022-05-05 07:13:29}%
    \msgMainContent{è¿™ä¸ªçš„æƒ…å†µæ¯”è¾ƒéº»çƒ¦ å› ä¸º defines é‡Œé¢æˆ‘ä»¬ç›®å‰è®¤ä¸ºæ˜¯ä¸èƒ½æœ‰é€»è¾‘çš„}%
    \nopagebreak\includegraphics[width=\linewidth]{./.tg-data/2022/photos/photo_235@05-05-2022_07-13-29.jpg}%
}


\channelMsgEntry{%
    \msgRealSource{liushuyu}{2022-05-05 07:13:29}%
    \msgMainContent{å› ä¸ºæ¢æµ‹çš„è¯éœ€è¦è¯»æ–‡ä»¶}%
    %
}


\channelMsgEntry{%
    \msgRealSource{Mingcong Bai}{2022-05-05 07:13:29}%
    \msgMainContent{\ldots\ldots æˆ‘ç»™å¿˜äº†}%
    %
}


\channelMsgEntry{%
    \msgRealSource{liushuyu}{2022-05-05 07:13:29}%
    \msgMainContent{æˆ–è€…æˆ‘ä»¬å¯ä»¥åœ¨ ab3 é‡Œé¢åŠ ä¸€ä¸ªé¢„ç½®å˜é‡}%
    %
}


\channelMsgEntry{%
    \msgRealSource{liushuyu}{2022-05-05 07:13:29}%
    \msgMainContent{æ¯”æ–¹è¯´ AB\_LLVM\_VER}%
    %
}


\channelMsgEntry{%
    \msgRealSource{Mingcong Bai}{2022-05-05 07:13:29}%
    \msgMainContent{è¿™ä¸ªä¸»æ„ä¸é”™}%
    %
}


\channelMsgEntry{%
    \msgRealSource{Mingcong Bai}{2022-05-05 07:13:29}%
    \msgMainContent{ABLLVMVERï¼Œå’Œ ABPY2/3VER ä¸€æ ·}%
    %
}


\channelMsgEntry{%
    \msgRealSource{åŒå€å¤šå¤šå†°ğŸ§¶ | ğ¦ğŸğœğŸ}{2022-05-05 07:13:29}%
    \msgMainContent{å†’æ±—}%
    %
}


\channelMsgEntry{%
    \msgRealSource{liushuyu}{2022-05-05 07:13:29}%
    \msgMainContent{ab3 çš„å¥‡æ€ªé€»è¾‘å¢åŠ äº†ï¼ˆ technical\_debt++;}%
    %
}


\channelMsgEntry{%
    \msgRealSource{Mingcong Bai}{2022-05-05 07:13:29}%
    \msgMainContent{è®©å…¨ä¸–ç•ŒæŠ€æœ¯ä¿å®ˆä¸»ä¹‰è€…åœ¨ Bash æ»¥ç”¨ä¸»ä¹‰ç¤¾åŒºçš„é¢å‰é¢¤æŠ–å§ï¼}%
    %
}


\channelMsgEntry{%
    \msgRealSource{åŒå€å¤šå¤šå†°ğŸ§¶ | ğ¦ğŸğœğŸ}{2022-05-14 19:37:50}%
    \msgMainContent{æˆ‘çš„å¦ˆå‘€ï¼Œè¿™æ•´ä¸ªé¡¹ç›®çš„ä¸­æ–‡ç¿»è¯‘éƒ½è®©æˆ‘æ„Ÿè§‰ä»¿ä½›å–äº†è¶…è¿‡ 100 åº¦çš„é…’}%
    \nopagebreak\includegraphics[width=\linewidth]{./.tg-data/2022/photos/photo_236@14-05-2022_19-37-50.jpg}%
}


\channelMsgEntry{%
    \msgRealSource{Kexy Biscuit | è¢«å­é¥¼ï¸ | ç™¾åˆãƒ¶å’²ã‚‹ã‚‹}{2022-05-14 19:37:50}%
    \msgMainContent{é‚£ä½ å¯ä»¥å»åˆ»å…‰ç›˜äº†}%
    %
}


\channelMsgEntry{%
    \msgRealSource{Mingcong Bai}{2022-05-18 23:20:31}%
    \msgMainContent{ThinkPad P16}%
    %
}


\channelMsgEntry{%
    \msgRealSource{Mingcong Bai}{2022-05-18 23:20:31}%
    \msgMainContent{Excuse me?}%
    %
}


\channelMsgEntry{%
    \msgRealSource{Mingcong Bai}{2022-05-18 23:20:31}%
    \msgMainContent{}%
    \nopagebreak\includegraphics[width=\linewidth]{./.tg-data/2022/photos/photo_237@18-05-2022_23-20-31.jpg}%
}


\channelMsgEntry{%
    \msgRealSource{å’¸é±¼}{2022-05-18 23:20:31}%
    \msgMainContent{å¤šå¥½å•Š}%
    %
}


\channelMsgEntry{%
    \msgRealSource{Mingcong Bai}{2022-05-18 23:20:31}%
    \msgMainContent{14 å²å°ç”·å­©çœ‹å°„äº†ï¼ˆ}%
    %
}


\channelMsgEntry{%
    \msgRealSource{CT1000MX500SSD4 1000.2 GB}{2022-05-23 02:21:02}%
    \msgMainContent{è‡ªç”±æ¡Œé¢ã€‚ç»„ç»‡å’Œåœ°ç²¾ç°åœ¨æ˜¯ä»€ä¹ˆå…³ç³»}%
    %
}


\channelMsgEntry{%
    \msgRealSource{Mingcong Bai}{2022-05-23 02:21:02}%
    \msgMainContent{æ®–æ°‘ä¸è¢«æ®–æ°‘çš„å…³ç³»}%
    %
}


\channelMsgEntry{%
    \msgRealSource{liushuyu}{2022-05-23 02:21:02}%
    \msgMainContent{FD.o ç°åœ¨æ˜¯åŠå°å»ºï¼ˆæŒ‡å§”å‘˜ä¼šæƒé™è¿‡å¤§ï¼‰åŠæ®–æ°‘åœ°ï¼ˆæŒ‡ GNOME è¯´ä¸€ä¸äºŒï¼‰ç»„ç»‡}%
    %
}


\channelMsgEntry{%
    \msgRealSource{Mag Mell}{2022-05-23 06:19:32}%
    \msgMainContent{}%
    \nopagebreak\includegraphics[width=\linewidth]{./.tg-data/2022/photos/photo_238@23-05-2022_06-19-32.jpg}%
}


\channelMsgEntry{%
    \msgRealSource{åƒé ˆæœ« [tÍ¡É•Ê°ieâ´â´ É•iâ´â´ mÉ™Ê”Â²Â³] @æœ‰å‚çœŸç™½FC}{2022-05-23 06:19:32}%
    \msgMainContent{saki ä½ æœ‰å¥½å¤š**å–”}%
    %
}


\channelMsgEntry{%
    \msgRealSource{Mag Mell}{2022-05-23 06:19:32}%
    \msgMainContent{èª’å–²ä½ è‡‰ç´…å•¦ï¼Œä¾†ï¼Œè®“æˆ‘çœ‹çœ‹}%
    %
}


\channelMsgEntry{%
    \msgRealSource{åƒé ˆæœ« [tÍ¡É•Ê°ieâ´â´ É•iâ´â´ mÉ™Ê”Â²Â³] @æœ‰å‚çœŸç™½FC}{2022-05-23 06:19:32}%
    \msgMainContent{saki ä½ å¹¹å˜›å•¦}%
    %
}


\channelMsgEntry{%
    \msgRealSource{CÎ±mber Kirisame | 80}{2022-05-25 05:38:28}%
    \msgMainContent{è¯´æ¥å†…æ ¸é€‚åˆç”¨qemu user-modeç¼–è¯‘ä¹ˆ}%
    %
}


\channelMsgEntry{%
    \msgRealSource{CÎ±mber Kirisame | 80}{2022-05-25 05:38:28}%
    \msgMainContent{hmmmm targetæ˜¯riscv64}%
    %
}


\channelMsgEntry{%
    \msgRealSource{CÎ±mber Kirisame | 80}{2022-05-25 05:38:28}%
    \msgMainContent{å’±æœ¬åœ°cross-compileå¾ˆå¿«}%
    %
}


\channelMsgEntry{%
    \msgRealSource{CÎ±mber Kirisame | 80}{2022-05-25 05:38:28}%
    \msgMainContent{ä¸Šä¸€æ¬¡åœ¨è€ç™½çš„å¹³å°æ„å»ºæ˜¯3h20m}%
    %
}


\channelMsgEntry{%
    \msgRealSource{CÎ±mber Kirisame | 80}{2022-05-25 05:38:28}%
    \msgMainContent{user-modeè¿˜æ²¡æµ‹é‡}%
    %
}


\channelMsgEntry{%
    \msgRealSource{CÎ±mber Kirisame | 80}{2022-05-25 05:38:28}%
    \msgMainContent{åŠå°æ—¶}%
    %
}


\channelMsgEntry{%
    \msgRealSource{Mingcong Bai}{2022-05-25 05:38:28}%
    \msgMainContent{å¿«è¿™ä¹ˆå¤šï¼Ÿ}%
    %
}


\channelMsgEntry{%
    \msgRealSource{CÎ±mber Kirisame | 80}{2022-05-25 05:38:28}%
    \msgMainContent{å’±è§‰å¾—ä¸€ä¸ªæ˜¯32c/64t}%
    %
}


\channelMsgEntry{%
    \msgRealSource{CÎ±mber Kirisame | 80}{2022-05-25 05:38:28}%
    \msgMainContent{ä¸€ä¸ª4c/4t}%
    %
}


\channelMsgEntry{%
    \msgRealSource{Mingcong Bai}{2022-05-25 05:38:28}%
    \msgMainContent{å…³é”®æ˜¯ RV é‚£æ ¸å¿ƒè¿™ä¹ˆè¯´æ¥ä¹Ÿæ‰ x86 æ¨¡æ‹Ÿå‡ºæ¥çš„æ€§èƒ½ï¼ˆ}%
    %
}


\channelMsgEntry{%
    \msgRealSource{Mingcong Bai}{2022-05-25 05:38:29}%
    \msgMainContent{å¤ªæƒ¨äº†}%
    %
}


\channelMsgEntry{%
    \msgRealSource{Robin Lu}{2022-05-25 05:38:29}%
    \msgMainContent{RV çš„æ ¸å¿ƒç¡®å®æ€§èƒ½ï¼Œä¸è¦è¯´è·Ÿä¸»æµ x86 æ¯”}%
    %
}


\channelMsgEntry{%
    \msgRealSource{Robin Lu}{2022-05-25 05:38:29}%
    \msgMainContent{ç°åœ¨è¿˜æ˜¯åœ¨è·Ÿ a53/a72 æ¯”å§}%
    %
}


\channelMsgEntry{%
    \msgRealSource{Mingcong Bai}{2022-05-25 05:38:29}%
    \msgMainContent{å“ˆå“ˆå“ˆå“ˆå“ˆå“ˆå“ˆå“ˆ}%
    %
}


\channelMsgEntry{%
    \msgRealSource{Mingcong Bai}{2022-05-25 05:38:29}%
    \msgMainContent{å’Œä»–ä»¬çš„å½±å­æ¯”è¿˜è¡Œ}%
    %
}


\channelMsgEntry{%
    \msgRealSource{Mingcong Bai}{2022-05-25 05:38:29}%
    \msgMainContent{æˆ‘ä»¬è¿™ä¸ª HU740}%
    %
}


\channelMsgEntry{%
    \msgRealSource{Mingcong Bai}{2022-05-25 05:38:29}%
    \msgMainContent{FU *}%
    %
}


\channelMsgEntry{%
    \msgRealSource{Mingcong Bai}{2022-05-25 05:38:29}%
    \msgMainContent{æ˜¯æˆ‘ä»¬è®°å½•åœ¨æ¡ˆä¸­ä»…æ¬¡äº 2F çš„è¶…ç®—ï¼ˆx}%
    %
}


\channelMsgEntry{%
    \msgRealSource{Mingcong Bai}{2022-05-25 05:38:29}%
    \msgMainContent{æŒ‡è¶…æ—¶ç©ºæ…¢åŠ¨ä½œè®¡ç®—æœº}%
    %
}


\channelMsgEntry{%
    \msgRealSource{Robin Lu}{2022-05-25 05:38:29}%
    \msgMainContent{``è¶…ç®—''}%
    %
}


\channelMsgEntry{%
    \msgRealSource{Mingcong Bai}{2022-05-25 05:38:29}%
    \msgMainContent{æ…¢å¾—å°±åƒæ¥è¿‘å…‰é€Ÿï¼ˆ}%
    %
}


\channelMsgEntry{%
    \msgRealSource{CÎ±mber Kirisame | 80}{2022-05-25 05:38:29}%
    \msgMainContent{å›å¤´å‡å¦‚å’±æˆåŠŸè®©D1ä¸Šçº¿relayäº†ï¼Œ}%
    %
}


\channelMsgEntry{%
    \msgRealSource{CÎ±mber Kirisame | 80}{2022-05-25 05:38:29}%
    \msgMainContent{é‚£å¯èƒ½}%
    %
}


\channelMsgEntry{%
    \msgRealSource{CÎ±mber Kirisame | 80}{2022-05-25 05:38:30}%
    \msgMainContent{æˆä¸ºç¬¬ä¸€è¶…ç®—}%
    %
}


\channelMsgEntry{%
    \msgRealSource{CÎ±mber Kirisame | 80}{2022-05-25 05:38:30}%
    \msgMainContent{æˆä¸ºå…‰é€Ÿ.png}%
    %
}


\channelMsgEntry{%
    \msgRealSource{Mingcong Bai}{2022-05-26 08:17:46}%
    \msgMainContent{FU540 - Fuck You æˆ‘æ­»äº†}%
    %
}


\channelMsgEntry{%
    \msgRealSource{Mingcong Bai}{2022-05-26 08:17:46}%
    \msgMainContent{FU740 - Fuck You æ°”æ­»äº†}%
    %
}


\channelMsgEntry{%
    \msgRealSource{Mingcong Bai}{2022-05-26 08:28:11}%
    \msgMainContent{RMS çš„æœ«æ—¥}%
    %
}


\channelMsgEntry{%
    \msgRealSource{Mingcong Bai}{2022-05-26 08:28:11}%
    \msgMainContent{é˜ç‹çˆ·é—®ï¼Œä½ ä¸ºä½•è€Œæ­»}%
    %
}


\channelMsgEntry{%
    \msgRealSource{Mingcong Bai}{2022-05-26 08:28:11}%
    \msgMainContent{Free}%
    %
}


\channelMsgEntry{%
    \msgRealSource{Mingcong Bai}{2022-05-26 08:28:11}%
    \msgMainContent{åˆé—®ï¼šå•¥æ„æ€}%
    %
}


\channelMsgEntry{%
    \msgRealSource{Mingcong Bai}{2022-05-26 08:28:11}%
    \msgMainContent{ä¸æ˜¯å…è´¹ï¼Œæ˜¯è‡ªç”±}%
    %
}


\channelMsgEntry{%
    \msgRealSource{è‡­è‡­}{2022-06-03 01:43:53}%
    \msgMainContent{}%
    \nopagebreak\includegraphics[width=\linewidth]{./.tg-data/2022/photos/photo_239@03-06-2022_01-43-53.jpg}%
}


\channelMsgEntry{%
    \msgRealSource{è‡­è‡­}{2022-06-03 01:43:53}%
    \msgMainContent{è¿™ä¸ªæ‰‹æŸ„}%
    %
}


\channelMsgEntry{%
    \msgRealSource{å’¸é±¼}{2022-06-03 01:43:53}%
    \msgMainContent{é€æˆ‘}%
    %
}


\channelMsgEntry{%
    \msgRealSource{è‡­è‡­}{2022-06-03 01:43:53}%
    \msgMainContent{ä¹– è‡ªå·±ä¹°ã€‚4000 çš„æ ·å­ã€‚}%
    %
}


\channelMsgEntry{%
    \msgRealSource{å’¸é±¼}{2022-06-03 01:43:53}%
    \msgMainContent{ç©·ç©· è‡­è‡­ å“¥å“¥ é¥¿é¥¿ é¥­é¥­}%
    %
}


\channelMsgEntry{%
    \msgRealSource{cth451 ÇÉ”uÇÆƒÉ¹ÇÊŒá´‰p}{2022-06-03 01:44:00}%
    \msgMainContent{\#æ€ä¹ˆå«}%
    %
}


\channelMsgEntry{%
    \msgRealSource{JSONRpCat}{2022-06-03 16:58:38}%
    \msgMainContent{ç”¨æˆ·å’Œé¸¡æœ‰ä»€ä¹ˆåŒºåˆ«ï¼Ÿ é¸¡æ˜¯è¦ä½ ç»™é’±çš„ï¼Œç”¨æˆ·ç»™ä½ é’±}%
    %
}


\channelMsgEntry{%
    \msgRealSource{Mingcong Bai}{2022-06-18 08:06:59}%
    \msgMainContent{å±…ç„¶è¢«æ–‡ä»¶åå‘äº†åŠä¸ªå°æ—¶ï¼Œè¿˜æ˜¯åˆ«å†™äº†ï¼ˆx}%
    %
}


\channelMsgEntry{%
    \msgRealSource{liushuyu}{2022-06-18 08:07:00}%
    \msgMainContent{å¤šå¥½ï¼ˆ}%
    %
}


\channelMsgEntry{%
    \msgRealSource{liushuyu}{2022-06-18 08:07:00}%
    \msgMainContent{è€Œä¸”ä½ çœ‹ plymouth å¾ˆå…ˆè¿›çš„}%
    %
}


\channelMsgEntry{%
    \msgRealSource{liushuyu}{2022-06-18 08:07:01}%
    \msgMainContent{ä½ ç”šè‡³æ²¡æœ‰åŠæ³•è°ƒè¯• è¿™æ˜¯ FD.o é«˜çº§è½¯ä»¶}%
    %
}


\channelMsgEntry{%
    \msgRealSource{Mingcong Bai}{2022-06-18 08:07:02}%
    \msgMainContent{å°±å®ƒç”šè‡³ä¸æŠ¥é”™ï¼ˆ}%
    %
}


\channelMsgEntry{%
    \msgRealSource{Mingcong Bai}{2022-06-18 08:07:02}%
    \msgMainContent{ä¹‹å‰å†™é”™è·¯å¾„ç›´æ¥ç»™æˆ‘å´© daemon}%
    %
}


\channelMsgEntry{%
    \msgRealSource{liushuyu}{2022-06-18 08:07:03}%
    \msgMainContent{ä½ æ‡‚ä»€ä¹ˆï¼Œè¿™æ˜¯ FD.o çš„æœ€æ–°åŠ›ä½œ fail early, fail fast}%
    %
}


\channelMsgEntry{%
    \msgRealSource{liushuyu}{2022-06-18 08:07:08}%
    \msgMainContent{å°±åƒ GNOME ä¸€æ ·ï¼Œé”å±å™¨å´©æºƒç»å¯¹ä¸å«ç³Š ç›´æ¥è§£é”è¿›æ¡Œé¢}%
    %
}


\channelMsgEntry{%
    \msgRealSource{Junde Yhi}{2022-06-18 15:37:33}%
    \msgMainContent{åˆ°è¾¾ä¸–ç•Œæœ€ Free
ç½‘ï¼ŒåŒºå—é“¾ï¼å¤ªè‡ªç”±äº†åŒºå—é“¾ã€‚å“Ÿè¿™ä¸ä¸­æœ¬èªå—ã€‚è¿˜æ˜¯çœ‹çœ‹è¿œå¤„çš„ K
çº¿å›¾å§å®¶äººä»¬ã€‚}%
    %
}


\channelMsgEntry{%
    \msgRealSource{Mag Mell}{2022-06-25 04:21:14}%
    \msgMainContent{è‡ªç”±æ¡Œé¢ï¼çµ„ç¹”}%
    %
}


\channelMsgEntry{%
    \msgRealSource{Mag Mell}{2022-06-25 04:21:15}%
    \msgMainContent{è‡ªç”±ï¼æ¡Œé¢çµ„ç¹”}%
    %
}


\channelMsgEntry{%
    \msgRealSource{Mag Mell}{2022-06-25 04:21:16}%
    \msgMainContent{è‡ªç”±å§ï¼æ¡Œé¢çµ„ç¹”ï¼}%
    %
}


\channelMsgEntry{%
    \msgRealSource{Mingcong Bai}{2022-06-26 04:46:44}%
    \msgMainContent{æˆ‘ç°åœ¨æœ‰åˆ˜å§¥å§¥ æˆ‘å¾ˆå–œæ¬¢åˆ˜å§¥å§¥ ä½†æ˜¯ ã€ŠAOSCC 9ã€‹ æ¯”åˆ˜å§¥å§¥ ã€ŠAOSC \ldotsã€‹
ã€ŠAOSCC 9ã€‹ æˆ‘æœ€å–œæ¬¢ æ‰€ä»¥ç°åœ¨æ˜¯ éŸ³ä¹ä¸–ç•Œ å‡†å¤‡ï¼Œ1-2-3 â™ª ä¸¤ä¸ªç¤¼æ‹œä»¥å â™ª
ã€ŠAOSCC 9ã€‹ â™ª ä¸¤ä¸ªç¤¼æ‹œä»¥å â™ª ã€ŠAOSCC 9ã€‹ â™ª ä¸¤ä¸ªç¤¼æ‹œä»¥å â™ª ã€ŠAOSCC 9ã€‹
ä¸è¦å¿˜è®° ä¸è¦é”™è¿‡ å» Discord çœ‹ã€ŠAOSCC 9ã€‹ å› ä¸ºéå¸¸å¥½ä¼šè®® è®®é¢˜ç‰¹åˆ«å¥½
å·®ä¸å¤šä¸€æ ·``ç‰›å­å…´'' å†è§ï¼}%
    %
}


\channelMsgEntry{%
    \msgRealSource{Mingcong Bai}{2022-06-26 04:46:44}%
    \msgMainContent{https://youtu.be/sxT5bnowzcU}%
    %
}


\channelMsgEntry{%
    \msgRealSource{Mingcong Bai}{2022-06-26 04:46:44}%
    \msgMainContent{å…¶å®æ˜¯å››ä¸ªæ˜ŸæœŸï¼ˆ}%
    %
}


\channelMsgEntry{%
    \msgRealSource{Mag Mell}{2022-06-26 04:46:44}%
    \msgMainContent{é¹¹é­šåœ¨å¤§è‰åŸçš„æ¹–é‚Š ç­‰å§¥å§¥é£›å›ä¾† ç­‰ä»–å€‘éƒ½é•·å¤§äº† å°±ç”Ÿä¸€å€‹ç‰›å­
ä»–æœƒè‡ªå·±é•·å¤§é å» ä»–å€‘ä¹Ÿå„è‡ªé å» é­šçµ¦å§¥å¯«ä¿¡ï¼Œå§¥ä¸æœƒå›ä¿¡ å§¥æ²’æœ‰æ‰‹å—ï¼Ÿ}%
    %
}


\channelMsgEntry{%
    \msgRealSource{Maria Bombardier}{2022-06-26 04:46:44}%
    \msgMainContent{å§¥ï¼šæ— ç¨½ä¹‹è°ˆ}%
    %
}


\channelMsgEntry{%
    \msgRealSource{Phoronix News}{2022-06-28 19:14:35}%
    \msgMainContent{Phoronix Vim 9.0 Released With New Vim9 Script For 10\textasciitilde100x
Execution Speed

Vim 9.0 is out as the first major update in two years for this popular
text editor. With Vim 9.0 comes the Vim9 scripting language that offers
significantly better performance\ldots{}}%
    %
}


\channelMsgEntry{%
    \msgRealSource{Mingcong Bai}{2022-06-28 19:14:36}%
    \msgMainContent{å“ªä½å¿ å®ä¿¡å¾’æ¥æ‰“ä¸€ä¸‹ï¼ˆ}%
    %
}


\channelMsgEntry{%
    \msgRealSource{åŒå€å¤šå¤šå†°ğŸ§¶ | ğ¦ğŸğœğŸ}{2022-07-02 12:34:10}%
    \msgMainContent{3b1500 ä¼¼ä¹æ˜¯å°è£…èƒ¶æ°´æ¥çš„ï¼Ÿ}%
    %
}


\channelMsgEntry{%
    \msgRealSource{Staph Bridge}{2022-07-02 12:34:10}%
    \msgMainContent{{[}D-Fearyncess{]} æ˜¯èƒ¶æ°´}%
    %
}


\channelMsgEntry{%
    \msgRealSource{Staph Bridge}{2022-07-02 12:34:10}%
    \msgMainContent{{[}D-Fearyncess{]} 2ä¸ª4cèƒ¶å‡ºæ¥çš„}%
    %
}


\channelMsgEntry{%
    \msgRealSource{Staph Bridge}{2022-07-02 12:34:10}%
    \msgMainContent{{[}D-Fearyncess{]} hwwèƒ¶ä½¬å®é”¤}%
    %
}


\channelMsgEntry{%
    \msgRealSource{Maria Bombardier}{2022-07-02 12:34:11}%
    \msgMainContent{ä¸æ˜¯å°è£…èƒ¶æ°´ï¼Œæ˜¯æ•´ä¸ªDieèƒ¶æ°´}%
    %
}


\channelMsgEntry{%
    \msgRealSource{Staph Bridge}{2022-07-02 12:34:11}%
    \msgMainContent{{[}D-Fearyncess{]} dieèƒ¶æ°´ä¹Ÿç®—èƒ¶}%
    %
}


\channelMsgEntry{%
    \msgRealSource{Robin Lu}{2022-07-02 12:34:11}%
    \msgMainContent{æ–°æ¦‚å¿µèƒ¶ä½¬}%
    %
}


\channelMsgEntry{%
    \msgRealSource{Robin Lu}{2022-07-04 05:29:13}%
    \msgMainContent{ç”¨é‚£ä¸ª c906 1C1T æˆ‘ä¸è§‰å¾— build from src æœ‰ä»€ä¹ˆæ´»è·¯. xD}%
    %
}


\channelMsgEntry{%
    \msgRealSource{CÎ±mber Kirisame | 80}{2022-07-04 05:29:14}%
    \msgMainContent{glibc 3h30m}%
    %
}


\channelMsgEntry{%
    \msgRealSource{CÎ±mber Kirisame | 80}{2022-07-04 05:29:14}%
    \msgMainContent{no optimize}%
    %
}


\channelMsgEntry{%
    \msgRealSource{Mingcong Bai}{2022-07-04 05:29:14}%
    \msgMainContent{Oof.}%
    %
}


\channelMsgEntry{%
    \msgRealSource{Robin Lu}{2022-07-04 05:29:14}%
    \msgMainContent{Ouch.}%
    %
}


\channelMsgEntry{%
    \msgRealSource{Robin Lu}{2022-07-04 05:29:14}%
    \msgMainContent{ä¸€æ¯èŒ¶ï¼Œä¸€åŒ…çƒŸ}%
    %
}


\channelMsgEntry{%
    \msgRealSource{Robin Lu}{2022-07-04 05:29:14}%
    \msgMainContent{ä¸€ä¸ª glibc è·‘ä¸€å¤©}%
    %
}


\channelMsgEntry{%
    \msgRealSource{Mingcong Bai}{2022-07-04 05:29:14}%
    \msgMainContent{æŒ‡è¶…æ—¶ç©ºæ…¢åŠ¨ä½œè®¡ç®—æœº}%
    %
}


\channelMsgEntry{%
    \msgRealSource{Mingcong Bai}{2022-07-04 05:29:14}%
    \msgMainContent{æ˜¯æˆ‘ä»¬è®°å½•åœ¨æ¡ˆä¸­ä»…æ¬¡äº 2F çš„è¶…ç®—ï¼ˆx}%
    %
}


\channelMsgEntry{%
    \msgRealSource{åŒå€å¤šå¤šå†°ğŸ§¶ | ğ¦ğŸğœğŸ}{2022-07-04 05:29:14}%
    \msgMainContent{10000+ äº†}%
    %
}


\channelMsgEntry{%
    \msgRealSource{åŒå€å¤šå¤šå†°ğŸ§¶ | ğ¦ğŸğœğŸ}{2022-07-04 05:29:14}%
    \msgMainContent{ä¼¼ä¹è¶…è¶Š 2F äº†}%
    %
}


\channelMsgEntry{%
    \msgRealSource{Mingcong Bai}{2022-07-04 05:29:14}%
    \msgMainContent{è¶…è¶Šäº†}%
    %
}


\channelMsgEntry{%
    \msgRealSource{Mingcong Bai}{2022-07-04 05:29:14}%
    \msgMainContent{2F æ˜¯ 9000 å¤š}%
    %
}


\channelMsgEntry{%
    \msgRealSource{Robin Lu}{2022-07-04 05:29:14}%
    \msgMainContent{9077s (-j1, 2.27)}%
    %
}


\channelMsgEntry{%
    \msgRealSource{Mingcong Bai}{2022-07-04 05:29:14}%
    \msgMainContent{æ­å–œ}%
    %
}


\channelMsgEntry{%
    \msgRealSource{åŒå€å¤šå¤šå†°ğŸ§¶ | ğ¦ğŸğœğŸ}{2022-07-04 05:29:14}%
    \msgMainContent{æ˜¯çš„ï¼Œè¶…è¶Š 2F äº†}%
    %
}


\channelMsgEntry{%
    \msgRealSource{Mingcong Bai}{2022-07-04 05:29:15}%
    \msgMainContent{å†å²æ€§çš„ä¸€åˆ»ï¼Œè¶…ç®—ä¹‹ç‹}%
    %
}


\channelMsgEntry{%
    \msgRealSource{Robin Lu}{2022-07-04 05:29:15}%
    \msgMainContent{è¶…è¶Šé¾™èŠ¯ 2F äº†ï¼}%
    %
}


\channelMsgEntry{%
    \msgRealSource{Robin Lu}{2022-07-04 05:29:15}%
    \msgMainContent{è¶…è¶Šäº†ï¼}%
    %
}


\channelMsgEntry{%
    \msgRealSource{Rick Liu}{2022-07-04 05:29:15}%
    \msgMainContent{hhhh}%
    %
}


\channelMsgEntry{%
    \msgRealSource{CÎ±mber Kirisame | 80}{2022-07-04 05:29:15}%
    \msgMainContent{ç‹ çš„ è¯ ç”Ÿ}%
    %
}


\channelMsgEntry{%
    \msgRealSource{Mag Mell}{2022-07-04 15:49:54}%
    \msgMainContent{å®ƒåœ¨æˆ‘çš„æœºå™¨ä¸Šå¯ä»¥å¾ˆå¥½è¿è¡Œï¼------å¤§éƒ¨åˆ†ç¨‹åºå‘˜
èƒ½è¯´ç®—ä¸ä¸Šä»€ä¹ˆï¼Œæœ‰æœ¬äº‹å°±æŠŠä½ çš„ä»£ç ç»™æˆ‘çœ‹çœ‹ã€‚------LinusTorvalds}%
    %
}


\channelMsgEntry{%
    \msgRealSource{Mag Mell}{2022-07-04 15:49:54}%
    \msgMainContent{å“å”·ä½ è‡‰ç´…å•¦ï¼Œä¾†ï¼Œä»£ç¢¼è®“æˆ‘çœ‹çœ‹}%
    %
}


\channelMsgEntry{%
    \msgRealSource{Mag Mell}{2022-07-04 15:49:54}%
    \msgMainContent{è¥ªå­å“¥ä¸è¦å•¦ï¼Œè¥ªå­å“¥ä½ å¹¹å˜›å•Š}%
    %
}


\channelMsgEntry{%
    \msgRealSource{Mag Mell}{2022-07-04 15:49:54}%
    \msgMainContent{è®“æˆ‘ä¾†çœ‹ä½ ä»£ç¢¼ç‰›ä¸ç‰›é€¼å•Š}%
    %
}


\channelMsgEntry{%
    \msgRealSource{Mag Mell}{2022-07-04 15:49:54}%
    \msgMainContent{è¥ªå­å“¥ä¸è¦å•Šè¥ªå­å“¥}%
    %
}


\channelMsgEntry{%
    \msgRealSource{Mingcong Bai}{2022-07-04 15:49:55}%
    \msgMainContent{æˆ‘çœ‹ä½ æ˜¯å®Œå…¨ä¸æ‡‚å–”}%
    %
}


\channelMsgEntry{%
    \msgRealSource{Neo\_Chen (BU4AK)}{2022-07-04 15:49:55}%
    \msgMainContent{ä¾†æˆ‘æˆ¿é–“ï¼Œçµ¦ä½ çœ‹ä¸€é»å¥½åº·çš„}%
    %
}


\channelMsgEntry{%
    \msgRealSource{NewMobileLife}{2022-07-06 20:46:49}%
    \msgMainContent{é˜²åœ‹å®¶ç´šé–“è«œå…¥ä¾µã€€è˜‹æœå®£ä½ˆ iOS 16 åŠ å…¥ Lockdown Mode

https://www.newmobilelife.com/2022/07/07/ios16-lockdown-mode/}%
    \nopagebreak\includegraphics[width=\linewidth]{./.tg-data/2022/photos/photo_240@06-07-2022_20-46-49.jpg}%
}


\channelMsgEntry{%
    \msgRealSource{cth451 ÇÉ”uÇÆƒÉ¹ÇÊŒá´‰p}{2022-07-06 20:46:50}%
    \msgMainContent{Don't give gnome ideas}%
    %
}


\channelMsgEntry{%
    \msgRealSource{impl<T: ?Sized> GenericContainer<T> for OriginCode<T>}{2022-07-13 13:41:59}%
    \msgMainContent{æœ‰ç©ºå¯©ä¸€ä¸‹ https://github.com/AOSC-Dev/aosc-os-abbs/pull/4061 éº¼ï¼ˆ}%
    %
}


\channelMsgEntry{%
    \msgRealSource{Staph Bridge}{2022-07-13 13:42:00}%
    \msgMainContent{{[}M-WPlanck{]} æ‰“ä¸ªå²”ï¼Œåˆç†æ€€ç–‘ä½ çš„å£çº¸æ˜¯ç¾ç¾å›¾ï¼ï¼ˆé€ƒ}%
    %
}


\channelMsgEntry{%
    \msgRealSource{impl<T: ?Sized> GenericContainer<T> for OriginCode<T>}{2022-07-13 13:42:00}%
    \msgMainContent{æ˜¯ R18 NSFW åœ–ï¼ˆot}%
    %
}


\channelMsgEntry{%
    \msgRealSource{Staph Bridge}{2022-07-13 13:42:00}%
    \msgMainContent{{[}M-WPlanck{]} {[}reply{]}: è‰ï¼ˆ}%
    %
}


\channelMsgEntry{%
    \msgRealSource{Junde Yhi}{2022-07-13 13:42:11}%
    \msgMainContent{@TheSaltedFish @OriginCode (?) è¯è¯´èƒ½ç”¨è¿™ç§å£çº¸çš„æˆ‘æŒºä½©æœçš„}%
    %
}


\channelMsgEntry{%
    \msgRealSource{Junde Yhi}{2022-07-13 13:42:11}%
    \msgMainContent{æˆ‘è¦æ˜¯å¤©å¤©å¯¹ç€è¿™ä¸ªæ¡Œé¢æˆ‘éƒ½æ²¡æ³•ä¸“å¿ƒå·¥ä½œ}%
    %
}


\channelMsgEntry{%
    \msgRealSource{FlyGoat}{2022-07-13 13:42:11}%
    \msgMainContent{è°å·¥ä½œçš„æ—¶å€™çª—å£ä¸é“ºæ»¡æ¡Œé¢å•Šï¼ˆx}%
    %
}


\channelMsgEntry{%
    \msgRealSource{Mingcong Bai}{2022-07-20 00:24:45}%
    \msgMainContent{æ”¾è‚†ï¼}%
    \nopagebreak\includegraphics[width=\linewidth]{./.tg-data/2022/photos/photo_241@20-07-2022_00-24-45.jpg}%
}


\channelMsgEntry{%
    \msgRealSource{Junde Yhi}{2022-07-20 00:25:07}%
    \msgMainContent{æˆ‘è¿˜æ²¡æœ‰ç¡è§‰è¿™ä»¶äº‹æƒ…æ˜¯æ€ä¹ˆä¼šäº‹å‘¢ï¼ŒåŸæ¥æ˜¯ä½ ç¾¤æ‰­æ›²äººå–œåŠ ä¸€}%
    \nopagebreak\includegraphics[width=\linewidth]{./.tg-data/2022/photos/photo_242@20-07-2022_00-25-07.jpg}%
}


\channelMsgEntry{%
    \msgRealSource{Junde Yhi}{2022-07-20 00:25:08}%
    \msgMainContent{æˆ‘èƒŒå›äº†ç»„ç»‡ï¼Œæˆ‘è°¢ç½ªï¼Œå¯¹ä¸èµ·}%
    %
}


\channelMsgEntry{%
    \msgRealSource{åŒå€å¤šå¤šå†°ğŸ§¶ | ğ¦ğŸğœğŸ}{2022-07-20 18:05:25}%
    \msgMainContent{æ€ä¹ˆè§‰å¾—æœ¬ç¾¤ç¾¤å‹éƒ½æœ‰å¥‡å¦™çš„ç«¥å¹´ï¼ˆä¸}%
    %
}


\channelMsgEntry{%
    \msgRealSource{FlyGoat}{2022-07-20 18:05:25}%
    \msgMainContent{è¿™å°±æ˜¯æ‰­æ›²äºº}%
    %
}


\channelMsgEntry{%
    \msgRealSource{Robin Lu}{2022-07-20 18:05:25}%
    \msgMainContent{ä½ å†éª‚ï¼ˆæ³æ±‚}%
    %
}


\channelMsgEntry{%
    \msgRealSource{FlyGoat}{2022-07-20 18:05:25}%
    \msgMainContent{æ­£å¸¸äººä¼šåŠ å…¥è¿™ç§æ‰­æ›²ç¾¤å—ï¼ˆx}%
    %
}


\channelMsgEntry{%
    \msgRealSource{åŒå€å¤šå¤šå†°ğŸ§¶ | ğ¦ğŸğœğŸ}{2022-07-20 18:05:25}%
    \msgMainContent{è·Ÿæœ¬ç¾¤ç¾¤å‹ä¸€æ¯”ï¼Œæˆ‘çœŸ tm æ­£å¸¸ï¼ˆx}%
    %
}


\channelMsgEntry{%
    \msgRealSource{Mingcong Bai}{2022-07-20 18:05:25}%
    \msgMainContent{\begin{itemize}
\tightlist
\item
\end{itemize}}%
    %
}


\channelMsgEntry{%
    \msgRealSource{åŒå€å¤šå¤šå†°ğŸ§¶ | ğ¦ğŸğœğŸ}{2022-07-20 18:05:25}%
    \msgMainContent{å¯æˆ‘è¯´è¿™å¥è¯é‡ŒåŒ…æ‹¬ä½ }%
    %
}


\channelMsgEntry{%
    \msgRealSource{å’¸é±¼}{2022-07-21 00:05:39}%
    \msgMainContent{ä½ çœ‹ä½ éƒ½å·¥ä½œäº†ï¼Œå¿«ç»™æˆ‘æ‰“ç‚¹é’±é’±è¡¥è´´ä¸€ä¸‹}%
    %
}


\channelMsgEntry{%
    \msgRealSource{cth451 ÇÉ”uÇÆƒÉ¹ÇÊŒá´‰p}{2022-07-21 00:05:39}%
    \msgMainContent{ä½ åƒå±}%
    %
}


\channelMsgEntry{%
    \msgRealSource{å’¸é±¼}{2022-07-21 00:05:39}%
    \msgMainContent{å˜¤å˜¤å˜¤}%
    %
}


\channelMsgEntry{%
    \msgRealSource{å’¸é±¼}{2022-07-21 00:05:39}%
    \msgMainContent{ä¼¤å¿ƒäº†}%
    %
}


\channelMsgEntry{%
    \msgRealSource{cth451 ÇÉ”uÇÆƒÉ¹ÇÊŒá´‰p}{2022-07-21 00:05:39}%
    \msgMainContent{è‡­å’¸é±¼å»æ‰¾ä½ ä»¬æœå†»å»ï¼ˆæ‘†æ‰‹}%
    %
}


\channelMsgEntry{%
    \msgRealSource{å’¸é±¼}{2022-07-21 00:05:39}%
    \msgMainContent{ä»–æ»¡è„‘å­éƒ½æ˜¯é±¼}%
    %
}


\channelMsgEntry{%
    \msgRealSource{cth451 ÇÉ”uÇÆƒÉ¹ÇÊŒá´‰p}{2022-07-21 00:05:39}%
    \msgMainContent{æ»¡è„‘å­éƒ½æ˜¯ä½ }%
    %
}


\channelMsgEntry{%
    \msgRealSource{cth451 ÇÉ”uÇÆƒÉ¹ÇÊŒá´‰p}{2022-07-24 09:36:16}%
    \msgMainContent{ï¼ˆå¸Œæœ›ä¸è¦è¢«äººæ—¥æ‰}%
    %
}


\channelMsgEntry{%
    \msgRealSource{cth451 ÇÉ”uÇÆƒÉ¹ÇÊŒá´‰p}{2022-07-24 09:36:16}%
    \msgMainContent{php å¤§ç²ª}%
    %
}


\channelMsgEntry{%
    \msgRealSource{å’¸é±¼}{2022-07-24 09:36:17}%
    \msgMainContent{æˆ‘è¿™å°±å»æŠŠä½ çš„æ—¥äº†}%
    %
}


\channelMsgEntry{%
    \msgRealSource{MoGeCâ‚â‚„N Yang}{2022-07-24 09:36:17}%
    \msgMainContent{ä¼ å‡ºå»ï¼Œå’¸é±¼è¦å»æ—¥æŸ´è€æ¿}%
    %
}


\channelMsgEntry{%
    \msgRealSource{å’¸é±¼}{2022-07-24 09:36:17}%
    \msgMainContent{æ²¡äº‹å„¿ï¼Œä¸‹ä¸ªå°±æ˜¯ä½ }%
    %
}


\channelMsgEntry{%
    \msgRealSource{å’¸é±¼}{2022-07-24 09:37:22}%
    \msgMainContent{å‰é¢å¤´å­æ¥çš„æ—¶å€™è¯´è§‰å¾—æˆ‘å’Œä½ è¿˜æœ‰æŸ´å®å®å¾ˆç»™}%
    %
}


\channelMsgEntry{%
    \msgRealSource{å’¸é±¼}{2022-07-24 09:37:22}%
    \msgMainContent{ä½ æœ‰ä»€ä¹ˆå¤´ç»ªå—}%
    %
}


\channelMsgEntry{%
    \msgRealSource{cth451 ÇÉ”uÇÆƒÉ¹ÇÊŒá´‰p}{2022-07-24 09:37:22}%
    \msgMainContent{æˆ‘æ˜¯æ²¡æœ‰ï¼Œæ¨è€æ¿ä¹Ÿæ²¡æœ‰}%
    %
}


\channelMsgEntry{%
    \msgRealSource{cth451 ÇÉ”uÇÆƒÉ¹ÇÊŒá´‰p}{2022-07-24 09:37:22}%
    \msgMainContent{å°±åªæœ‰ä½ è€Œå·²}%
    %
}


\channelMsgEntry{%
    \msgRealSource{cth451 ÇÉ”uÇÆƒÉ¹ÇÊŒá´‰p}{2022-07-24 09:37:22}%
    \msgMainContent{æˆ‘ï¼Œæ¨è€æ¿ï¼Œæœå†»ï¼ŒæŸ³æ ‘é±¼éƒ½æ˜¯å—å®³è€…ï¼ˆ}%
    %
}


\channelMsgEntry{%
    \msgRealSource{å’¸é±¼}{2022-07-24 09:37:22}%
    \msgMainContent{æˆ‘ä¸€ç‚¹éƒ½ä¸ç»™çš„}%
    %
}


\channelMsgEntry{%
    \msgRealSource{å’¸é±¼}{2022-07-24 09:37:22}%
    \msgMainContent{åˆ«çš„äººä¸çŸ¥é“}%
    %
}


\channelMsgEntry{%
    \msgRealSource{å’¸é±¼}{2022-07-24 09:37:22}%
    \msgMainContent{åæ­£é‚£ä¸ªç™½å§“ç”·äººè‚¯å®šæœ‰é—®é¢˜}%
    %
}


\channelMsgEntry{%
    \msgRealSource{å’¸é±¼}{2022-07-24 09:37:22}%
    \msgMainContent{è‡³äºå§¥å§¥éƒ½è·Ÿæˆ‘ç¡ä¸€é—´æˆ¿ç¡äº†å‡ æ¬¡äº†}%
    %
}


\channelMsgEntry{%
    \msgRealSource{å’¸é±¼}{2022-07-24 09:37:22}%
    \msgMainContent{æ‡‚å¾—éƒ½æ‡‚}%
    %
}


\channelMsgEntry{%
    \msgRealSource{å’¸é±¼}{2022-07-24 09:37:22}%
    \msgMainContent{ä½ ä¹Ÿç¡è¿‡æˆ‘çš„åºŠäº†}%
    %
}


\channelMsgEntry{%
    \msgRealSource{liushuyu}{2022-07-24 09:37:22}%
    \msgMainContent{ä½ å¯æœç„¶æ˜¯ä¹å›­å›­é•¿ï¼ˆ}%
    %
}


\channelMsgEntry{%
    \msgRealSource{å’¸é±¼}{2022-07-24 09:37:22}%
    \msgMainContent{ä½ ä¹Ÿé€ƒä¸æ‰}%
    %
}


\channelMsgEntry{%
    \msgRealSource{å’¸é±¼}{2022-07-24 09:37:22}%
    \msgMainContent{éƒ½è·Ÿæˆ‘ç¡è¿‡ä¸€å¼ åºŠçš„äººäº†}%
    %
}


\channelMsgEntry{%
    \msgRealSource{å’¸é±¼}{2022-07-24 09:37:22}%
    \msgMainContent{è£…ä»€ä¹ˆè£…}%
    %
}


\channelMsgEntry{%
    \msgRealSource{liushuyu}{2022-07-24 09:37:22}%
    \msgMainContent{é‚£æˆ‘å½“ç„¶é€ƒä¸æ‰è¢«ä½ æš—å®³äº†ï¼ˆ}%
    %
}


\channelMsgEntry{%
    \msgRealSource{ç™¾åˆå­}{2022-07-24 09:37:22}%
    \msgMainContent{åŸæ¥æ˜¯çœŸçš„}%
    %
}


\channelMsgEntry{%
    \msgRealSource{Rick Liu}{2022-07-24 09:37:23}%
    \msgMainContent{å®‰åŒå®é”¤}%
    %
}


\channelMsgEntry{%
    \msgRealSource{Mingcong Bai}{2022-07-24 09:37:23}%
    \msgMainContent{å¤©\ldots\ldots{} ä¸ï¼Œä¹±ä¼¦ä¹‹ä¹}%
    %
}


\channelMsgEntry{%
    \msgRealSource{Rick Liu}{2022-07-24 09:37:23}%
    \msgMainContent{å¤ªå“ˆäºº æ¶¦äº†æ¶¦äº†}%
    %
}


\channelMsgEntry{%
    \msgRealSource{ZHITAI PC005 Active 1TB}{2022-07-24 09:37:23}%
    \msgMainContent{è°¢å’¸é±¼ä¸æ€ä¹‹æ©}%
    %
}


\channelMsgEntry{%
    \msgRealSource{ZHITAI PC005 Active 1TB}{2022-07-24 09:38:02}%
    \msgMainContent{è°¢å’¸é±¼ä¸æ€ä¹‹æ©}%
    %
}


\channelMsgEntry{%
    \msgRealSource{å’¸é±¼}{2022-07-24 09:38:02}%
    \msgMainContent{ä½ ä¹Ÿæ¥è¿‡æˆ‘å®¶äº†}%
    %
}


\channelMsgEntry{%
    \msgRealSource{ZHITAI PC005 Active 1TB}{2022-07-24 09:38:02}%
    \msgMainContent{ä½†æ˜¯æ²¡ä¸Šè¿‡ä½ çš„åºŠï¼ˆ}%
    %
}


\channelMsgEntry{%
    \msgRealSource{Maria Bombardil}{2022-07-24 09:38:02}%
    \msgMainContent{ä½ ä»¬åœ¨é…’åº—é‡Œäº’ç›¸ä¸ŠåºŠä¸å°±ä¸€èµ·ä¸Šè¿‡åºŠäº†ä¹ˆ}%
    %
}


\channelMsgEntry{%
    \msgRealSource{CT1000MX500SSD4 1000.2 GB}{2022-07-24 09:38:02}%
    \msgMainContent{é‚£æ¬¡æˆ‘ç¡æ²™å‘çš„ æƒ³ä¸åˆ°å§}%
    %
}


\channelMsgEntry{%
    \msgRealSource{Maria Bombardil}{2022-07-24 09:38:02}%
    \msgMainContent{é‚£æ²™å‘åè¿‡å…¶ä»–äººæ²¡ï¼Ÿ}%
    %
}


\channelMsgEntry{%
    \msgRealSource{Maria Bombardil}{2022-07-24 09:38:03}%
    \msgMainContent{æœ‰æ°”å‘³åº”è¯¥å°±ç®—ä¸€èµ·ç¡è¿‡}%
    %
}


\channelMsgEntry{%
    \msgRealSource{Kexy Biscuit | è¢«å­é¥¼ï¸ | ç™¾åˆãƒ¶å’²ã‚‹ã‚‹}{2022-07-24 09:38:15}%
    \msgMainContent{æ—¶ç©ºä¼´éšè€…æ˜¯å§}%
    %
}


\channelMsgEntry{%
    \msgRealSource{Junde Yhi}{2022-07-25 09:21:58}%
    \msgMainContent{æœ‰ä¸€å—åŒºåŸŸå‘Šè¯‰ä½ ç°åœ¨ç”µç½‘è´Ÿè·å¤§è¯·ä½ æ‹”ç”µæˆ–è€…å…³é—­ç”µå™¨ç½¢}%
    %
}


\channelMsgEntry{%
    \msgRealSource{Junde Yhi}{2022-07-25 09:21:58}%
    \msgMainContent{è¿˜å¯ä»¥æ¯ä¸ªæœˆåŠ  Â£6 ç»™ä½ é€æ²¼æ°”ï¼ˆé¢}%
    %
}


\channelMsgEntry{%
    \msgRealSource{Junde Yhi}{2022-07-25 09:21:58}%
    \msgMainContent{``ç”Ÿç‰©ç‡ƒæ°”''ï¼Œä½†æ˜¯ä¸€æ–¹é¢ä½ æ¥çš„åˆä¸æ˜¯ä¸“çº¿è€Œæ˜¯å›½å®¶æ°”ç½‘ï¼Œå¦ä¸€æ–¹é¢æ€»å…±åˆæ²¡æœ‰é‚£ä¹ˆå¤§çš„äº§é‡ï¼Œäºæ˜¯å®é™…ä¸Šçš„æƒ…å†µå°±æ˜¯å®ƒæ‰¿è¯ºå°†
Â£6 é‡Œçš„ 15\% æ¢æˆç”Ÿç‰©ç‡ƒæ°”é€è¿›æ°”ç½‘ï¼Œå‰©ä¸‹ 85\% å»ä¹°èµç½ªåˆ¸}%
    %
}


\channelMsgEntry{%
    \msgRealSource{Junde Yhi}{2022-07-25 09:21:58}%
    \msgMainContent{åƒæˆ‘å®¶è¿™ç§æ²¡æ¥ç‡ƒæ°”çš„ï¼Œä¹Ÿå¯ä»¥ä¹°ï¼Œè¿™æ · Â£6 ä¼šå…¨éƒ¨æ‹¿å»å–èµç½ªåˆ¸}%
    %
}


\channelMsgEntry{%
    \msgRealSource{Junde Yhi}{2022-07-25 09:21:58}%
    \msgMainContent{æ‰¿è¯ºä¸€å¹´å¸®ä½ ç§äº”æ£µæ ‘}%
    %
}


\channelMsgEntry{%
    \msgRealSource{æ°¸ç¥¥}{2022-07-25 09:21:58}%
    \msgMainContent{å› ä¸ºå¤ªè¿‡ç¦»å¥‡ï¼Œæˆ‘è¿˜ä»¥ä¸ºæ˜¯ä½ åœ¨ç©ä»€ä¹ˆæ–°çš„steamæ‰“æŠ˜æ¸¸æˆã€‚ï¼ˆx}%
    %
}


\channelMsgEntry{%
    \msgRealSource{Junde Yhi}{2022-07-26 21:31:56}%
    \msgMainContent{æ²¡è£…è£™æ‘†ï¼Œä¾§é¢çœ‹ä¸Šå»å°±åƒæ²¡ç©¿åº•è£¤ä¸€æ ·}%
    %
}


\channelMsgEntry{%
    \msgRealSource{Mingcong Bai}{2022-07-28 04:25:52}%
    \msgMainContent{}%
    \nopagebreak\includegraphics[width=\linewidth]{./.tg-data/2022/photos/photo_243@28-07-2022_04-25-52.jpg}%
}


\channelMsgEntry{%
    \msgRealSource{Mingcong Bai}{2022-07-28 04:25:52}%
    \msgMainContent{æˆ‘ä»¬æ˜¯ AOSC â€¢ æ ¹å‘è¡Œç‰ˆç¤¾åŒº}%
    %
}


\channelMsgEntry{%
    \msgRealSource{Yangff}{2022-07-28 04:25:52}%
    \msgMainContent{xs}%
    %
}


\channelMsgEntry{%
    \msgRealSource{Lion III}{2022-07-28 04:25:52}%
    \msgMainContent{æ ¹ â€¢ å‘è¡Œç‰ˆ}%
    %
}


\channelMsgEntry{%
    \msgRealSource{Lion III}{2022-07-28 04:25:53}%
    \msgMainContent{å¬èµ·æ¥åƒæ˜¯ç”Ÿå‘å…»å‘çš„æ´—å‘æ°´}%
    %
}


\channelMsgEntry{%
    \msgRealSource{Robin Lu}{2022-07-28 04:25:53}%
    \msgMainContent{è‰ åˆ«æ ¹ç¤¾åŒºäº†ï¼ˆx}%
    %
}


\channelMsgEntry{%
    \msgRealSource{Robin Lu}{2022-07-28 04:25:53}%
    \msgMainContent{OpenKylin è§‚æµ‹äººç°åœ¨çœ‹åˆ°æ ¹ç¤¾åŒºï¼Œå°±å¤´å¤§}%
    %
}


\channelMsgEntry{%
    \msgRealSource{Robin Lu}{2022-07-28 04:25:53}%
    \msgMainContent{æˆ‘ç°åœ¨å°±æ€• Deepin ææ ¹ç¤¾åŒºæå‡ºæ›´ä¸å¯åçŠ¶çš„ä¸œè¥¿}%
    %
}


\channelMsgEntry{%
    \msgRealSource{Robin Lu}{2022-07-28 04:25:53}%
    \msgMainContent{åˆ°æ—¶å€™ lazyparser è¦æ˜¯åˆè®©æˆ‘å»è§‚æµ‹æˆ‘å°±å¯ä»¥ç­‰ç€ç”³è¯·å·¥ä¼¤äº†}%
    %
}


\channelMsgEntry{%
    \msgRealSource{Robin Lu}{2022-07-28 04:25:53}%
    \msgMainContent{å› ä¸ºä¸å¯åçŠ¶çš„åŠ›é‡è€Œæ‰ SAN}%
    %
}


\channelMsgEntry{%
    \msgRealSource{Catten Linger}{2022-07-28 04:25:53}%
    \msgMainContent{æ¢—å‘è¡Œç‰ˆ}%
    %
}


\channelMsgEntry{%
    \msgRealSource{Neruthes 0xAFB3373F5200DF38}{2022-07-28 04:25:53}%
    \msgMainContent{æ ¹ç¤¾åŒºå“ˆå“ˆå“ˆå“ˆå“ˆ}%
    %
}


\channelMsgEntry{%
    \msgRealSource{Mingye Wang}{2022-07-28 04:25:53}%
    \msgMainContent{å®˜æ–¹é¥®æ–™ï¼šæ ¹å•¤}%
    %
}


\channelMsgEntry{%
    \msgRealSource{Mag Mell}{2022-07-28 04:25:53}%
    \msgMainContent{}%
    \nopagebreak\includegraphics[width=\linewidth]{./.tg-data/2022/photos/photo_244@28-07-2022_04-25-53.jpg}%
}


\channelMsgEntry{%
    \msgRealSource{ĞĞµĞ‘ÑƒÑ‚Ğ»ĞµĞ³ ï¼ˆè¿«çœŸï¼‰}{2022-07-28 04:25:53}%
    \msgMainContent{æ ¹æ ¹æ ¹æ ¹æ ¹æ ¹æ ¹æ ¹}%
    %
}


\channelMsgEntry{%
    \msgRealSource{Neo\_Chen (BU4AK)}{2022-07-28 04:25:53}%
    \msgMainContent{Reggae Roots Society ï¼ˆ}%
    %
}


\channelMsgEntry{%
    \msgRealSource{Mag Mell}{2022-07-28 04:25:53}%
    \msgMainContent{åº”è¯¥æ˜¯è¿™æ ·}%
    \nopagebreak\includegraphics[width=\linewidth]{./.tg-data/2022/photos/photo_245@28-07-2022_04-25-53.jpg}%
}


\channelMsgEntry{%
    \msgRealSource{Mag Mell}{2022-07-28 04:25:53}%
    \msgMainContent{ç„¶å¾Œæˆ‘çªç„¶è¦ºå¾—}%
    %
}


\channelMsgEntry{%
    \msgRealSource{Mag Mell}{2022-07-28 04:25:53}%
    \msgMainContent{Deepin çš„ logo æœ‰é»åƒå†°è–„è·æ´—é«®æ°´}%
    %
}


\channelMsgEntry{%
    \msgRealSource{Phoronix News}{2022-08-02 03:38:25}%
    \msgMainContent{Phoronix Linux 5.19 Released - Linus Torvalds Released It From An Apple
Silicon MacBook

Linus Torvalds just released Linux 5.19 as stable for the newest version
of the Linux kernel. He also mentioned this is the first time he
released the new Linux kernel from an ARM64 laptop in the form of an
Apple MacBook running an AArch64 Apple M1 SoC\ldots{}}%
    %
}


\channelMsgEntry{%
    \msgRealSource{Mingcong Bai}{2022-08-02 03:38:25}%
    \msgMainContent{@cth451}%
    %
}


\channelMsgEntry{%
    \msgRealSource{cth451 ÇÉ”uÇÆƒÉ¹ÇÊŒá´‰p}{2022-08-02 03:38:25}%
    \msgMainContent{Shet}%
    %
}


\channelMsgEntry{%
    \msgRealSource{å’¸é±¼}{2022-08-02 03:38:25}%
    \msgMainContent{é€æˆ‘}%
    %
}


\channelMsgEntry{%
    \msgRealSource{Mingcong Bai}{2022-08-02 03:38:25}%
    \msgMainContent{shetï¼Ÿ}%
    %
}


\channelMsgEntry{%
    \msgRealSource{Mingcong Bai}{2022-08-02 03:38:25}%
    \msgMainContent{çˆ±å¥½ä¸é”™å•Š}%
    %
}


\channelMsgEntry{%
    \msgRealSource{Kexy Biscuit | è¢«å­é¥¼ï¸ | ç™¾åˆãƒ¶å’²ã‚‹ã‚‹}{2022-08-02 03:38:25}%
    \msgMainContent{\#NSFW}%
    %
}


\channelMsgEntry{%
    \msgRealSource{Staph Bridge}{2022-08-02 19:21:59}%
    \msgMainContent{{[}D-Fearyncess{]}
https://cdn.discordapp.com/attachments/737207136450379836/1003901890540601375/unknown.png}%
    %
}


\channelMsgEntry{%
    \msgRealSource{Staph Bridge}{2022-08-02 19:21:59}%
    \msgMainContent{{[}D-Fearyncess{]} ç‹å‹‡éƒ½éª‚gnomeï¼ˆ}%
    %
}


\channelMsgEntry{%
    \msgRealSource{Cyan ğŸ‘}{2022-08-02 19:21:59}%
    \msgMainContent{å¥½éª‚}%
    %
}


\channelMsgEntry{%
    \msgRealSource{Staph Bridge}{2022-08-02 19:21:59}%
    \msgMainContent{{[}D-Fearyncess{]} éª‚å¾—å¥½ï¼.jpg}%
    %
}


\channelMsgEntry{%
    \msgRealSource{ĞĞµĞ‘ÑƒÑ‚Ğ»ĞµĞ³ ï¼ˆè¿«çœŸï¼‰}{2022-08-02 19:23:38}%
    \msgMainContent{}%
    \nopagebreak\includegraphics[width=\linewidth]{./.tg-data/2022/photos/photo_246@02-08-2022_19-23-38.jpg}%
}


\channelMsgEntry{%
    \msgRealSource{MoGeCâ‚â‚„N Yang}{2022-08-02 19:23:39}%
    \msgMainContent{é™ˆè€æ¿è¿™ä¹ˆå›å˜é©å‘½äº†}%
    %
}


\channelMsgEntry{%
    \msgRealSource{MoGeCâ‚â‚„N Yang}{2022-08-02 19:23:39}%
    \msgMainContent{tpå‘¢}%
    %
}


\channelMsgEntry{%
    \msgRealSource{ĞĞµĞ‘ÑƒÑ‚Ğ»ĞµĞ³ ï¼ˆè¿«çœŸï¼‰}{2022-08-02 19:23:39}%
    \msgMainContent{åœ¨åŸå‘¢}%
    %
}


\channelMsgEntry{%
    \msgRealSource{ĞĞµĞ‘ÑƒÑ‚Ğ»ĞµĞ³ ï¼ˆè¿«çœŸï¼‰}{2022-08-02 19:23:39}%
    \msgMainContent{æˆ‘å…¨éƒ½è¦}%
    %
}


\channelMsgEntry{%
    \msgRealSource{MoGeCâ‚â‚„N Yang}{2022-08-02 19:23:39}%
    \msgMainContent{åŸp}%
    %
}


\channelMsgEntry{%
    \msgRealSource{ĞĞµĞ‘ÑƒÑ‚Ğ»ĞµĞ³ ï¼ˆè¿«çœŸï¼‰}{2022-08-02 19:23:39}%
    \msgMainContent{æˆ‘è¶…ï¼op.ogg}%
    %
}


\channelMsgEntry{%
    \msgRealSource{å’¸é±¼}{2022-08-02 19:25:50}%
    \msgMainContent{è¿˜æœ‰ä»€ä¹ˆæ˜¯ä½ ä»¬é£ç¾Šåšä¸åˆ°çš„}%
    %
}


\channelMsgEntry{%
    \msgRealSource{Mingcong Bai}{2022-08-02 19:25:50}%
    \msgMainContent{ä¸€åˆ†é’Ÿå†…ç»“å©šç»™ç¾¤å‹ä»¬çœ‹}%
    %
}


\channelMsgEntry{%
    \msgRealSource{FlyGoat}{2022-08-02 19:25:50}%
    \msgMainContent{è‰æ­»}%
    %
}


\channelMsgEntry{%
    \msgRealSource{å’¸é±¼}{2022-08-02 19:25:50}%
    \msgMainContent{è¯´è¿™ä¸ªä¹‹å‰}%
    %
}


\channelMsgEntry{%
    \msgRealSource{å’¸é±¼}{2022-08-02 19:25:50}%
    \msgMainContent{ä½ è‡ªå·±å•¥æ—¶å€™æ‰¾ä¸ªå¯¹è±¡}%
    %
}


\channelMsgEntry{%
    \msgRealSource{Mingcong Bai}{2022-08-02 19:25:50}%
    \msgMainContent{åœ¨è¯´è¿™ä¸ªä¹‹å‰ï¼Œä½ è¦ä¸è¦è€ƒè™‘ä¸‹ç°åœ¨è¢«æ®´çš„å¯èƒ½æ€§ï¼ˆ}%
    %
}


\channelMsgEntry{%
    \msgRealSource{å’¸é±¼}{2022-08-02 19:25:50}%
    \msgMainContent{æˆ‘æœ‰è…¿}%
    %
}


\channelMsgEntry{%
    \msgRealSource{Rick Liu}{2022-08-02 19:25:50}%
    \msgMainContent{ç«Ÿç„¶ä¸æ˜¯ä½ }%
    %
}


\channelMsgEntry{%
    \msgRealSource{Mingcong Bai}{2022-08-02 19:25:50}%
    \msgMainContent{ç„¶åå°±è¢«æˆ‘è¸¹äº†}%
    %
}


\channelMsgEntry{%
    \msgRealSource{å’¸é±¼}{2022-08-02 19:25:50}%
    \msgMainContent{ç”·åŒèµ°å¼€}%
    %
}


\channelMsgEntry{%
    \msgRealSource{Kexy Biscuit | è¢«å­é¥¼ï¸ | ç™¾åˆãƒ¶å’²ã‚‹ã‚‹}{2022-08-02 19:27:09}%
    \msgMainContent{ç¾å›½å¥½åƒè¿˜æ²¡æœ‰å¼€æ”¾äººé±¼è·¨ç‰©ç§å©šå§»ã€‚}%
    %
}


\channelMsgEntry{%
    \msgRealSource{Mingcong Bai}{2022-08-02 19:27:10}%
    \msgMainContent{è¿™æ˜¯ä»€ä¹ˆå›½å®¶æ¸—é€ä¸ªäººè¡Œä¸ºçš„è¶‹åŠ¿ï¼ˆ}%
    %
}


\channelMsgEntry{%
    \msgRealSource{å’¸é±¼}{2022-08-02 19:27:10}%
    \msgMainContent{ä¸æ˜¯ç¾å›½é±¼}%
    %
}


\channelMsgEntry{%
    \msgRealSource{Mingcong Bai}{2022-08-02 19:27:10}%
    \msgMainContent{ã€Šæœå†»å‘Šå…¨ç¤¾åŒºå…¨ç»„ç»‡ã€å…¨è´¡çŒ®è€…ã€å…¨æ‰˜è…®ç¾¤ä¹¦ã€‹

ä½ ä»¬æ˜å¤©å¯èƒ½çœ‹ä¸åˆ°è¿™ç¾¤é‡Œçš„å…¶ä¸­ä¸€ä¸ªäººäº†ï¼Œä»–æˆ–ä¼šå‡ºç°åœ¨æˆ‘çš„å…¶ä¸­ä¸€ä¸ªé±¼ç¼¸é‡Œ}%
    %
}


\channelMsgEntry{%
    \msgRealSource{Maria Bombardil}{2022-08-02 19:27:10}%
    \msgMainContent{ä»€ä¹ˆè‹è”æ ¸å¿ƒæŠ€æœ¯}%
    %
}


\channelMsgEntry{%
    \msgRealSource{å’¸é±¼}{2022-08-02 19:27:10}%
    \msgMainContent{å¤ªå¥½äº†ï¼Œæˆ‘æ˜¯å’¸é±¼ï¼Œåæ­£ä¸æ˜¯æˆ‘}%
    %
}


\channelMsgEntry{%
    \msgRealSource{Kexy Biscuit | è¢«å­é¥¼ï¸ | ç™¾åˆãƒ¶å’²ã‚‹ã‚‹}{2022-08-02 19:27:10}%
    \msgMainContent{å¼ºçƒˆè°´è´£åé±¼ç±»è¡Œå¾„}%
    %
}


\channelMsgEntry{%
    \msgRealSource{Mingcong Bai}{2022-08-02 19:27:10}%
    \msgMainContent{é¥¼æ–¹ç½”é¡¾ç™½å®¶åº—çŒªåœˆé±¼ç±»ä¼™é£ŸçŠ¶å†µå¥½äºäººç±»è¿™ä¸€äº‹å®ï¼Œæ˜¯æ— è€»çš„è´¼å–Šæ‰è´¼ã€å»ºç«‹åŒæ ‡è¡Œå¾„}%
    %
}


\channelMsgEntry{%
    \msgRealSource{Mingcong Bai}{2022-08-02 19:27:10}%
    \msgMainContent{æœå†»ä»£è¡¨å…¨ç¤¾åŒºå…¨ç»„ç»‡ã€å…¨è´¡çŒ®è€…ã€å…¨æ‰˜è…®ç¾¤è¡¨ç¤ºæ„¤æ…¨åŠå¼ºçƒˆè°´è´£}%
    %
}


\channelMsgEntry{%
    \msgRealSource{Kexy Biscuit | è¢«å­é¥¼ï¸ | ç™¾åˆãƒ¶å’²ã‚‹ã‚‹}{2022-08-02 19:27:10}%
    \msgMainContent{UPS?}%
    %
}


\channelMsgEntry{%
    \msgRealSource{Kexy Biscuit | è¢«å­é¥¼ï¸ | ç™¾åˆãƒ¶å’²ã‚‹ã‚‹}{2022-08-02 19:27:10}%
    \msgMainContent{å®Œäº†ï¼Œæˆ‘æˆå®‰ç‹¬äº†}%
    %
}


\channelMsgEntry{%
    \msgRealSource{Mingcong Bai}{2022-08-02 19:27:10}%
    \msgMainContent{``æˆ‘æ€ä¹ˆä¸çŸ¥é“æˆ‘ä»¬è‡ªå·±å…¬å¸æœ‰æ–°æœåŠ¡å‘¢''}%
    %
}


\channelMsgEntry{%
    \msgRealSource{Mingcong Bai}{2022-08-02 19:27:10}%
    \msgMainContent{ææ¸…æ¥šï¼Œæ˜¯é¥¼ç‹¬ï¼ˆ}%
    %
}


\channelMsgEntry{%
    \msgRealSource{Mingcong Bai}{2022-08-02 19:27:10}%
    \msgMainContent{å®‰åœ¨è¿™é‡Œï¼ˆ}%
    %
}


\channelMsgEntry{%
    \msgRealSource{Robin Lu}{2022-08-02 19:27:10}%
    \msgMainContent{ä½ ä»¬è¿™å¯¹è¯å¤ªåç°ä»£äº†}%
    %
}


\channelMsgEntry{%
    \msgRealSource{Robin Lu}{2022-08-02 19:29:10}%
    \msgMainContent{ä½ ä»¬è¿™å¯¹è¯å¤ªåç°ä»£äº†}%
    %
}


\channelMsgEntry{%
    \msgRealSource{Mingcong Bai}{2022-08-02 19:29:10}%
    \msgMainContent{æˆ‘ä»¬çš„åŒå¿—ä¹‹ä¸­æœ‰ä¸ªåˆ«äººæ€»æ˜¯ä»¥è¥¿æ–¹å”¯å¿ƒä¸»ä¹‰ä¹‹åï¼Œè¡Œä¹±æ³•æƒ‘ä¼—ä¹‹å®ï¼Œå…¶å¿ƒå¯è¯›}%
    %
}


\channelMsgEntry{%
    \msgRealSource{Maria Bombardil}{2022-08-02 19:29:10}%
    \msgMainContent{æ—¢ç„¶è‡ªç§°æœå†»äº†ï¼Œå°±åˆ«å†è‡ªç§°äººäº†ï¼ˆ}%
    %
}


\channelMsgEntry{%
    \msgRealSource{Mingcong Bai}{2022-08-02 19:29:10}%
    \msgMainContent{æˆ‘åšä¸äº†äººï¼Œä½ åšå¾—äº†ï¼Ÿï¼ˆx}%
    %
}


\channelMsgEntry{%
    \msgRealSource{Mingcong Bai}{2022-08-02 19:29:10}%
    \msgMainContent{å°±ä¸€ç ´ç«è½¦å¤´ï¼Œå’‹åºŸè¯è¿™ä¹ˆå¤šï¼ˆx}%
    %
}


\channelMsgEntry{%
    \msgRealSource{Robin Lu}{2022-08-02 19:29:10}%
    \msgMainContent{æˆ‘æ„Ÿè§‰ä½ ä»¬æŒºé»‘è¯çš„}%
    %
}


\channelMsgEntry{%
    \msgRealSource{å’¸é±¼}{2022-08-02 19:29:10}%
    \msgMainContent{â¬†ï¸ä¸€é¢—ä¸€å¹´å››å­£éƒ½æˆ´åœ£è¯å¸½çš„æœå†»}%
    %
}


\channelMsgEntry{%
    \msgRealSource{Mingcong Bai}{2022-08-02 19:29:10}%
    \msgMainContent{é‚£ä½ ä¾¿èƒ½ç™½äº†ï¼Ÿå¥½ä¸€ä¸ªæ²™æ–‡ä¸»ä¹‰è·µè¡Œè€…}%
    %
}


\channelMsgEntry{%
    \msgRealSource{Robin Lu}{2022-08-02 19:29:10}%
    \msgMainContent{é»‘è‰²çˆ±å¥½è€…ç«™èµ·æ¥äº†ï¼}%
    %
}


\channelMsgEntry{%
    \msgRealSource{Robin Lu}{2022-08-02 19:29:10}%
    \msgMainContent{åœ°ç‹±ç©ºè¡è¡ï¼Œæ¶é­”åœ¨äººé—´ï¼ˆå¤§å˜˜}%
    %
}


\channelMsgEntry{%
    \msgRealSource{å’¸é±¼}{2022-08-02 19:29:10}%
    \msgMainContent{è¿™æ˜¯å¦æ˜¯ä¸€ç§æœºæ¢°é£å‡}%
    %
}


\channelMsgEntry{%
    \msgRealSource{Mingcong Bai}{2022-08-02 19:29:10}%
    \msgMainContent{æˆ‘ä»¬ä¹‹ä¸­æå°‘æ•°äººæ€»è§‰å¾—è‡ªå·±æˆäº†åœ£è´¤------}%
    %
}


\channelMsgEntry{%
    \msgRealSource{Maria Bombardil}{2022-08-02 19:29:10}%
    \msgMainContent{åŒ…æ‹¬ä½ }%
    %
}


\channelMsgEntry{%
    \msgRealSource{Robin Lu}{2022-08-02 19:29:10}%
    \msgMainContent{AOSC/æœ€åçš„æ™šé¤}%
    %
}


\channelMsgEntry{%
    \msgRealSource{Mingcong Bai}{2022-08-02 19:29:10}%
    \msgMainContent{ã€Šè®ºåŠå¤œå‡ºå‘çº¢çœ¼èˆªç­åœ¨äººç¾¤å¯†é›†çš„èˆªç«™æ¥¼é‡Œäººçš„å¿ƒæ€ä¼šå‘ç”Ÿä»€ä¹ˆå˜åŒ–ã€‹}%
    %
}


\channelMsgEntry{%
    \msgRealSource{Robin Lu}{2022-08-02 19:29:10}%
    \msgMainContent{æˆ‘ä»¬ä¸­å‡ºäº†ä¸ªåœ£è´¤}%
    %
}


\channelMsgEntry{%
    \msgRealSource{Mingcong Bai}{2022-08-02 19:29:10}%
    \msgMainContent{é‚£ä½ ä¾¿æ˜¯çŠ¹å¤§ç½¢ï¼}%
    %
}


\channelMsgEntry{%
    \msgRealSource{Robin Lu}{2022-08-02 19:30:55}%
    \msgMainContent{æˆ‘ä»¬ä¸­å‡ºäº†ä¸ªåœ£è´¤}%
    %
}


\channelMsgEntry{%
    \msgRealSource{Maria Bombardil}{2022-08-02 19:30:55}%
    \msgMainContent{æ–°æ¦‚å¿µä¸­å‡º}%
    %
}


\channelMsgEntry{%
    \msgRealSource{Neo\_Chen (BU4AK)}{2022-08-02 19:30:55}%
    \msgMainContent{ä¸­æ–‡æ–·å¥åç´šè€ƒè©¦ï¼ˆ}%
    %
}


\channelMsgEntry{%
    \msgRealSource{Mingcong Bai}{2022-08-02 19:30:55}%
    \msgMainContent{è®²çœŸæˆ‘ä¸Šå­¦æœŸåœ¨ç¿»è¯‘è’‹å›½å…¬æ–‡}%
    %
}


\channelMsgEntry{%
    \msgRealSource{Mingcong Bai}{2022-08-02 19:30:55}%
    \msgMainContent{å¯è°“é…£ç•…æ·‹æ¼“}%
    %
}


\channelMsgEntry{%
    \msgRealSource{Mingcong Bai}{2022-08-02 19:30:55}%
    \msgMainContent{ä¸çŸ¥é“åœ¨è¯»å…¬æ–‡è¿˜æ˜¯é‡‘åˆšç»ï¼ˆ}%
    %
}


\channelMsgEntry{%
    \msgRealSource{Mingcong Bai}{2022-08-02 19:30:55}%
    \msgMainContent{è€Œä¸”è¿˜æ˜¯å¸¦ä¸‰çº§ Ref çš„ç©æ³•}%
    %
}


\channelMsgEntry{%
    \msgRealSource{Maria Bombardil}{2022-08-02 19:30:55}%
    \msgMainContent{ä¹ å¾—è’‹å…¬ç²¾é«“ï¼Œåä¸–å¤©å¤©çœ‹æ¯›æ³½ä¸œçš„æ–‡ç« æ˜¯å§}%
    %
}


\channelMsgEntry{%
    \msgRealSource{Robin Lu}{2022-08-02 19:38:20}%
    \msgMainContent{AOSC/SuperComputing}%
    %
}


\channelMsgEntry{%
    \msgRealSource{Mingcong Bai}{2022-08-02 19:38:20}%
    \msgMainContent{AOSC/HPC}%
    %
}


\channelMsgEntry{%
    \msgRealSource{Robin Lu}{2022-08-02 19:38:20}%
    \msgMainContent{shipped with MPI}%
    %
}


\channelMsgEntry{%
    \msgRealSource{Robin Lu}{2022-08-02 19:38:20}%
    \msgMainContent{\& OpenBLAS}%
    %
}


\channelMsgEntry{%
    \msgRealSource{Robin Lu}{2022-08-02 19:41:59}%
    \msgMainContent{man, who can resist VLIW}%
    %
}


\channelMsgEntry{%
    \msgRealSource{FlyGoat}{2022-08-02 19:41:59}%
    \msgMainContent{è¯´çš„å¥½ï¼Œè¯·ç«‹åˆ»å»å†™EPICæ±‡ç¼–ï¼ˆx}%
    %
}


\channelMsgEntry{%
    \msgRealSource{FlyGoat}{2022-08-02 19:41:59}%
    \msgMainContent{ç„¶åä½ å°±çŸ¥é“ä»€ä¹ˆå«è„‘å­ä¸å¤Ÿç”¨äº†}%
    %
}


\channelMsgEntry{%
    \msgRealSource{Robin Lu}{2022-08-02 19:41:59}%
    \msgMainContent{æˆ‘ï¼š``man, who can resist VLIW'' å¤šå¤šå†°å§ï¼š``compiler authors''}%
    %
}


\channelMsgEntry{%
    \msgRealSource{Give Way}{2022-08-02 19:45:47}%
    \msgMainContent{å·äº†ç‰¹é¦–é±¼ç¼¸çš„å’¸é±¼ çƒ§ç†Ÿäº†åƒ å´å‘ç°äº†P65 warningçš„è´´çº¸ ï¼ˆ}%
    %
}


\channelMsgEntry{%
    \msgRealSource{Mingcong Bai}{2022-08-02 19:45:47}%
    \msgMainContent{æˆ‘æ•´ä¸ªå®¶å°±æ˜¯ä¸€å¼ å¤§å¤§çš„ P65ï¼ˆ}%
    %
}


\channelMsgEntry{%
    \msgRealSource{åŒå€å¤šå¤šå†°ğŸ§¶ | ğ¦ğŸğœğŸ}{2022-08-02 19:45:47}%
    \msgMainContent{åœ¨é—¨å£è´´ä¸€ä¸ªï¼Ÿï¼ˆ}%
    %
}


\channelMsgEntry{%
    \msgRealSource{Neo\_Chen (BU4AK)}{2022-08-09 17:16:48}%
    \msgMainContent{æ‡‚äº†ï¼Œæˆ‘è¦å­¸ç¿’ ed(1)ï¼ŒéŒ¯èª¤è¨Šæ¯åªæœ‰ ``?''}%
    %
}


\channelMsgEntry{%
    \msgRealSource{Mag Mell}{2022-08-10 07:44:38}%
    \msgMainContent{æˆ‘è¶…}%
    %
}


\channelMsgEntry{%
    \msgRealSource{Mag Mell}{2022-08-10 07:44:38}%
    \msgMainContent{åˆæœ‰äººæå—é€š}%
    %
}


\channelMsgEntry{%
    \msgRealSource{æ°¸ç¥¥}{2022-08-10 07:44:39}%
    \msgMainContent{å—é€šç§‘æŠ€äº§ä¸šå›­æ˜¯é¡ºåº”äº§ä¸šå‡çº§ã€èµ„æºé›†çº¦çš„æ–°å½¢åŠ¿ã€æ–°è¦æ±‚ï¼Œä¾æ‰˜ç‰¹æ®Šçš„åŒºä½ã€äº¤é€šä»¥åŠäººåŠ›èµ„æºä¼˜åŠ¿ï¼Œé‡ç‚¹å¼€å‘çš„ç°ä»£äº§ä¸šç¤ºèŒƒåŒº}%
    %
}


\channelMsgEntry{%
    \msgRealSource{Mag Mell}{2022-08-10 07:44:39}%
    \msgMainContent{æˆ‘çŸ¥é“ï¼Œè¯äº‹äººæ˜¯ä¸€æ¡é±¼ï¼}%
    %
}


\channelMsgEntry{%
    \msgRealSource{æ°¸ç¥¥}{2022-08-10 07:44:39}%
    \msgMainContent{}%
    \nopagebreak\includegraphics[width=\linewidth]{./.tg-data/2022/photos/photo_247@10-08-2022_07-44-39.jpg}%
}


\channelMsgEntry{%
    \msgRealSource{æ°¸ç¥¥}{2022-08-10 07:44:39}%
    \msgMainContent{ä½ çœ‹ï¼Œè¿˜æœ‰é±¼éª¨å¤´}%
    %
}


\channelMsgEntry{%
    \msgRealSource{Mag Mell}{2022-08-10 07:44:39}%
    \msgMainContent{æ˜ç™½äº†ï¼Œå’¸é±¼è¢«äººå¹²äº†}%
    %
}


\channelMsgEntry{%
    \msgRealSource{Mag Mell}{2022-08-10 07:44:39}%
    \msgMainContent{æ‰æœ‰å—é€šä¹å›­}%
    %
}


\channelMsgEntry{%
    \msgRealSource{Mag Mell}{2022-08-10 07:44:39}%
    \msgMainContent{ç”¨ä»–çš„éª¨å¤´æ¥ç¥­æ‹œ}%
    %
}


\channelMsgEntry{%
    \msgRealSource{Mingcong Bai}{2022-08-11 04:48:54}%
    \msgMainContent{https://youtu.be/4uPRZQ-xw9E}%
    %
}


\channelMsgEntry{%
    \msgRealSource{æ¢“ç‘¶é…±}{2022-08-11 04:48:54}%
    \msgMainContent{ç›´æ’­çš„å±å¹•æ»šè¿‡ä¹ˆï¼ˆ}%
    %
}


\channelMsgEntry{%
    \msgRealSource{Mingcong Bai}{2022-08-11 04:48:54}%
    \msgMainContent{è€å¿ƒç­‰ï¼ˆ}%
    %
}


\channelMsgEntry{%
    \msgRealSource{Mingcong Bai}{2022-08-11 04:48:54}%
    \msgMainContent{ç­‰åˆ°äº†å¾ˆæœ‰æˆå°±æ„Ÿçš„ï¼ˆ}%
    %
}


\channelMsgEntry{%
    \msgRealSource{webRTCCat}{2022-08-11 04:48:54}%
    \msgMainContent{ä»€ä¹ˆèµ›åšæ²¥é’æ»´è½å®éªŒ}%
    %
}


\channelMsgEntry{%
    \msgRealSource{Robin Lu}{2022-08-11 18:40:06}%
    \msgMainContent{æˆ‘æ„Ÿè§‰ç‰¹é¦–çš„ m68k ç¼–è¯‘}%
    %
}


\channelMsgEntry{%
    \msgRealSource{Robin Lu}{2022-08-11 18:40:06}%
    \msgMainContent{æ˜¯ä¸æ˜¯å¡äº†å¿«ä¸€å¤©}%
    %
}


\channelMsgEntry{%
    \msgRealSource{Robin Lu}{2022-08-11 18:40:06}%
    \msgMainContent{è¿˜å¡åœ¨åŒä¸€ä¸ª make-syscall ä¸Š}%
    %
}


\channelMsgEntry{%
    \msgRealSource{åŒå€å¤šå¤šå†°ğŸ§¶ | ğ¦ğŸğœğŸ}{2022-08-11 18:40:06}%
    \msgMainContent{èµ›åšæ²¥é’æ»´è½å®éªŒå˜›}%
    %
}


\channelMsgEntry{%
    \msgRealSource{Robin Lu}{2022-08-11 18:40:06}%
    \msgMainContent{çœŸå°±æ²¥é’æ»´è½å•Š}%
    %
}


\channelMsgEntry{%
    \msgRealSource{Robin Lu}{2022-08-11 18:40:07}%
    \msgMainContent{è‰}%
    %
}


\channelMsgEntry{%
    \msgRealSource{Robin Lu}{2022-08-11 18:40:07}%
    \msgMainContent{æˆ‘ä»¥ä¸ºè‡³å°‘åŠå°æ—¶æ»šä¸€è¡Œ}%
    %
}


\channelMsgEntry{%
    \msgRealSource{Robin Lu}{2022-08-11 18:40:07}%
    \msgMainContent{æˆ–è€…åå‡ åˆ†é’Ÿæ»šä¸€è¡Œ}%
    %
}


\channelMsgEntry{%
    \msgRealSource{å’¸é±¼}{2022-08-11 18:40:07}%
    \msgMainContent{è‚¯å®šä¸æ˜¯åŒä¸€ä¸ª}%
    %
}


\channelMsgEntry{%
    \msgRealSource{å’¸é±¼}{2022-08-11 18:40:07}%
    \msgMainContent{æ»šè¿‡äº†}%
    %
}


\channelMsgEntry{%
    \msgRealSource{Robin Lu}{2022-08-11 18:40:07}%
    \msgMainContent{å“¦ å¥½}%
    %
}


\channelMsgEntry{%
    \msgRealSource{å’¸é±¼}{2022-08-11 18:40:07}%
    \msgMainContent{ä½†æ˜¯é•¿å¾—ç¡®å®æœ‰å¤Ÿåƒ}%
    %
}


\channelMsgEntry{%
    \msgRealSource{Robin Lu}{2022-08-11 18:40:07}%
    \msgMainContent{é‚£ä¼°è®¡æ²¡æ»šå¤ªå¤šï¼Œå¯èƒ½æ˜¯ç›¸å…³çš„é‚£äº›}%
    %
}


\channelMsgEntry{%
    \msgRealSource{åŒå€å¤šå¤šå†°ğŸ§¶ | ğ¦ğŸğœğŸ}{2022-08-11 18:40:07}%
    \msgMainContent{``ç…§ç›¸æœºæ‹ä¸‹äº†æ²¥é’æ»´è½çš„é‚£ä¸€åˆ»''}%
    %
}


\channelMsgEntry{%
    \msgRealSource{Robin Lu}{2022-08-11 18:40:07}%
    \msgMainContent{å“¦å“¦å“¦å“¦ æˆ‘è§‚æµ‹åˆ°å®ƒåŠ¨äº†.png}%
    %
}


\channelMsgEntry{%
    \msgRealSource{Robin Lu}{2022-08-11 18:40:07}%
    \msgMainContent{ä»æ¥æ²¡æœ‰çœ‹åˆ°è¿‡æ»šåŠ¨è¿™ä¹ˆæ…¢çš„ make}%
    %
}


\channelMsgEntry{%
    \msgRealSource{Robin Lu}{2022-08-11 18:40:07}%
    \msgMainContent{ï¼ˆx}%
    %
}


\channelMsgEntry{%
    \msgRealSource{webRTCCat}{2022-08-11 18:40:07}%
    \msgMainContent{ç¬‘æ­»}%
    %
}


\channelMsgEntry{%
    \msgRealSource{webRTCCat}{2022-08-11 18:40:07}%
    \msgMainContent{èŠ±åå‡ å¹´æ‰“å®ŒåŒ…æ˜¯å§}%
    %
}


\channelMsgEntry{%
    \msgRealSource{å’¸é±¼}{2022-08-11 18:40:07}%
    \msgMainContent{è¿™ç”šè‡³ä¸æ˜¯æ‰“åŒ…}%
    %
}


\channelMsgEntry{%
    \msgRealSource{å’¸é±¼}{2022-08-11 18:40:07}%
    \msgMainContent{æ²¡æœ‰ç”¨ acbs ç›´æ¥ç¼–è¯‘çš„}%
    %
}


\channelMsgEntry{%
    \msgRealSource{å’¸é±¼}{2022-08-11 18:40:07}%
    \msgMainContent{å±äºæ˜¯æ ‡å‡†è·‘åˆ†æ“ä½œï¼ˆx}%
    %
}


\channelMsgEntry{%
    \msgRealSource{webRTCCat}{2022-08-11 18:40:07}%
    \msgMainContent{specpackæ˜¯å§}%
    %
}


\channelMsgEntry{%
    \msgRealSource{webRTCCat}{2022-08-11 18:40:07}%
    \msgMainContent{è¶…ç®—è·‘åˆ†ï¼ˆ}%
    %
}


\channelMsgEntry{%
    \msgRealSource{Mingcong Bai}{2022-08-13 00:13:00}%
    \msgMainContent{è¿™æ¬¡æŠ•ç¥¨çš„æƒ…å†µ}%
    \nopagebreak\includegraphics[width=\linewidth]{./.tg-data/2022/photos/photo_248@13-08-2022_00-13-00.jpg}%
}


\channelMsgEntry{%
    \msgRealSource{Mingcong Bai}{2022-08-13 00:13:00}%
    \msgMainContent{å¦‚æ­¤å‹å€’æ€§çš„é€‰æƒ…å…¶å®æ˜¯ç¬¬ä¸€æ¬¡å‡ºç°ï¼ˆ}%
    %
}


\channelMsgEntry{%
    \msgRealSource{å’¸é±¼}{2022-08-13 00:13:00}%
    \msgMainContent{å¦‚æœä¸æ˜¯è¿™æ¬¡æœ€é«˜æŒ‡ç¤ºç¦æ­¢ä¸ªäººå´‡æ‹œ}%
    %
}


\channelMsgEntry{%
    \msgRealSource{å’¸é±¼}{2022-08-13 00:13:00}%
    \msgMainContent{æˆ–è®¸ä¼šæ˜¯ Jelly}%
    %
}


\channelMsgEntry{%
    \msgRealSource{Mingcong Bai}{2022-08-13 00:13:00}%
    \msgMainContent{è¿™æ¬¡æœ€é«˜æŒ‡ç¤ºæ˜¯æ”¾é€å’¸é±¼}%
    %
}


\channelMsgEntry{%
    \msgRealSource{å’¸é±¼}{2022-08-13 04:41:14}%
    \msgMainContent{å™¢æŠ±æ­‰æˆ‘å¿˜äº†ï¼ˆæå°å£°}%
    %
}


\channelMsgEntry{%
    \msgRealSource{å’¸é±¼}{2022-08-13 04:41:14}%
    \msgMainContent{é‚£ä¸ª topic é‡Œé¢çš„è„šæœ¬ä½ è§‰å¾—æœ‰å•¥è¦æ”¹çš„å—}%
    %
}


\channelMsgEntry{%
    \msgRealSource{Mingcong Bai}{2022-08-13 04:41:14}%
    \msgMainContent{ä¹°åŠå•¥ï¼Ÿ}%
    %
}


\channelMsgEntry{%
    \msgRealSource{Mingcong Bai}{2022-08-13 04:41:14}%
    \msgMainContent{è¿™é‡Œä¸è®¸è…è´¥}%
    %
}


\channelMsgEntry{%
    \msgRealSource{å’¸é±¼}{2022-08-13 04:41:14}%
    \msgMainContent{è¦æ”¹çš„ï¼}%
    %
}


\channelMsgEntry{%
    \msgRealSource{å’¸é±¼}{2022-08-13 04:41:14}%
    \msgMainContent{æ‰“é”™äº†ï¼ï¼}%
    %
}


\channelMsgEntry{%
    \msgRealSource{å’¸é±¼}{2022-08-13 04:41:14}%
    \msgMainContent{æœ€é«˜æŒ‡ç¤ºï¼šä¸å…è®¸è…è´¥}%
    %
}


\channelMsgEntry{%
    \msgRealSource{Mingcong Bai}{2022-08-13 04:41:27}%
    \msgMainContent{æ³¨ï¼šåŸå¥é‡Œæ˜¯``ä¹°''è€Œä¸æ˜¯``æ”¹''}%
    %
}


\channelMsgEntry{%
    \msgRealSource{Mingcong Bai}{2022-08-16 05:40:44}%
    \msgMainContent{}%
    \nopagebreak\includegraphics[width=\linewidth]{./.tg-data/2022/photos/photo_249@16-08-2022_05-40-44.jpg}%
}


\channelMsgEntry{%
    \msgRealSource{Mingcong Bai}{2022-08-16 05:40:44}%
    \msgMainContent{Neofetch è¡¨ç¤ºå®Œå…¨çœ‹ä¸æ‡‚ï¼ˆ}%
    %
}


\channelMsgEntry{%
    \msgRealSource{Kexy Biscuit | è¢«å­é¥¼ï¸ | ç™¾åˆãƒ¶å’²ã‚‹ã‚‹}{2022-08-16 05:40:44}%
    \msgMainContent{CPU: yes}%
    %
}


\channelMsgEntry{%
    \msgRealSource{åŒå€å¤šå¤šå†°ğŸ§¶ | ğ¦ğŸğœğŸ}{2022-08-18 08:50:18}%
    \msgMainContent{å¥‡æ€ªçš„ PC ä¸»æ¿ï¼ˆxï¼‰åˆ°äº†}%
    \nopagebreak\includegraphics[width=\linewidth]{./.tg-data/2022/photos/photo_250@18-08-2022_08-50-18.jpg}%
}


\channelMsgEntry{%
    \msgRealSource{ĞĞµĞ‘ÑƒÑ‚Ğ»ĞµĞ³ ï¼ˆè¿«çœŸï¼‰}{2022-08-18 08:50:18}%
    \msgMainContent{Painful computer}%
    %
}


\channelMsgEntry{%
    \msgRealSource{è‡­è‡­}{2022-08-19 01:59:17}%
    \msgMainContent{https://www.youtube.com/watch?v=YKyt6Zifez0}%
    %
}


\channelMsgEntry{%
    \msgRealSource{è‡­è‡­}{2022-08-19 01:59:18}%
    \msgMainContent{ç¾å°‘å¥³éƒ½å¼€ Subaru}%
    %
}


\channelMsgEntry{%
    \msgRealSource{cth451 ÇÉ”uÇÆƒÉ¹ÇÊŒá´‰p}{2022-08-19 01:59:18}%
    \msgMainContent{æœå†»ï¼š}%
    %
}


\channelMsgEntry{%
    \msgRealSource{Cat Ball}{2022-08-19 01:59:18}%
    \msgMainContent{æ˜¯ç¾å°‘å¥³}%
    %
}


\channelMsgEntry{%
    \msgRealSource{è‡­è‡­}{2022-08-19 01:59:18}%
    \msgMainContent{æ˜¯ç¾å°‘å¥³}%
    %
}


\channelMsgEntry{%
    \msgRealSource{Mingcong Bai}{2022-08-20 06:34:07}%
    \msgMainContent{sprbï¼Ÿ}%
    %
}


\channelMsgEntry{%
    \msgRealSource{cth451 ÇÉ”uÇÆƒÉ¹ÇÊŒá´‰p}{2022-08-20 06:34:08}%
    \msgMainContent{Summer pocket reflection blue}%
    %
}


\channelMsgEntry{%
    \msgRealSource{cth451 ÇÉ”uÇÆƒÉ¹ÇÊŒá´‰p}{2022-08-20 06:34:09}%
    \msgMainContent{æ˜¯ AOSC wine certified è§†è§‰å°è¯´ç±»æ¸¸æˆä¹‹ä¸€ï¼ˆ}%
    %
}


\channelMsgEntry{%
    \msgRealSource{Mingcong Bai}{2022-08-20 06:34:09}%
    \msgMainContent{æ­»å®…æ»šå•Šï¼ˆ}%
    %
}


\channelMsgEntry{%
    \msgRealSource{Mingcong Bai}{2022-08-21 01:16:33}%
    \msgMainContent{ä»–ä»¬æœ‰ä¸ªç‰ˆæœ¬æ›´æ–°æç¤ºï¼Œè¦ patch å±Œ}%
    %
}


\channelMsgEntry{%
    \msgRealSource{é—‡é›¨.ptcop | Revins de l'Origine.}{2022-08-22 01:21:33}%
    \msgMainContent{äº²çˆ±çš„æ—¶é—´æ—…è¡Œè€…ï¼Œåœ¨æˆ‘ä»¬æ‰€åœ¨çš„é‚£ä¸ªæ—¶ç©ºï¼ŒAOSC OS å®‰è£…å™¨åªèƒ½æ”¯æŒæœ€é«˜ 8PiB
çš„ RAMï¼Œè¯·å°½å¯èƒ½å‡å°‘ç³»ç»Ÿçš„ RAM å¤§å°ï¼Œè°¢è°¢ã€‚}%
    %
}


\channelMsgEntry{%
    \msgRealSource{Rick Liu}{2022-08-22 01:21:33}%
    \msgMainContent{æˆ‘å€’æ˜¯æŒºæƒ³çŸ¥é“æ—…è¡Œè€…æ¥çš„æ—¶ç©ºAOSC OSçš„ç”¨æˆ·æ¯”å¼€å‘è€…å¤šäº†å—ï¼ˆ}%
    %
}


\channelMsgEntry{%
    \msgRealSource{Mingcong Bai}{2022-08-22 01:21:33}%
    \msgMainContent{ï¼ˆç©¿è¶Šï¼‰ Aï¼šä»Šå¹´æ˜¯å‡ å¹´ Bï¼šè®©æˆ‘é—®é—® ï¼ˆB è½¬å¤´ï¼‰
Bï¼šä½ ä»¬ç¤¾åŒºå¼€å‘è€…ç”¨æˆ·æ¯”ç°åœ¨æ˜¯å¤šå°‘ï¼Ÿ ï¼ˆSaki é•¿è€å›é“ 1:1ï¼‰ ï¼ˆB å›å¤´çœ‹ Aï¼‰
Bï¼š3302 å¹´}%
    %
}


\channelMsgEntry{%
    \msgRealSource{liushuyu}{2022-08-22 01:21:33}%
    \msgMainContent{3306 å§ï¼ˆ}%
    %
}


\channelMsgEntry{%
    \msgRealSource{åŒå€å¤šå¤šå†°ğŸ§¶ | ğ¦ğŸğœğŸ}{2022-08-24 23:36:15}%
    \msgMainContent{@atCamber æˆ‘å¤ä½ lorenz äº†å•Š}%
    %
}


\channelMsgEntry{%
    \msgRealSource{åŒå€å¤šå¤šå†°ğŸ§¶ | ğ¦ğŸğœğŸ}{2022-08-24 23:36:15}%
    \msgMainContent{å¦å¤–æˆ‘å¯èƒ½è¦åœ¨ä¸Šé¢åšç‚¹å®éªŒ}%
    %
}


\channelMsgEntry{%
    \msgRealSource{åŒå€å¤šå¤šå†°ğŸ§¶ | ğ¦ğŸğœğŸ}{2022-08-24 23:36:15}%
    \msgMainContent{è¯·ä¸è¦ä½¿ç”¨}%
    %
}


\channelMsgEntry{%
    \msgRealSource{åŒå€å¤šå¤šå†°ğŸ§¶ | ğ¦ğŸğœğŸ}{2022-08-24 23:36:15}%
    \msgMainContent{bricked it}%
    %
}


\channelMsgEntry{%
    \msgRealSource{åŒå€å¤šå¤šå†°ğŸ§¶ | ğ¦ğŸğœğŸ}{2022-08-24 23:36:15}%
    \msgMainContent{say goodbye}%
    %
}


\channelMsgEntry{%
    \msgRealSource{ĞĞµĞ‘ÑƒÑ‚Ğ»ĞµĞ³ ï¼ˆè¿«çœŸï¼‰}{2022-08-24 23:36:15}%
    \msgMainContent{And hurt you}%
    %
}


\channelMsgEntry{%
    \msgRealSource{Robin Lu}{2022-08-25 18:42:52}%
    \msgMainContent{http://hmli.ustc.edu.cn/doc/userguide/kd-50-userguide.pdf}%
    %
}


\channelMsgEntry{%
    \msgRealSource{Canary pwn}{2022-08-25 18:42:52}%
    \msgMainContent{è¶…ç®—}%
    %
}


\channelMsgEntry{%
    \msgRealSource{Robin Lu}{2022-08-25 18:42:52}%
    \msgMainContent{è¶…ç®— æ„å‘³æ·±}%
    %
}


\channelMsgEntry{%
    \msgRealSource{ĞĞµĞ‘ÑƒÑ‚Ğ»ĞµĞ³ ï¼ˆè¿«çœŸï¼‰}{2022-08-25 18:42:52}%
    \msgMainContent{å¼€ç©ç¬‘ï¼Œæˆ‘è¶…ä¼šç®—çš„å•¦}%
    %
}


\channelMsgEntry{%
    \msgRealSource{Canary pwn}{2022-08-25 18:42:52}%
    \msgMainContent{æŠŠç›–å­æ‰“å¼€ è®©æˆ‘çœ‹çœ‹}%
    %
}


\channelMsgEntry{%
    \msgRealSource{Mag Mell}{2022-08-27 08:27:06}%
    \msgMainContent{@cth451 ä½ èƒ½å¤ç°è¿™ä¸ªé—®é¢˜å—ï¼Ÿ}%
    %
}


\channelMsgEntry{%
    \msgRealSource{Mag Mell}{2022-08-27 08:27:07}%
    \msgMainContent{è¿™ä¸ªè§†é¢‘ä¼šå¯¼è‡´ mpv ä¸€ç›´å¡ä½ï¼Œvlc æ­£å¸¸}%
    %
}


\channelMsgEntry{%
    \msgRealSource{Mag Mell}{2022-08-27 08:27:07}%
    \msgMainContent{}%
    %
}


\channelMsgEntry{%
    \msgRealSource{Mingcong Bai}{2022-08-27 08:27:07}%
    \msgMainContent{å–‚ï¼Œä¸ä¼šæ˜¯é’“é±¼å§ï¼ˆx}%
    %
}


\channelMsgEntry{%
    \msgRealSource{Mag Mell}{2022-08-27 08:27:07}%
    \msgMainContent{ä¸æ˜¯}%
    %
}


\channelMsgEntry{%
    \msgRealSource{Mag Mell}{2022-08-27 08:27:07}%
    \msgMainContent{ä»–å¦ˆçš„æ€ä¹ˆåˆå¯ä»¥äº†}%
    %
}


\channelMsgEntry{%
    \msgRealSource{Mag Mell}{2022-08-27 08:27:07}%
    \msgMainContent{è¿™æ˜¯æ´—ä¸æ¸…äº†}%
    %
}


\channelMsgEntry{%
    \msgRealSource{GitHub}{2022-09-04 21:55:16}%
    \msgMainContent{ğŸ”¨ 1 new commit to aosc-os-abbs:rustc-1.63.0:

79d0d46: wezterm: update to 20220903+194523+3bb1ed61 by liushuyu}%
    %
}


\channelMsgEntry{%
    \msgRealSource{liushuyu}{2022-09-04 21:55:17}%
    \msgMainContent{ä¸Šæ¸¸åˆš tag çš„ç‰ˆæœ¬}%
    %
}


\channelMsgEntry{%
    \msgRealSource{liushuyu}{2022-09-04 21:55:17}%
    \msgMainContent{ç¾å›½å‡¤å‡°åŸæ—¶é—´ 2022 å¹´ 9 æœˆ 3 æ—¥ 19 æ—¶ 45 åˆ† 23 ç§’}%
    %
}


\channelMsgEntry{%
    \msgRealSource{liushuyu}{2022-09-04 21:55:18}%
    \msgMainContent{ç‰ˆæœ¬å·ï¼Œä½†æ˜¯ä¸åŠ¨è„‘å­ï¼ˆ}%
    %
}


\channelMsgEntry{%
    \msgRealSource{å’¸é±¼}{2022-09-04 21:55:19}%
    \msgMainContent{åŠ¨è„‘å­äº†ï¼Œä»–åŠ æ—¶é—´äº†}%
    %
}


\channelMsgEntry{%
    \msgRealSource{åŒå€å¤šå¤šå†°ğŸ§¶ | ğ¦ğŸğœğŸ}{2022-09-04 21:55:19}%
    \msgMainContent{è¿˜æœ‰ git hash}%
    %
}


\channelMsgEntry{%
    \msgRealSource{åŒå€å¤šå¤šå†°ğŸ§¶ | ğ¦ğŸğœğŸ}{2022-09-04 21:55:20}%
    \msgMainContent{å¾ˆåŠ¨è±†è…è„‘äº†ï¼ˆx}%
    %
}


\channelMsgEntry{%
    \msgRealSource{GitHub}{2022-09-09 08:06:49}%
    \msgMainContent{ğŸ”¨ 1 new commit to aosc-os-abbs:clash-premium-2022-08.26:

920bad8: clash-premium: update to 2022.08.26 by root}%
    %
}


\channelMsgEntry{%
    \msgRealSource{CÎ±mber Kirisame | 80}{2022-09-09 08:06:49}%
    \msgMainContent{\ldots by root?}%
    %
}


\channelMsgEntry{%
    \msgRealSource{Mingcong Bai}{2022-09-09 08:06:49}%
    \msgMainContent{Git èº«ä»½æœ‰é—®é¢˜}%
    %
}


\channelMsgEntry{%
    \msgRealSource{Mag Mell}{2022-09-09 08:06:49}%
    \msgMainContent{æˆ‘æ”¹åå« root å¥½äº†ï¼ˆ}%
    %
}


\channelMsgEntry{%
    \msgRealSource{ĞĞµĞ‘ÑƒÑ‚Ğ»ĞµĞ³ ï¼ˆè¿«çœŸï¼‰}{2022-09-09 08:06:49}%
    \msgMainContent{ä¸æ„§æ˜¯openwrtç©å®¶ï¼ˆx}%
    %
}


\channelMsgEntry{%
    \msgRealSource{ĞĞµĞ‘ÑƒÑ‚Ğ»ĞµĞ³ ï¼ˆè¿«çœŸï¼‰}{2022-09-09 08:06:49}%
    \msgMainContent{ï¼ˆæŒ‡ç®¡ç†ç•Œé¢ç”¨æˆ·åä¹Ÿæ˜¯root}%
    %
}


\channelMsgEntry{%
    \msgRealSource{Mingcong Bai}{2022-09-09 08:06:49}%
    \msgMainContent{Saki å°‘æ‰“ä¸¤ä¸ªå‘½ä»¤ï¼Œå´æ„å¤–å¼•å‘ AOSC æ”¿æƒæ›´æ›¿}%
    %
}


\channelMsgEntry{%
    \msgRealSource{liushuyu}{2022-09-09 22:09:43}%
    \msgMainContent{è¿™å°é£å«ä»€ä¹ˆåå­—ï¼ˆå¥½åƒæ˜¯ Earl ï¼Ÿ}%
    %
}


\channelMsgEntry{%
    \msgRealSource{Mingcong Bai}{2022-09-09 22:09:43}%
    \msgMainContent{Kay}%
    %
}


\channelMsgEntry{%
    \msgRealSource{Mingcong Bai}{2022-09-09 22:09:44}%
    \msgMainContent{æ˜¯å’¸é±¼å°é£}%
    %
}


\channelMsgEntry{%
    \msgRealSource{Mingcong Bai}{2022-09-09 22:09:45}%
    \msgMainContent{æ³¨æ„ç”ŸåŒ–æ±¡æŸ“}%
    %
}


\channelMsgEntry{%
    \msgRealSource{liushuyu}{2022-09-09 22:09:45}%
    \msgMainContent{è‰ï¼Œå’¸é±¼æ€èµ·äº†åƒå±‚æµªï¼ˆ}%
    %
}


\channelMsgEntry{%
    \msgRealSource{liushuyu}{2022-09-09 22:28:05}%
    \msgMainContent{}%
    \nopagebreak\includegraphics[width=\linewidth]{./.tg-data/2022/photos/photo_251@09-09-2022_22-28-05.jpg}%
}


\channelMsgEntry{%
    \msgRealSource{liushuyu}{2022-09-09 22:28:06}%
    \msgMainContent{ä½ çœ‹è¿™ç©æ„çš„æŒç»­é£é€Ÿå¯èƒ½æ¯”ä½ çš„ä¹°èœè½¦åœ¨è¾ƒä¸ºæ‹¥å µçš„é«˜é€Ÿä¸Šè¿˜æ…¢ï¼ˆ}%
    %
}


\channelMsgEntry{%
    \msgRealSource{cth451 ÇÉ”uÇÆƒÉ¹ÇÊŒá´‰p}{2022-09-16 19:12:31}%
    \msgMainContent{æˆ‘è„‘å­é‡Œæœ‰ä¸€ä¸ª plymouth ä¸»é¢˜çš„æƒ³æ³•}%
    %
}


\channelMsgEntry{%
    \msgRealSource{cth451 ÇÉ”uÇÆƒÉ¹ÇÊŒá´‰p}{2022-09-16 19:12:31}%
    \msgMainContent{åŠ è½½ä¸­å°±æ˜¯æ’é£äºº}%
    %
}


\channelMsgEntry{%
    \msgRealSource{cth451 ÇÉ”uÇÆƒÉ¹ÇÊŒá´‰p}{2022-09-16 19:12:31}%
    \msgMainContent{åŠ è½½å®Œäº†å°±ä¸€å¤´æ’å¢™ï¼ˆï¼Ÿ}%
    %
}


\channelMsgEntry{%
    \msgRealSource{Mingcong Bai}{2022-09-16 19:12:31}%
    \msgMainContent{AOSC OS, Rated M for Mature}%
    %
}


\channelMsgEntry{%
    \msgRealSource{Mingcong Bai}{2022-09-16 19:12:31}%
    \msgMainContent{Fantasy Violence}%
    %
}


\channelMsgEntry{%
    \msgRealSource{cth451 ÇÉ”uÇÆƒÉ¹ÇÊŒá´‰p}{2022-09-16 19:12:31}%
    \msgMainContent{\begin{itemize}
\tightlist
\item
  online interactions not rated by ESRB
\end{itemize}}%
    %
}


\channelMsgEntry{%
    \msgRealSource{cth451 ÇÉ”uÇÆƒÉ¹ÇÊŒá´‰p}{2022-09-17 05:23:38}%
    \msgMainContent{}%
    %
}


\channelMsgEntry{%
    \msgRealSource{Mingcong Bai}{2022-09-17 05:23:38}%
    \msgMainContent{Rated M for Mature}%
    %
}


\channelMsgEntry{%
    \msgRealSource{Maria Bombardier}{2022-09-25 22:15:24}%
    \msgMainContent{}%
    \nopagebreak\includegraphics[width=\linewidth]{./.tg-data/2022/photos/photo_252@25-09-2022_22-15-24.jpg}%
}


\channelMsgEntry{%
    \msgRealSource{ZHITAI PC005 Active 1TB}{2022-09-25 22:15:25}%
    \msgMainContent{æŸ´ gie gie å†™ä¸€ä¸ª for AOSC çš„}%
    %
}


\channelMsgEntry{%
    \msgRealSource{cth451 ÇÉ”uÇÆƒÉ¹ÇÊŒá´‰p}{2022-09-25 22:15:26}%
    \msgMainContent{å¦‚æœæ˜¯æˆ‘çš„è¯å°±ä¼šç›´æ¥æŠŠ server console ç”¨ stdio åŒ…ä¸€é}%
    %
}


\channelMsgEntry{%
    \msgRealSource{Maria Bombardier}{2022-09-25 22:15:26}%
    \msgMainContent{çœ‹åˆ°æ²¡}%
    %
}


\channelMsgEntry{%
    \msgRealSource{cth451 ÇÉ”uÇÆƒÉ¹ÇÊŒá´‰p}{2022-09-25 22:15:27}%
    \msgMainContent{ç„¶åå†™ä¸€ä¸ª minecraftctl}%
    %
}


\channelMsgEntry{%
    \msgRealSource{cth451 ÇÉ”uÇÆƒÉ¹ÇÊŒá´‰p}{2022-09-25 22:15:28}%
    \msgMainContent{é€šè¿‡ dbus å’ŒæœåŠ¡å™¨é€šä¿¡}%
    %
}


\channelMsgEntry{%
    \msgRealSource{cth451 ÇÉ”uÇÆƒÉ¹ÇÊŒá´‰p}{2022-09-25 22:15:28}%
    \msgMainContent{å–åº•è£¤ä¸å½»åº•ç­‰åŒäºæ²¡æœ‰å–åº•è£¤}%
    %
}


\channelMsgEntry{%
    \msgRealSource{å†°ç³çš„å†°é›ªä¹‹åŸŸ}{2022-10-20 07:36:02}%
    \msgMainContent{2022 æœ€æ–° RISC-V é€šç”¨æ“ä½œç³»ç»Ÿå…¼å®¹æ€§åŸºçº¿ï¼š
RV64IMAFDCZicsrZicntrZihpmZiccifZiccrseZiccamoaZicclsmZa64rsZihintpauseZbaZbbZbsZic64bZicbomZicbopZicbozZfhminZktZifenceiSs1p12SvbareSv39SsccptrSstvecdSstvalaSvpbmtSvnapotSvinval}%
    %
}


\channelMsgEntry{%
    \msgRealSource{Kexy Biscuit | è¢«å­é¥¼ï¸ | ç™¾åˆãƒ¶å’²ã‚‹ã‚‹}{2022-10-20 07:36:02}%
    \msgMainContent{å¸ˆå‚…åˆ«å¿µäº†}%
    %
}


\channelMsgEntry{%
    \msgRealSource{å’¸é±¼}{2022-10-20 07:36:02}%
    \msgMainContent{æ‰€ä»¥æ˜¯ä¸€ä¸ª RV64GC å¤šç§è¡¨è¾¾å—}%
    %
}


\channelMsgEntry{%
    \msgRealSource{Rick Liu}{2022-10-20 07:36:02}%
    \msgMainContent{ä¸€ä¸ªRV,å„è‡ªè¡¨è¿°}%
    %
}


\channelMsgEntry{%
    \msgRealSource{åŒå€å¤šå¤šå†°ğŸ§¶ | ğ¦ğŸğœğŸ}{2022-10-21 11:10:44}%
    \msgMainContent{æ‰€ä»¥ pmon æ˜¯ -bios æŒ‡å®šè¿˜æ˜¯ -kernel}%
    %
}


\channelMsgEntry{%
    \msgRealSource{ĞĞµĞ‘ÑƒÑ‚Ğ»ĞµĞ³ ï¼ˆè¿«çœŸï¼‰}{2022-10-21 11:10:45}%
    \msgMainContent{æ˜¯paimonï¼Œç›´æ¥æŒ‡å®šunityè¿è¡Œæ—¶ï¼ˆä¸æ˜¯}%
    %
}


\channelMsgEntry{%
    \msgRealSource{æ¯æ—¥æ¶ˆè´¹ç”µå­è§‚å¯Ÿ}{2022-10-25 04:43:30}%
    \msgMainContent{Linus Torvalds å¸Œæœ›ä» Linux å†…æ ¸ä¸­åˆ é™¤å¯¹ i486 å¤„ç†å™¨çš„æ”¯æŒ

Linux å†…æ ¸æ—©åœ¨ 2012 å¹´å°±å·²ç»å–æ¶ˆäº†å¯¹ i386
å¤„ç†å™¨çš„æ”¯æŒï¼Œç°åœ¨è¿‡å»äº†åå¹´ï¼ŒLinus Torvalds å¸Œæœ›ä¹Ÿåˆ é™¤å¯¹ i486
å¤„ç†å™¨çš„æ”¯æŒã€‚ https://www.landiannews.com/archives/95775.html ========
AOSC/Retroï¼Œé—œå¿ƒä½ çš„å¥‡å¦™é–‹ç™¼æ¿ï¼Œä½ çš„è¿·ä¹‹è™•ç†å™¨ï¼Œä»¥åŠä½ çš„å²å‰éºç”¢ã€‚}%
    %
}


\channelMsgEntry{%
    \msgRealSource{Mingcong Bai}{2022-10-25 04:43:30}%
    \msgMainContent{çŸ¥é“çš„}%
    %
}


\channelMsgEntry{%
    \msgRealSource{Mingcong Bai}{2022-10-25 04:43:31}%
    \msgMainContent{è‡³å°‘åˆ° 2027 å¹´æˆ‘ä»¬éƒ½æœ‰å†…æ ¸ç”¨}%
    %
}


\channelMsgEntry{%
    \msgRealSource{Mingcong Bai}{2022-10-25 04:43:32}%
    \msgMainContent{ä¸æ€•}%
    %
}


\channelMsgEntry{%
    \msgRealSource{CT1000MX500SSD1 1000.2 GB}{2022-10-25 04:43:32}%
    \msgMainContent{ç‰¹é¦–å¯ä»¥äº‰å–åœ¨ 2027 å¹´ä»¥å‰è®©è„±è¢œå­æ³¨æ„åˆ° AOSC/Retro}%
    %
}


\channelMsgEntry{%
    \msgRealSource{Mingcong Bai}{2022-10-25 04:43:33}%
    \msgMainContent{ä¹Ÿè®¸èƒ½è®©ä»–é‡æ–°å¼€å§‹éª‚äºº}%
    %
}


\channelMsgEntry{%
    \msgRealSource{Rick Liu}{2022-11-04 02:43:38}%
    \msgMainContent{æ€ä¹ˆè¿˜æ‰“åŒ…äº†ss-tproxy}%
    %
}


\channelMsgEntry{%
    \msgRealSource{Rick Liu}{2022-11-04 02:43:39}%
    \msgMainContent{æˆ‘æƒŠå‘†äº†}%
    %
}


\channelMsgEntry{%
    \msgRealSource{Rick Liu}{2022-11-04 02:43:39}%
    \msgMainContent{ä»€ä¹ˆéæ³•å‘è¡Œç‰ˆ}%
    %
}


\channelMsgEntry{%
    \msgRealSource{Mingcong Bai}{2022-11-04 02:43:40}%
    \msgMainContent{åˆ«å¿˜äº†æˆ‘ä»¬çš„å¹¿å‘Šè¯ï¼ˆ}%
    %
}


\channelMsgEntry{%
    \msgRealSource{Mingcong Bai}{2022-11-04 03:49:44}%
    \msgMainContent{}%
    \nopagebreak\includegraphics[width=\linewidth]{./.tg-data/2022/photos/photo_253@04-11-2022_03-49-44.jpg}%
}


\channelMsgEntry{%
    \msgRealSource{Mag Mell}{2022-11-09 02:43:33}%
    \msgMainContent{æ²¡äº‹ï¼Œå½“ä½ äº†è§£äº†åœ¨ CIP çš„å…¶ä»–å‘è¡Œçš„æ—¶å€™\ldots\ldots{}}%
    %
}


\channelMsgEntry{%
    \msgRealSource{Mag Mell}{2022-11-09 02:43:34}%
    \msgMainContent{ä½ å°±ä¸ä¼šè¯´å‡ºè¿™ä¸ªç»“è®ºäº†}%
    %
}


\channelMsgEntry{%
    \msgRealSource{Mag Mell}{2022-11-09 02:43:35}%
    \msgMainContent{æˆ‘é è¿™ä¸æ˜¯æ°´ç¾¤}%
    %
}


\channelMsgEntry{%
    \msgRealSource{Mingcong Bai}{2022-11-09 02:43:35}%
    \msgMainContent{å•§å•§å•§}%
    %
}


\channelMsgEntry{%
    \msgRealSource{Mag Mell}{2022-11-09 02:43:36}%
    \msgMainContent{æˆ‘æ‰å‘ç°}%
    %
}


\channelMsgEntry{%
    \msgRealSource{Mingcong Bai}{2022-11-09 02:43:37}%
    \msgMainContent{è‹± é›„ æœ¬ è‰²}%
    %
}


\channelMsgEntry{%
    \msgRealSource{ĞĞµĞ‘ÑƒÑ‚Ğ»ĞµĞ³ ï¼ˆè¿«çœŸï¼‰}{2022-11-09 02:43:37}%
    \msgMainContent{è‹± é›„ æœ¬ è‰²}%
    %
}


\channelMsgEntry{%
    \msgRealSource{ĞĞµĞ‘ÑƒÑ‚Ğ»ĞµĞ³ ï¼ˆè¿«çœŸï¼‰}{2022-11-09 02:43:43}%
    \msgMainContent{åœ¨ä¸»ç¾¤é”è¯„}%
    %
}


\channelMsgEntry{%
    \msgRealSource{åŒå€å¤šå¤šå†°ğŸ§¶ | ğ¦ğŸğœğŸ}{2022-11-13 07:34:02}%
    \msgMainContent{æˆ‘è§‰å¾—æˆ‘ä»¬çš„ qemu å¿«å’Œä¸Šæ¸¸æ˜¯ä¸¤ä¸ªç‰©ç§äº†ï¼ˆä¸}%
    %
}


\channelMsgEntry{%
    \msgRealSource{CT1000MX500SSD1 1000.2 GB}{2022-11-13 07:34:02}%
    \msgMainContent{æ€•å•¥}%
    %
}


\channelMsgEntry{%
    \msgRealSource{CT1000MX500SSD1 1000.2 GB}{2022-11-13 07:34:02}%
    \msgMainContent{ç¾Šåœ¨å¤©ä¸Šé£}%
    %
}


\channelMsgEntry{%
    \msgRealSource{åŒå€å¤šå¤šå†°ğŸ§¶ | ğ¦ğŸğœğŸ}{2022-11-13 07:34:02}%
    \msgMainContent{å†æ”¯æŒ mips æ˜¯ç‹—ï¼ˆä¸}%
    %
}


\channelMsgEntry{%
    \msgRealSource{åŒå€å¤šå¤šå†°ğŸ§¶ | ğ¦ğŸğœğŸ}{2022-11-13 07:34:02}%
    \msgMainContent{æ±ª}%
    %
}


\channelMsgEntry{%
    \msgRealSource{billchenchina | Nya!}{2022-11-19 22:16:55}%
    \msgMainContent{åŸæ¥æ˜¯ aosc ç›¸å…³ç¾¤å•Šï¼ˆ}%
    %
}


\channelMsgEntry{%
    \msgRealSource{åƒé ˆæœ« é›¶æ™‚é–“}{2022-11-19 22:16:55}%
    \msgMainContent{æ˜¯ AOSC ç¬¨è›‹ç¾¤}%
    %
}


\channelMsgEntry{%
    \msgRealSource{Mingcong Bai}{2022-11-19 22:16:55}%
    \msgMainContent{è ¢åˆ°å¸® AOSC å–å‘½çš„ç¾¤}%
    %
}


\channelMsgEntry{%
    \msgRealSource{åƒé ˆæœ« é›¶æ™‚é–“}{2022-11-19 22:16:55}%
    \msgMainContent{\#AOSCæ¢—}%
    %
}


\channelMsgEntry{%
    \msgRealSource{cth451 ÇÉ”uÇÆƒÉ¹ÇÊŒá´‰p}{2022-11-28 07:15:08}%
    \msgMainContent{ä»¥åå’¸é±¼æ¯æ¬¡æŒ‘è¡…æˆ‘å’Œå§¥å§¥æˆ‘å°±å¯ä»¥å‘è¿™ä¸ª.heif}%
    \nopagebreak\includegraphics[width=\linewidth]{./.tg-data/2022/photos/photo_254@28-11-2022_07-15-08.jpg}%
}


\channelMsgEntry{%
    \msgRealSource{Mag Mell}{2022-11-28 07:15:09}%
    \msgMainContent{@TheSaltedFish å‡ºæ¥åƒé¥­äº†}%
    %
}


\channelMsgEntry{%
    \msgRealSource{Canary pwn}{2022-12-03 06:51:38}%
    \msgMainContent{}%
    \nopagebreak\includegraphics[width=\linewidth]{./.tg-data/2022/photos/photo_255@03-12-2022_06-51-38.jpg}%
}


\channelMsgEntry{%
    \msgRealSource{åŒå€å¤šå¤šå†°ğŸ§¶ | ğ¦ğŸğœğŸ}{2022-12-09 10:12:47}%
    \msgMainContent{https://github.com/maharmstone/ntfs2btrfs}%
    %
}


\channelMsgEntry{%
    \msgRealSource{Mingcong Bai}{2022-12-09 10:12:48}%
    \msgMainContent{ä¸å¦‚æ”¹åå« Secure Erase}%
    %
}


\channelMsgEntry{%
    \msgRealSource{Mingcong Bai}{2022-12-13 04:50:57}%
    \msgMainContent{}%
    \nopagebreak\includegraphics[width=\linewidth]{./.tg-data/2022/photos/photo_256@13-12-2022_04-50-57.jpg}%
}


\channelMsgEntry{%
    \msgRealSource{å’¸é±¼}{2022-12-13 04:50:57}%
    \msgMainContent{hey meingcheing! who's ready to port ğŸš¢ AOSC OS ğŸ° to LoongArch ğŸ¦ ?? we
will be meeting 6am ğŸŒ… on wed, 12/18 at KTV (1234 right behind you) to
bus ğŸšŒ over to âœ¨ SD âœ¨ together! let's show loongson ğŸ˜ˆ that we're not
done yet ğŸ˜¤ !! will I see you ğŸ‘€ and your porting ğŸš¢ besties ğŸ‘¯â€â™‚ï¸ there?}%
    %
}


\channelMsgEntry{%
    \msgRealSource{Mingcong Bai}{2022-12-14 01:55:05}%
    \msgMainContent{}%
    \nopagebreak\includegraphics[width=\linewidth]{./.tg-data/2022/photos/photo_257@14-12-2022_01-55-05.jpg}%
}


\channelMsgEntry{%
    \msgRealSource{Mingcong Bai}{2022-12-14 01:55:05}%
    \msgMainContent{åˆ›ç©¿åœ°å£³}%
    %
}


\channelMsgEntry{%
    \msgRealSource{webRTCCat | ZhiTai PC230 2TB}{2022-12-14 01:55:05}%
    \msgMainContent{ä»€ä¹ˆä¹å±‚å¦–å¡”}%
    %
}


\channelMsgEntry{%
    \msgRealSource{Mingcong Bai}{2022-12-14 01:55:05}%
    \msgMainContent{AOSC/ITAIC åŒ—ç¾æ•°æ®ä¸­å¿ƒ}%
    %
}


\channelMsgEntry{%
    \msgRealSource{æŸ10}{2022-12-26 13:22:48}%
    \msgMainContent{æ­£ç»äººï¼Œè°å†™æ—¥è®°å•Šï¼}%
    %
}


\channelMsgEntry{%
    \msgRealSource{Junde Yhi}{2022-12-26 13:22:49}%
    \msgMainContent{æœºå™¨å†™æ—¥è®°}%
    %
}


\channelMsgEntry{%
    \msgRealSource{Junde Yhi}{2022-12-26 13:22:49}%
    \msgMainContent{æ­£ç»æ–‡ä»¶ç³»ç»Ÿå†™æ—¥è®°}%
    %
}


\channelMsgEntry{%
    \msgRealSource{Jerry Xiaoï¸}{2022-12-26 13:22:49}%
    \msgMainContent{å¥½ï¼Œé‚£æœ‰æ²¡æœ‰å¹´ç»ˆæ€»ç»“}%
    %
}


\channelMsgEntry{%
    \msgRealSource{å’¸é±¼}{2022-12-26 13:22:49}%
    \msgMainContent{æˆ‘è¿˜ä»¥ä¸ºä½ æƒ³è¯´è®© ChatGPT å¸®ä½ å†™æ—¥è®°}%
    %
}


\channelMsgEntry{%
    \msgRealSource{Junde Yhi}{2022-12-26 13:22:49}%
    \msgMainContent{å¥½}%
    %
}


\channelMsgEntry{%
    \msgRealSource{å’¸é±¼}{2022-12-26 13:22:49}%
    \msgMainContent{ä¸ç”¨äº†}%
    %
}


\channelMsgEntry{%
    \msgRealSource{å’¸é±¼}{2022-12-26 13:22:49}%
    \msgMainContent{æ–‡ä»¶ç³»ç»Ÿé‡Œå·²ç»æœ‰æ—¥å¿—äº†}%
    %
}


\channelMsgEntry{%
    \msgRealSource{å’¸é±¼}{2022-12-26 13:22:49}%
    \msgMainContent{ä¸ç”¨å†™äº†.jpg}%
    %
}


\channelMsgEntry{%
    \msgRealSource{Jerry Xiaoï¸}{2022-12-26 13:22:49}%
    \msgMainContent{ä¸ç”¨äº†}%
    %
}


\channelMsgEntry{%
    \msgRealSource{Junde Yhi}{2022-12-26 13:22:49}%
    \msgMainContent{æˆ‘ç¿»å‡ºæ¥ä¸€çœ‹ï¼Œè¿™æ—¥è®°æ²¡æœ‰å­—}%
    %
}


\channelMsgEntry{%
    \msgRealSource{Jerry Xiaoï¸}{2022-12-26 13:22:49}%
    \msgMainContent{systemdå¸®æˆ‘å†™å¥½äº†}%
    %
}


\channelMsgEntry{%
    \msgRealSource{Jerry Xiaoï¸}{2022-12-26 13:22:50}%
    \msgMainContent{è€Œä¸”æœ‰å­—}%
    %
}


\channelMsgEntry{%
    \msgRealSource{å’¸é±¼}{2022-12-26 13:22:50}%
    \msgMainContent{å¥½.jpg}%
    %
}


\channelMsgEntry{%
    \msgRealSource{Jerry Xiaoï¸}{2022-12-26 13:22:50}%
    \msgMainContent{å¾ˆå¤šå­—}%
    %
}


\channelMsgEntry{%
    \msgRealSource{å’¸é±¼}{2022-12-26 13:22:50}%
    \msgMainContent{logrotate ä¸€ä¸‹}%
    %
}


\channelMsgEntry{%
    \msgRealSource{å’¸é±¼}{2022-12-26 13:22:50}%
    \msgMainContent{å…¨æ‰¬äº†}%
    %
}


\channelMsgEntry{%
    \msgRealSource{Jerry Xiaoï¸}{2022-12-26 13:22:50}%
    \msgMainContent{å¹´åº¦æ€»ç»“ï¼ŒæŒ‡ journalctl --since 2022-01-01 \textbar{} xxhash}%
    %
}


\channelMsgEntry{%
    \msgRealSource{Jerry Xiaoï¸}{2022-12-26 13:22:50}%
    \msgMainContent{è¨€ç®€æ„èµ…}%
    %
}