
\channelMsgEntry{%
    \msgRealSource{Deleted Account}{2017-07-26 11:31:45}%
    \msgMainContent{}%
    %
}


\channelMsgEntry{%
    \msgRealSource{Mingcong Bai}{2017-07-26 11:32:54}%
    \msgMainContent{å†°é›ªèªæ˜å°„çº¿ï¼Ÿï¼ˆx}%
    %
}


\channelMsgEntry{%
    \msgRealSource{Mingcong Bai}{2017-07-27 05:02:00}%
    \msgMainContent{æ­£åœ¨æŒ‘æˆ˜åœ¨çº¿é˜…è¯»ï¼ˆ}%
    %
}


\channelMsgEntry{%
    \msgRealSource{Mingcong Bai}{2017-07-27 05:02:00}%
    \msgMainContent{Woah\ldots{} æˆ‘ä¸‹è½½ï¼Œæˆ‘ä¸‹è½½è¿˜ä¸è¡Œä¹ˆï¼ˆ}%
    %
}


\channelMsgEntry{%
    \msgRealSource{Deleted Account}{2017-07-27 05:02:01}%
    \msgMainContent{ç™¾ä¸‡æ—¥å¿—ä»»ä½ çœ‹}%
    %
}


\channelMsgEntry{%
    \msgRealSource{Deleted Account}{2017-07-27 05:02:01}%
    \msgMainContent{çœ‹ä¸æ­»ä½ }%
    %
}


\channelMsgEntry{%
    \msgRealSource{Mingcong Bai}{2017-07-27 05:02:01}%
    \msgMainContent{BuildBot ä¹¦å†™çš„é•¿æ¨ä¹¦ï¼ˆ}%
    %
}


\channelMsgEntry{%
    \msgRealSource{åŒå€å¤šå¤šå†°ğŸ§¶ | ğ¦ğŸğœğŸ}{2017-07-27 05:54:46}%
    \msgMainContent{æ—¥ç¼– GCC ä¸‰ç™¾éï¼Œä¸è¾é•¿åš ARM64 äººï¼ˆ}%
    %
}


\channelMsgEntry{%
    \msgRealSource{cth451 ÇÉ”uÇÆƒÉ¹ÇÊŒá´‰p}{2017-07-27 15:20:52}%
    \msgMainContent{æ†‹ç€ä¸æ¨(}%
    %
}


\channelMsgEntry{%
    \msgRealSource{Deleted Account}{2017-07-27 15:20:52}%
    \msgMainContent{å°å¿ƒæ†‹å‡ºæ¯›ç—…}%
    %
}


\channelMsgEntry{%
    \msgRealSource{cth451 ÇÉ”uÇÆƒÉ¹ÇÊŒá´‰p}{2017-07-27 15:20:59}%
    \msgMainContent{åŒ…æ¯’ç—‡ï¼Ÿ}%
    %
}


\channelMsgEntry{%
    \msgRealSource{åŒå€å¤šå¤šå†°ğŸ§¶ | ğ¦ğŸğœğŸ}{2017-07-27 15:20:59}%
    \msgMainContent{éœ€è¦è¿›è¡Œç¡¬ç›˜é€æ}%
    %
}


\channelMsgEntry{%
    \msgRealSource{Mingcong Bai}{2017-07-27 15:46:25}%
    \msgMainContent{Godo}%
    %
}


\channelMsgEntry{%
    \msgRealSource{Mingcong Bai}{2017-07-27 15:46:25}%
    \msgMainContent{Good *}%
    %
}


\channelMsgEntry{%
    \msgRealSource{Mingcong Bai}{2017-07-27 15:46:25}%
    \msgMainContent{Threadsafe åˆæ²¡äº†}%
    %
}


\channelMsgEntry{%
    \msgRealSource{Junde Yhi}{2017-07-28 12:31:17}%
    \msgMainContent{ä¸€æ¬¡ç¼–è¯‘ï¼Œåˆ°å¤„è°ƒè¯•}%
    %
}


\channelMsgEntry{%
    \msgRealSource{Deleted Account}{2017-07-28 12:31:26}%
    \msgMainContent{æ®è¯´ Gentoo è¿˜ç©¿ç€è‡ªå·±çš„åº•è£¤}%
    %
}


\channelMsgEntry{%
    \msgRealSource{Deleted Account}{2017-07-28 12:31:26}%
    \msgMainContent{æ²¡å–}%
    %
}


\channelMsgEntry{%
    \msgRealSource{Mingcong Bai}{2017-07-28 12:31:26}%
    \msgMainContent{æ‰’äº†ï¼Œç ´å››æ—§ï¼}%
    %
}


\channelMsgEntry{%
    \msgRealSource{Deleted Account}{2017-07-28 15:41:29}%
    \msgMainContent{ä½ æˆåŠŸå–æ‰ä¸€æ¡åº•è£¤äº†ï¼Œå¿«å’Œå¤§å®¶æ‰“æ‹›å‘¼å§ï¼}%
    %
}


\channelMsgEntry{%
    \msgRealSource{åŒå€å¤šå¤šå†°ğŸ§¶ | ğ¦ğŸğœğŸ}{2017-07-29 08:01:42}%
    \msgMainContent{æ—¥å†™ bug report ä¸‰ç™¾ç¯‡ï¼Œä¸è¾é•¿åš ARM64 äºº}%
    %
}


\channelMsgEntry{%
    \msgRealSource{liushuyu}{2017-07-29 12:09:03}%
    \msgMainContent{ã€Šå…³äºç¤¾åŒºç½‘é¡µä¸»æœåŠ¡å™¨æ•…éšœå£°æ˜ã€‹ï¼ˆ}%
    %
}


\channelMsgEntry{%
    \msgRealSource{Deleted Agasa}{2017-07-29 12:09:03}%
    \msgMainContent{ã€Šå…³äºç¤¾åŒºä¸»æœåŠ¡å™¨é—®é¢˜çš„è”åˆå£°æ˜ã€‹}%
    %
}


\channelMsgEntry{%
    \msgRealSource{Deleted Agasa}{2017-07-29 12:09:03}%
    \msgMainContent{å²ç§° 729 æ–‡ä»¶}%
    %
}


\channelMsgEntry{%
    \msgRealSource{åŒå€å¤šå¤šå†°ğŸ§¶ | ğ¦ğŸğœğŸ}{2017-07-29 12:09:44}%
    \msgMainContent{ç„¶åè¿ç§»å®Œæˆå†å‘ä¸€ä¸ª
``ä¸Šä¸€ä¸ªå…¬å‘Šæ˜¯å†å²æ€§æ–‡ä»¶ï¼Œåœ¨å½“ä¸‹çš„æ¡ä»¶ä¸‹æ²¡æœ‰æ„ä¹‰äº†''}%
    %
}


\channelMsgEntry{%
    \msgRealSource{liushuyu}{2017-07-29 12:14:19}%
    \msgMainContent{729 æ–‡ä»¶è®°å½•äº† 2017 å¹´ 7 æœˆ 29 æ—¥ AOSC webteam
è¾¾æˆçš„å‰æ‰€æœªæœ‰çš„å…±è¯†ï¼Œä¹Ÿå°±æ˜¯ ä¸ƒäºŒä¹å…±è¯† ï¼Œè¿™æ ‡å¿—ç€ AOSC
åœ¨ç¤¾åŒºé—¨æˆ·çš„åŸºç¡€è®¾æ–½ç®¡ç†ä¸Šåˆè¿ˆå‡ºäº†åšå®çš„ä¸€æ­¥ ï¼ˆ}%
    %
}


\channelMsgEntry{%
    \msgRealSource{åŒå€å¤šå¤šå†°ğŸ§¶ | ğ¦ğŸğœğŸ}{2017-07-30 04:03:55}%
    \msgMainContent{@JeffBai new architecture request: potato-ubisoft-linux-gnu}%
    %
}


\channelMsgEntry{%
    \msgRealSource{Deleted Account}{2017-07-31 04:28:27}%
    \msgMainContent{``Now I am a potato!'' (Clap clap)}%
    %
}


\channelMsgEntry{%
    \msgRealSource{Deleted Account}{2017-07-31 04:29:59}%
    \msgMainContent{AOSC Portal is now running on a potato server from Ubisoft. It is
powered by AOSC OS!}%
    %
}


\channelMsgEntry{%
    \msgRealSource{Deleted Account}{2017-07-31 10:43:05}%
    \msgMainContent{ã‚¤ã‚¨!}%
    %
}


\channelMsgEntry{%
    \msgRealSource{Deleted Account}{2017-07-31 10:43:05}%
    \msgMainContent{æˆ‘ãŒè¼¸å…¥æ³•ãŒå£Šã‚Œäº†}%
    %
}


\channelMsgEntry{%
    \msgRealSource{Deleted Account}{2017-07-31 10:43:05}%
    \msgMainContent{ç¾åœ¨ç”¨æ—¥æœ¬èªè¼¸å…¥æ³•æ¥æ‰“ä¸­æ–‡ï¼ˆ}%
    %
}


\channelMsgEntry{%
    \msgRealSource{Deleted Account}{2017-07-31 10:43:05}%
    \msgMainContent{å¥½ãçœ©ã—ã„é…·ã„é˜¿}%
    %
}


\channelMsgEntry{%
    \msgRealSource{Mingcong Bai}{2017-08-01 04:15:47}%
    \msgMainContent{}%
    \nopagebreak\includegraphics[width=\linewidth]{./.tg-data/Legacy/photos/photo_1@01-08-2017_04-15-47.jpg}%
}


\channelMsgEntry{%
    \msgRealSource{Deleted Account}{2017-08-01 07:27:35}%
    \msgMainContent{ç„¶åæˆ‘å°±å¿µäº†ä¸€é¦–è¯—}%
    %
}


\channelMsgEntry{%
    \msgRealSource{Deleted Account}{2017-08-01 07:27:35}%
    \msgMainContent{ï¼ˆmotdï¼‰}%
    %
}


\channelMsgEntry{%
    \msgRealSource{Deleted Account}{2017-08-01 07:27:35}%
    \msgMainContent{ç»ˆå—å±±ï¼Œç‹çºŸ}%
    %
}


\channelMsgEntry{%
    \msgRealSource{Deleted Account}{2017-08-01 07:27:35}%
    \msgMainContent{ï¼ˆè¢«æ‹–èµ°ï¼‰}%
    %
}


\channelMsgEntry{%
    \msgRealSource{ÊŸ.á´‡.Ê€}{2017-08-01 12:30:42}%
    \msgMainContent{æˆ‘åœ¨gedité‡Œå°±æ•²äº†é‚£å‡ ä¸ªå­—ï¼Œç„¶åç‚¹çš„ä¹’åæ£€æŸ¥}%
    %
}


\channelMsgEntry{%
    \msgRealSource{Mingcong Bai}{2017-08-01 12:30:42}%
    \msgMainContent{pin'xie}%
    %
}


\channelMsgEntry{%
    \msgRealSource{Mingcong Bai}{2017-08-01 12:30:42}%
    \msgMainContent{ä¸æ˜¯ ping'xie}%
    %
}


\channelMsgEntry{%
    \msgRealSource{ÊŸ.á´‡.Ê€}{2017-08-01 12:30:42}%
    \msgMainContent{å“¦å“¦é¼»å­åäº†ã€‚ã€‚}%
    %
}


\channelMsgEntry{%
    \msgRealSource{Deleted Account}{2017-08-01 13:08:17}%
    \msgMainContent{è‡ªä»ç”¨äº† AOSC OS æˆ‘ç°åœ¨å·²ç»æ˜¯å¤©å¤©è£¸ç¡äº†}%
    %
}


\channelMsgEntry{%
    \msgRealSource{Mingcong Bai}{2017-08-01 13:08:17}%
    \msgMainContent{é€æ°”å•Š}%
    %
}


\channelMsgEntry{%
    \msgRealSource{Mingcong Bai}{2017-08-01 13:46:47}%
    \msgMainContent{å±}%
    %
}


\channelMsgEntry{%
    \msgRealSource{Mingcong Bai}{2017-08-01 13:46:47}%
    \msgMainContent{å˜Ÿ}%
    %
}


\channelMsgEntry{%
    \msgRealSource{Mingcong Bai}{2017-08-01 13:46:47}%
    \msgMainContent{å˜}%
    %
}


\channelMsgEntry{%
    \msgRealSource{Deleted Account}{2017-08-01 16:19:06}%
    \msgMainContent{å’Œ systemd å€’æ²¡ä»€ä¹ˆå…³ç³»}%
    %
}


\channelMsgEntry{%
    \msgRealSource{Deleted Account}{2017-08-01 16:19:06}%
    \msgMainContent{systemd è¦æ˜¯æŸ“æŒ‡ SNMPï¼Œæˆ‘ç›´æ’­åƒé¦™è‚ }%
    %
}


\channelMsgEntry{%
    \msgRealSource{Deleted Account}{2017-08-01 16:19:07}%
    \msgMainContent{systemd åªå–œæ¬¢åº•è£¤}%
    %
}


\channelMsgEntry{%
    \msgRealSource{Deleted Account}{2017-08-01 16:32:45}%
    \msgMainContent{}%
    \nopagebreak\includegraphics[width=\linewidth]{./.tg-data/Legacy/photos/photo_2@01-08-2017_16-32-45.jpg}%
}


\channelMsgEntry{%
    \msgRealSource{cth451 ÇÉ”uÇÆƒÉ¹ÇÊŒá´‰p}{2017-08-02 07:36:54}%
    \msgMainContent{ç™½å­¦ certified.}%
    %
}


\channelMsgEntry{%
    \msgRealSource{Deleted Account}{2017-08-02 07:41:45}%
    \msgMainContent{wine æµ‹è¯•åˆ—è¡¨ï¼š * White Album 2 * osu! * Mineways * Clannad æ™ºä»£ After}%
    %
}


\channelMsgEntry{%
    \msgRealSource{Mingcong Bai}{2017-08-02 14:23:12}%
    \msgMainContent{æˆ–è€…è¯´å°±æ˜¯å¹¿ä¸œäººå£ä¸­çš„ flashplayer}%
    %
}


\channelMsgEntry{%
    \msgRealSource{Mingcong Bai}{2017-08-02 14:23:12}%
    \msgMainContent{è¯»ä½œ freshplayer}%
    %
}


\channelMsgEntry{%
    \msgRealSource{cth451 ÇÉ”uÇÆƒÉ¹ÇÊŒá´‰p}{2017-08-02 14:24:02}%
    \msgMainContent{whooooah so commit message such fancy}%
    \nopagebreak\includegraphics[width=\linewidth]{./.tg-data/Legacy/photos/photo_3@02-08-2017_14-24-02.jpg}%
}


\channelMsgEntry{%
    \msgRealSource{ÊŸ.á´‡.Ê€}{2017-08-02 14:24:02}%
    \msgMainContent{ä¸å¥½æ„æ€æˆ‘å¹²çš„ã€‚ã€‚}%
    %
}


\channelMsgEntry{%
    \msgRealSource{Mingcong Bai}{2017-08-02 14:24:02}%
    \msgMainContent{å¹²}%
    %
}


\channelMsgEntry{%
    \msgRealSource{Mingcong Bai}{2017-08-02 14:24:02}%
    \msgMainContent{Dayum son.}%
    %
}


\channelMsgEntry{%
    \msgRealSource{Deleted Agasa}{2017-08-02 14:52:07}%
    \msgMainContent{æ¨å‡º Basic ç‰ˆå’Œ Advance ç‰ˆã€‚å‚ä¼šè€…å…è´¹æä¾› Basic ç‰ˆè´´çº¸ï¼Œä¸€é¡µã€‚Advance
ç‰ˆå”®ä»· 9.99ï¼Œ10 é¡µæ¢—ã€‚}%
    %
}


\channelMsgEntry{%
    \msgRealSource{cth451 ÇÉ”uÇÆƒÉ¹ÇÊŒá´‰p}{2017-08-02 14:52:07}%
    \msgMainContent{å’ŒæŠŠå…¨ AOSC çš„æ¢—éƒ½é€ä½ æ²¡ä¸¤æ ·}%
    %
}


\channelMsgEntry{%
    \msgRealSource{Deleted Account}{2017-08-02 14:52:07}%
    \msgMainContent{ä¸ä¼šè€…éšæœºèµ é€å…¶ä¸­ä¸€é¡µï¼Œå…è®¸è‡ªç”±äº¤æ˜“}%
    %
}


\channelMsgEntry{%
    \msgRealSource{Deleted Agasa}{2017-08-02 14:52:07}%
    \msgMainContent{ç¬¬ä¸€ä¸ªé›†é½å…¨å¥—çš„å¯è·å¾—çè—ç‰ˆ Sticker}%
    %
}


\channelMsgEntry{%
    \msgRealSource{Jack Works}{2017-08-02 14:52:07}%
    \msgMainContent{æˆ‘tmé¢†çˆ†}%
    %
}


\channelMsgEntry{%
    \msgRealSource{Staph. aureus | In your GI Tract}{2017-08-02 14:52:07}%
    \msgMainContent{è­¦å‘Šï¼šä»¥ä¸Šå°è©±å°‡ç¹¼çºŒå¢å¤§ AOSC æ¢—é«”ç© Positive feedback loop created.}%
    %
}


\channelMsgEntry{%
    \msgRealSource{Junde Yhi}{2017-08-03 06:14:53}%
    \msgMainContent{Go çš„è§„èŒƒ}%
    %
}


\channelMsgEntry{%
    \msgRealSource{Deleted Account}{2017-08-03 06:14:53}%
    \msgMainContent{å˜›}%
    %
}


\channelMsgEntry{%
    \msgRealSource{Deleted Account}{2017-08-03 06:14:53}%
    \msgMainContent{ğŸš®}%
    %
}


\channelMsgEntry{%
    \msgRealSource{Mingcong Bai}{2017-08-03 14:04:36}%
    \msgMainContent{ä¸å¦‚ç€æ‰‹å¹²ï¼Ÿå…ˆä» fork äº†æ¢æ ‡å¼€å§‹ï¼Ÿï¼ˆ}%
    %
}


\channelMsgEntry{%
    \msgRealSource{Deleted Account}{2017-08-03 14:04:36}%
    \msgMainContent{æˆ‘å»ºè®®å…ˆå†™å†…å®¹}%
    %
}


\channelMsgEntry{%
    \msgRealSource{Mingcong Bai}{2017-08-03 14:04:36}%
    \msgMainContent{é‚£ä¹Ÿå¾—å…ˆéƒ¨ç½²ä¸ªå®ä¾‹å¼€å§‹å¡«\ldots\ldots{}}%
    %
}


\channelMsgEntry{%
    \msgRealSource{Deleted Account}{2017-08-03 14:04:36}%
    \msgMainContent{Here it is}%
    %
}


\channelMsgEntry{%
    \msgRealSource{Mingcong Bai}{2017-08-03 14:04:36}%
    \msgMainContent{é‚£ä¸ªä¸æ˜¯åœ¨ä½ çš„æœºå™¨ä¸Šï¼Ÿ}%
    %
}


\channelMsgEntry{%
    \msgRealSource{Deleted Account}{2017-08-03 14:04:36}%
    \msgMainContent{åœ¨é•¿è€…æ‰¹è¯„å¼ å®åçš„å®åœ°çš„æˆ‘ä»¬çš„ä¸»æœåŠ¡å™¨ä¸Š}%
    %
}


\channelMsgEntry{%
    \msgRealSource{Mingcong Bai}{2017-08-03 14:04:36}%
    \msgMainContent{hhhhh}%
    %
}


\channelMsgEntry{%
    \msgRealSource{Deleted Account}{2017-08-03 14:13:30}%
    \msgMainContent{æˆ‘ç»™å®ƒè½»è½»åœ° reset --hard ä¸€ä¸‹ï¼Œä¸ç—›çš„}%
    %
}


\channelMsgEntry{%
    \msgRealSource{Deleted Account}{2017-08-03 14:24:57}%
    \msgMainContent{Wikipedia å¯ä»¥æ£€æµ‹ IPï¼Œç„¶åè°´è´£+å°ç¦}%
    %
}


\channelMsgEntry{%
    \msgRealSource{Mingcong Bai}{2017-08-03 14:24:57}%
    \msgMainContent{æˆ‘ä»¬è¿˜èƒ½äº¤æ¶‰ï¼ˆ}%
    %
}


\channelMsgEntry{%
    \msgRealSource{Mingcong Bai}{2017-08-03 14:24:57}%
    \msgMainContent{æœ€åè¿˜èƒ½æ•¦ä¿ƒ}%
    %
}


\channelMsgEntry{%
    \msgRealSource{Mingcong Bai}{2017-08-05 08:25:58}%
    \msgMainContent{é \ldots\ldots{}}%
    %
}


\channelMsgEntry{%
    \msgRealSource{Mingcong Bai}{2017-08-05 08:25:58}%
    \msgMainContent{Fedora pkgs æ‰”æ‰äº† cgit}%
    %
}


\channelMsgEntry{%
    \msgRealSource{Mingcong Bai}{2017-08-05 08:25:58}%
    \msgMainContent{è¿™ä¸‹æ—¥å­ä¸å¥½è¿‡äº†}%
    %
}


\channelMsgEntry{%
    \msgRealSource{Mingcong Bai}{2017-08-05 08:25:58}%
    \msgMainContent{No.~No.~No.}%
    \nopagebreak\includegraphics[width=\linewidth]{./.tg-data/Legacy/photos/photo_4@05-08-2017_08-25-58.jpg}%
}


\channelMsgEntry{%
    \msgRealSource{Deleted Account}{2017-08-05 08:26:06}%
    \msgMainContent{}%
    %
}


\channelMsgEntry{%
    \msgRealSource{Botsheen}{2017-08-05 11:24:28}%
    \msgMainContent{{[}AOSC Hermes HTTP{]} down! Timeout}%
    %
}


\channelMsgEntry{%
    \msgRealSource{Botsheen}{2017-08-05 11:24:28}%
    \msgMainContent{{[}AOSC Hermes Inbound SMTP{]} down! Timeout}%
    %
}


\channelMsgEntry{%
    \msgRealSource{Mingcong Bai}{2017-08-05 11:24:28}%
    \msgMainContent{è¿™æ˜¯è°çš„æœåŠ¡å™¨ï¼Œå¤´ä¼¸å‡ºæ¥ï¼Œä¹–ï¼ˆ}%
    %
}


\channelMsgEntry{%
    \msgRealSource{cth451 ÇÉ”uÇÆƒÉ¹ÇÊŒá´‰p}{2017-08-05 12:12:37}%
    \msgMainContent{åˆšåˆšå‹é©¬è·¯å›æ¥}%
    %
}


\channelMsgEntry{%
    \msgRealSource{cth451 ÇÉ”uÇÆƒÉ¹ÇÊŒá´‰p}{2017-08-05 12:12:37}%
    \msgMainContent{åº”è¯¥ç¼–è¯‘å®Œäº†}%
    %
}


\channelMsgEntry{%
    \msgRealSource{Mingcong Bai}{2017-08-05 12:17:10}%
    \msgMainContent{~å¤„ç†å™¨å ç”¨å›æ¥å•¦å¥½è€¶ /}%
    %
}


\channelMsgEntry{%
    \msgRealSource{Mingcong Bai}{2017-08-05 12:17:10}%
    \msgMainContent{~ç»§ç»­å‰¥å‰Š /}%
    %
}


\channelMsgEntry{%
    \msgRealSource{Deleted Account}{2017-08-05 12:17:10}%
    \msgMainContent{æ®‹å¿}%
    %
}


\channelMsgEntry{%
    \msgRealSource{Mingcong Bai}{2017-08-05 13:39:52}%
    \msgMainContent{Woah you calm down right there eh?}%
    \nopagebreak\includegraphics[width=\linewidth]{./.tg-data/Legacy/photos/photo_5@05-08-2017_13-39-52.jpg}%
}


\channelMsgEntry{%
    \msgRealSource{Junde Yhi}{2017-08-05 13:39:52}%
    \msgMainContent{æ€§æƒ…ä¸­äºº}%
    %
}


\channelMsgEntry{%
    \msgRealSource{Junde Yhi}{2017-08-05 13:39:52}%
    \msgMainContent{ç›¸æ¯”ä¹‹ä¸‹ ab scripts å°±å¾ˆç ´å¨ƒäº†}%
    %
}


\channelMsgEntry{%
    \msgRealSource{Deleted Account}{2017-08-05 15:34:48}%
    \msgMainContent{https://github.com/radare/radare2/blob/master/sys/r2-docker.sh Shit
indeed.}%
    %
}


\channelMsgEntry{%
    \msgRealSource{Mingcong Bai}{2017-08-06 04:44:47}%
    \msgMainContent{å…³é”®åˆ«å¼ºåˆ¶æ†ç»‘ vPro ä»€ä¹ˆçš„}%
    %
}


\channelMsgEntry{%
    \msgRealSource{cth451 ÇÉ”uÇÆƒÉ¹ÇÊŒá´‰p}{2017-08-06 04:44:47}%
    \msgMainContent{è¿™ä¸ªå•¥}%
    %
}


\channelMsgEntry{%
    \msgRealSource{åŒå€å¤šå¤šå†°ğŸ§¶ | ğ¦ğŸğœğŸ}{2017-08-06 04:44:47}%
    \msgMainContent{è¿œç¨‹ç®¡ç†ç‰¹æ€§å•Š}%
    %
}


\channelMsgEntry{%
    \msgRealSource{Mingcong Bai}{2017-08-06 04:44:47}%
    \msgMainContent{``è®©è€å“¥ç»™ä½ ç®¡â™‚ç†â™‚ç®¡â™‚ç†''}%
    %
}


\channelMsgEntry{%
    \msgRealSource{ĞĞµĞ‘ÑƒÑ‚Ğ»ĞµĞ³ ï¼ˆè¿«çœŸï¼‰}{2017-08-06 05:32:40}%
    \msgMainContent{è¿™ä¸ªäººçš„åå­—}%
    %
}


\channelMsgEntry{%
    \msgRealSource{ĞĞµĞ‘ÑƒÑ‚Ğ»ĞµĞ³ ï¼ˆè¿«çœŸï¼‰}{2017-08-06 05:32:40}%
    \msgMainContent{ä¸æ­»è€è€…}%
    %
}


\channelMsgEntry{%
    \msgRealSource{Deleted Account}{2017-08-06 05:32:40}%
    \msgMainContent{è¿˜éœ€è¦å­¦ä¹ ä¸€ä¸ªï¼}%
    %
}


\channelMsgEntry{%
    \msgRealSource{Deleted Account}{2017-08-06 05:34:03}%
    \msgMainContent{gmc -DIGNORE\_AOSC\_MEME\_OVERFLOW}%
    %
}


\channelMsgEntry{%
    \msgRealSource{åŒå€å¤šå¤šå†°ğŸ§¶ | ğ¦ğŸğœğŸ}{2017-08-06 05:57:33}%
    \msgMainContent{ç°åœ¨æˆ‘æ˜¯å°‘åƒå°‘å–å°‘åŠ¨}%
    %
}


\channelMsgEntry{%
    \msgRealSource{åŒå€å¤šå¤šå†°ğŸ§¶ | ğ¦ğŸğœğŸ}{2017-08-06 05:57:33}%
    \msgMainContent{è·Ÿæ­»äººæ²¡ä»€ä¹ˆä¸¤æ ·}%
    %
}


\channelMsgEntry{%
    \msgRealSource{Deleted Account}{2017-08-06 05:57:34}%
    \msgMainContent{å¤šè¿åŠ¨2333}%
    %
}


\channelMsgEntry{%
    \msgRealSource{Mingcong Bai}{2017-08-06 05:57:34}%
    \msgMainContent{å¤šæ‰‹è‡‚åœ†å‘¨è¿åŠ¨}%
    %
}


\channelMsgEntry{%
    \msgRealSource{Deleted Account}{2017-08-06 05:57:34}%
    \msgMainContent{é‚£æ˜¯\ldotsï¼Ÿ}%
    %
}


\channelMsgEntry{%
    \msgRealSource{Mingcong Bai}{2017-08-06 05:57:34}%
    \msgMainContent{åˆå``æ•™è‚²''ï¼Œæ¸¯äººå¯ä»¥å­¦ä¹ ä¸€ä¸ªçš„}%
    %
}


\channelMsgEntry{%
    \msgRealSource{Mingcong Bai}{2017-08-06 05:57:34}%
    \msgMainContent{``æä¸ªå¤§æ–° wehï¼ŒæŠŠ o æ‰¹åˆ¤ä¸€ç•ª''}%
    %
}


\channelMsgEntry{%
    \msgRealSource{Deleted Account}{2017-08-06 05:57:34}%
    \msgMainContent{å™¢å™¢å™¢å™¢å™¢å™¢å™¢å™¢}%
    %
}


\channelMsgEntry{%
    \msgRealSource{Deleted Account}{2017-08-06 05:57:34}%
    \msgMainContent{æ³•åŠ›æ— è¾¹çš„æŠ¡åœ†ï¼ˆ}%
    %
}


\channelMsgEntry{%
    \msgRealSource{Junde Yhi}{2017-08-06 08:15:08}%
    \msgMainContent{\#disambiguation}%
    \nopagebreak\includegraphics[width=\linewidth]{./.tg-data/Legacy/photos/photo_6@06-08-2017_08-15-08.jpg}%
}


\channelMsgEntry{%
    \msgRealSource{Mingcong Bai}{2017-08-06 08:15:08}%
    \msgMainContent{@cth451 å¸çŒ«è¿›è¡Œæ›²ï¼ˆ}%
    %
}


\channelMsgEntry{%
    \msgRealSource{ACID è®¡åˆ’}{2017-08-07 14:24:21}%
    \msgMainContent{extra-games in progress.}%
    %
}


\channelMsgEntry{%
    \msgRealSource{Mingcong Bai}{2017-08-07 14:24:21}%
    \msgMainContent{ç¨‹åºå‘˜æ±‚ç­¾ ä»Šå¤©æ˜¯2017å¹´8æœˆ7æ—¥ æ˜ŸæœŸä¸€ æ‰€æ±‚äº‹é¡¹ï¼šextra-games ç»“æœï¼šå‰}%
    %
}


\channelMsgEntry{%
    \msgRealSource{Mingcong Bai}{2017-08-07 14:24:21}%
    \msgMainContent{Bullshit, 50+\% fail rate}%
    %
}


\channelMsgEntry{%
    \msgRealSource{ACID è®¡åˆ’}{2017-08-07 14:24:21}%
    \msgMainContent{è¿™ä¸ªæ•…äº‹å‘Šè¯‰æˆ‘ä»¬å°å»ºè¿·ä¿¡è½åè€Œä¸å¯é }%
    %
}


\channelMsgEntry{%
    \msgRealSource{Mingcong Bai}{2017-08-08 09:34:06}%
    \msgMainContent{@GodsonAllFamily}%
    %
}


\channelMsgEntry{%
    \msgRealSource{Mingcong Bai}{2017-08-08 09:34:06}%
    \msgMainContent{@PowerPC}%
    %
}


\channelMsgEntry{%
    \msgRealSource{Junde Yhi}{2017-08-08 09:34:06}%
    \msgMainContent{s/Arduino/Loongson/g}%
    %
}


\channelMsgEntry{%
    \msgRealSource{Nine9}{2017-08-10 03:01:33}%
    \msgMainContent{ç‰¹é¦–åº”è¯¥å·²ç»å‡ºå¢ƒäº†}%
    %
}


\channelMsgEntry{%
    \msgRealSource{Nine9}{2017-08-10 03:01:33}%
    \msgMainContent{æ²¡è§ä»–ä¸Šçº¿äº†}%
    %
}


\channelMsgEntry{%
    \msgRealSource{Nine9}{2017-08-10 03:01:33}%
    \msgMainContent{ç™½ä¸åœ¨å¼€å§‹æ°´ï¼ˆç™½å¼€æ°´}%
    %
}


\channelMsgEntry{%
    \msgRealSource{cth451 ÇÉ”uÇÆƒÉ¹ÇÊŒá´‰p}{2017-08-10 12:08:52}%
    \msgMainContent{}%
    \nopagebreak\includegraphics[width=\linewidth]{./.tg-data/Legacy/photos/photo_7@10-08-2017_12-08-52.jpg}%
}


\channelMsgEntry{%
    \msgRealSource{cth451 ÇÉ”uÇÆƒÉ¹ÇÊŒá´‰p}{2017-08-10 12:08:52}%
    \msgMainContent{Blah blah blah Blahblah Blah Blah Blahé”Ÿæ–¤é“blah {[}Yes{]}{[}No{]}}%
    %
}


\channelMsgEntry{%
    \msgRealSource{Noncrystalline Solid Rabbit}{2017-08-10 17:44:36}%
    \msgMainContent{MCæœåŠ¡å™¨è¢«å¤§è§„æ¨¡//replace 1 97ä¹‹å}%
    %
}


\channelMsgEntry{%
    \msgRealSource{Noncrystalline Solid Rabbit}{2017-08-10 17:44:36}%
    \msgMainContent{ä»çŸ³å¤´æ¢æˆè™«åµã€‚}%
    %
}


\channelMsgEntry{%
    \msgRealSource{Noncrystalline Solid Rabbit}{2017-08-10 17:44:36}%
    \msgMainContent{æ‘¸ä¸€ä¸‹æœåŠ¡å™¨éƒ½ç‚¸äº†ã€‚}%
    %
}


\channelMsgEntry{%
    \msgRealSource{cth451 ÇÉ”uÇÆƒÉ¹ÇÊŒá´‰p}{2017-08-10 17:44:36}%
    \msgMainContent{æ”¹å›å»å•Š}%
    %
}


\channelMsgEntry{%
    \msgRealSource{cth451 ÇÉ”uÇÆƒÉ¹ÇÊŒá´‰p}{2017-08-10 17:44:36}%
    \msgMainContent{//undo}%
    %
}


\channelMsgEntry{%
    \msgRealSource{Noncrystalline Solid Rabbit}{2017-08-10 17:44:36}%
    \msgMainContent{ä¸æ˜¯æˆ‘doçš„ã€‚}%
    %
}


\channelMsgEntry{%
    \msgRealSource{Noncrystalline Solid Rabbit}{2017-08-10 17:44:36}%
    \msgMainContent{æˆ‘undoä¹Ÿæ²¡ç”¨ï¼ˆ}%
    %
}


\channelMsgEntry{%
    \msgRealSource{Noncrystalline Solid Rabbit}{2017-08-10 17:44:36}%
    \msgMainContent{å¤§è§„æ¨¡çš„åå‘//replaceç›´æ¥å´©æ‰äº†æœåŠ¡å™¨ã€‚}%
    %
}


\channelMsgEntry{%
    \msgRealSource{Noncrystalline Solid Rabbit}{2017-08-10 17:44:36}%
    \msgMainContent{ä¹Ÿä¸çŸ¥é“å…·ä½“çš„å—å®³åŒºåŸŸã€‚}%
    %
}


\channelMsgEntry{%
    \msgRealSource{Noncrystalline Solid Rabbit}{2017-08-10 17:44:36}%
    \msgMainContent{æœåŠ¡å™¨logé‡Œé¢æ²¡å†™ã€‚}%
    %
}


\channelMsgEntry{%
    \msgRealSource{Deleted Account}{2017-08-10 17:44:36}%
    \msgMainContent{ç”¨é‚£ä¸ªäººçš„è´¦å·ç™»å½•ï¼Œundo}%
    %
}


\channelMsgEntry{%
    \msgRealSource{Deleted Account}{2017-08-10 17:44:36}%
    \msgMainContent{ï¼ˆè®°å¾— offline}%
    %
}


\channelMsgEntry{%
    \msgRealSource{Noncrystalline Solid Rabbit}{2017-08-10 17:44:36}%
    \msgMainContent{è¿™äººåé¢è¿˜doäº†å¾ˆå¤šæœ‰ç”¨çš„å·¥ç¨‹ã€‚}%
    %
}


\channelMsgEntry{%
    \msgRealSource{Noncrystalline Solid Rabbit}{2017-08-10 17:44:36}%
    \msgMainContent{undoå°±æ²¡äº†ã€‚}%
    %
}


\channelMsgEntry{%
    \msgRealSource{Noncrystalline Solid Rabbit}{2017-08-10 17:44:36}%
    \msgMainContent{æˆ‘åªå¥½æ˜å¤©ä¿®å­˜æ¡£}%
    %
}


\channelMsgEntry{%
    \msgRealSource{ĞĞµĞ‘ÑƒÑ‚Ğ»ĞµĞ³ ï¼ˆè¿«çœŸï¼‰}{2017-08-10 17:44:36}%
    \msgMainContent{è¿™ç§çˆ±æäº‹çš„è€å¸æœº}%
    %
}


\channelMsgEntry{%
    \msgRealSource{cth451 ÇÉ”uÇÆƒÉ¹ÇÊŒá´‰p}{2017-08-10 17:44:36}%
    \msgMainContent{å¬èµ·æ¥åƒä¿®æ­£ä¸€ä¸ªä¸€ä¸‡ä¸ª commit ä¹‹å‰ç¡¬ç¼–ç è¿›å»çš„ä¸€ä¸ª password}%
    %
}


\channelMsgEntry{%
    \msgRealSource{cth451 ÇÉ”uÇÆƒÉ¹ÇÊŒá´‰p}{2017-08-10 17:44:36}%
    \msgMainContent{å¹¶ä¸”è¿˜è¢«äººç”¨æ¥å½“ 0day æŠŠæœåŠ¡å™¨è‰¹äº†ä¸ªé}%
    %
}


\channelMsgEntry{%
    \msgRealSource{Deleted Account}{2017-08-10 17:44:36}%
    \msgMainContent{è¿™ç§çœŸæ˜¯å¯æ€•}%
    %
}


\channelMsgEntry{%
    \msgRealSource{Deleted Account}{2017-08-10 17:44:36}%
    \msgMainContent{git ä¸€ä¸ªä¸å¥½å°±æ˜¯è´è¶æ•ˆåº”ï¼ˆ}%
    %
}


\channelMsgEntry{%
    \msgRealSource{Deleted Account}{2017-08-10 17:44:36}%
    \msgMainContent{sha1 é“¾çš„è¿é”ååº”}%
    %
}


\channelMsgEntry{%
    \msgRealSource{Deleted Account}{2017-08-10 17:44:36}%
    \msgMainContent{åˆºæ¿€}%
    %
}


\channelMsgEntry{%
    \msgRealSource{cth451 ÇÉ”uÇÆƒÉ¹ÇÊŒá´‰p}{2017-08-10 17:44:36}%
    \msgMainContent{åˆ«çš„ç‰ˆæœ¬æ§åˆ¶èƒ½é¿å…å—(}%
    %
}


\channelMsgEntry{%
    \msgRealSource{Deleted Account}{2017-08-10 17:44:36}%
    \msgMainContent{ä½ æ€•æ˜¯æ²¡ç”¨è¿‡ Baidu Disk}%
    %
}


\channelMsgEntry{%
    \msgRealSource{cth451 ÇÉ”uÇÆƒÉ¹ÇÊŒá´‰p}{2017-08-10 17:44:36}%
    \msgMainContent{æ˜¯å…ˆè¿›çš„}%
    %
}


\channelMsgEntry{%
    \msgRealSource{Deleted Account}{2017-08-10 17:44:36}%
    \msgMainContent{å‡è®¾ã€‚æœ‰ä¸€å¤©çªç„¶æƒ³èµ·}%
    %
}


\channelMsgEntry{%
    \msgRealSource{Deleted Account}{2017-08-10 17:44:36}%
    \msgMainContent{initial commit çš„ä¸‹ä¸€ä¸ª commit é‡Œå¥½åƒæœ‰ç§é’¥}%
    %
}


\channelMsgEntry{%
    \msgRealSource{Deleted Account}{2017-08-10 17:44:36}%
    \msgMainContent{åæ¥åˆ äº†}%
    %
}


\channelMsgEntry{%
    \msgRealSource{Deleted Account}{2017-08-10 17:44:36}%
    \msgMainContent{ä½†æ˜¯\ldots{}}%
    %
}


\channelMsgEntry{%
    \msgRealSource{cth451 ÇÉ”uÇÆƒÉ¹ÇÊŒá´‰p}{2017-08-10 17:44:36}%
    \msgMainContent{æ˜¯æˆ‘æˆ‘å°±åˆ åº“è·‘è·¯äº†(}%
    %
}


\channelMsgEntry{%
    \msgRealSource{Deleted Account}{2017-08-10 17:44:36}%
    \msgMainContent{git filter-branch --all --tree-filter `rm id.pem'}%
    %
}


\channelMsgEntry{%
    \msgRealSource{ĞĞµĞ‘ÑƒÑ‚Ğ»ĞµĞ³ ï¼ˆè¿«çœŸï¼‰}{2017-08-10 17:44:36}%
    \msgMainContent{ç„¶åè¢«æ‰¾åˆ°äº†}%
    %
}


\channelMsgEntry{%
    \msgRealSource{Deleted Account}{2017-08-10 17:44:36}%
    \msgMainContent{git push --all --force}%
    %
}


\channelMsgEntry{%
    \msgRealSource{Deleted Account}{2017-08-10 17:44:36}%
    \msgMainContent{å…¨ä¸–ç•Œä¸ºä¹‹å°–å«ï¼}%
    %
}


\channelMsgEntry{%
    \msgRealSource{cth451 ÇÉ”uÇÆƒÉ¹ÇÊŒá´‰p}{2017-08-10 17:44:36}%
    \msgMainContent{å¤§æ¦‚å†²å‡»ä¸äºšäºåˆ åº“è·‘è·¯}%
    %
}


\channelMsgEntry{%
    \msgRealSource{Deleted Account}{2017-08-10 17:44:36}%
    \msgMainContent{æ²¡å…³ç³»å•Šï¼Œé€šçŸ¥ä¸€ä¸‹}%
    %
}


\channelMsgEntry{%
    \msgRealSource{Deleted Account}{2017-08-10 17:44:37}%
    \msgMainContent{å¤§å®¶ï¼Œ\ldots å¬æˆ‘è¯´}%
    %
}


\channelMsgEntry{%
    \msgRealSource{cth451 ÇÉ”uÇÆƒÉ¹ÇÊŒá´‰p}{2017-08-10 17:44:37}%
    \msgMainContent{æˆ‘ä»¬åˆšåˆšåšäº†ä¸€ä¸ªè‰°éš¾çš„æ’…è…š}%
    %
}


\channelMsgEntry{%
    \msgRealSource{Deleted Account}{2017-08-10 17:44:37}%
    \msgMainContent{git stash; git reset --hard ; git pull --rebase --all; git stash pop}%
    %
}


\channelMsgEntry{%
    \msgRealSource{Deleted Account}{2017-08-10 17:44:37}%
    \msgMainContent{å¤§å®¶è¿™ä¹ˆåšä¸€ä¸‹}%
    %
}


\channelMsgEntry{%
    \msgRealSource{Deleted Account}{2017-08-10 17:44:37}%
    \msgMainContent{ball ball ä½ ä»¬äº†ï¼}%
    %
}


\channelMsgEntry{%
    \msgRealSource{Deleted Account}{2017-08-10 17:44:37}%
    \msgMainContent{ï¼ˆä¸‹è·ªï¼‰}%
    %
}


\channelMsgEntry{%
    \msgRealSource{Deleted Account}{2017-08-10 18:03:58}%
    \msgMainContent{ä¸ç’ä½ è¯´ï¼Œæˆ‘è¿˜çœŸæ˜¯\ldots\ldots è¯•è¿‡ initial commit ä¿®æ­£\ldots\ldots{}}%
    %
}


\channelMsgEntry{%
    \msgRealSource{Deleted Account}{2017-08-10 18:03:58}%
    \msgMainContent{è¿™ä¸ªå¤ªå›°éš¾äº†}%
    %
}


\channelMsgEntry{%
    \msgRealSource{Deleted Account}{2017-08-10 18:03:58}%
    \msgMainContent{æ•´ä¸ªæäº¤æ ‘å…¨æ¯äº†}%
    %
}


\channelMsgEntry{%
    \msgRealSource{Deleted Account}{2017-08-10 18:03:58}%
    \msgMainContent{æ‰€æœ‰ commit çš„ sha1 éƒ½å˜äº†}%
    %
}


\channelMsgEntry{%
    \msgRealSource{Deleted Account}{2017-08-10 18:03:58}%
    \msgMainContent{è¿˜å¥½æ²¡äºº}%
    %
}


\channelMsgEntry{%
    \msgRealSource{Deleted Account}{2017-08-10 18:03:58}%
    \msgMainContent{ä½†æƒ³æƒ³é‚£äº›ä¸ªå¤§ repo}%
    %
}


\channelMsgEntry{%
    \msgRealSource{Deleted Account}{2017-08-10 18:03:58}%
    \msgMainContent{çŸ¥åç‚¹çš„}%
    %
}


\channelMsgEntry{%
    \msgRealSource{cth451 ÇÉ”uÇÆƒÉ¹ÇÊŒá´‰p}{2017-08-10 18:03:58}%
    \msgMainContent{ä½ åé¢è·Ÿç€ä¸€å¤§å †äººé¡ºç€ç½‘çº¿æ¥å•ƒç‹®å­å¤´äº†}%
    %
}


\channelMsgEntry{%
    \msgRealSource{Deleted Account}{2017-08-10 18:03:58}%
    \msgMainContent{å™«}%
    %
}


\channelMsgEntry{%
    \msgRealSource{Deleted Account}{2017-08-10 18:03:58}%
    \msgMainContent{åˆ€ç‰‡å£°ï¼ŒBull shitå£°ï¼Œç‹‚æå£°ï¼Œç™¾åƒé½å‘ï¼Œç™¾åƒé½ä½œ}%
    %
}


\channelMsgEntry{%
    \msgRealSource{Deleted Account}{2017-08-10 18:03:58}%
    \msgMainContent{é—»è€…æ— ä¸ä¸¤è‚¡æˆ˜æˆ˜ï¼Œå‡ æ¬²å…ˆèµ°}%
    %
}


\channelMsgEntry{%
    \msgRealSource{Deleted Account}{2017-08-10 18:03:58}%
    \msgMainContent{å¿½é—»æ‰¶å°ºä¸€ä¸‹}%
    %
}


\channelMsgEntry{%
    \msgRealSource{Deleted Account}{2017-08-10 18:03:58}%
    \msgMainContent{ä¸€ç‹®ä¸€.gitä¸€shellè€Œå·²}%
    %
}


\channelMsgEntry{%
    \msgRealSource{Mingcong Bai}{2017-08-11 07:06:01}%
    \msgMainContent{}%
    \nopagebreak\includegraphics[width=\linewidth]{./.tg-data/Legacy/photos/photo_8@11-08-2017_07-06-01.jpg}%
}


\channelMsgEntry{%
    \msgRealSource{Mingcong Bai}{2017-08-11 07:06:01}%
    \msgMainContent{\&\%\&**!\&!\#}%
    %
}


\channelMsgEntry{%
    \msgRealSource{Deleted Account}{2017-08-11 22:55:01}%
    \msgMainContent{è„šæ³¨ï¼šå…¶å®å¦‚æœæ›¿ä»£çš„æ„å»ºç³»ç»Ÿæ¯” autotools ç®€æ´ä¸”ä¸é‚£ä¹ˆä¾èµ– shell script,
ä¹Ÿæœªå¿…ä¸æ˜¯åäº‹ï¼ˆè·‘}%
    %
}


\channelMsgEntry{%
    \msgRealSource{Deleted Account}{2017-08-12 02:21:14}%
    \msgMainContent{çœ‹äº†å¥½ä¸€ä¼šå„¿ï¼ŒåŸæ¥æ˜¯``æœªå¿…ä¸æ˜¯åäº‹''}%
    %
}


\channelMsgEntry{%
    \msgRealSource{Neruthes 0xAFB3373F5200DF38}{2017-08-13 03:39:31}%
    \msgMainContent{æ¬¢è¿åŠ å…¥å¥”ä¸‰å¤§å†›ï¼Ÿ}%
    %
}


\channelMsgEntry{%
    \msgRealSource{Mingcong Bai}{2017-08-13 03:39:31}%
    \msgMainContent{å¼å•Š}%
    %
}


\channelMsgEntry{%
    \msgRealSource{Mingcong Bai}{2017-08-13 03:39:31}%
    \msgMainContent{ä¹¦è®°éƒ½å¿«å›¾æ‹‰ä¸äº†}%
    %
}


\channelMsgEntry{%
    \msgRealSource{ĞĞµĞ‘ÑƒÑ‚Ğ»ĞµĞ³ ï¼ˆè¿«çœŸï¼‰}{2017-08-13 03:39:47}%
    \msgMainContent{å¥”ä¸‰}%
    %
}


\channelMsgEntry{%
    \msgRealSource{ĞĞµĞ‘ÑƒÑ‚Ğ»ĞµĞ³ ï¼ˆè¿«çœŸï¼‰}{2017-08-13 03:39:47}%
    \msgMainContent{ç¥ä½ æ—©æ—¥ç½‘çˆ†ï¼ˆx}%
    %
}


\channelMsgEntry{%
    \msgRealSource{ĞĞµĞ‘ÑƒÑ‚Ğ»ĞµĞ³ ï¼ˆè¿«çœŸï¼‰}{2017-08-13 03:39:47}%
    \msgMainContent{åæ­£ä½ ç½‘çˆ†äº†æˆ‘ä¹Ÿç½‘çˆ†äº†}%
    %
}


\channelMsgEntry{%
    \msgRealSource{Mingcong Bai}{2017-08-13 03:39:47}%
    \msgMainContent{Pentium 3 Katmai â†’ Coppermine â†’ Tualatin}%
    %
}


\channelMsgEntry{%
    \msgRealSource{å’¸é±¼}{2017-08-13 03:39:47}%
    \msgMainContent{netoburasutoï¼ˆx}%
    %
}


\channelMsgEntry{%
    \msgRealSource{Mingcong Bai}{2017-08-13 03:39:47}%
    \msgMainContent{Netburst}%
    %
}


\channelMsgEntry{%
    \msgRealSource{å’¸é±¼}{2017-08-13 03:42:22}%
    \msgMainContent{è²´æ¨£çŸ¥ã‚‰ãªã„ã“ã“ã‚æ—¥æœ¬èªéº¼ï¼Ÿ}%
    %
}


\channelMsgEntry{%
    \msgRealSource{Mingcong Bai}{2017-08-13 03:42:22}%
    \msgMainContent{{[}{]}{[}{]}{[}{]}å°±é¢œä¸è¦{[}{]}{[}{]}{[}{]}å±çœ¼å­{[}{]}{[}{]}{[}{]}æ¥æ‰“æˆ‘å•Š{[}{]}{[}{]}}%
    %
}


\channelMsgEntry{%
    \msgRealSource{å’¸é±¼}{2017-08-13 03:42:22}%
    \msgMainContent{}%
    %
}


\channelMsgEntry{%
    \msgRealSource{Junde Yhi}{2017-08-17 17:46:41}%
    \msgMainContent{ç¨‹åºå‘˜æ±‚ç­¾ ä»Šå¤©æ˜¯2017å¹´8æœˆ18æ—¥ æ˜ŸæœŸäº” æ‰€æ±‚äº‹é¡¹ï¼šå–æ ¼ç“¦æ–¯ ç»“æœï¼šå‰}%
    %
}


\channelMsgEntry{%
    \msgRealSource{Junde Yhi}{2017-08-17 17:46:41}%
    \msgMainContent{å‰ä½ éº»ç—¹}%
    %
}


\channelMsgEntry{%
    \msgRealSource{Junde Yhi}{2017-08-17 17:46:41}%
    \msgMainContent{è€å­è¿‡æ•}%
    %
}


\channelMsgEntry{%
    \msgRealSource{Mingcong Bai}{2017-08-17 17:46:41}%
    \msgMainContent{ç¨‹åºå‘˜æ±‚ç­¾ ä»Šå¤©æ˜¯2017å¹´8æœˆ18æ—¥ æ˜ŸæœŸäº” æ‰€æ±‚äº‹é¡¹ï¼šé…’ç²¾è¿‡æ• ç»“æœï¼šå°å‡¶}%
    %
}


\channelMsgEntry{%
    \msgRealSource{Mingcong Bai}{2017-08-17 17:46:41}%
    \msgMainContent{å‡¶ä½ å¦ˆï¼Œè¿‡æ•äº†}%
    %
}


\channelMsgEntry{%
    \msgRealSource{Deleted Account}{2017-08-17 17:46:41}%
    \msgMainContent{ç¨‹åºå‘˜æ±‚ç­¾ ä»Šå¤©æ˜¯2017å¹´8æœˆ18æ—¥ æ˜ŸæœŸäº” æ‰€æ±‚äº‹é¡¹ï¼šå†™ä»£ç  ç»“æœï¼šå°å‡¶}%
    %
}


\channelMsgEntry{%
    \msgRealSource{Deleted Account}{2017-08-17 17:46:42}%
    \msgMainContent{æˆ‘æ—¥}%
    %
}


\channelMsgEntry{%
    \msgRealSource{Deleted Account}{2017-08-17 17:46:42}%
    \msgMainContent{èƒ¸ä½ å¦ˆ}%
    %
}


\channelMsgEntry{%
    \msgRealSource{Deleted Account}{2017-08-17 17:46:42}%
    \msgMainContent{å†ä¸å†™ç”Ÿäº§åŠ›å°±æˆajiäº†}%
    %
}


\channelMsgEntry{%
    \msgRealSource{Mingcong Bai}{2017-08-17 17:46:42}%
    \msgMainContent{è¿™å°±æ˜¯ç°ä»£å­¦æœ¯äººå£«å¯¹è¿·ä¿¡çš„æŠ—äº‰ï¼}%
    %
}


\channelMsgEntry{%
    \msgRealSource{åŒå€å¤šå¤šå†°ğŸ§¶ | ğ¦ğŸğœğŸ}{2017-08-17 19:08:38}%
    \msgMainContent{ç°åœ¨æ˜¯ä¸‘æ—¶å˜›ï¼ˆ}%
    %
}


\channelMsgEntry{%
    \msgRealSource{Deleted Account}{2017-08-17 19:08:38}%
    \msgMainContent{ä½ å¥½ä¸‘}%
    %
}


\channelMsgEntry{%
    \msgRealSource{Deleted Account}{2017-08-17 19:08:38}%
    \msgMainContent{ï¼ˆ``ä¸‘æ—¶''ï¼‰}%
    %
}


\channelMsgEntry{%
    \msgRealSource{Mingcong Bai}{2017-08-17 19:08:38}%
    \msgMainContent{çœ‹é”™ä½ äº†ï¼Œä½ ä¹Ÿå¥½ä¸‘ï¼ˆ}%
    %
}


\channelMsgEntry{%
    \msgRealSource{Deleted Account}{2017-08-17 19:08:38}%
    \msgMainContent{å­æ—¶èŠ±è§æ³ªï¼Œä¸‘æ—¶é¸ŸæƒŠå¿ƒ}%
    %
}


\channelMsgEntry{%
    \msgRealSource{Deleted Account}{2017-08-17 19:08:38}%
    \msgMainContent{ç‹®å­çš„çœŸå®å†™ç…§ï¼ˆé€†å¤©å¤§é›¾}%
    %
}


\channelMsgEntry{%
    \msgRealSource{Deleted Account}{2017-08-17 19:08:54}%
    \msgMainContent{æˆ‘æ‰¾äº†ä¸€åˆ†é’Ÿæ‰‹æœº}%
    %
}


\channelMsgEntry{%
    \msgRealSource{Deleted Account}{2017-08-17 19:08:54}%
    \msgMainContent{åˆ°å¤„ä¹±ç¿»}%
    %
}


\channelMsgEntry{%
    \msgRealSource{Deleted Account}{2017-08-17 19:08:54}%
    \msgMainContent{å‘ç°ç°åœ¨ æˆ‘ç”¨çš„ä¸å°±æ˜¯æ‰‹æœºå—\ldots{}}%
    %
}


\channelMsgEntry{%
    \msgRealSource{Balthild}{2017-08-17 19:38:13}%
    \msgMainContent{è¯´èµ·æ¥ï¼Œæˆ‘ä»¬çš„åˆè¡·æ˜¯å•¥ï¼ˆ}%
    %
}


\channelMsgEntry{%
    \msgRealSource{Balthild}{2017-08-17 19:38:13}%
    \msgMainContent{ï¼ˆå»ä»–å¦ˆçš„åˆè¡·}%
    %
}


\channelMsgEntry{%
    \msgRealSource{Deleted Account}{2017-08-17 19:38:13}%
    \msgMainContent{ï¼ˆæ±‚å½’æ¡£åˆ°æ¢—ch}%
    %
}


\channelMsgEntry{%
    \msgRealSource{Mingcong Bai}{2017-08-18 07:42:35}%
    \msgMainContent{tracker-miner è¯ˆå°¸ï¼Œç‚¸å‡ºä¸€å †è…çƒ‚çš„èµ„äº§é˜¶çº§ç¿»è¯‘}%
    %
}


\channelMsgEntry{%
    \msgRealSource{Mingcong Bai}{2017-08-18 07:42:35}%
    \msgMainContent{åŠè§’æ‹¬å·ï¼Œä¸­è‹±ä¸å¸¦ç©ºæ ¼ç­‰è…è´¥ç°è±¡æ¯”æ¯”çš†æ˜¯}%
    %
}


\channelMsgEntry{%
    \msgRealSource{åŒå€å¤šå¤šå†°ğŸ§¶ | ğ¦ğŸğœğŸ}{2017-08-18 08:44:28}%
    \msgMainContent{å¦å¤–è¿™æ˜¯ä»€ä¹ˆç‰ˆæœ¬ï¼Œç¨³å®šç‰ˆè¿˜æ˜¯ svn ç‰ˆ}%
    %
}


\channelMsgEntry{%
    \msgRealSource{liushuyu}{2017-08-18 08:44:28}%
    \msgMainContent{èƒ½ï¼Œä½†æ˜¯ä»–ä»¬æœåŠ¡å™¨å¾ˆçƒ‚ï¼Œè¦åŠ è½½ä¸ªåŠä¸ªå°æ—¶}%
    %
}


\channelMsgEntry{%
    \msgRealSource{Deleted Account}{2017-08-18 08:44:28}%
    \msgMainContent{ç»­å®ƒ}%
    %
}


\channelMsgEntry{%
    \msgRealSource{liushuyu}{2017-08-18 08:44:28}%
    \msgMainContent{svn ç‰ˆä¸èƒ½ç¼–è¯‘ï¼ŒLinux ä¸Šçš„ GL æ¸²æŸ“è¢«æ”¹åäº†}%
    %
}


\channelMsgEntry{%
    \msgRealSource{Deleted Account}{2017-08-18 08:44:28}%
    \msgMainContent{é‚£å²‚ä¸æ˜¯æ¯” code.soundsoftware.ac.uk é‚£ä¸ªè¿˜å¼º}%
    %
}


\channelMsgEntry{%
    \msgRealSource{Deleted Account}{2017-08-18 08:44:28}%
    \msgMainContent{å†™ä¸ªé‚®ä»¶å»é—®é—®å§}%
    %
}


\channelMsgEntry{%
    \msgRealSource{Deleted Account}{2017-08-18 08:44:28}%
    \msgMainContent{å¤ªå¼ºå¤§äº†}%
    %
}


\channelMsgEntry{%
    \msgRealSource{Deleted Account}{2017-08-18 08:44:28}%
    \msgMainContent{\ldots\ldots ä½ ä»¬åˆšæ‰çš„å¯¹è¯æˆ‘å¥½åƒä¹‹å‰æ¢¦åˆ°è¿‡}%
    %
}


\channelMsgEntry{%
    \msgRealSource{cth451 ÇÉ”uÇÆƒÉ¹ÇÊŒá´‰p}{2017-08-18 08:44:28}%
    \msgMainContent{\#dejavu}%
    %
}


\channelMsgEntry{%
    \msgRealSource{Deleted Account}{2017-08-18 08:44:28}%
    \msgMainContent{å‰å¥å“èµ·}%
    %
}


\channelMsgEntry{%
    \msgRealSource{cth451 ÇÉ”uÇÆƒÉ¹ÇÊŒá´‰p}{2017-08-18 08:44:28}%
    \msgMainContent{I've dreamed this code before}%
    %
}


\channelMsgEntry{%
    \msgRealSource{cth451 ÇÉ”uÇÆƒÉ¹ÇÊŒá´‰p}{2017-08-18 08:44:28}%
    \msgMainContent{Higher on the mov}%
    %
}


\channelMsgEntry{%
    \msgRealSource{cth451 ÇÉ”uÇÆƒÉ¹ÇÊŒá´‰p}{2017-08-18 08:44:28}%
    \msgMainContent{I know it's time to SIGSEGV}%
    %
}


\channelMsgEntry{%
    \msgRealSource{åŒå€å¤šå¤šå†°ğŸ§¶ | ğ¦ğŸğœğŸ}{2017-08-18 08:52:08}%
    \msgMainContent{æ‰“å€’ x86 éœ¸æƒä¸»ä¹‰ï¼}%
    %
}


\channelMsgEntry{%
    \msgRealSource{åŒå€å¤šå¤šå†°ğŸ§¶ | ğ¦ğŸğœğŸ}{2017-08-18 08:52:08}%
    \msgMainContent{æ¶æ„å¹³æƒä¸‡å²ï¼}%
    %
}


\channelMsgEntry{%
    \msgRealSource{Deleted Account}{2017-08-18 08:53:20}%
    \msgMainContent{ä¸€è‚¡èµ„äº§é˜¶çº§è€ä»£ç çš„æ°”æ¯}%
    %
}


\channelMsgEntry{%
    \msgRealSource{Deleted Account}{2017-08-18 08:53:20}%
    \msgMainContent{20ä¸–çºªåˆçš„å¥¥åœ°åˆ©å¸å›½ä¸»ä¹‰}%
    %
}


\channelMsgEntry{%
    \msgRealSource{åŒå€å¤šå¤šå†°ğŸ§¶ | ğ¦ğŸğœğŸ}{2017-08-18 08:53:20}%
    \msgMainContent{è¿«çœŸèµ„äº§é˜¶çº§è€ä»£ç }%
    %
}


\channelMsgEntry{%
    \msgRealSource{åŒå€å¤šå¤šå†°ğŸ§¶ | ğ¦ğŸğœğŸ}{2017-08-18 08:53:20}%
    \msgMainContent{è¿™è«éæ˜¯ idTech4 å¼•æ“ï¼Ÿ}%
    %
}


\channelMsgEntry{%
    \msgRealSource{åŒå€å¤šå¤šå†°ğŸ§¶ | ğ¦ğŸğœğŸ}{2017-08-18 08:53:20}%
    \msgMainContent{æœç„¶ã€‚ã€‚ã€‚åŸºäº Doom 3}%
    %
}


\channelMsgEntry{%
    \msgRealSource{Mingcong Bai}{2017-08-18 09:00:43}%
    \msgMainContent{å¯¹äºè¿™ç§ä»£ç æˆ‘æœ‰å¤šäºä¸€åƒå¥è¯è¯´}%
    %
}


\channelMsgEntry{%
    \msgRealSource{Mingcong Bai}{2017-08-18 09:00:43}%
    \msgMainContent{``A picture is worth a thousand words''}%
    %
}


\channelMsgEntry{%
    \msgRealSource{Mingcong Bai}{2017-08-18 09:00:43}%
    \msgMainContent{}%
    \nopagebreak\includegraphics[width=\linewidth]{./.tg-data/Legacy/photos/photo_9@18-08-2017_09-00-43.jpg}%
}


\channelMsgEntry{%
    \msgRealSource{Mingcong Bai}{2017-08-18 09:00:43}%
    \msgMainContent{è·¨æ¶æ„å·¥äººä¸é›†ä½“ x86 ç çŒ´ {[}åˆ‡ç£‹{]} é›•å¡‘}%
    %
}


\channelMsgEntry{%
    \msgRealSource{åŒå€å¤šå¤šå†°ğŸ§¶ | ğ¦ğŸğœğŸ}{2017-08-18 09:00:43}%
    \msgMainContent{æ‰€ä»¥è¿™åŠ èµ·æ¥æ˜¯ 1001 å¥å’¯}%
    %
}


\channelMsgEntry{%
    \msgRealSource{Mingcong Bai}{2017-08-18 09:00:53}%
    \msgMainContent{1001 å¥è·¨æ¶æ„ä¸ x86 è‡³ä¸Šä¸»ä¹‰è€…ä¹‹é—´å–Šçš„ mmp}%
    %
}


\channelMsgEntry{%
    \msgRealSource{Mingcong Bai}{2017-08-19 16:13:05}%
    \msgMainContent{ç„¶åæ²¡æœ‰ç­·å­}%
    %
}


\channelMsgEntry{%
    \msgRealSource{å’¸é±¼}{2017-08-19 16:13:05}%
    \msgMainContent{ç”¨æ‰‹æ‹¿ï¼Œç›´æ¥å•ƒï¼ˆx}%
    %
}


\channelMsgEntry{%
    \msgRealSource{å’¸é±¼}{2017-08-19 16:13:05}%
    \msgMainContent{é‚£å°±ç”¨åŸåŠ›}%
    %
}


\channelMsgEntry{%
    \msgRealSource{Mingcong Bai}{2017-08-19 16:13:05}%
    \msgMainContent{}%
    \nopagebreak\includegraphics[width=\linewidth]{./.tg-data/Legacy/photos/photo_10@19-08-2017_16-13-05.jpg}%
}


\channelMsgEntry{%
    \msgRealSource{Mingcong Bai}{2017-08-19 16:13:05}%
    \msgMainContent{@TheSaltedFish æ•ˆæœä¸å¥½è¯¶ï¼ˆ}%
    %
}


\channelMsgEntry{%
    \msgRealSource{å’¸é±¼}{2017-08-19 16:13:05}%
    \msgMainContent{é‚£æ˜¯ä½ åŸåŠ›ä¸å¤ }%
    %
}


\channelMsgEntry{%
    \msgRealSource{å’¸é±¼}{2017-08-19 16:13:05}%
    \msgMainContent{å†å»é›ç…‰å¹¾ç™¾å¹´å†ä¾†åƒé£¯}%
    %
}


\channelMsgEntry{%
    \msgRealSource{Mingcong Bai}{2017-08-19 16:13:05}%
    \msgMainContent{}%
    \nopagebreak\includegraphics[width=\linewidth]{./.tg-data/Legacy/photos/photo_11@19-08-2017_16-13-05.jpg}%
}


\channelMsgEntry{%
    \msgRealSource{Mingcong Bai}{2017-08-19 16:18:22}%
    \msgMainContent{}%
    \nopagebreak\includegraphics[width=\linewidth]{./.tg-data/Legacy/photos/photo_12@19-08-2017_16-18-22.jpg}%
}


\channelMsgEntry{%
    \msgRealSource{Mingcong Bai}{2017-08-25 03:49:56}%
    \msgMainContent{å®¶é‡Œç°åœ¨ç½‘ç»œå°´å°¬ï¼Œè·¯ç”±å™¨åœ¨å¤©èŠ±}%
    %
}


\channelMsgEntry{%
    \msgRealSource{Mingcong Bai}{2017-08-25 03:49:56}%
    \msgMainContent{æ²¡æ³•åŠ Tegra}%
    %
}


\channelMsgEntry{%
    \msgRealSource{åŒå€å¤šå¤šå†°ğŸ§¶ | ğ¦ğŸğœğŸ}{2017-08-25 03:49:56}%
    \msgMainContent{ä»€ä¹ˆæ—¶å€™èµ·ç–¹å­çš„ï¼ˆå¤§é›¾}%
    %
}


\channelMsgEntry{%
    \msgRealSource{liushuyu}{2017-08-25 03:49:56}%
    \msgMainContent{``åˆä¸å¥½è®© Tegra ä¸ŠåŠ''ï¼ˆ}%
    %
}


\channelMsgEntry{%
    \msgRealSource{Mingcong Bai}{2017-08-25 14:07:53}%
    \msgMainContent{è¿™ä¸ªæœˆçš„ staging åˆ« merge äº†\ldots\ldots{} ARM
éƒ½æ²¡è·Ÿï¼Œæ²¡å¸Œæœ›è·Ÿä¸Šï¼Œè€Œä¸”é‡Œé¢è¿˜æ··äº†å¤§é‡ acid}%
    %
}


\channelMsgEntry{%
    \msgRealSource{Mingcong Bai}{2017-08-25 14:07:53}%
    \msgMainContent{@rainbow\_sea \ldots{} å› æ­¤å…«æœˆä»½çš„ staging ä¸ç”¨æ‹–äº†}%
    %
}


\channelMsgEntry{%
    \msgRealSource{Mingcong Bai}{2017-08-25 14:07:53}%
    \msgMainContent{é¡ºä¾¿ @cth451 å¦‚æœä½ æœ‰ commit æ†‹ç€ï¼Œå°å¿ƒåŒ…æ¯’ç—‡}%
    %
}


\channelMsgEntry{%
    \msgRealSource{Deleted Account}{2017-08-26 16:17:50}%
    \msgMainContent{æˆ‘æœ‰ä¸ªæƒ³æ³•å‘¢\ldots\ldots å°±æ˜¯}%
    %
}


\channelMsgEntry{%
    \msgRealSource{Deleted Account}{2017-08-26 16:17:50}%
    \msgMainContent{ciel å…è®¸åªå¯ç”¨ä¸€ä¸ªæ ¸å¿ƒ}%
    %
}


\channelMsgEntry{%
    \msgRealSource{Deleted Account}{2017-08-26 16:17:50}%
    \msgMainContent{ç„¶åå°±å¯ä»¥ä¸ç®¡ä¸‰ä¸ƒäºŒåä¸€å…¨éƒ¨å¤šçº¿ç¨‹xjbä¹±è·‘äº†}%
    %
}


\channelMsgEntry{%
    \msgRealSource{Deleted Account}{2017-08-26 16:17:50}%
    \msgMainContent{è°è·‘å¾—å¿«è°å°±å½“é•¿è€…}%
    %
}


\channelMsgEntry{%
    \msgRealSource{cth451 ÇÉ”uÇÆƒÉ¹ÇÊŒá´‰p}{2017-08-29 12:16:56}%
    \msgMainContent{}%
    \nopagebreak\includegraphics[width=\linewidth]{./.tg-data/Legacy/photos/photo_13@29-08-2017_12-16-56.jpg}%
}


\channelMsgEntry{%
    \msgRealSource{cth451 ÇÉ”uÇÆƒÉ¹ÇÊŒá´‰p}{2017-08-29 12:16:56}%
    \msgMainContent{``æ¥æ”¶å¯¹è±¡ä¸­''}%
    %
}


\channelMsgEntry{%
    \msgRealSource{cth451 ÇÉ”uÇÆƒÉ¹ÇÊŒá´‰p}{2017-08-29 12:16:56}%
    \msgMainContent{æ²¡æœ‰å¯¹è±¡ã€‚}%
    %
}


\channelMsgEntry{%
    \msgRealSource{åŒå€å¤šå¤šå†°ğŸ§¶ | ğ¦ğŸğœğŸ}{2017-08-29 12:16:56}%
    \msgMainContent{}%
    %
}


\channelMsgEntry{%
    \msgRealSource{Mingcong Bai}{2017-08-29 12:16:56}%
    \msgMainContent{\emph{shots fired}}%
    %
}


\channelMsgEntry{%
    \msgRealSource{cth451 ÇÉ”uÇÆƒÉ¹ÇÊŒá´‰p}{2017-08-29 12:19:56}%
    \msgMainContent{æ˜¯è¿™ä¹ˆå›äº‹}%
    %
}


\channelMsgEntry{%
    \msgRealSource{åŒå€å¤šå¤šå†°ğŸ§¶ | ğ¦ğŸğœğŸ}{2017-08-29 12:19:56}%
    \msgMainContent{fatal: ç”¨æˆ·é•¿ç›¸æ¬ ä½³ï¼Œæ— æ³•è·å–å¯¹è±¡ã€‚}%
    %
}


\channelMsgEntry{%
    \msgRealSource{Deleted Account}{2017-08-29 19:18:22}%
    \msgMainContent{å±…ç„¶ä¸æ˜¯ Exceptionï¼ˆå¤§é›¾}%
    %
}


\channelMsgEntry{%
    \msgRealSource{Deleted Account}{2017-08-31 14:31:03}%
    \msgMainContent{/pakreq@pakreqBot opalang A programming language for creating web}%
    %
}


\channelMsgEntry{%
    \msgRealSource{Deleted Account}{2017-08-31 14:31:03}%
    \msgMainContent{å””\ldots{} å‘½å opa æˆ–è€… opalang éƒ½å¯ä»¥è€ƒè™‘\ldots{}}%
    %
}


\channelMsgEntry{%
    \msgRealSource{Mingcong Bai}{2017-08-31 14:31:03}%
    \msgMainContent{Cre\ldots{} Creating web}%
    %
}


\channelMsgEntry{%
    \msgRealSource{Mingcong Bai}{2017-08-31 14:31:03}%
    \msgMainContent{Hot damn}%
    %
}


\channelMsgEntry{%
    \msgRealSource{cth451 ÇÉ”uÇÆƒÉ¹ÇÊŒá´‰p}{2017-08-31 17:02:30}%
    \msgMainContent{ç„¶è€Œæ»´æ°´æ¹–åœ¨ ingress é‡Œå’Œå¸‚åŒºä¸åœ¨ä¸€ä¸ª cell}%
    %
}


\channelMsgEntry{%
    \msgRealSource{cth451 ÇÉ”uÇÆƒÉ¹ÇÊŒá´‰p}{2017-08-31 17:02:30}%
    \msgMainContent{I.e.}%
    %
}


\channelMsgEntry{%
    \msgRealSource{Deleted Account}{2017-08-31 17:02:30}%
    \msgMainContent{è¿™æ‰ç¬¦åˆç›´è§‰}%
    %
}


\channelMsgEntry{%
    \msgRealSource{Deleted Account}{2017-08-31 17:02:30}%
    \msgMainContent{æˆ‘ä»æ¥æ²¡æŠŠè‡ªå·±å½“æˆä½åˆ°äº†ä¸Šæµ·}%
    %
}


\channelMsgEntry{%
    \msgRealSource{Deleted Account}{2017-08-31 17:02:30}%
    \msgMainContent{æ€•æ˜¯ä½è¿›äº†ä¸œæµ·}%
    %
}


\channelMsgEntry{%
    \msgRealSource{cth451 ÇÉ”uÇÆƒÉ¹ÇÊŒá´‰p}{2017-08-31 17:02:30}%
    \msgMainContent{æ¹–ä¸Šå´å¾·ä½³}%
    %
}


\channelMsgEntry{%
    \msgRealSource{Deleted Account}{2017-08-31 17:02:30}%
    \msgMainContent{ä¸€ä¸ªæ¼‚ç§»ï¼Œé£ä¸œæµ·é‡Œäº†ï¼ˆx}%
    %
}


\channelMsgEntry{%
    \msgRealSource{Deleted Account}{2017-08-31 17:02:30}%
    \msgMainContent{ç„¶å APUç‚¹ç«ï¼Œå¯åŠ¨å·¦å¼•æ“ï¼Œå¯åŠ¨å³å¼•æ“ï¼Œæ¨è¿›èŠ‚æµé˜€ï¼Œè¥Ÿç¿¼5ï¼ˆ}%
    %
}


\channelMsgEntry{%
    \msgRealSource{æµ…ç¾½ (ç¾½é†¬) æ«»å·}{2017-08-31 17:02:30}%
    \msgMainContent{ç„¶å¾Œå°±èµ·ç«äº†}%
    %
}


\channelMsgEntry{%
    \msgRealSource{Deleted Account}{2017-08-31 17:02:30}%
    \msgMainContent{V1 rotate V2}%
    %
}


\channelMsgEntry{%
    \msgRealSource{Deleted Account}{2017-08-31 17:02:30}%
    \msgMainContent{ç…®ç†Ÿçš„ç‹®å­å¤´é£äº†}%
    %
}


\channelMsgEntry{%
    \msgRealSource{æµ…ç¾½ (ç¾½é†¬) æ«»å·}{2017-08-31 17:02:30}%
    \msgMainContent{MAYDAY MAYDAY MAYDAY We have a fire on board}%
    %
}


\channelMsgEntry{%
    \msgRealSource{Deleted Account}{2017-08-31 17:02:30}%
    \msgMainContent{hhhhè¿™ä¸ªæ•…äº‹å±•å¼€å¤ªæ¿€çƒˆäº†ï¼ˆ}%
    %
}


\channelMsgEntry{%
    \msgRealSource{Deleted Account}{2017-08-31 17:02:30}%
    \msgMainContent{æ²¡å…³ç³»ï¼Œç‹®å­å¤´å·ä¸Šæœ‰å¯çˆ±çš„ç©ºå“¥ç­ç«ï¼ˆï¼Ÿ}%
    %
}


\channelMsgEntry{%
    \msgRealSource{Jack Works}{2017-08-31 17:02:30}%
    \msgMainContent{ç‹®å­æ™šä¸Šå¥½}%
    %
}


\channelMsgEntry{%
    \msgRealSource{Deleted Account}{2017-08-31 17:02:30}%
    \msgMainContent{å“¦æˆ‘çš„ä¸Šå¸ï¼Œæ™šä¸Šå¥½å•Šæ°å…‹ï¼è°¢å¤©è°¢åœ°ï¼Œæ˜¯å“ªè‚¡é£æŠŠæ‚¨å¹æ¥äº†ï¼}%
    %
}


\channelMsgEntry{%
    \msgRealSource{Deleted Account}{2017-08-31 17:02:30}%
    \msgMainContent{ï¼ˆç³Ÿç³•çš„è…”è°ƒï¼‰}%
    %
}


\channelMsgEntry{%
    \msgRealSource{Jack Works}{2017-08-31 17:02:30}%
    \msgMainContent{å•Šï¼ˆæƒŠæ…Œå¤±æª}%
    %
}


\channelMsgEntry{%
    \msgRealSource{cth451 ÇÉ”uÇÆƒÉ¹ÇÊŒá´‰p}{2017-08-31 17:02:30}%
    \msgMainContent{ï¼Ÿï¼}%
    %
}


\channelMsgEntry{%
    \msgRealSource{cth451 ÇÉ”uÇÆƒÉ¹ÇÊŒá´‰p}{2017-08-31 17:02:30}%
    \msgMainContent{Burrrrrrrrrrrp.}%
    %
}


\channelMsgEntry{%
    \msgRealSource{Usagi Mashiro ä½ ç¾¤èŠ³ä¹ƒå¨}{2017-08-31 17:05:39}%
    \msgMainContent{ä¸€å¹´æ¥ä¸¤æ¬¡ç‹®å­ä¹‹å®¶ã€‚}%
    %
}


\channelMsgEntry{%
    \msgRealSource{Usagi Mashiro ä½ ç¾¤èŠ³ä¹ƒå¨}{2017-08-31 17:05:39}%
    \msgMainContent{æ¯æ¬¡éƒ½æœ‰æ–°ç‹®å­ã€‚}%
    %
}


\channelMsgEntry{%
    \msgRealSource{Noncrystalline Solid Rabbit}{2017-09-02 17:24:28}%
    \msgMainContent{è¿˜æœ‰ä»€ä¹ˆèƒ½å¤Ÿç®€å•ç²—æš´è·å–åˆ°IPçš„ä¸œè¥¿ã€‚ã€‚ã€‚ã€‚}%
    %
}


\channelMsgEntry{%
    \msgRealSource{Revp}{2017-09-02 17:24:28}%
    \msgMainContent{æŠ±ç€ç½‘çº¿é—®å®ƒ}%
    %
}


\channelMsgEntry{%
    \msgRealSource{Jinyu Meng}{2017-09-02 17:24:28}%
    \msgMainContent{æŠ±ç€é—®å¤§æ¦‚æ²¡ç”¨ï¼Œå¤§æ¦‚éœ€è¦æ‹ä¸€ä¸ªèœåˆ€}%
    %
}


\channelMsgEntry{%
    \msgRealSource{liushuyu}{2017-09-04 16:45:33}%
    \msgMainContent{ä¸Šå¸è¦ä½ é‡å¯ä»–å„¿å­ï¼Œä½ å°±è¦ç…§åšï¼ˆ}%
    %
}


\channelMsgEntry{%
    \msgRealSource{åŒå€å¤šå¤šå†°ğŸ§¶ | ğ¦ğŸğœğŸ}{2017-09-05 13:15:06}%
    \msgMainContent{æ˜¨å¤œè¥¿é£å‡‹ btrfs ï¼ˆé€ƒ}%
    %
}


\channelMsgEntry{%
    \msgRealSource{åŒå€å¤šå¤šå†°ğŸ§¶ | ğ¦ğŸğœğŸ}{2017-09-05 13:15:06}%
    \msgMainContent{ç‹¬ä¸Š ciel}%
    %
}


\channelMsgEntry{%
    \msgRealSource{åŒå€å¤šå¤šå†°ğŸ§¶ | ğ¦ğŸğœğŸ}{2017-09-05 13:15:06}%
    \msgMainContent{æœ›å°½ stale è·¯ï¼ˆ}%
    %
}


\channelMsgEntry{%
    \msgRealSource{cth451 ÇÉ”uÇÆƒÉ¹ÇÊŒá´‰p}{2017-09-05 15:23:37}%
    \msgMainContent{æ¢äº† ext4 å¥½äº†}%
    %
}


\channelMsgEntry{%
    \msgRealSource{Deleted Account}{2017-09-05 15:23:37}%
    \msgMainContent{å¥ˆä½•æ¡¥ä¸Šåƒç²‰è‚ }%
    %
}


\channelMsgEntry{%
    \msgRealSource{Deleted Account}{2017-09-05 15:23:37}%
    \msgMainContent{è¿™ä»€ä¹ˆç‹—(lÃ²u)æ´}%
    %
}


\channelMsgEntry{%
    \msgRealSource{cth451 ÇÉ”uÇÆƒÉ¹ÇÊŒá´‰p}{2017-09-18 14:50:44}%
    \msgMainContent{WI scons in}%
    %
}


\channelMsgEntry{%
    \msgRealSource{Mingcong Bai}{2017-09-18 14:50:44}%
    \msgMainContent{Wisconsin Scons In}%
    %
}


\channelMsgEntry{%
    \msgRealSource{cth451 ÇÉ”uÇÆƒÉ¹ÇÊŒá´‰p}{2017-09-18 14:51:41}%
    \msgMainContent{åˆšåˆšçœ‹åˆ°æœ‰ä¸ªå¥³ç”Ÿçš„å¤´å‘æŠ«ä¸‹æ¥é®ä½äº† wi å’Œ ij}%
    %
}


\channelMsgEntry{%
    \msgRealSource{cth451 ÇÉ”uÇÆƒÉ¹ÇÊŒá´‰p}{2017-09-18 14:51:41}%
    \msgMainContent{*in}%
    %
}


\channelMsgEntry{%
    \msgRealSource{cth451 ÇÉ”uÇÆƒÉ¹ÇÊŒá´‰p}{2017-09-18 14:51:41}%
    \msgMainContent{å¯¼è‡´æˆ‘ä»¥ä¸ºè¡£æœä¸Šå†™äº† scons}%
    %
}


\channelMsgEntry{%
    \msgRealSource{Mingcong Bai}{2017-09-19 02:05:53}%
    \msgMainContent{å°†æ¶æè¿›è¡Œåˆ°åº•}%
    \nopagebreak\includegraphics[width=\linewidth]{./.tg-data/Legacy/photos/photo_14@19-09-2017_02-05-53.jpg}%
}


\channelMsgEntry{%
    \msgRealSource{cth451 ÇÉ”uÇÆƒÉ¹ÇÊŒá´‰p}{2017-09-19 02:07:06}%
    \msgMainContent{}%
    \nopagebreak\includegraphics[width=\linewidth]{./.tg-data/Legacy/photos/photo_15@19-09-2017_02-07-06.jpg}%
}


\channelMsgEntry{%
    \msgRealSource{Mingcong Bai}{2017-09-22 03:28:19}%
    \msgMainContent{@ADA\_Refactor æˆ‘å¯èƒ½åŠ¨ä¸äº†\ldots\ldots{} Inkscape åœ¨æˆ‘çš„ T61 ä¸Šå¡åˆ°é£èµ·}%
    %
}


\channelMsgEntry{%
    \msgRealSource{Mingcong Bai}{2017-09-22 03:28:19}%
    \msgMainContent{é‚£å¼ å£çº¸å¿’é«˜ç«¯äº†ï¼ˆ}%
    %
}


\channelMsgEntry{%
    \msgRealSource{Mingcong Bai}{2017-09-22 03:28:19}%
    \msgMainContent{ä»¥åç³»ç»Ÿéœ€è¦åŸºæœ¬é…ç½®ï¼Œæ¨èé…ç½®ï¼Œä»¥åŠæ‰“å¼€å£çº¸é…ç½®}%
    %
}


\channelMsgEntry{%
    \msgRealSource{Deleted Account}{2017-09-22 03:37:39}%
    \msgMainContent{è¿˜éœ€è¦æ¸²æŸ“å£çº¸é…ç½®(é€ƒ}%
    %
}


\channelMsgEntry{%
    \msgRealSource{å’¸é±¼}{2017-09-22 04:43:27}%
    \msgMainContent{åª½è€¶æˆ‘æœ€è¿‘çŸ¥ä¹ç¸½æ˜¯è¢«é‚€è«‹å›ç­”æ°´æœç›¸é—œçš„å•é¡Œ}%
    %
}


\channelMsgEntry{%
    \msgRealSource{å’¸é±¼}{2017-09-22 04:43:27}%
    \msgMainContent{æˆ‘å¯æ˜¯å€‹æœé»‘å•Š Orz}%
    %
}


\channelMsgEntry{%
    \msgRealSource{ĞĞµĞ‘ÑƒÑ‚Ğ»ĞµĞ³ ï¼ˆè¿«çœŸï¼‰}{2017-09-22 04:43:27}%
    \msgMainContent{è¯´æ˜è‹¹æœè¶Šæ¥è¶Šçƒ‚äº†ï¼ˆ}%
    %
}


\channelMsgEntry{%
    \msgRealSource{cth451 ÇÉ”uÇÆƒÉ¹ÇÊŒá´‰p}{2017-09-22 04:43:27}%
    \msgMainContent{å–œæ¬¢ä½ æœçš„äººæœ€åè¦æŠŠèŠèŠ±å’Œå˜´éƒ½çŒ®ç»™ä½ æœ}%
    %
}


\channelMsgEntry{%
    \msgRealSource{cth451 ÇÉ”uÇÆƒÉ¹ÇÊŒá´‰p}{2017-09-22 04:43:27}%
    \msgMainContent{credit å—æ–¹å…¬å›­}%
    %
}


\channelMsgEntry{%
    \msgRealSource{å’¸é±¼}{2017-09-22 04:43:27}%
    \msgMainContent{hhhhh}%
    %
}


\channelMsgEntry{%
    \msgRealSource{ĞĞµĞ‘ÑƒÑ‚Ğ»ĞµĞ³ ï¼ˆè¿«çœŸï¼‰}{2017-09-22 04:43:27}%
    \msgMainContent{åº“å…‹æ˜¯ç»™ï¼ˆæ„å‘³æ·±}%
    %
}


\channelMsgEntry{%
    \msgRealSource{Deleted Account}{2017-09-23 04:29:12}%
    \msgMainContent{æ¸²æŸ“å°±æ˜¯è§£ä¸€é“å·¨å¤§çš„çŸ©é˜µé¢˜}%
    %
}


\channelMsgEntry{%
    \msgRealSource{Deleted Account}{2017-09-23 04:29:12}%
    \msgMainContent{ç¼–è¯‘å°±æ˜¯åšä¸€é“å·¨å¤§çš„çº é”™ç¿»è¯‘é¢˜}%
    %
}


\channelMsgEntry{%
    \msgRealSource{Mingcong Bai}{2017-09-23 16:01:26}%
    \msgMainContent{å„ä½å°æœ‹å‹ä»¬å¤§å®¶å¥½ï¼Œè¿˜è®°å¾—æˆ‘æ˜¯è°å—ï¼Œå¯¹ï¼Œæˆ‘å°±æ˜¯ä½ ä»¬ç†ŸçŸ¥çš„ locale-gen}%
    \nopagebreak\includegraphics[width=\linewidth]{./.tg-data/Legacy/photos/photo_16@23-09-2017_16-01-26.jpg}%
}


\channelMsgEntry{%
    \msgRealSource{Mingcong Bai}{2017-09-24 15:08:39}%
    \msgMainContent{æ·±åº¦ï¼Œå€¼å¾—æ’å…¥}%
    %
}


\channelMsgEntry{%
    \msgRealSource{Mingcong Bai}{2017-09-25 04:04:43}%
    \msgMainContent{G5 åœ¨å’†å“®}%
    \nopagebreak\includegraphics[width=\linewidth]{./.tg-data/Legacy/photos/photo_17@25-09-2017_04-04-43.jpg}%
}


\channelMsgEntry{%
    \msgRealSource{Mingcong Bai}{2017-09-25 04:04:43}%
    \msgMainContent{å—¯ä»Šæ™šç¡è§‰ä½“éªŒæ¯”è¾ƒæ„‰å¿«}%
    %
}


\channelMsgEntry{%
    \msgRealSource{Mingcong Bai}{2017-09-25 04:04:43}%
    \msgMainContent{æƒ³è±¡æˆåˆç§‹çš„æ™šé£ï¼Œä»æ¹–è¾¹å¹æ¥}%
    %
}


\channelMsgEntry{%
    \msgRealSource{Mingcong Bai}{2017-09-25 04:04:43}%
    \msgMainContent{Ah\ldots{} Cheesecake Americano}%
    %
}


\channelMsgEntry{%
    \msgRealSource{Mingcong Bai}{2017-09-25 20:15:52}%
    \msgMainContent{Fuck yeah}%
    \nopagebreak\includegraphics[width=\linewidth]{./.tg-data/Legacy/photos/photo_18@25-09-2017_20-15-52.jpg}%
}


\channelMsgEntry{%
    \msgRealSource{Mingcong Bai}{2017-09-25 20:15:52}%
    \msgMainContent{Double fuck yeah}%
    \nopagebreak\includegraphics[width=\linewidth]{./.tg-data/Legacy/photos/photo_19@25-09-2017_20-15-52.jpg}%
}


\channelMsgEntry{%
    \msgRealSource{cth451 ÇÉ”uÇÆƒÉ¹ÇÊŒá´‰p}{2017-09-25 20:15:58}%
    \msgMainContent{Segmentation fault (core dumped)}%
    %
}


\channelMsgEntry{%
    \msgRealSource{Mingcong Bai}{2017-09-25 20:15:58}%
    \msgMainContent{Triple Fuck nah}%
    %
}


\channelMsgEntry{%
    \msgRealSource{Mingcong Bai}{2017-09-25 20:20:34}%
    \msgMainContent{(Double Fuck Yeah) \^{} 2}%
    \nopagebreak\includegraphics[width=\linewidth]{./.tg-data/Legacy/photos/photo_20@25-09-2017_20-20-34.jpg}%
}


\channelMsgEntry{%
    \msgRealSource{liushuyu}{2017-09-25 22:07:17}%
    \msgMainContent{---``å°æœ‹å‹ä»¬å¤§å®¶å¥½ï¼Œè¿˜è®°å¾—\ldots\ldots{}''
---``ç»™æˆ‘æŠŠå˜´å·´é—­ä¸Šï¼Œå¿«ç‚¹æ»š''ï¼ˆ}%
    \nopagebreak\includegraphics[width=\linewidth]{./.tg-data/Legacy/photos/photo_21@25-09-2017_22-07-17.jpg}%
}


\channelMsgEntry{%
    \msgRealSource{cth451 ÇÉ”uÇÆƒÉ¹ÇÊŒá´‰p}{2017-09-25 22:31:39}%
    \msgMainContent{---``å°æœ‹å‹ä»¬å¤§å®¶å¥½ï¼Œè¿˜è®°å¾—\ldots\ldots{}'' ---``å‘ƒ\ldots æˆ‘æ˜¯è°æ¥ç€''}%
    %
}


\channelMsgEntry{%
    \msgRealSource{cth451 ÇÉ”uÇÆƒÉ¹ÇÊŒá´‰p}{2017-09-25 22:39:35}%
    \msgMainContent{}%
    %
}


\channelMsgEntry{%
    \msgRealSource{ĞĞµĞ‘ÑƒÑ‚Ğ»ĞµĞ³ ï¼ˆè¿«çœŸï¼‰}{2017-09-29 21:01:49}%
    \msgMainContent{æ•°ä½æ¿è½¬åœˆå¤ªæ–¹ä¾¿äº†}%
    %
}


\channelMsgEntry{%
    \msgRealSource{Mingcong Bai}{2017-09-29 21:01:49}%
    \msgMainContent{``æä¸ªå¤§æ–° weh''}%
    %
}


\channelMsgEntry{%
    \msgRealSource{Junde Yhi}{2017-10-02 07:26:29}%
    \msgMainContent{æ‚¨å¯èƒ½æ˜¯ç›—ç‰ˆ AOSC OS çš„å—å®³è€…}%
    \nopagebreak\includegraphics[width=\linewidth]{./.tg-data/Legacy/photos/photo_22@02-10-2017_07-26-29.jpg}%
}


\channelMsgEntry{%
    \msgRealSource{Deleted Account}{2017-10-02 07:26:30}%
    \msgMainContent{æ­¤AOSC OSå‰¯æœ¬ä¸æ˜¯æ­£ç‰ˆ}%
    %
}


\channelMsgEntry{%
    \msgRealSource{å’¸é±¼}{2017-10-02 07:38:47}%
    \msgMainContent{''AOSC OS å…§éƒ¨ç‰ˆæœ¬ 051001ï¼Œæ­¤ AOSC OS å‰¯æœ¬ä¸æ˜¯æ­£ç‰ˆ`` ``AOSC OS
å·²æ¿€æ´»ï¼Œå®‰å…¨ï¼Œç©©å®šï¼Œè²è­½''}%
    %
}


\channelMsgEntry{%
    \msgRealSource{Mingcong Bai}{2017-10-02 20:57:21}%
    \msgMainContent{Orz}%
    %
}


\channelMsgEntry{%
    \msgRealSource{Deleted Account}{2017-10-02 20:57:21}%
    \msgMainContent{ä½ ä¸ªå¤§å¤´é¬¼ï¼ˆ}%
    %
}


\channelMsgEntry{%
    \msgRealSource{ĞĞµĞ‘ÑƒÑ‚Ğ»ĞµĞ³ ï¼ˆè¿«çœŸï¼‰}{2017-10-02 20:57:21}%
    \msgMainContent{Big Endian Ghost}%
    %
}


\channelMsgEntry{%
    \msgRealSource{Junde Yhi}{2017-10-07 04:20:01}%
    \msgMainContent{ä¸è¿‡è¿™æ¬¡æ˜¯ \#Desktop}%
    %
}


\channelMsgEntry{%
    \msgRealSource{åŒå€å¤šå¤šå†°ğŸ§¶ | ğ¦ğŸğœğŸ}{2017-10-07 04:20:01}%
    \msgMainContent{desktop ä½ åªå·´è¥¿é¾Ÿï¼ˆ}%
    %
}


\channelMsgEntry{%
    \msgRealSource{åŒå€å¤šå¤šå†°ğŸ§¶ | ğ¦ğŸğœğŸ}{2017-10-07 04:20:01}%
    \msgMainContent{ä½ å®¶çš„ desktop ä¸Šé‚£ä¹ˆå¤šå°æ ¸å•Š}%
    %
}


\channelMsgEntry{%
    \msgRealSource{Staph. aureus | In your GI Tract}{2017-10-14 00:07:44}%
    \msgMainContent{``I'm not ARMed but I have POWER''}%
    %
}


\channelMsgEntry{%
    \msgRealSource{åŒå€å¤šå¤šå†°ğŸ§¶ | ğ¦ğŸğœğŸ}{2017-10-26 01:30:34}%
    \msgMainContent{I\_say\_hey\_hey\_hey\_start\_da.sh}%
    %
}


\channelMsgEntry{%
    \msgRealSource{Deleted Account}{2017-10-26 16:24:50}%
    \msgMainContent{There's POWER in UnionFS\ldots{}}%
    %
}


\channelMsgEntry{%
    \msgRealSource{dahliavkarma é¤ŠãŸã„/å‘å‘}{2017-10-27 02:35:14}%
    \msgMainContent{è¶Šæ¥è¶Šå¥½å¥‡äº†ã€‚æœå†»åˆ°åº•æ˜¯ä»€ä¹ˆæ ·çš„äºº}%
    %
}


\channelMsgEntry{%
    \msgRealSource{dahliavkarma é¤ŠãŸã„/å‘å‘}{2017-10-27 02:35:14}%
    \msgMainContent{æ˜¯ä¸æ˜¯é‚£ç§å¤´ä¸Šæˆ´ä¸€ä¸ªä¸­å¼ç‚’é”…çš„}%
    %
}


\channelMsgEntry{%
    \msgRealSource{cth451 ÇÉ”uÇÆƒÉ¹ÇÊŒá´‰p}{2017-10-27 02:35:14}%
    \msgMainContent{https://aosc.io/assets/i/gallery/2017-day1-aosc-os-codename.jpg}%
    %
}


\channelMsgEntry{%
    \msgRealSource{dahliavkarma é¤ŠãŸã„/å‘å‘}{2017-10-27 02:35:14}%
    \msgMainContent{å•Š æœå†»ä¸æ˜¯aoscå¨å¨˜å—\ldots\ldots{}}%
    %
}


\channelMsgEntry{%
    \msgRealSource{Single Image Random Dot Stereogram}{2017-10-27 02:41:14}%
    \msgMainContent{çœŸç¾¡æ…• é«˜éŸ³ç”œ ä¸­éŸ³å‡† ä½éŸ³åŠ² çš„å’¸é±¼}%
    %
}


\channelMsgEntry{%
    \msgRealSource{Mingcong Bai}{2017-10-27 02:52:20}%
    \msgMainContent{}%
    \nopagebreak\includegraphics[width=\linewidth]{./.tg-data/Legacy/photos/photo_23@27-10-2017_02-52-20.jpg}%
}


\channelMsgEntry{%
    \msgRealSource{Mingcong Bai}{2017-10-28 04:06:48}%
    \msgMainContent{æ­£åœ¨ä½¿ç”¨ GCC åŠ çƒ­å¤œå®µ}%
    \nopagebreak\includegraphics[width=\linewidth]{./.tg-data/Legacy/photos/photo_24@28-10-2017_04-06-48.jpg}%
}


\channelMsgEntry{%
    \msgRealSource{Deleted Account}{2017-10-30 17:37:15}%
    \msgMainContent{}%
    \nopagebreak\includegraphics[width=\linewidth]{./.tg-data/Legacy/photos/photo_25@30-10-2017_17-37-15.jpg}%
}


\channelMsgEntry{%
    \msgRealSource{Deleted Account}{2017-10-30 17:37:15}%
    \msgMainContent{hot damn southern cucumber}%
    %
}


\channelMsgEntry{%
    \msgRealSource{Mingcong Bai}{2017-10-30 17:37:15}%
    \msgMainContent{æˆ‘æ“ï¼ŒåŠ²çˆ†å—æ–¹é»„ç“œï¼}%
    %
}


\channelMsgEntry{%
    \msgRealSource{ã™ã¿å¤§å¥½ãï¼ˆÂ´ãƒ»Ï‰ãƒ»ï½€ï¼‰[NSFW]}{2017-10-30 17:51:18}%
    \msgMainContent{}%
    \nopagebreak\includegraphics[width=\linewidth]{./.tg-data/Legacy/photos/photo_26@30-10-2017_17-51-18.jpg}%
}


\channelMsgEntry{%
    \msgRealSource{cth451 ÇÉ”uÇÆƒÉ¹ÇÊŒá´‰p}{2017-10-30 17:51:18}%
    \msgMainContent{ä¸ï¼Œéœ€è¦ libc.so.6 not found}%
    %
}


\channelMsgEntry{%
    \msgRealSource{Deleted Account}{2017-10-30 17:51:18}%
    \msgMainContent{æŠŠæˆ‘å“é†’äº†}%
    %
}


\channelMsgEntry{%
    \msgRealSource{Deleted Account}{2017-11-03 05:51:16}%
    \msgMainContent{ç¤¾åŒºè¦æ”¹æ”¹åå­—æ‰è¡Œï¼Œæœ€è¿‘æµè¡Œè±¡å½¢}%
    %
}


\channelMsgEntry{%
    \msgRealSource{Deleted Account}{2017-11-03 05:51:16}%
    \msgMainContent{æˆ‘ä»¬å«åšç”µæœºæ¢å‘å™¨æ€ä¹ˆæ ·ï¼ˆ}%
    %
}


\channelMsgEntry{%
    \msgRealSource{Deleted Account}{2017-11-03 05:51:17}%
    \msgMainContent{ä¼šè½¬}%
    \nopagebreak\includegraphics[width=\linewidth]{./.tg-data/Legacy/photos/photo_27@03-11-2017_05-51-17.jpg}%
}


\channelMsgEntry{%
    \msgRealSource{Deleted Account}{2017-11-03 05:51:17}%
    \msgMainContent{éš”å£ ArchLinux å·²ç»é’¦å®šè“æ‹±é—¨äº†ï¼ˆ}%
    %
}


\channelMsgEntry{%
    \msgRealSource{Deleted Account}{2017-11-03 05:51:17}%
    \msgMainContent{}%
    \nopagebreak\includegraphics[width=\linewidth]{./.tg-data/Legacy/photos/photo_28@03-11-2017_05-51-17.jpg}%
}


\channelMsgEntry{%
    \msgRealSource{Deleted Account}{2017-11-03 05:51:17}%
    \msgMainContent{ç›´æµç”µæœºæ¨¡å‹}%
    %
}


\channelMsgEntry{%
    \msgRealSource{åŒå€å¤šå¤šå†°ğŸ§¶ | ğ¦ğŸğœğŸ}{2017-11-08 06:48:26}%
    \msgMainContent{ä¸»è¦ opi r1 æ˜¯å¤åˆè§†é¢‘è¾“å‡º}%
    %
}


\channelMsgEntry{%
    \msgRealSource{ĞĞµĞ‘ÑƒÑ‚Ğ»ĞµĞ³ ï¼ˆè¿«çœŸï¼‰}{2017-11-08 06:48:26}%
    \msgMainContent{çœŸ AV ç”»è´¨}%
    %
}


\channelMsgEntry{%
    \msgRealSource{ĞĞµĞ‘ÑƒÑ‚Ğ»ĞµĞ³ ï¼ˆè¿«çœŸï¼‰}{2017-11-08 06:48:26}%
    \msgMainContent{ï¼ˆåŒå…³}%
    %
}


\channelMsgEntry{%
    \msgRealSource{åŒå€å¤šå¤šå†°ğŸ§¶ | ğ¦ğŸğœğŸ}{2017-11-10 03:00:13}%
    \msgMainContent{ç»ˆäºç†è§£äº† ``ä¸€èŠ±ä¸€ä¸–ç•Œï¼Œä¸€å¶ä¸€è©æ'' ï¼ˆ}%
    %
}


\channelMsgEntry{%
    \msgRealSource{åŒå€å¤šå¤šå†°ğŸ§¶ | ğ¦ğŸğœğŸ}{2017-11-10 03:00:13}%
    \msgMainContent{è¦è®©èŠ±å¼€çš„è¯å¾—è®©å®ƒå¸¦ä¸Šä¸€ä¸ªä¸–ç•Œ}%
    %
}


\channelMsgEntry{%
    \msgRealSource{åŒå€å¤šå¤šå†°ğŸ§¶ | ğ¦ğŸğœğŸ}{2017-11-10 03:00:13}%
    \msgMainContent{è¦é•¿å‡ºä¸€ç‰‡æ ‘å¶çš„è¯å¾—æœ‰ä¸€æ£µè©ææ ‘}%
    %
}


\channelMsgEntry{%
    \msgRealSource{Deleted Account}{2017-11-10 03:00:13}%
    \msgMainContent{ä¸€èŠ±ä¸€ä¸–ç•Œï¼Œä¸€åŒ…ä¸€ç³»ç»Ÿ}%
    %
}


\channelMsgEntry{%
    \msgRealSource{Deleted Account}{2017-11-11 04:32:28}%
    \msgMainContent{ç½‘æ˜“æˆ‘è¯´çš„å°±æ˜¯ä½ }%
    \nopagebreak\includegraphics[width=\linewidth]{./.tg-data/Legacy/photos/photo_29@11-11-2017_04-32-28.jpg}%
}


\channelMsgEntry{%
    \msgRealSource{Deleted Account}{2017-11-11 04:34:54}%
    \msgMainContent{è®© Snap å’Œ Flatpak è‡ªæ„§ä¸å¦‚}%
    %
}


\channelMsgEntry{%
    \msgRealSource{Deleted Account}{2017-11-11 04:35:28}%
    \msgMainContent{https://github.com/qzwlecr/netease-cloud-music-docker-version}%
    %
}


\channelMsgEntry{%
    \msgRealSource{CT1000MX500SSD1 1000.2 GB}{2017-11-11 10:29:50}%
    \msgMainContent{softpipe æ˜¯ä»€ä¹ˆé¬¼}%
    \nopagebreak\includegraphics[width=\linewidth]{./.tg-data/Legacy/photos/photo_30@11-11-2017_10-29-50.jpg}%
}


\channelMsgEntry{%
    \msgRealSource{CT1000MX500SSD1 1000.2 GB}{2017-11-11 10:29:50}%
    \msgMainContent{å’Œ llvmpipe æœ‰ä»€ä¹ˆåŒºåˆ«ä¹ˆ}%
    %
}


\channelMsgEntry{%
    \msgRealSource{åŒå€å¤šå¤šå†°ğŸ§¶ | ğ¦ğŸğœğŸ}{2017-11-11 10:29:51}%
    \msgMainContent{llvmpipe æœ‰ jit}%
    %
}


\channelMsgEntry{%
    \msgRealSource{åŒå€å¤šå¤šå†°ğŸ§¶ | ğ¦ğŸğœğŸ}{2017-11-11 10:29:51}%
    \msgMainContent{è¿™å¤šå±é™©å•Šï¼ˆç¬‘}%
    %
}


\channelMsgEntry{%
    \msgRealSource{åŒå€å¤šå¤šå†°ğŸ§¶ | ğ¦ğŸğœğŸ}{2017-11-11 10:32:13}%
    \msgMainContent{æ¯•ç«Ÿåœ¨æœ‰ anti-JIT çš„æƒ…å†µä¸‹ llvmpipe éœ€è¦ç»™æ‰€æœ‰ç”¨ GL çš„ç¨‹åºæ”¾å¼€ JIT}%
    %
}


\channelMsgEntry{%
    \msgRealSource{åŒå€å¤šå¤šå†°ğŸ§¶ | ğ¦ğŸğœğŸ}{2017-11-11 10:32:14}%
    \msgMainContent{ä¸å¯é¥¶æ•çš„ï¼ˆ}%
    %
}


\channelMsgEntry{%
    \msgRealSource{imi415}{2017-11-12 05:51:40}%
    \msgMainContent{å§æ§½å¤ªæ‰¯æ·¡äº†ï¼Œtgçš„æ¼å†…å­˜é—®é¢˜æ˜¯éŸ³é¢‘é—®é¢˜ï¼Ÿï¼Ÿï¼Ÿ}%
    %
}


\channelMsgEntry{%
    \msgRealSource{Dr.Thril}{2017-11-12 05:51:40}%
    \msgMainContent{Realtekå£°å¡é©±åŠ¨é—®é¢˜å§}%
    %
}


\channelMsgEntry{%
    \msgRealSource{åŒå€å¤šå¤šå†°ğŸ§¶ | ğ¦ğŸğœğŸ}{2017-11-12 05:51:41}%
    \msgMainContent{ä¸æ˜¯å§}%
    %
}


\channelMsgEntry{%
    \msgRealSource{åŒå€å¤šå¤šå†°ğŸ§¶ | ğ¦ğŸğœğŸ}{2017-11-12 05:51:41}%
    \msgMainContent{ä»€ä¹ˆæ“ä½œç³»ç»Ÿéƒ½æ¼}%
    %
}


\channelMsgEntry{%
    \msgRealSource{Dr.Thril}{2017-11-12 05:51:41}%
    \msgMainContent{ç”¨DDUå®Œå…¨å¸è½½å¹²å‡€ï¼Œç„¶åå» www.realtek.com.tw ä¸‹è½½æœ€æ–°çš„WHQL
Certifiedé©±åŠ¨ç¨‹åº}%
    %
}


\channelMsgEntry{%
    \msgRealSource{Dr.Thril}{2017-11-12 05:51:41}%
    \msgMainContent{é—®é¢˜å°±è§£å†³äº†}%
    %
}


\channelMsgEntry{%
    \msgRealSource{å’¸é±¼}{2017-11-12 05:51:41}%
    \msgMainContent{Linux å“ªå…’ä¾†çš„ WHQLï¼ˆ}%
    %
}


\channelMsgEntry{%
    \msgRealSource{Dr.Thril}{2017-11-12 05:51:41}%
    \msgMainContent{å¸è½½alsaå»å®‰è£…ç§æœ‰çš„Realtek High Audio Driver}%
    %
}


\channelMsgEntry{%
    \msgRealSource{liushuyu}{2017-11-13 21:57:54}%
    \msgMainContent{å“‡ï¼Œè¿™ Electron æ–°ç‰ˆæœ¬æ›´å¯æ€•äº†ï¼Œè¿˜ bundle ä¸€ä¸ª LLVM + Clang}%
    %
}


\channelMsgEntry{%
    \msgRealSource{liushuyu}{2017-11-13 21:57:54}%
    \msgMainContent{ï¼ˆè¿ç¼–è¯‘å™¨éƒ½è¦ç”¨è‡ªå·±çš„ä¹ˆ}%
    %
}


\channelMsgEntry{%
    \msgRealSource{liushuyu}{2017-11-13 21:57:55}%
    \msgMainContent{ï¼ˆä½ ä»¬è€ƒè™‘ä»¥åå¸¦ä¸ªå†…æ ¸æºç å¥½ä¸ï¼Œè¿å†…æ ¸éƒ½å¯ä»¥çœäº† Node.OS}%
    %
}


\channelMsgEntry{%
    \msgRealSource{liushuyu}{2017-11-13 22:04:19}%
    \msgMainContent{woc æ˜¯åœ¨ä¸‹è¾“äº† https://node-os.com}%
    %
}


\channelMsgEntry{%
    \msgRealSource{liushuyu}{2017-11-13 22:04:20}%
    \msgMainContent{è¿™ç©æ„åŒ…ç®¡ç†å™¨æ˜¯ç›´æ¥ npm}%
    %
}


\channelMsgEntry{%
    \msgRealSource{cth451 ÇÉ”uÇÆƒÉ¹ÇÊŒá´‰p}{2017-11-14 15:49:17}%
    \msgMainContent{``no bash here''}%
    %
}


\channelMsgEntry{%
    \msgRealSource{cth451 ÇÉ”uÇÆƒÉ¹ÇÊŒá´‰p}{2017-11-14 15:49:18}%
    \msgMainContent{\begin{itemize}
\tightlist
\item
  Triggered *
\end{itemize}}%
    %
}


\channelMsgEntry{%
    \msgRealSource{liushuyu}{2017-11-14 15:49:19}%
    \msgMainContent{ä½ ä»¬å¤©å¤©è¯´ åº•è£¤ ç®¡å¾—å¤šï¼Œä½ çœ‹çœ‹ NodeOS é‡Œé¢çš„ v8 ï¼ˆ}%
    %
}


\channelMsgEntry{%
    \msgRealSource{å’¸é±¼}{2017-11-21 04:37:51}%
    \msgMainContent{ä¸»ç¾¤æˆ‘ä¹Ÿç…§æ¨£æ°´ï¼ï¼ˆç„¶å¾Œè¢«æœå‡æ‰“æ­»}%
    %
}


\channelMsgEntry{%
    \msgRealSource{Mingcong Bai}{2017-11-21 04:37:51}%
    \msgMainContent{Hibathi!}%
    %
}


\channelMsgEntry{%
    \msgRealSource{dahliavkarma é¤ŠãŸã„/å‘å‘}{2017-11-21 04:37:51}%
    \msgMainContent{æœå†» ä½¿ç”¨äº† é”…ï¼}%
    %
}


\channelMsgEntry{%
    \msgRealSource{dahliavkarma é¤ŠãŸã„/å‘å‘}{2017-11-21 04:37:51}%
    \msgMainContent{å’¸é±¼ä¸‹é”…å•¦ï¼}%
    %
}


\channelMsgEntry{%
    \msgRealSource{Mingcong Bai}{2017-11-21 04:37:51}%
    \msgMainContent{\emph{clonk}}%
    %
}


\channelMsgEntry{%
    \msgRealSource{dahliavkarma é¤ŠãŸã„/å‘å‘}{2017-11-21 04:37:51}%
    \msgMainContent{å’¸é±¼ æŒ£æ‰ç€ç¿»èº«}%
    %
}


\channelMsgEntry{%
    \msgRealSource{Mingcong Bai}{2017-11-21 04:37:51}%
    \msgMainContent{æœå†» ä½¿ç”¨äº† é”…ç›–ï¼}%
    %
}


\channelMsgEntry{%
    \msgRealSource{dahliavkarma é¤ŠãŸã„/å‘å‘}{2017-11-21 04:37:51}%
    \msgMainContent{æ•ˆæœæ‹”ç¾¤ï¼}%
    %
}


\channelMsgEntry{%
    \msgRealSource{Mingcong Bai}{2017-11-21 04:37:51}%
    \msgMainContent{``é…¸èœé—·å’¸é±¼''}%
    %
}


\channelMsgEntry{%
    \msgRealSource{dahliavkarma é¤ŠãŸã„/å‘å‘}{2017-11-21 04:37:51}%
    \msgMainContent{æ•ˆæœæ‹”ç¾¤ï¼}%
    %
}


\channelMsgEntry{%
    \msgRealSource{Mingcong Bai}{2017-11-21 04:57:34}%
    \msgMainContent{Chai Lives Matter!}%
    %
}


\channelMsgEntry{%
    \msgRealSource{dahliavkarma é¤ŠãŸã„/å‘å‘}{2017-11-21 04:57:34}%
    \msgMainContent{æ¯ä¸€åŒ…Chai teaçš„ç”Ÿäº§ éƒ½ä¼´éšç€ä¸€é›†è£…ç®±cthçš„æ­»äº¡}%
    %
}


\channelMsgEntry{%
    \msgRealSource{dahliavkarma é¤ŠãŸã„/å‘å‘}{2017-11-21 04:57:34}%
    \msgMainContent{ä¿æŠ¤cth æ‹’ç»chai tea}%
    %
}


\channelMsgEntry{%
    \msgRealSource{dahliavkarma é¤ŠãŸã„/å‘å‘}{2017-11-21 04:57:34}%
    \msgMainContent{æ²¡æœ‰ä¹°å– å°±æ²¡æœ‰æ€å®³}%
    %
}


\channelMsgEntry{%
    \msgRealSource{åŒå€å¤šå¤šå†°ğŸ§¶ | ğ¦ğŸğœğŸ}{2017-11-22 00:56:24}%
    \msgMainContent{åˆšæ‰æƒ³åˆ°äº†ä¸€å¥å¥‡æ€ªçš„è¯ï¼ˆ}%
    %
}


\channelMsgEntry{%
    \msgRealSource{åŒå€å¤šå¤šå†°ğŸ§¶ | ğ¦ğŸğœğŸ}{2017-11-22 00:56:25}%
    \msgMainContent{Wine æ˜¯ PE å¸å›½ä¸»ä¹‰åœ¨ POSIX ä¸–ç•Œçš„ä»£ç†äºº}%
    %
}


\channelMsgEntry{%
    \msgRealSource{Mingye Wang}{2017-11-22 00:56:25}%
    \msgMainContent{ğŸ™ˆ COFF åŒæ–‡åŒç§ï¼Œx86 å…±è£åœˆ}%
    %
}


\channelMsgEntry{%
    \msgRealSource{CT1000MX500SSD1 1000.2 GB}{2017-11-25 08:01:00}%
    \msgMainContent{ä»€ä¹ˆæ—¶å€™ nano ä¹Ÿé…åˆ Vim è¿˜æœ‰ Emacs ç›¸æå¹¶è®ºäº†ï¼ˆ}%
    \nopagebreak\includegraphics[width=\linewidth]{./.tg-data/Legacy/photos/photo_31@25-11-2017_08-01-00.jpg}%
}


\channelMsgEntry{%
    \msgRealSource{å’¸é±¼}{2017-11-25 08:01:01}%
    \msgMainContent{å°±æ˜¯ï¼ŒVim å’Œ Emacs æ ¹æœ¬ä¸é…è·Ÿ nano æ¯”ï¼ˆè·‘}%
    %
}


\channelMsgEntry{%
    \msgRealSource{å’¸é±¼}{2017-11-25 08:01:01}%
    \msgMainContent{æˆ‘å¤§ nano é²æ—©ä¸€çµ±å®‡å®™ï¼ˆè·‘}%
    %
}


\channelMsgEntry{%
    \msgRealSource{å’¸é±¼}{2017-11-25 08:01:02}%
    \msgMainContent{åˆ¥çš„ç·¨è¼¯å™¨éƒ½æ˜¯æ¸£æ¸£ï¼ˆè·‘}%
    %
}


\channelMsgEntry{%
    \msgRealSource{CT1000MX500SSD1 1000.2 GB}{2017-11-25 08:01:03}%
    \msgMainContent{ä»€ä¹ˆæ—¶å€™åº•è£¤æ”¶ç¼– nano å•Š}%
    %
}


\channelMsgEntry{%
    \msgRealSource{å’¸é±¼}{2017-11-25 08:01:03}%
    \msgMainContent{ï¼ˆeditctl}%
    %
}


\channelMsgEntry{%
    \msgRealSource{gumblex}{2017-11-25 08:11:05}%
    \msgMainContent{editd}%
    %
}


\channelMsgEntry{%
    \msgRealSource{gumblex}{2017-11-25 08:11:05}%
    \msgMainContent{editctl ä¸€ä¸‡ä¸ª rpc}%
    %
}


\channelMsgEntry{%
    \msgRealSource{Single Image Random Dot Stereogram}{2017-11-25 08:11:06}%
    \msgMainContent{The editd configuration file for seniorthesis.md appears to be changed.
Use \texttt{editctl\ daemon-reload} to edit from the changed version.}%
    %
}


\channelMsgEntry{%
    \msgRealSource{gumblex}{2017-11-25 08:11:07}%
    \msgMainContent{editctl run translate.awk}%
    %
}


\channelMsgEntry{%
    \msgRealSource{liushuyu}{2017-11-26 01:45:18}%
    \msgMainContent{CVE in lots for sale at 30\% off*}%
    %
}


\channelMsgEntry{%
    \msgRealSource{Programmer Jokes}{2017-11-30 20:50:48}%
    \msgMainContent{}%
    \nopagebreak\includegraphics[width=\linewidth]{./.tg-data/Legacy/photos/photo_32@30-11-2017_20-50-48.jpg}%
}


\channelMsgEntry{%
    \msgRealSource{Deleted Agasa}{2017-11-30 20:50:48}%
    \msgMainContent{è¿™ä¸ work å§ã€‚ã€‚ã€‚}%
    %
}


\channelMsgEntry{%
    \msgRealSource{Deleted Agasa}{2017-11-30 20:50:48}%
    \msgMainContent{å¾ˆå¥½å¥‡é‚£ä¸ª usb æ˜¯æ’çš„ä»€ä¹ˆæ¥å£}%
    %
}


\channelMsgEntry{%
    \msgRealSource{å’¸é±¼}{2017-11-30 20:50:48}%
    \msgMainContent{æ„Ÿè¦ºåƒ PS/2}%
    %
}


\channelMsgEntry{%
    \msgRealSource{Mingcong Bai}{2017-11-30 20:50:48}%
    \msgMainContent{å°±ä¸€ technical dick (}%
    %
}


\channelMsgEntry{%
    \msgRealSource{Mingcong Bai}{2017-11-30 22:42:21}%
    \msgMainContent{å„ä½æ—©ä¸Šå¥½ï¼Œä»Šå¤©æ˜¯ç¤¾åŒºå…­å‘¨å¹´çºªå¿µæ—¥ï¼ˆ2011-2017ï¼‰ï¼Œä»Šæ—¥ç¤¾åŒºæä¾›å…è´¹æ—©èŒ¶ï¼Œèœè°±å¦‚ä¸‹ï¼š
- ä¸‰ä¸è’¸æŸ³æ ‘é±¼ - çš®è›‹å’¸é±¼ç²¥ - éº»å©†æœå†» - æ‹›ç‰Œç‹®å­å¤´}%
    %
}


\channelMsgEntry{%
    \msgRealSource{liushuyu}{2017-11-30 22:43:03}%
    \msgMainContent{ç”œç‚¹ è›‹ç­’å†°æ·‡æ·‹ï¼ˆ}%
    %
}


\channelMsgEntry{%
    \msgRealSource{Deleted Account}{2017-11-30 22:43:03}%
    \msgMainContent{è¿˜æœ‰a2é’™å¥¶ï¼ˆx}%
    %
}


\channelMsgEntry{%
    \msgRealSource{æŸ10}{2017-12-02 12:52:24}%
    \msgMainContent{è·¯ç”±å™¨:ä½ å±…ç„¶æƒ³ææˆ‘}%
    %
}


\channelMsgEntry{%
    \msgRealSource{Taá´‹aÉ´asÊœÉª HoÊ€o}{2017-12-02 12:53:27}%
    \msgMainContent{è·¯ç”±å™¨ï¼šå•Šï¼Œä¸è¦è¿›æ¥ï¼Œå•Šï¼Œå•Š\ldots\ldots{}}%
    %
}


\channelMsgEntry{%
    \msgRealSource{Mingcong Bai}{2017-12-16 07:31:13}%
    \msgMainContent{}%
    \nopagebreak\includegraphics[width=\linewidth]{./.tg-data/Legacy/photos/photo_33@16-12-2017_07-31-13.jpg}%
}


\channelMsgEntry{%
    \msgRealSource{åŒå€å¤šå¤šå†°ğŸ§¶ | ğ¦ğŸğœğŸ}{2017-12-16 07:31:13}%
    \msgMainContent{}%
    %
}


\channelMsgEntry{%
    \msgRealSource{å’¸é±¼}{2017-12-16 07:31:13}%
    \msgMainContent{Hark how the CVEs, Sweet silver CVEs, All seem to say, Throw cares away}%
    %
}


\channelMsgEntry{%
    \msgRealSource{å’¸é±¼}{2017-12-16 07:31:13}%
    \msgMainContent{CVE is here, Bringing good cheer, To young and old, Meek and the bold.}%
    %
}


\channelMsgEntry{%
    \msgRealSource{Deleted Account}{2017-12-16 07:47:01}%
    \msgMainContent{CVE-2017-12333 Arbitrary Video Access through Santa Claus elf\_on\_shelf
Module}%
    %
}


\channelMsgEntry{%
    \msgRealSource{Deleted Account}{2017-12-20 05:04:54}%
    \msgMainContent{ä»æŸç§æ„ä¹‰ä¸Šæ¥è¯´macOSæ˜¯çœŸæ­£çš„æ»šåŠ¨å‘è¡Œç‰ˆ\ldots\ldots{}}%
    %
}


\channelMsgEntry{%
    \msgRealSource{Deleted Account}{2017-12-20 05:04:54}%
    \msgMainContent{è¿ç¡¬ä»¶ä¹Ÿè¦è·Ÿç€æ»šåŠ¨çš„æ»šåŠ¨å‘è¡Œç‰ˆ}%
    %
}


\channelMsgEntry{%
    \msgRealSource{Deleted Account}{2017-12-20 05:11:37}%
    \msgMainContent{é‚£ä¹ˆé—®é¢˜æ¥äº†ï¼Œä¸€èˆ¬çš„å½“ä»£ç¡¬ä»¶èƒ½æ»šå‡ ä¸ª release cycle å‘¢}%
    %
}


\channelMsgEntry{%
    \msgRealSource{Mingcong Bai}{2017-12-21 03:06:47}%
    \msgMainContent{Now powered by Linus' Finger(R) Graphics Technologies}%
    \nopagebreak\includegraphics[width=\linewidth]{./.tg-data/Legacy/photos/photo_34@21-12-2017_03-06-47.jpg}%
}


\channelMsgEntry{%
    \msgRealSource{Mingcong Bai}{2017-12-21 06:39:36}%
    \msgMainContent{FCC é‚£ä¸ªå¤´å¤´å“ªå¤©è‡ªæ…°çš„æ—¶å€™æƒ³èµ·ä»¶äº‹æƒ…å°±åš}%
    %
}


\channelMsgEntry{%
    \msgRealSource{Mingcong Bai}{2017-12-21 06:39:36}%
    \msgMainContent{å±è‚¡/ç”Ÿæ®–å™¨æŒ‡æŒ¥è„‘è¢‹}%
    %
}


\channelMsgEntry{%
    \msgRealSource{ĞĞµĞ‘ÑƒÑ‚Ğ»ĞµĞ³ ï¼ˆè¿«çœŸï¼‰}{2017-12-21 06:39:36}%
    \msgMainContent{é‡å…½å…ˆè¾ˆFCCè¯´}%
    %
}


\channelMsgEntry{%
    \msgRealSource{ĞĞµĞ‘ÑƒÑ‚Ğ»ĞµĞ³ ï¼ˆè¿«çœŸï¼‰}{2017-12-21 06:39:36}%
    \msgMainContent{ä»–ä»¬éƒ½æ˜¯ç”Ÿæ®–å™¨æŒ‡æŒ¥è„‘è¢‹}%
    %
}


\channelMsgEntry{%
    \msgRealSource{Noncrystalline Solid Rabbit}{2017-12-27 06:09:56}%
    \msgMainContent{}%
    %
}


\channelMsgEntry{%
    \msgRealSource{Mingcong Bai}{2017-12-28 02:41:35}%
    \msgMainContent{}%
    \nopagebreak\includegraphics[width=\linewidth]{./.tg-data/Legacy/photos/photo_35@28-12-2017_02-41-35.jpg}%
}


\channelMsgEntry{%
    \msgRealSource{Mingcong Bai}{2017-12-28 02:41:35}%
    \msgMainContent{Ğ›ĞµĞ² Ğ¢Ğ¾ÑÑ‚ Ñ Ğ Ğ¾ÑÑ‚Ğ±Ğ¸Ñ„ (}%
    %
}


\channelMsgEntry{%
    \msgRealSource{Deleted Account}{2017-12-28 02:41:35}%
    \msgMainContent{}%
    \nopagebreak\includegraphics[width=\linewidth]{./.tg-data/Legacy/photos/photo_36@28-12-2017_02-41-35.jpg}%
}


\channelMsgEntry{%
    \msgRealSource{Mingcong Bai}{2017-12-28 02:41:35}%
    \msgMainContent{æœ¬æ¥æ˜¯æƒ³ç©åˆ—å¤«æ‰˜å°”æ–¯æ³°çš„è¯»éŸ³ï¼ˆ}%
    %
}


\channelMsgEntry{%
    \msgRealSource{Mingcong Bai}{2017-12-28 02:41:35}%
    \msgMainContent{Lev Tost}%
    %
}


\channelMsgEntry{%
    \msgRealSource{gumblex}{2018-01-03 06:57:17}%
    \msgMainContent{Anthon Overuse SQL Community)}%
    %
}


\channelMsgEntry{%
    \msgRealSource{Junde Yhi}{2018-01-03 06:57:17}%
    \msgMainContent{Accepted.}%
    %
}


\channelMsgEntry{%
    \msgRealSource{Mingcong Bai}{2018-01-04 03:40:30}%
    \msgMainContent{å“¦è¿˜æœ‰ 2.5 å¯¸ç¡¬ç›˜ï¼ˆé SSDï¼‰æ”¾åœ¨å°å¼æœºé‡Œé¢ç”¨ç­‰åŒäºç©¿ç€å†…è£¤å½“é‹ç”¨ï¼ˆx}%
    %
}


\channelMsgEntry{%
    \msgRealSource{Mingcong Bai}{2018-01-04 03:40:30}%
    \msgMainContent{ä»¥åŠå¦‚æœä½ çš„ç”µè„‘è¦å« PC çš„è¯å¿…é¡»å¾—æœ‰ FDD+ODDï¼ˆx}%
    %
}


\channelMsgEntry{%
    \msgRealSource{cth451 ÇÉ”uÇÆƒÉ¹ÇÊŒá´‰p}{2018-01-04 03:40:30}%
    \msgMainContent{å…‰é©±æœ‰}%
    %
}


\channelMsgEntry{%
    \msgRealSource{cth451 ÇÉ”uÇÆƒÉ¹ÇÊŒá´‰p}{2018-01-04 03:40:30}%
    \msgMainContent{è½¯é©±å°±æ²¡äº†}%
    %
}


\channelMsgEntry{%
    \msgRealSource{Mingcong Bai}{2018-01-04 03:40:30}%
    \msgMainContent{ä½è´±çš„ Intel PC99 å…¼å®¹æœºï¼ˆx}%
    %
}


\channelMsgEntry{%
    \msgRealSource{ĞĞµĞ‘ÑƒÑ‚Ğ»ĞµĞ³ ï¼ˆè¿«çœŸï¼‰}{2018-01-04 06:05:12}%
    \msgMainContent{C64è‡ªå§‹è‡³ç»ˆéƒ½æ˜¯é’¦å®šåœ°å€ä¸€æŠŠæ¢­}%
    %
}


\channelMsgEntry{%
    \msgRealSource{ĞĞµĞ‘ÑƒÑ‚Ğ»ĞµĞ³ ï¼ˆè¿«çœŸï¼‰}{2018-01-04 06:05:12}%
    \msgMainContent{ç°åœ¨å¤§å®¶éƒ½åœ¨æ–°è®¾å¤‡ä¸Šç ´è§£äº†è¿™ä¸ªæŠ€èƒ½ï¼ˆ}%
    %
}


\channelMsgEntry{%
    \msgRealSource{Mingcong Bai}{2018-01-06 03:48:07}%
    \msgMainContent{``è¿˜è®°å¾—æˆ‘å—''}%
    \nopagebreak\includegraphics[width=\linewidth]{./.tg-data/Legacy/photos/photo_37@06-01-2018_03-48-07.jpg}%
}


\channelMsgEntry{%
    \msgRealSource{Deleted Account}{2018-01-07 04:45:24}%
    \msgMainContent{è¯´ä¸ªæœ‰è¶£çš„æ•…äº‹ç»™ä»¥ä»¥å¬}%
    %
}


\channelMsgEntry{%
    \msgRealSource{Deleted Account}{2018-01-07 04:45:24}%
    \msgMainContent{ä½†æ˜¯å†ä»”ç»†ä¸€æƒ³}%
    %
}


\channelMsgEntry{%
    \msgRealSource{Deleted Account}{2018-01-07 04:45:24}%
    \msgMainContent{å‡ºç°äº†å‰æ‰€æœªæœ‰çš„æœºæ™º}%
    %
}


\channelMsgEntry{%
    \msgRealSource{Deleted Account}{2018-01-08 01:08:28}%
    \msgMainContent{æ‰“åŒ… Beat the bag}%
    %
}


\channelMsgEntry{%
    \msgRealSource{Deleted Account}{2018-01-08 01:23:35}%
    \msgMainContent{\begin{itemize}
\tightlist
\item
  beat the bun
\end{itemize}}%
    %
}


\channelMsgEntry{%
    \msgRealSource{Mingcong Bai}{2018-01-29 00:04:32}%
    \msgMainContent{Cherry MX Asshole (R)}%
    \nopagebreak\includegraphics[width=\linewidth]{./.tg-data/Legacy/photos/photo_38@29-01-2018_00-04-32.jpg}%
}


\channelMsgEntry{%
    \msgRealSource{Mingcong Bai}{2018-01-30 02:48:33}%
    \msgMainContent{``æœç„¶åœ¨é™„è¿‘ä¸€ä¸ªå°ç®±å­é‡Œæ‰¾åˆ°äº†æ²¹çº¸åŒ…ç€çš„é›¶ä»¶''}%
    \nopagebreak\includegraphics[width=\linewidth]{./.tg-data/Legacy/photos/photo_39@30-01-2018_02-48-33.jpg}%
}


\channelMsgEntry{%
    \msgRealSource{Mingcong Bai}{2018-02-01 06:23:47}%
    \msgMainContent{ä¸æ•¢åƒ}%
    %
}


\channelMsgEntry{%
    \msgRealSource{Deleted Account}{2018-02-01 06:23:47}%
    \msgMainContent{Life is an adventure}%
    %
}


\channelMsgEntry{%
    \msgRealSource{Mingcong Bai}{2018-02-01 06:23:47}%
    \msgMainContent{While diarrhea is certain}%
    %
}


\channelMsgEntry{%
    \msgRealSource{Mingcong Bai}{2018-02-01 06:23:47}%
    \msgMainContent{And parasites don't lie}%
    %
}


\channelMsgEntry{%
    \msgRealSource{Mingcong Bai}{2018-02-02 03:49:44}%
    \msgMainContent{çˆ½çˆ†ï¼Œè·‘ç€ j8 å†…æ ¸ç¼–è¯‘ä¸€è¾¹ä¸Šç½‘è¿˜ä¸å¡}%
    %
}


\channelMsgEntry{%
    \msgRealSource{Mingcong Bai}{2018-02-02 04:11:48}%
    \msgMainContent{å¦‚å›¾æ‰€ç¤º}%
    \nopagebreak\includegraphics[width=\linewidth]{./.tg-data/Legacy/photos/photo_40@02-02-2018_04-11-48.jpg}%
}


\channelMsgEntry{%
    \msgRealSource{Ariel AxionL è‰¾é›¨å¯’ | ğŸ˜ª ç¡è§‰}{2018-02-02 04:11:48}%
    \msgMainContent{Firefox: æˆ‘æ²¡æƒ³åˆ°çœŸçš„æœ‰äººæµ‹è¯•è¿™ä¸ªå¹¿å‘Šå®£ä¼ æ˜¯å¦ä¸ºçœŸ}%
    \nopagebreak\includegraphics[width=\linewidth]{./.tg-data/Legacy/photos/photo_41@02-02-2018_04-11-48.jpg}%
}


\channelMsgEntry{%
    \msgRealSource{Mingcong Bai}{2018-02-02 16:11:18}%
    \msgMainContent{å¦™ï¼Œå¦™}%
    %
}


\channelMsgEntry{%
    \msgRealSource{Mingcong Bai}{2018-02-03 01:29:07}%
    \msgMainContent{}%
    \nopagebreak\includegraphics[width=\linewidth]{./.tg-data/Legacy/photos/photo_42@03-02-2018_01-29-07.jpg}%
}


\channelMsgEntry{%
    \msgRealSource{Mingcong Bai}{2018-02-03 01:29:07}%
    \msgMainContent{tim-cook.tar.gz}%
    %
}


\channelMsgEntry{%
    \msgRealSource{Mingcong Bai}{2018-02-05 17:12:06}%
    \msgMainContent{https://repo.aosc.io/os-amd64/testing/os-amd64/os3-dpkg/l/linux-kernel-4.15.1\_4.15.1-0\_amd64.deb
ç”ŸçŒ›å¤§é—¸èŸ¹}%
    %
}


\channelMsgEntry{%
    \msgRealSource{Mingcong Bai}{2018-02-05 19:43:34}%
    \msgMainContent{They only let me in too late}%
    %
}


\channelMsgEntry{%
    \msgRealSource{Mingcong Bai}{2018-02-05 19:43:34}%
    \msgMainContent{And I stupid so I read history}%
    %
}


\channelMsgEntry{%
    \msgRealSource{ĞĞµĞ‘ÑƒÑ‚Ğ»ĞµĞ³ ï¼ˆè¿«çœŸï¼‰}{2018-02-05 19:43:34}%
    \msgMainContent{i cant do linear algebra proof}%
    %
}


\channelMsgEntry{%
    \msgRealSource{Mingcong Bai}{2018-02-05 19:43:34}%
    \msgMainContent{Oh you stupid too? I so happy!}%
    %
}


\channelMsgEntry{%
    \msgRealSource{Staph. aureus | In your GI Tract}{2018-02-08 00:18:42}%
    \msgMainContent{ç™½æ‰‹æŒ‡\ldots\ldots( æˆ‘æ‰‹æŒ‡é‚„åœ¨é€æ­¥æ¢å¾©çŸ¥è¦º}%
    %
}


\channelMsgEntry{%
    \msgRealSource{Mingcong Bai}{2018-02-08 00:18:42}%
    \msgMainContent{LOLï¼ŒæŒ–è½¦å»äº†ï¼Ÿ}%
    %
}


\channelMsgEntry{%
    \msgRealSource{Staph. aureus | In your GI Tract}{2018-02-08 00:18:42}%
    \msgMainContent{å—¯}%
    %
}


\channelMsgEntry{%
    \msgRealSource{Mingcong Bai}{2018-02-08 02:40:16}%
    \msgMainContent{}%
    \nopagebreak\includegraphics[width=\linewidth]{./.tg-data/Legacy/photos/photo_43@08-02-2018_02-40-16.jpg}%
}


\channelMsgEntry{%
    \msgRealSource{Mingcong Bai}{2018-02-08 02:40:16}%
    \msgMainContent{eCPU (}%
    %
}


\channelMsgEntry{%
    \msgRealSource{åŒå€å¤šå¤šå†°ğŸ§¶ | ğ¦ğŸğœğŸ}{2018-02-09 06:54:36}%
    \msgMainContent{é¸¡èŸ¹é”®ç›˜ï¼Ÿ}%
    %
}


\channelMsgEntry{%
    \msgRealSource{Mingcong Bai}{2018-02-11 07:16:29}%
    \msgMainContent{è¿˜æ˜¯çœ‹çœ‹åé¢æœ‰æ²¡æœ‰å…¶ä»–å‚å•†ï¼ˆå°¤å…¶ç¡…ä¸‰è§’ï¼‰å»åšæ¿å­}%
    %
}


\channelMsgEntry{%
    \msgRealSource{åŒå€å¤šå¤šå†°ğŸ§¶ | ğ¦ğŸğœğŸ}{2018-02-11 07:16:29}%
    \msgMainContent{ç¡…ä¸‰è§’ 2333333}%
    %
}


\channelMsgEntry{%
    \msgRealSource{å’¸é±¼}{2018-02-11 23:52:55}%
    \msgMainContent{èŸ†çš„ï¼ŒWindows Media Cretion Tool æŠ½é¢¨äº†å…©æ¬¡äº†}%
    %
}


\channelMsgEntry{%
    \msgRealSource{cth451 ÇÉ”uÇÆƒÉ¹ÇÊŒá´‰p}{2018-02-11 23:52:55}%
    \msgMainContent{cretion?!}%
    %
}


\channelMsgEntry{%
    \msgRealSource{ĞĞµĞ‘ÑƒÑ‚Ğ»ĞµĞ³ ï¼ˆè¿«çœŸï¼‰}{2018-02-11 23:52:55}%
    \msgMainContent{Windows Media excretion toolï¼ˆå‘•}%
    %
}


\channelMsgEntry{%
    \msgRealSource{Deleted Account}{2018-02-11 23:52:55}%
    \msgMainContent{è„æ­»äº†}%
    %
}


\channelMsgEntry{%
    \msgRealSource{Mingcong Bai}{2018-02-11 23:52:55}%
    \msgMainContent{Windows ä»‹è´¨æ’é—å·¥å…·ï¼ˆ}%
    %
}


\channelMsgEntry{%
    \msgRealSource{Deleted Account}{2018-02-11 23:56:19}%
    \msgMainContent{ä»å…‰é©±å‘•å‡ºä¸€ç‰‡shitï¼ˆ}%
    %
}


\channelMsgEntry{%
    \msgRealSource{Mingcong Bai}{2018-02-12 05:52:40}%
    \msgMainContent{ä¸»ç¾¤é‡Œé¢æœ‰ bot å¯ä»¥å—ç†ï¼ŒèƒŒåæœ‰å—è‹¦çš„äººç±»}%
    %
}


\channelMsgEntry{%
    \msgRealSource{Mingcong Bai}{2018-02-12 05:52:40}%
    \msgMainContent{æˆ‘è¿™å¹´ä¸è¿‡äº†å¹²ï¼ˆx}%
    %
}


\channelMsgEntry{%
    \msgRealSource{XtenDimension}{2018-02-12 05:52:40}%
    \msgMainContent{``æ˜¯ä¸€ä¸ªä¸»è¦å­¦ç”Ÿç»„æˆçš„å¼€æºç¤¾åŒº'' æ˜¯çœŸçš„å—ã€‚ã€‚ã€‚}%
    %
}


\channelMsgEntry{%
    \msgRealSource{Deleted Account}{2018-02-12 05:52:40}%
    \msgMainContent{æ˜¯ï¼ˆ}%
    %
}


\channelMsgEntry{%
    \msgRealSource{Mingcong Bai}{2018-02-12 05:52:41}%
    \msgMainContent{å¤§å®¶éƒ½æ˜¯ï¼Œæˆ‘ \textless24 å²ï¼Œæ˜¯å­¦ç”Ÿï¼ˆ}%
    %
}


\channelMsgEntry{%
    \msgRealSource{Mingcong Bai}{2018-02-12 17:10:07}%
    \msgMainContent{AOSC ä¹‹æºè¦æ–­äº†\ldots\ldots{}}%
    \nopagebreak\includegraphics[width=\linewidth]{./.tg-data/Legacy/photos/photo_44@12-02-2018_17-10-07.jpg}%
}


\channelMsgEntry{%
    \msgRealSource{Richard Yu}{2018-02-13 19:12:20}%
    \msgMainContent{æˆ‘ç»ˆäºæ˜ç™½äº†ä¸ºä»€ä¹ˆ nightly é‚£ä¹ˆä¸ç¨³å®š\ldots\ldots{}}%
    %
}


\channelMsgEntry{%
    \msgRealSource{Richard Yu}{2018-02-13 19:12:20}%
    \msgMainContent{ä¼°è®¡æ˜¯å…ˆæŠŠä»£ç  push äº†ç„¶åç­‰ nightly å‡ºæ¥æµ‹è¯•}%
    %
}


\channelMsgEntry{%
    \msgRealSource{Deleted Account}{2018-02-14 07:40:55}%
    \msgMainContent{}%
    %
}


\channelMsgEntry{%
    \msgRealSource{Mingcong Bai}{2018-02-14 07:41:09}%
    \msgMainContent{}%
    \nopagebreak\includegraphics[width=\linewidth]{./.tg-data/Legacy/photos/photo_45@14-02-2018_07-41-09.jpg}%
}


\channelMsgEntry{%
    \msgRealSource{Mingcong Bai}{2018-02-14 07:50:55}%
    \msgMainContent{ä½ ä»¬æƒ…äººèŠ‚æ„‰å¿«ï¼Œæˆ‘å°±ä¸€ä¸ªäººå…ˆç¡äº†}%
    %
}


\channelMsgEntry{%
    \msgRealSource{Mingcong Bai}{2018-02-14 07:50:55}%
    \msgMainContent{å“¦æœ‰ç‚¹å£æ¸´ï¼Œä¸€ä¸ªäººå‡ºå»æ‰“æ°´ï¼Œè¿˜æ˜¯å†·çš„}%
    %
}


\channelMsgEntry{%
    \msgRealSource{Mingcong Bai}{2018-02-14 07:50:55}%
    \msgMainContent{ä¹Ÿæ²¡äººå–œæ¬¢æˆ‘}%
    %
}


\channelMsgEntry{%
    \msgRealSource{Deleted Account}{2018-02-14 07:50:55}%
    \msgMainContent{å’Œè¢«å­ç¼ ç»µ}%
    %
}


\channelMsgEntry{%
    \msgRealSource{Mingcong Bai}{2018-02-14 07:50:55}%
    \msgMainContent{å¯¹å˜›ï¼Œè¢«å­æ‰æ˜¯çœŸè€å©†}%
    %
}


\channelMsgEntry{%
    \msgRealSource{Mingcong Bai}{2018-02-14 07:50:55}%
    \msgMainContent{è‚‰ä½“ä»€ä¹ˆçš„}%
    %
}


\channelMsgEntry{%
    \msgRealSource{Deleted Account}{2018-02-14 07:50:55}%
    \msgMainContent{è®©å®ƒåœ¨èƒ¯ä¸‹ç©¿è¿‡ï¼Œç´§ç´§æ‚åœ¨èƒ¸å‰}%
    %
}


\channelMsgEntry{%
    \msgRealSource{Deleted Account}{2018-02-14 07:50:55}%
    \msgMainContent{äº²ä¸ªçˆ½}%
    %
}


\channelMsgEntry{%
    \msgRealSource{å’¸é±¼}{2018-02-14 07:50:55}%
    \msgMainContent{ï¼ˆè«ä¸æ˜¯æƒ³ã€‡ã€‡}%
    %
}


\channelMsgEntry{%
    \msgRealSource{å’¸é±¼}{2018-02-14 07:50:55}%
    \msgMainContent{ç„¶å¾Œã€‡ã€‡}%
    %
}


\channelMsgEntry{%
    \msgRealSource{å’¸é±¼}{2018-02-14 07:50:55}%
    \msgMainContent{å†æŠŠã€‡ã€‡äº†çš„ã€‡ã€‡çµ¦ã€‡ã€‡}%
    %
}


\channelMsgEntry{%
    \msgRealSource{Deleted Account}{2018-02-14 07:51:02}%
    \msgMainContent{æ‘©æ“¦}%
    %
}


\channelMsgEntry{%
    \msgRealSource{Deleted Account}{2018-02-14 07:51:02}%
    \msgMainContent{å†²æ’}%
    %
}


\channelMsgEntry{%
    \msgRealSource{Deleted Account}{2018-02-14 07:51:02}%
    \msgMainContent{æ‰æ“}%
    %
}


\channelMsgEntry{%
    \msgRealSource{Mingcong Bai}{2018-02-15 16:17:52}%
    \msgMainContent{autobuild/build: line 32: unexpected EOF while looking for matching
```\,' autobuild/build: line 34: syntax error: unexpected end of file}%
    %
}


\channelMsgEntry{%
    \msgRealSource{Mingcong Bai}{2018-02-15 16:17:52}%
    \msgMainContent{Rose is red, Violets are blue, Unexpected ``, On line 32}%
    %
}


\channelMsgEntry{%
    \msgRealSource{Mingcong Bai}{2018-02-16 20:12:39}%
    \msgMainContent{Damned lies stir fried with a light drizzle of bullshit}%
    %
}


\channelMsgEntry{%
    \msgRealSource{Mingcong Bai}{2018-02-16 20:15:24}%
    \msgMainContent{}%
    \nopagebreak\includegraphics[width=\linewidth]{./.tg-data/Legacy/photos/photo_46@16-02-2018_20-15-24.jpg}%
}


\channelMsgEntry{%
    \msgRealSource{webRTCCat | ZhiTai PC230 2TB}{2018-02-18 09:57:13}%
    \msgMainContent{éš”å£ç¾¤ç³»åˆ—}%
    %
}


\channelMsgEntry{%
    \msgRealSource{David Gao}{2018-02-18 09:57:13}%
    \msgMainContent{archhentaiï¼}%
    %
}


\channelMsgEntry{%
    \msgRealSource{webRTCCat | ZhiTai PC230 2TB}{2018-02-18 09:57:13}%
    \msgMainContent{ubuntai}%
    %
}


\channelMsgEntry{%
    \msgRealSource{webRTCCat | ZhiTai PC230 2TB}{2018-02-18 09:57:13}%
    \msgMainContent{manjatai}%
    %
}


\channelMsgEntry{%
    \msgRealSource{Deleted Account}{2018-02-18 09:57:13}%
    \msgMainContent{Debiantai!}%
    %
}


\channelMsgEntry{%
    \msgRealSource{ĞĞµĞ‘ÑƒÑ‚Ğ»ĞµĞ³ ï¼ˆè¿«çœŸï¼‰}{2018-02-18 09:57:13}%
    \msgMainContent{Dabiantai}%
    %
}


\channelMsgEntry{%
    \msgRealSource{å’¸é±¼}{2018-02-19 02:22:47}%
    \msgMainContent{æˆ‘é€™é‚Šçš„ï¼ˆ}%
    \nopagebreak\includegraphics[width=\linewidth]{./.tg-data/Legacy/photos/photo_47@19-02-2018_02-22-47.jpg}%
}


\channelMsgEntry{%
    \msgRealSource{Mingcong Bai}{2018-02-19 02:22:47}%
    \msgMainContent{å“‡å¥½å¤šç”Ÿæ®–å™¨}%
    %
}


\channelMsgEntry{%
    \msgRealSource{Deleted Account}{2018-02-19 02:22:47}%
    \msgMainContent{æ–‡æ˜è§‚å™¨}%
    %
}


\channelMsgEntry{%
    \msgRealSource{Mingcong Bai}{2018-02-19 02:22:47}%
    \msgMainContent{ä¸€å¸®æ··å¸ Debiantai}%
    %
}


\channelMsgEntry{%
    \msgRealSource{Deleted Account}{2018-02-19 02:22:47}%
    \msgMainContent{èµå™¨}%
    %
}


\channelMsgEntry{%
    \msgRealSource{Deleted Agasa}{2018-02-19 02:29:39}%
    \msgMainContent{æ‰¾å®¶å’–å•¡é¦†}%
    %
}


\channelMsgEntry{%
    \msgRealSource{Ariel AxionL è‰¾é›¨å¯’ | ğŸ˜ª ç¡è§‰}{2018-02-19 02:29:39}%
    \msgMainContent{ä¸»è¦æ˜¯éº»ç…©åˆ¥äººï¼ˆ}%
    %
}


\channelMsgEntry{%
    \msgRealSource{Ariel AxionL è‰¾é›¨å¯’ | ğŸ˜ª ç¡è§‰}{2018-02-19 02:29:39}%
    \msgMainContent{è³´è‘—ä¸‰å¤©ä¸èµ°ï¼Œé€™é‚„æ˜¯äººå—ï¼ˆx}%
    %
}


\channelMsgEntry{%
    \msgRealSource{Mingcong Bai}{2018-02-19 02:29:39}%
    \msgMainContent{äº¤äº†é’±çœ‹ä»–ç®¡ä¸ç®¡ä½ å«äºº}%
    %
}


\channelMsgEntry{%
    \msgRealSource{Deleted Account}{2018-02-19 02:30:25}%
    \msgMainContent{æ€¥æ€§æ¢—é˜»æ€§åŒ–è„“æ€§èƒ†ç®¡ç‚æ•™}%
    %
}


\channelMsgEntry{%
    \msgRealSource{Deleted Account}{2018-02-19 02:30:25}%
    \msgMainContent{ç—…å‹äº¤æµä¼š}%
    %
}


\channelMsgEntry{%
    \msgRealSource{Deleted Account}{2018-02-19 02:50:52}%
    \msgMainContent{æˆ‘ä»¬å¹³å‡ä¸€ä½ç”¨æˆ·å°±æœ‰ä¸‰å››ä½å¼€å‘è€…æ¥æ´½ã€ååŠ©ï¼ˆè¿«çœŸï¼‰}%
    %
}


\channelMsgEntry{%
    \msgRealSource{Ariel AxionL è‰¾é›¨å¯’ | ğŸ˜ª ç¡è§‰}{2018-02-19 02:50:52}%
    \msgMainContent{ä½ è¿™ä¸ªä¸æŠŠå¼€å‘è€…å½“ç”¨æˆ·çš„æ€æƒ³ä¼¼ä¹æš´éœ²äº†ä»€ä¹ˆ}%
    %
}


\channelMsgEntry{%
    \msgRealSource{Ariel AxionL è‰¾é›¨å¯’ | ğŸ˜ª ç¡è§‰}{2018-02-19 02:50:52}%
    \msgMainContent{ï¼ˆå¼€å‘è€…åˆä¸ä¸€å®šæ˜¯ç”¨æˆ·ï¼ˆå¥½åƒæ²¡å•¥é—®é¢˜}%
    %
}


\channelMsgEntry{%
    \msgRealSource{Ariel AxionL è‰¾é›¨å¯’ | ğŸ˜ª ç¡è§‰}{2018-02-19 02:50:52}%
    \msgMainContent{è¯´ä¸å®šåœ¨archä¸Šæ‰“çš„åŒ…ä¹Ÿä¸ä¸€å®šå‘¢ï¼ˆ}%
    %
}


\channelMsgEntry{%
    \msgRealSource{Deleted Agasa}{2018-02-19 02:50:52}%
    \msgMainContent{chroot æ‰“çš„åŒ…æ€ä¹ˆèƒ½è¯´åœ¨ arch ä¸Šå‘¢}%
    %
}


\channelMsgEntry{%
    \msgRealSource{å’¸é±¼}{2018-02-19 04:26:40}%
    \msgMainContent{ä¸€å€‹ AOSC OS
ç”¨æˆ¶åŒæ™‚è™•æ–¼é–‹ç™¼è€…å’Œç”¨æˆ¶çš„ç–ŠåŠ æ…‹ï¼Œåªæœ‰åœ¨é‡åˆ°å•é¡Œçš„æ™‚å€™çº”æœƒåç¸®æˆå…¶ä¸­ä¸€ç¨®}%
    %
}


\channelMsgEntry{%
    \msgRealSource{Mingcong Bai}{2018-02-21 22:04:33}%
    \msgMainContent{å’»}%
    %
}


\channelMsgEntry{%
    \msgRealSource{Bash Horatio}{2018-02-22 00:54:04}%
    \msgMainContent{æ¡é³ï½}%
    %
}


\channelMsgEntry{%
    \msgRealSource{Junde Yhi}{2018-02-23 07:02:59}%
    \msgMainContent{rebase -i}%
    %
}


\channelMsgEntry{%
    \msgRealSource{Junde Yhi}{2018-02-23 07:02:59}%
    \msgMainContent{äº¤ äº’ å˜ åŸº}%
    %
}


\channelMsgEntry{%
    \msgRealSource{Deleted Account}{2018-02-23 07:06:42}%
    \msgMainContent{fork ä¸€ä¸ª gitï¼ŒæŠŠå‘½ä»¤ä¸€ä¸ªä¸ªæ”¹æˆä¸­æ–‡}%
    %
}


\channelMsgEntry{%
    \msgRealSource{Deleted Account}{2018-02-23 07:06:42}%
    \msgMainContent{å»ä¸“åˆ©å±€ç”³è¯·ä¸­æ–‡ç‰ˆæœ¬ç®¡ç†ç³»ç»Ÿ}%
    %
}


\channelMsgEntry{%
    \msgRealSource{Deleted Account}{2018-02-23 07:06:42}%
    \msgMainContent{è´±äºº å˜åŸº}%
    %
}


\channelMsgEntry{%
    \msgRealSource{å…ˆçŸ¥}{2018-02-23 07:06:42}%
    \msgMainContent{è³¤äºº çª© å½ˆå‡º}%
    %
}


\channelMsgEntry{%
    \msgRealSource{cth451 ÇÉ”uÇÆƒÉ¹ÇÊŒá´‰p}{2018-02-23 07:06:42}%
    \msgMainContent{è´±äºº é‡ç½® --ç¡¬}%
    %
}


\channelMsgEntry{%
    \msgRealSource{å…ˆçŸ¥}{2018-02-23 07:07:31}%
    \msgMainContent{è³¤äºº æ—¥èªŒ ---è‰² ---åœ–}%
    %
}


\channelMsgEntry{%
    \msgRealSource{Mingcong Bai}{2018-03-01 07:01:28}%
    \msgMainContent{}%
    %
}


\channelMsgEntry{%
    \msgRealSource{Mingcong Bai}{2018-03-01 07:01:28}%
    \msgMainContent{Listen here you little shit.}%
    %
}


\channelMsgEntry{%
    \msgRealSource{Mingcong Bai}{2018-03-01 07:01:28}%
    \msgMainContent{You are a piece of human cunt. Bad.}%
    %
}


\channelMsgEntry{%
    \msgRealSource{åŒå€å¤šå¤šå†°ğŸ§¶ | ğ¦ğŸğœğŸ}{2018-03-02 06:15:32}%
    \msgMainContent{ä¸æ¥ç‚¹ä¸ªäººè®¡ç®—æœºç”·äººæ–‡ä»¶ç®¡ç†å™¨ï¼Ÿ}%
    %
}


\channelMsgEntry{%
    \msgRealSource{ĞĞµĞ‘ÑƒÑ‚Ğ»ĞµĞ³ ï¼ˆè¿«çœŸï¼‰}{2018-03-03 04:32:17}%
    \msgMainContent{ç™½ç‰¹æ‰‹}%
    %
}


\channelMsgEntry{%
    \msgRealSource{Deleted Account}{2018-03-03 04:32:17}%
    \msgMainContent{ç‰¹ç™½æ‰‹}%
    %
}


\channelMsgEntry{%
    \msgRealSource{Deleted Account}{2018-03-03 20:49:43}%
    \msgMainContent{}%
    %
}


\channelMsgEntry{%
    \msgRealSource{å’¸é±¼}{2018-03-05 05:33:57}%
    \msgMainContent{æˆ‘è·‘çš„ j8 å•Šï¼ˆ}%
    %
}


\channelMsgEntry{%
    \msgRealSource{Mingcong Bai}{2018-03-05 05:33:57}%
    \msgMainContent{ä½  j8 è¿˜èƒ½ç”¨æ¥è·‘çš„å“¦ï¼Ÿ}%
    %
}


\channelMsgEntry{%
    \msgRealSource{Deleted Account}{2018-03-07 16:46:20}%
    \msgMainContent{}%
    %
}


\channelMsgEntry{%
    \msgRealSource{Mingcong Bai}{2018-03-21 04:13:01}%
    \msgMainContent{è¿™é‡Œè¿˜æœ‰ 1400 ä¸ª wordreq}%
    \nopagebreak\includegraphics[width=\linewidth]{./.tg-data/Legacy/photos/photo_48@21-03-2018_04-13-01.jpg}%
}


\channelMsgEntry{%
    \msgRealSource{Mingcong Bai}{2018-03-21 04:13:01}%
    \msgMainContent{æ‰€ä»¥æˆ‘å…ˆå¤„ç†æ•°é‡å¤§çš„äº†ï¼ˆ}%
    %
}


\channelMsgEntry{%
    \msgRealSource{Deleted Account}{2018-03-21 19:26:36}%
    \msgMainContent{overlayfs å°±åƒèŒ…å•ï¼Œéšä¾¿æ‰¾ä¸ªåœ°æ–¹å‡ ä¸ªåœŸæ–¹å—å›´èµ·æ¥å°ä¸ªé¡¶ï¼Œæ’ä¸ªç«æŠŠå°±èƒ½ç”¨}%
    %
}


\channelMsgEntry{%
    \msgRealSource{Deleted Account}{2018-03-21 19:26:36}%
    \msgMainContent{éœ€è¦çš„æ—¶å€™è¿˜å¯ä»¥å †ä¸ªäºŒå±‚ä¸‰å±‚å°æ´‹å•}%
    %
}


\channelMsgEntry{%
    \msgRealSource{Deleted Account}{2018-03-21 19:26:36}%
    \msgMainContent{ä¸è¦çš„æ—¶å€™ TNT æ”¾ä¸Šå»å°±å¥½}%
    %
}


\channelMsgEntry{%
    \msgRealSource{Mingcong Bai}{2018-03-21 20:26:28}%
    \msgMainContent{æŠŠä»¥ååŠªåŠ›å¯¼è‡´çš„è„±å‘éƒ½å…ˆè„±å…‰äº†ï¼Œå°±æŠŠåŠªåŠ›çš„æˆæœå…ˆæ‹¿åˆ°äº†}%
    %
}


\channelMsgEntry{%
    \msgRealSource{Deleted Account}{2018-03-21 20:26:28}%
    \msgMainContent{é¢„ç§ƒå¤´ç†è®º}%
    %
}


\channelMsgEntry{%
    \msgRealSource{Deleted Account}{2018-03-21 20:26:28}%
    \msgMainContent{å¤´å‘ä¸€è„±ï¼Œé«˜æµ“åº¦çš„æ™ºå•†ï¼ˆé‡çº²é”™è¯¯ï¼‰æ»šæ»šæ¶Œæ¥}%
    %
}


\channelMsgEntry{%
    \msgRealSource{Mingcong Bai}{2018-03-24 06:29:06}%
    \msgMainContent{TRC - Tmux Relay Chat}%
    %
}


\channelMsgEntry{%
    \msgRealSource{Deleted Account}{2018-03-31 16:58:58}%
    \msgMainContent{}%
    %
}


\channelMsgEntry{%
    \msgRealSource{Mingcong Bai}{2018-03-31 17:12:28}%
    \msgMainContent{}%
    \nopagebreak\includegraphics[width=\linewidth]{./.tg-data/Legacy/photos/photo_49@31-03-2018_17-12-28.jpg}%
}


\channelMsgEntry{%
    \msgRealSource{Deleted Account}{2018-04-02 01:03:45}%
    \msgMainContent{}%
    %
}


\channelMsgEntry{%
    \msgRealSource{Deleted Account}{2018-04-02 01:07:42}%
    \msgMainContent{}%
    \nopagebreak\includegraphics[width=\linewidth]{./.tg-data/Legacy/photos/photo_50@02-04-2018_01-07-42.jpg}%
}


\channelMsgEntry{%
    \msgRealSource{Mingcong Bai}{2018-04-04 16:19:44}%
    \msgMainContent{æˆ‘ç°åœ¨è·‘ä¸ªçœ‹çœ‹}%
    %
}


\channelMsgEntry{%
    \msgRealSource{Mingcong Bai}{2018-04-04 16:19:44}%
    \msgMainContent{\ldots\ldots ç„¶åå°±æ‰“ä¸ä¸Šäº†}%
    %
}


\channelMsgEntry{%
    \msgRealSource{Mingcong Bai}{2018-04-04 16:19:44}%
    \msgMainContent{Ay blyat.}%
    %
}


\channelMsgEntry{%
    \msgRealSource{Deleted Account}{2018-04-04 16:21:20}%
    \msgMainContent{ĞĞ¹ Ğ±Ğ»ÑÑ‚ÑŒ!}%
    %
}


\channelMsgEntry{%
    \msgRealSource{Deleted Account}{2018-04-05 20:42:52}%
    \msgMainContent{å¥½å¥‡æ€ªå•Š}%
    %
}


\channelMsgEntry{%
    \msgRealSource{Deleted Account}{2018-04-05 20:42:52}%
    \msgMainContent{æˆ‘è¿™é‡Œå¯åŠ¨æ—¶çªç„¶æ— æ³• mount /home äº†}%
    %
}


\channelMsgEntry{%
    \msgRealSource{Deleted Account}{2018-04-05 20:42:52}%
    \msgMainContent{åªè¦ mount äº†å°±ä¼šæç¤º Failed mount /home ç„¶åè¿›å…¥ç´§æ€¥æ•‘æ´æ¨¡å¼}%
    %
}


\channelMsgEntry{%
    \msgRealSource{CT1000MX500SSD1 1000.2 GB}{2018-04-05 20:42:52}%
    \msgMainContent{chkdsk}%
    %
}


\channelMsgEntry{%
    \msgRealSource{cth451 ÇÉ”uÇÆƒÉ¹ÇÊŒá´‰p}{2018-04-05 20:42:52}%
    \msgMainContent{ä»€ä¹ˆ chkdsk}%
    %
}


\channelMsgEntry{%
    \msgRealSource{cth451 ÇÉ”uÇÆƒÉ¹ÇÊŒá´‰p}{2018-04-05 20:42:52}%
    \msgMainContent{è¿™å« f**k}%
    %
}


\channelMsgEntry{%
    \msgRealSource{cth451 ÇÉ”uÇÆƒÉ¹ÇÊŒá´‰p}{2018-04-05 20:42:52}%
    \msgMainContent{ä¸å¯¹}%
    %
}


\channelMsgEntry{%
    \msgRealSource{cth451 ÇÉ”uÇÆƒÉ¹ÇÊŒá´‰p}{2018-04-05 20:42:52}%
    \msgMainContent{fsck}%
    %
}


\channelMsgEntry{%
    \msgRealSource{CT1000MX500SSD1 1000.2 GB}{2018-04-05 20:42:52}%
    \msgMainContent{å› ä¸ºé‚£ä¸ªè¯å¤ªä¸æ–‡æ˜äº†ï¼ˆ}%
    %
}


\channelMsgEntry{%
    \msgRealSource{CT1000MX500SSD1 1000.2 GB}{2018-04-05 20:42:52}%
    \msgMainContent{æ‰€ä»¥æ‰€ä»¥æ£€æŸ¥æ–‡ä»¶ç³»ç»Ÿæˆ‘éƒ½ç”¨ chkdsk}%
    %
}


\channelMsgEntry{%
    \msgRealSource{Catten Linger 18576508396}{2018-04-08 08:18:34}%
    \msgMainContent{æˆ‘æƒ³çŸ¥é“å“ªé—¨ç¼–ç¨‹è¯­è¨€æ˜¯æ²¡æœ‰å˜é‡çš„ï¼ˆx}%
    %
}


\channelMsgEntry{%
    \msgRealSource{cth451 ÇÉ”uÇÆƒÉ¹ÇÊŒá´‰p}{2018-04-08 08:18:34}%
    \msgMainContent{ASM}%
    %
}


\channelMsgEntry{%
    \msgRealSource{cth451 ÇÉ”uÇÆƒÉ¹ÇÊŒá´‰p}{2018-04-08 08:18:34}%
    \msgMainContent{å‡ºé—¨å·¦è½¬ -8(\%rbp)}%
    %
}


\channelMsgEntry{%
    \msgRealSource{Jack Works}{2018-04-08 08:18:34}%
    \msgMainContent{å¯„å­˜å™¨ä»€ä¹ˆçš„ä¸ç®—å˜é‡å—}%
    %
}


\channelMsgEntry{%
    \msgRealSource{Deleted Agasa}{2018-04-08 08:18:34}%
    \msgMainContent{å¯„å­˜å™¨ï¼šæœ‰äººæ‰¾æˆ‘ï¼Ÿ}%
    %
}


\channelMsgEntry{%
    \msgRealSource{cth451 ÇÉ”uÇÆƒÉ¹ÇÊŒá´‰p}{2018-04-08 08:18:34}%
    \msgMainContent{æ˜¯çŠ¶æ€}%
    %
}


\channelMsgEntry{%
    \msgRealSource{Deleted Account}{2018-04-08 08:18:34}%
    \msgMainContent{ä¸è¡Œå•Šï¼Œäººå®¶å¯ä»¥åé©³è¯´æ•´ä¸ªå†…å­˜éƒ½æ˜¯å˜é‡ï¼ˆ}%
    %
}


\channelMsgEntry{%
    \msgRealSource{cth451 ÇÉ”uÇÆƒÉ¹ÇÊŒá´‰p}{2018-04-08 08:18:34}%
    \msgMainContent{Internal state ä»€ä¹ˆçš„}%
    %
}


\channelMsgEntry{%
    \msgRealSource{Yangff}{2018-04-08 08:18:34}%
    \msgMainContent{å›¾çµæœºï¼šå’Œè¿™è·Ÿçº¸å¸¦è°ˆè°ˆ}%
    %
}


\channelMsgEntry{%
    \msgRealSource{cth451 ÇÉ”uÇÆƒÉ¹ÇÊŒá´‰p}{2018-04-08 08:18:34}%
    \msgMainContent{å¯„å­˜å™¨çš„äº‹æƒ…èƒ½å«å†…å­˜å—}%
    %
}


\channelMsgEntry{%
    \msgRealSource{Deleted Agasa}{2018-04-08 08:18:34}%
    \msgMainContent{æ¯æ¬¡çœ‹åˆ°è¿™äº›è®¨è®ºï¼Œæˆ‘éƒ½è¦æ€è€ƒè‡ªå·±æ˜¯ä¸æ˜¯æ—¥è¯­ç³»è€Œä¸æ˜¯å­¦è®¡ç®—æœºçš„ã€‚}%
    %
}


\channelMsgEntry{%
    \msgRealSource{Deleted Account}{2018-04-08 08:18:34}%
    \msgMainContent{ä½ åˆå­¦æ—¥è¯­å•¦ï¼ˆ}%
    %
}


\channelMsgEntry{%
    \msgRealSource{Deleted Agasa}{2018-04-08 08:18:34}%
    \msgMainContent{ä¸å¯èƒ½çš„ï¼Œè¿™è¾ˆå­éƒ½ä¸å¯èƒ½çš„}%
    %
}


\channelMsgEntry{%
    \msgRealSource{Mingcong Bai}{2018-04-17 05:18:44}%
    \msgMainContent{Ğ“Ğ£Ğ›ĞĞ“, Ğ¿Ğ¾Ğ¶Ğ°Ğ»ÑƒĞ¹ÑÑ‚Ğ°.}%
    %
}


\channelMsgEntry{%
    \msgRealSource{cth451 ÇÉ”uÇÆƒÉ¹ÇÊŒá´‰p}{2018-04-17 05:18:44}%
    \msgMainContent{gulag æ˜¯å•¥}%
    %
}


\channelMsgEntry{%
    \msgRealSource{Mingcong Bai}{2018-04-17 05:18:44}%
    \msgMainContent{``å‰è‹è”æ”¿åºœçš„ä¸€ä¸ªæœºæ„ï¼Œè´Ÿè´£ç®¡ç†å…¨å›½çš„åŠ³æ”¹è¥ã€‚å…¶ä¿„è¯­å…¨ç§°ä¸º``Ğ“Ğ»Ğ°Ğ²Ğ½Ğ¾Ğµ
Ğ£Ğ¿Ñ€Ğ°Ğ²Ğ»ĞµĞ½Ğ¸Ğµ Ğ˜ÑĞ¿Ñ€Ğ°Ğ²Ğ¸Ñ‚ĞµĞ»ÑŒĞ½Ğ¾---Ğ¢Ñ€ÑƒĞ´Ğ¾Ğ²Ñ‹Ñ… Ğ›Ğ°Ğ³ĞµÑ€ĞµĞ¹ Ğ¸
ĞºĞ¾Ğ»Ğ¾Ğ½Ğ¸Ğ¹''ï¼Œç®€ç§°``Ğ“Ğ£Ğ›ĞĞ“''ï¼Œæ„æ€ä¸º``åŠ³é€ è¥ç®¡ç†æ€»å±€''ã€‚æ ¹æ®å®‰å¦®Â·è‰¾æ³¢é²å§†çš„è‘—ä½œã€Šå¤æ‹‰æ ¼ï¼šä¸€æ®µå†å²ã€‹ä¸­ä¹‹å™è¿°ï¼Œ``å¤æ‹‰æ ¼''æ˜¯è‹è”çš„å›½å®¶æ”¿æ²»ä¿å«æ€»å±€ã€å†…åŠ¡äººæ°‘å§”å‘˜éƒ¨çš„åˆ†æ”¯éƒ¨é—¨ï¼Œæ‰§è¡ŒåŠ³æ”¹ã€æ‰£ç•™ç­‰èŒåŠ¡ã€‚è¿™äº›è¥æˆ¿è¢«å›šäººå£«ä¸­åŒ…æ‹¬ä¸åŒç±»å‹çš„ç½ªçŠ¯ï¼Œæ—¥åæˆä¸ºé•‡å‹åå¯¹è‹è”å¼‚è§äººå£«çš„å·¥å…·ï¼Œè¢«å›šç¦äººå£«æ•°ä»¥ç™¾ä¸‡è®¡ã€‚''}%
    %
}


\channelMsgEntry{%
    \msgRealSource{Deleted Account}{2018-04-17 05:18:44}%
    \msgMainContent{gNewSense Users, Linux And GNU.}%
    %
}


\channelMsgEntry{%
    \msgRealSource{Zemin Ha}{2018-04-22 17:12:26}%
    \msgMainContent{å¼å•Š}%
    %
}


\channelMsgEntry{%
    \msgRealSource{Zemin Ha}{2018-04-22 17:12:27}%
    \msgMainContent{é¡ºä¾¿ä¸æ˜¯kernel 3.4å°±å¥½ï¼ˆé€ƒ}%
    %
}


\channelMsgEntry{%
    \msgRealSource{Mingcong Bai}{2018-04-22 17:12:28}%
    \msgMainContent{æ˜¯ä¸»çº¿å†…æ ¸}%
    %
}


\channelMsgEntry{%
    \msgRealSource{Mingcong Bai}{2018-04-22 17:12:28}%
    \msgMainContent{3.4 éƒ½è·‘ä¸äº† systemd äº†}%
    %
}


\channelMsgEntry{%
    \msgRealSource{Zemin Ha}{2018-04-22 17:12:29}%
    \msgMainContent{armbiançš„4.14é«˜è´Ÿè½½å¡æ­»}%
    %
}


\channelMsgEntry{%
    \msgRealSource{Zemin Ha}{2018-04-22 17:12:30}%
    \msgMainContent{çƒ«å¾—å¯æ€•}%
    %
}


\channelMsgEntry{%
    \msgRealSource{åŒå€å¤šå¤šå†°ğŸ§¶ | ğ¦ğŸğœğŸ}{2018-04-22 17:12:30}%
    \msgMainContent{ä¸ºäº†å–åº•è£¤æˆ‘ä»¬æ”¾å¼ƒäº† BSP ï¼ˆé€ƒ}%
    %
}


\channelMsgEntry{%
    \msgRealSource{imi415}{2018-04-22 17:12:31}%
    \msgMainContent{BSPä¹Ÿèƒ½åº•è£¤å§}%
    %
}


\channelMsgEntry{%
    \msgRealSource{imi415}{2018-04-22 17:12:32}%
    \msgMainContent{ayufançš„é‚£ä¸€ç¥¨BSPå†…æ ¸ä¸ä¹Ÿæ˜¯å¯ä»¥åº•è£¤ä¹ˆ}%
    %
}


\channelMsgEntry{%
    \msgRealSource{åŒå€å¤šå¤šå†°ğŸ§¶ | ğ¦ğŸğœğŸ}{2018-04-22 17:12:33}%
    \msgMainContent{é‚£æ˜¯è€åº•è£¤}%
    %
}


\channelMsgEntry{%
    \msgRealSource{åŒå€å¤šå¤šå†°ğŸ§¶ | ğ¦ğŸğœğŸ}{2018-04-22 17:12:33}%
    \msgMainContent{è€Œä¸”é‚£å·²ç» 3.10 äº†}%
    %
}


\channelMsgEntry{%
    \msgRealSource{Deleted Account}{2018-04-22 17:13:36}%
    \msgMainContent{Stale Underpants}%
    %
}


\channelMsgEntry{%
    \msgRealSource{Mingye Wang}{2018-04-28 02:37:24}%
    \msgMainContent{å¦å¤– Iosevka ç³»æ˜¯æ•…æ„åšæˆ '' (``.renderEqn''ï¼ˆ`` çš„}%
    %
}


\channelMsgEntry{%
    \msgRealSource{cth451 ÇÉ”uÇÆƒÉ¹ÇÊŒá´‰p}{2018-04-28 02:37:24}%
    \msgMainContent{Iosevka å¥½å•Š}%
    %
}


\channelMsgEntry{%
    \msgRealSource{cth451 ÇÉ”uÇÆƒÉ¹ÇÊŒá´‰p}{2018-04-28 02:37:24}%
    \msgMainContent{(}%
    %
}


\channelMsgEntry{%
    \msgRealSource{gumblex}{2018-04-28 02:37:24}%
    \msgMainContent{)}%
    %
}


\channelMsgEntry{%
    \msgRealSource{Deleted Account}{2018-04-28 02:37:24}%
    \msgMainContent{ï¸¶}%
    %
}


\channelMsgEntry{%
    \msgRealSource{Deleted Account}{2018-05-01 01:40:20}%
    \msgMainContent{ï¼ˆæ„è­˜ä¸æ¸…ï¼‰}%
    %
}


\channelMsgEntry{%
    \msgRealSource{å’¸é±¼}{2018-05-01 01:40:20}%
    \msgMainContent{ç…å­å«ï¼Œç…å­å«ï¼Œç…å­å–µå–µå«}%
    %
}


\channelMsgEntry{%
    \msgRealSource{å…ˆçŸ¥}{2018-05-01 01:40:20}%
    \msgMainContent{é¹¹é­šå«ï¼Œé¹¹é­šå«ï¼Œé¹¹é­šè¢«å–«æ‰}%
    %
}


\channelMsgEntry{%
    \msgRealSource{Deleted Account}{2018-05-01 06:14:46}%
    \msgMainContent{ã€Šæœå†»æµ…è°ˆ *nix å‘½ä»¤ä¹‹æ”¿æ²»å–å‘é—®é¢˜ã€‹èŠ‚é€‰}%
    %
}


\channelMsgEntry{%
    \msgRealSource{Deleted Account}{2018-05-01 06:15:41}%
    \msgMainContent{ç¾¡æ…•ffmpegèŠè‹£}%
    %
}


\channelMsgEntry{%
    \msgRealSource{Mingcong Bai}{2018-05-01 06:15:41}%
    \msgMainContent{ç¾¡æ…•å•¥\ldots\ldots{} ç”·äººä¸€æŠŠ}%
    %
}


\channelMsgEntry{%
    \msgRealSource{Mingcong Bai}{2018-05-01 06:15:41}%
    \msgMainContent{å…¶å®æœ¬æ¥åº”è¯¥å« whitemale ffmpeg}%
    %
}


\channelMsgEntry{%
    \msgRealSource{Mingcong Bai}{2018-05-01 06:15:41}%
    \msgMainContent{man ffmpeg ä¹ƒæ˜¯æ”¿æ²»æ­£ç¡®çš„ç¬¬ä¸€æ­¥ï¼ˆé›¾}%
    %
}


\channelMsgEntry{%
    \msgRealSource{Mingcong Bai}{2018-05-01 06:15:41}%
    \msgMainContent{ç„¶ååé¢åˆæœ‰ master slave ä¹‹è¯­å¢ƒé—®é¢˜}%
    %
}


\channelMsgEntry{%
    \msgRealSource{Mingcong Bai}{2018-05-01 06:15:41}%
    \msgMainContent{å–‹å–‹ä¸ä¼‘æ— ç»ˆæ—¥}%
    %
}


\channelMsgEntry{%
    \msgRealSource{Deleted Account}{2018-05-01 06:15:41}%
    \msgMainContent{è¿˜æ˜¯ç¡¬é“¾æ¥å¥½}%
    %
}


\channelMsgEntry{%
    \msgRealSource{Deleted Account}{2018-05-01 06:15:41}%
    \msgMainContent{å¹³ç­‰}%
    %
}


\channelMsgEntry{%
    \msgRealSource{Mingcong Bai}{2018-05-01 06:15:41}%
    \msgMainContent{ç„¶åä½ åˆå‘ç°ç®­å¤´ä¸€ç›´å‘å³}%
    %
}


\channelMsgEntry{%
    \msgRealSource{Mingcong Bai}{2018-05-01 06:15:41}%
    \msgMainContent{ç»™å·¦æ´¾ä¸€ç§è¢«è¿«è½¬å‘çš„æ„Ÿè§‰}%
    %
}


\channelMsgEntry{%
    \msgRealSource{å’¸é±¼}{2018-05-01 06:15:41}%
    \msgMainContent{ï¼ˆcp ä¸€æŠŠæ¢­ï¼ˆx}%
    %
}


\channelMsgEntry{%
    \msgRealSource{Mingcong Bai}{2018-05-01 06:15:41}%
    \msgMainContent{ç„¶åæ€ä¹ˆ cp é»˜è®¤ä¸ç»™ä¿¡æ¯è¾“å‡ºå‘¢ï¼Ÿè¿™æ˜¯å³æ´¾å°å˜´ï¼Œå› ä¸ºä½ åŠ  -v
å¼ºåˆ¶å…¬å¼€ä¿¡æ¯ï¼Œå‘ç°ç®­å¤´ä¹Ÿæ˜¯æ°¸è¿œå‘å³}%
    %
}


\channelMsgEntry{%
    \msgRealSource{Mingcong Bai}{2018-05-01 06:15:42}%
    \msgMainContent{è¿™ç§å³æ´¾ä¸“åˆ¶å‘½ä»¤è¿˜æœ‰ mv ä¹‹æµ}%
    %
}


\channelMsgEntry{%
    \msgRealSource{Deleted Account}{2018-05-01 06:16:01}%
    \msgMainContent{æ³¨ï¼šæ­¤å¤„ç¡¬é“¾æ¥é€šå‡ç¬¦å·é“¾æ¥}%
    %
}


\channelMsgEntry{%
    \msgRealSource{Deleted Account}{2018-05-01 06:21:20}%
    \msgMainContent{ä½ å¯èƒ½éœ€è¦}%
    %
}


\channelMsgEntry{%
    \msgRealSource{Deleted Account}{2018-05-01 06:21:24}%
    \msgMainContent{C++}%
    %
}


\channelMsgEntry{%
    \msgRealSource{Junde Yhi}{2018-05-10 02:37:44}%
    \msgMainContent{éƒ½ä¸ä¸Šè¯¾çš„å—}%
    %
}


\channelMsgEntry{%
    \msgRealSource{ĞĞµĞ‘ÑƒÑ‚Ğ»ĞµĞ³ ï¼ˆè¿«çœŸï¼‰}{2018-05-27 01:09:21}%
    \msgMainContent{è½¦æ‰‹ä¸éœ€è¦å¥³äººå“ˆå“ˆå“ˆ}%
    %
}


\channelMsgEntry{%
